id,conversation_id,created_at,date,time,timezone,user_id,username,name,place,tweet,language,mentions,urls,photos,replies_count,retweets_count,likes_count,hashtags,cashtags,link,retweet,quote_url,video,thumbnail,near,geo,source,user_rt_id,user_rt,retweet_id,reply_to,retweet_date,translate,trans_src,trans_dest
1250377262186315778,1250322228807266305,2020-04-15 10:55:44 UTC,2020-04-15,10:55:44,0,1148184155118821377,rashid39047297,Rashid🇬🇭,,@PeterPsquare @zoomupyourlife Name: ABDULAI ABDULRASHID  Bank name: GUARANTY TRUSTED BANK  Account number: 301-120067-1-70-0 Swift Code: GTBIGHAC Country: GHANA  Telephone number: +233243018265 Your fans in Ghana to will be glad to receive something fr9m you this time around #One_Africa,en,[],[],[],0,0,0,['one_africa'],[],https://twitter.com/Rashid39047297/status/1250377262186315778,False,,0,,,,,,,,"[{'screen_name': 'PeterPsquare', 'name': 'Peter Okoye MrP', 'id': '47033057'}, {'screen_name': 'zoomupyourlife', 'name': 'zoomupyourlife', 'id': '1097517894315982855'}]",,,,
1250371446460821504,1250371446460821504,2020-04-15 10:32:38 UTC,2020-04-15,10:32:38,0,3378496205,couretech,COURE Software & Sys,,Did You Know? Your Idle data can be another revenue stream!   Contact us today to find out more!  Email - Sales@coure-tech.com Telephone - +(234)-1-631-1910  #StayHome #Tech #accurate #africa #LockdownExtended  https://t.co/9ClI8yosRm,en,[],[],['https://pbs.twimg.com/media/EVo0_KVWsAA8H7M.png'],0,1,0,"['stayhome', 'tech', 'accurate', 'africa', 'lockdownextended']",[],https://twitter.com/couretech/status/1250371446460821504,False,,1,https://pbs.twimg.com/media/EVo0_KVWsAA8H7M.png,,,,,,,[],,,,
1250338909302611970,1250338909302611970,2020-04-15 08:23:20 UTC,2020-04-15,08:23:20,0,98639090,fretigne,David Frétigné,,"J’ai équipé mon Africa Twin Adventure sport pour le voyage. Valise, sur valise, top case, support bison, support boisson, boîte à outils, support valise de réservoir, support téléphone avec boule ram, sélecteur de…  https://t.co/pbObKcmRqA",fr,[],['https://www.instagram.com/p/B-_qKrindAH/?igshid=dorgewmf50vf'],[],0,0,0,[],[],https://twitter.com/fretigne/status/1250338909302611970,False,,0,,,,,,,,[],,,,
1250100564454711297,1250096805762813953,2020-04-14 16:36:14 UTC,2020-04-14,16:36:14,0,4054025477,smyleafrica,SMYLE Africa Trust,,"In response to the Coronavirus crisis and in support of the efforts of the Federal Government and NCDC, SMYLE Africa Trust has today launched a new, nationwide COVID-19 Hotline, a service based on the telephone line (08120298919).  #COVID19 #SocialMobility4Youths  https://t.co/kNJG30Nt1W",en,[],[],['https://pbs.twimg.com/media/EVk_yaNXsAANhvg.jpg'],1,5,4,"['covid19', 'socialmobility4youths']",[],https://twitter.com/SmyleAfrica/status/1250100564454711297,False,,1,https://pbs.twimg.com/media/EVk_yaNXsAANhvg.jpg,,,,,,,[],,,,
1250060172904615936,1250060172904615936,2020-04-14 13:55:44 UTC,2020-04-14,13:55:44,0,730770854724943872,tagtheflag,Tag The Flag,,"Who has the ability to begin to reopen the American economy? Plus, the Supreme Court will hear oral arguments by telephone, Bernie Sanders endorses Joe Biden, and China-Africa relations rocked by alleged racism over Covid-19 ... KEEP READING →   https://t.co/WeStcB289z",en,[],['https://tagtheflag.co/newsletter/4-14-20/'],[],0,0,1,[],[],https://twitter.com/tagtheflag/status/1250060172904615936,False,,0,,,,,,,,[],,,,
1250046072401125376,1250046072401125376,2020-04-14 12:59:43 UTC,2020-04-14,12:59:43,0,3378496205,couretech,COURE Software & Sys,,"Don't lose clients, because of inaccurate data.  Keep them updated with your campaigns by routing with accurate data  Email - Sales@coure-tech.com Telephone - +(234)-1-631-1910  #LockdownExtended #StayHome #TECH #Africa  https://t.co/5N7VNx9dXT",en,[],[],['https://pbs.twimg.com/media/EVkOPU6XsAANLF4.jpg'],0,0,0,"['lockdownextended', 'stayhome', 'tech', 'africa']",[],https://twitter.com/couretech/status/1250046072401125376,False,,1,https://pbs.twimg.com/media/EVkOPU6XsAANLF4.jpg,,,,,,,[],,,,
1250026846495870981,1250026846495870981,2020-04-14 11:43:19 UTC,2020-04-14,11:43:19,0,3378496205,couretech,COURE Software & Sys,,Stay connected this season with Accurate data.   Email - Sales@coure-tech.com Telephone - +(234)-1-631-1910  #StayHome #Tech #accurate #africa #LockdownExtended  https://t.co/OCXZAq8lEy,en,[],[],['https://pbs.twimg.com/media/EVj2vBUXQAACq7v.jpg'],0,0,0,"['stayhome', 'tech', 'accurate', 'africa', 'lockdownextended']",[],https://twitter.com/couretech/status/1250026846495870981,False,,1,https://pbs.twimg.com/media/EVj2vBUXQAACq7v.jpg,,,,,,,[],,,,
1250020113983700992,1250020113983700992,2020-04-14 11:16:34 UTC,2020-04-14,11:16:34,0,1149740584665583621,josly_ngoma,Josly Ngoma,,HM #MohammedVI proposes the launch of an African Heads of State initiative to establish an operational framework to combat the #Coronavirus in #Africa. The sovereign had telephone conversations on this subject with presidents  @AOuattara_PRCI  @Macky_Sall   https://t.co/7i1r5kaQJj,en,"[{'screen_name': 'aouattara_prci', 'name': 'alassane ouattara', 'id': '86037380'}, {'screen_name': 'macky_sall', 'name': 'macky sall', 'id': '197493438'}]",[],"['https://pbs.twimg.com/media/EVjwUBnXsAI-Bym.jpg', 'https://pbs.twimg.com/media/EVjwUXPXkAA-V78.jpg']",0,0,0,"['mohammedvi', 'coronavirus', 'africa']",[],https://twitter.com/josly_ngoma/status/1250020113983700992,False,,1,https://pbs.twimg.com/media/EVjwUBnXsAI-Bym.jpg,,,,,,,[],,,,
1250013133155991555,1250013133155991555,2020-04-14 10:48:49 UTC,2020-04-14,10:48:49,0,1565788418,maroc_unesco,Le Maroc à l'UNESCO 🇲🇦,,HM #MohammedVI proposes the launch of an African Heads of State initiative to establish an operational framework to combat the #Coronavirus #pandemic in #Africa. The sovereign had telephone conversations on this subject with presidents  @AOuattara_PRCI  @Macky_Sall. #COVID2019  https://t.co/k85Ahvl30Y,en,"[{'screen_name': 'aouattara_prci', 'name': 'alassane ouattara', 'id': '86037380'}, {'screen_name': 'macky_sall', 'name': 'macky sall', 'id': '197493438'}]",[],"['https://pbs.twimg.com/media/EVjwUBnXsAI-Bym.jpg', 'https://pbs.twimg.com/media/EVjwUXPXkAA-V78.jpg']",0,4,8,"['mohammedvi', 'coronavirus', 'pandemic', 'africa', 'covid2019']",[],https://twitter.com/Maroc_UNESCO/status/1250013133155991555,False,,1,https://pbs.twimg.com/media/EVjwUBnXsAI-Bym.jpg,,,,,,,[],,,,
1250008183504097280,1250000981028491264,2020-04-14 10:29:09 UTC,2020-04-14,10:29:09,0,1243811037234765824,adnanmaks,Maks Adnan,,"@davidicke This may seem inappropriate to write here. Someone recently said Africa did not have 5g. There is 5g and has been tested by a telephone company called MTN. The countries that were launched, is where people are suffering from this virus. And in specific towns🤷🏽‍♂️",en,[],[],[],0,2,1,[],[],https://twitter.com/AdnanMaks/status/1250008183504097280,False,,0,,,,,,,,"[{'screen_name': 'davidicke', 'name': 'David Icke', 'id': '66643970'}]",,,,
1249985166254190592,1249985166254190592,2020-04-14 08:57:41 UTC,2020-04-14,08:57:41,0,376690007,creseldah,Creseldah Cassandra,"{'type': 'Point', 'coordinates': [-29.0, 24.0]}",Reusable Cloth Face Mask. To place your order email us info@cefpads.co.za Telephone +2713 110 0210 #reusable #facemasks #clothfacemask @ South Africa  https://t.co/ytvVK5sDx1,en,[],['https://www.instagram.com/p/B-9JTR_nBxc/?igshid=nx83olgtyxrr'],[],0,0,0,"['reusable', 'facemasks', 'clothfacemask']",[],https://twitter.com/Creseldah/status/1249985166254190592,False,,0,,,,,,,,[],,,,
1249975318699552769,1249975318699552769,2020-04-14 08:18:34 UTC,2020-04-14,08:18:34,0,471454373,mrchrisgay,Chris Gay,"{'type': 'Point', 'coordinates': [53.7443, -0.3325]}",Masked up at the new factory unit for installation of telephone and internet.  My team at Pomegranate South Africa Ltd will be working from here after lockdown to provide high quality oil and other health products…  https://t.co/KVQnBCIm0z,en,[],['https://www.instagram.com/p/B-9E0rQhquV/?igshid=18q9d4n6p2s5t'],[],0,0,0,[],[],https://twitter.com/MrChrisGay/status/1249975318699552769,False,,0,,,,,,,,[],,,,
1249965403012583426,1249965403012583426,2020-04-14 07:39:09 UTC,2020-04-14,07:39:09,0,427641057,israel_mid_ru,Russia 🇷🇺 in Israel,,"Sergey #Lavrov had a telephone conversation with Foreign Minister of #Egypt Sameh Shoukry The ministers discussed the situation in the Middle East and North Africa, including the developments in #Syria and #Libya and the Palestinian-Israeli settlement  https://t.co/5bylSNI0wC  https://t.co/2f7n3M1rzN",en,[],['https://bit.ly/2XAk3uy'],['https://pbs.twimg.com/media/EVjESgYXgAEKM3Q.jpg'],0,0,7,"['lavrov', 'egypt', 'syria', 'libya']",[],https://twitter.com/israel_mid_ru/status/1249965403012583426,False,,1,https://pbs.twimg.com/media/EVjESgYXgAEKM3Q.jpg,,,,,,,[],,,,
1249816202765053953,1249626003007209473,2020-04-13 21:46:17 UTC,2020-04-13,21:46:17,0,424138504,mabuza_05,Mshengu Shabalala,,"@FumbataMarcus 😂 I remember telling him that every time there are xenophobic attacks in South Africa, I will be at the forefront of such, even requested Mbalula's telephone numbers to report the case 😂",en,[],[],[],0,0,0,[],[],https://twitter.com/Mabuza_05/status/1249816202765053953,False,,0,,,,,,,,"[{'screen_name': 'FumbataMarcus', 'name': 'Marcus Fumbata', 'id': '988799819777966085'}]",,,,
1249710279509843968,1249708936778985480,2020-04-13 14:45:23 UTC,2020-04-13,14:45:23,0,166287523,davidlyddon,David Lyddon Actor & DJ 俳優とDJ 🇬🇧🇯🇵🇺🇸 🌈,,@Channel4News I thought he had a direct telephone line to God so why doesn't he call him up and say sort it out get rid of this covid 19 afro everyone who goes to church has been praying to get rid of it but he too busy giving AIDS to children and babies in Africa at the moment?,en,[],[],[],0,1,2,[],[],https://twitter.com/DavidLyddon/status/1249710279509843968,False,,0,,,,,,,,"[{'screen_name': 'Channel4News', 'name': 'Channel 4 News', 'id': '14569869'}]",,,,
1249341572640104449,1249341572640104449,2020-04-12 14:20:17 UTC,2020-04-12,14:20:17,0,4838520568,tian_a1,Tian_A1 (Thierry),,"10 facons simples de rendre votre telephone #Android plus [Africa Daily News] Source : Harish Jonnalagadda/Android Central.Vous avez achete un nouveau telephone brillant, et quelques mois plus tard, vous vous rendez compte qu'il.  https://t.co/qNvqASViHl",fr,[],['https://bit.ly/3a1HYFy'],[],0,0,0,['android'],[],https://twitter.com/Tian_A1/status/1249341572640104449,False,,0,,,,,,,,[],,,,
1248962238553165824,1248962238553165824,2020-04-11 13:12:56 UTC,2020-04-11,13:12:56,0,3378496205,couretech,COURE Software & Sys,,"Everyone deserve something ""Extra""! Route those Voice and SMS Campaign to #Ghana and other #African countries this season with accurate routing information to ensure efficient deliveries.   Email - Sales@coure-tech.com  Telephone - +(234)-1-631-1910 #tech #Africa  #HappyEaster  https://t.co/3VhH7YOhUA",en,[],[],['https://pbs.twimg.com/media/EVU0gNXXsAUPHSQ.jpg'],0,0,0,"['ghana', 'african', 'tech', 'africa', 'happyeaster']",[],https://twitter.com/couretech/status/1248962238553165824,False,,1,https://pbs.twimg.com/media/EVU0gNXXsAUPHSQ.jpg,,,,,,,[],,,,
1248882202076753920,1248877074254712833,2020-04-11 07:54:54 UTC,2020-04-11,07:54:54,0,842816524872306688,jamalelchapo,BARDE,,@CRFC4ME Ok as u said hopefully soon. But are there any contradictions if telephone wires are still flying on poles in our backyards? (Africa ),en,[],[],[],1,0,0,[],[],https://twitter.com/JAMALELCHAPO/status/1248882202076753920,False,,0,,,,,,,,"[{'screen_name': 'CRFC4ME', 'name': 'JJ', 'id': '754531132650106880'}]",,,,
1248713818831761408,1248713818831761408,2020-04-10 20:45:49 UTC,2020-04-10,20:45:49,0,727156472,louisecrtgn,loulie🧸,,EXPOSE TON TÉLÉPHONE  - Emma - oui - ma mère  - 17 -  - la bomba king africa 😭 - Emma  - Jul - mon frère  - des tatouages  - non - oui - non - ❤️😭🥺 - ma soeur   comment un emoji je t'envoie les questions,fr,[],[],[],1,0,0,[],[],https://twitter.com/LouiseCrtgn/status/1248713818831761408,False,,0,,,,,,,,[],,,,
1248482064363474949,1248482064363474949,2020-04-10 05:24:54 UTC,2020-04-10,05:24:54,0,381903333,earthafrica,Earth Africa,,Telephone wire baskets handmade in South Africa.  https://t.co/IBdLfAuB0b,en,[],['https://www.youtube.com/watch?v=IZhZ3es6UTs'],[],0,0,0,[],[],https://twitter.com/EarthAfrica/status/1248482064363474949,False,,0,,,,,,,,[],,,,
1248314271269900294,1248314271269900294,2020-04-09 18:18:09 UTC,2020-04-09,18:18:09,0,35139253,latitude90,John Rosenberg,,"Xi in telephone diplomacy with #Africa, offering #coronavirus support. Tells Ramaphosa that China is there to help ""as requested."" Likewise Trump calls to Nigeria, Ghana, and Kenya offer great comfort. Or... forget that last part. #SouthAfrica",en,[],[],[],0,0,0,"['africa', 'coronavirus', 'southafrica']",[],https://twitter.com/Latitude90/status/1248314271269900294,False,,0,,,,,,,,[],,,,
1248310119936462850,1248310119936462850,2020-04-09 18:01:39 UTC,2020-04-09,18:01:39,0,264612782,mathabo__m,•.¸♡ HOD ♡¸.•🌻,,Sheesh!!!😭😭😭  I dont know if they are working or not but Partserve is the official mechanical technician in Southern Africa for Sony playstation.   0861 773 783   Lee Bowes at telephone (011) 201 7777  e-mail leeb@partserve.co.za.,en,[],[],[],1,0,0,[],[],https://twitter.com/Mathabo__M/status/1248310119936462850,False,https://twitter.com/unclebig_shaq/status/1248307529463091201,0,,,,,,,,[],,,,
1248237260014845952,1248237260014845952,2020-04-09 13:12:08 UTC,2020-04-09,13:12:08,0,2696850584,tshamanomakhadi,Tshamano Makhadi,,"Here is a podcast of my interview speaking to Ubuntu Radio with host, Tali Munzhedzi this morning. Founder of Champion South Africa, Ashraf Garda on the other side of the telephone shared some great insights. Take a listen.   https://t.co/GQiSZ86lWe",en,[],['https://soundcloud.com/ubunturadioza/south-african-media-coverage-and-govt-communications-during-coronovirus-pandemic'],[],0,1,0,[],[],https://twitter.com/tshamanomakhadi/status/1248237260014845952,False,,0,,,,,,,,[],,,,
1248026217858596867,1248026217858596867,2020-04-08 23:13:32 UTC,2020-04-08,23:13:32,0,1174634562204422144,a_yenky,Yenky A Sesay,,"310–564–7981 : voici le numéro de téléphone de Maria Sharapova, elle attend vos messages   https://t.co/u7ydqd639R.  Hello love u with peace harommony'am guineaan west africa",fr,[],['https://news.phxfeeds.com/share?docId=641093264908266692&source=phx'],[],1,0,0,[],[],https://twitter.com/a_yenky/status/1248026217858596867,False,,0,,,,,,,,[],,,,
1247889943596126210,1247889943596126210,2020-04-08 14:12:01 UTC,2020-04-08,14:12:01,0,1134555578,africanat,African Antitrust,,Free -- Two upcoming #Africa-focused telephone seminars (on Wed. 15 April and Tue. 21 April). More info and RSVP for Zoom details here:  https://t.co/DgJWL8OyxG #AfricanAntitrust #AfricaLegal #LawInAfrica #LawAfrica #LexAfrica,en,[],['https://africanantitrust.com/2020/04/08/primeriowebinars/'],[],0,2,0,"['africa', 'africanantitrust', 'africalegal', 'lawinafrica', 'lawafrica', 'lexafrica']",[],https://twitter.com/AfricanAT/status/1247889943596126210,False,,0,,,,,,,,[],,,,
1247643909070544896,1247643909070544896,2020-04-07 21:54:22 UTC,2020-04-07,21:54:22,0,17564640,marclevine,Marc Levine,,The pandemic can be so overwhelming. Join me this afternoon for a telephone town hall in conversation with Dr. Jei Africa about mental health and sheltering in place. Today at 4pm. Call information in the graphic. Email questions to Assemblymember.levine@assembly.ca.gov  https://t.co/WQX73yd7AQ,en,[],[],['https://pbs.twimg.com/media/EVCFhTgUwAAS0B9.jpg'],0,0,0,[],[],https://twitter.com/MarcLevine/status/1247643909070544896,False,,1,https://pbs.twimg.com/media/EVCFhTgUwAAS0B9.jpg,,,,,,,[],,,,
1247641297998970882,1247641297998970882,2020-04-07 21:44:00 UTC,2020-04-07,21:44:00,0,2585656873,norm_energy,Norm Energy Systems,,"Kiosque à énergie solaire autonome, qui a son propre éclairage et sa propre connexion wifi; Possibilité de charger le téléphone et l'ordinateur et de faire fonctionner le réfrigérateur et le ventilateur.  #afrique #africa #turquie #Kiosque #EnergieSolaire #Kiosk #SolarEnergy  https://t.co/tOuuxNcAL9",fr,[],[],['https://pbs.twimg.com/media/EVCCy4qX0AYOrHg.jpg'],0,0,2,"['afrique', 'africa', 'turquie', 'kiosque', 'energiesolaire', 'kiosk', 'solarenergy']",[],https://twitter.com/Norm_Energy/status/1247641297998970882,False,,1,https://pbs.twimg.com/media/EVCCy4qX0AYOrHg.jpg,,,,,,,[],,,,
1247577452139839490,1247577452139839490,2020-04-07 17:30:18 UTC,2020-04-07,17:30:18,0,17564640,marclevine,Marc Levine,,The pandemic can feel so overwhelming. Join me this afternoon for a telephone town hall in conversation with Dr. Jei Africa about mental health and sheltering in place. Today at 4pm. Call information in the graphic. Email questions to Assemblymember.levine@assembly.ca.gov  https://t.co/YevEwIH2Pr,en,[],[],['https://pbs.twimg.com/media/EVBJE-sUcAM1g_z.jpg'],0,1,5,[],[],https://twitter.com/MarcLevine/status/1247577452139839490,False,,1,https://pbs.twimg.com/media/EVBJE-sUcAM1g_z.jpg,,,,,,,[],,,,
1247497445514326016,1247497445514326016,2020-04-07 12:12:23 UTC,2020-04-07,12:12:23,0,263074291,addisstandard,Addis Standard,,"#Ethiopia: @AbiyAhmedAli , Putin hold telephone conversation over COVID-19 pandemic  https://t.co/xrBsc90E1T The Ethiopian prime minister said he was impressed by Putin’s mobilization of resources to support Africa’s fight against #COVID19. #Russia  https://t.co/DPYBXQ7E5K",en,"[{'screen_name': 'abiyahmedali', 'name': 'abiy ahmed ali 🇪🇹', 'id': '1168167671151628290'}]",['https://africa.cgtn.com/2020/04/07/abiy-putin-hold-telephone-conversation-over-covid-19-pandemic/'],['https://pbs.twimg.com/media/EVAASuLWAAEh248.jpg'],0,2,23,"['ethiopia', 'covid19', 'russia']",[],https://twitter.com/addisstandard/status/1247497445514326016,False,,1,https://pbs.twimg.com/media/EVAASuLWAAEh248.jpg,,,,,,,[],,,,
1247472695996022784,1247472695996022784,2020-04-07 10:34:02 UTC,2020-04-07,10:34:02,0,3378496205,couretech,COURE Software & Sys,,There should be no such thing  as trial by error.   Route your Voice/SMS campaigns across Africa with accurate data using ANQ Routing Service.  Email - Sales@coure-tech.com Telephone - +(234)-1-631-1910  #Tech #Africa #StayAtHome #Quarantine #SMS  https://t.co/okL38sO8RD,en,[],[],['https://pbs.twimg.com/media/EU_puDCWkAAdSdC.jpg'],0,0,0,"['tech', 'africa', 'stayathome', 'quarantine', 'sms']",[],https://twitter.com/couretech/status/1247472695996022784,False,,1,https://pbs.twimg.com/media/EU_puDCWkAAdSdC.jpg,,,,,,,[],,,,
1247094044532117504,1247094044532117504,2020-04-06 09:29:24 UTC,2020-04-06,09:29:24,0,3378496205,couretech,COURE Software & Sys,,There is a lot of opportunity to harness even with the present #lockdown.  Now you can expand your SMS/Voice reach with access to African data for efficient delivery  Email - Sales@coure-tech.com  Telephone - +(234)-1-631-1910  #Africa #Tech4All #lockdown #COVID19 #Tech #StayHome  https://t.co/73A0sevf5s,en,[],[],['https://pbs.twimg.com/media/EU6RaQWXsAEi7i1.jpg'],0,1,1,"['lockdown', 'africa', 'tech4all', 'lockdown', 'covid19', 'tech', 'stayhome']",[],https://twitter.com/couretech/status/1247094044532117504,False,,1,https://pbs.twimg.com/media/EU6RaQWXsAEi7i1.jpg,,,,,,,[],,,,
1246388686608117760,1246343656061239296,2020-04-04 10:46:34 UTC,2020-04-04,10:46:34,0,3359718766,moonarys,Solares,,"@Eliuuuuuus Le classique : Toto - Africa Après, y a du a-ha, du Depeche Mode, du Europe, du Indochine, du Michael Jackson, du Queen, du Téléphone, du U2, du Wham!, etc",fr,[],[],[],1,0,1,[],[],https://twitter.com/Moonarys/status/1246388686608117760,False,,0,,,,,,,,"[{'screen_name': 'Eliuuuuuus', 'name': 'Eliux on the flux', 'id': '991235436'}]",,,,
1246230003928518658,1246230003928518658,2020-04-04 00:16:01 UTC,2020-04-04,00:16:01,0,815658513112432641,yemembassynl,Yemen Embassy in NL,,"The Foreign Minister, H.E. Mohammed Al-Hadhrami, discusses in a telephone conversation with the British Minister of State for Middle East and North Africa Affairs the bilateral relations and the latest developments in the peace process.",en,[],[],[],1,0,3,[],[],https://twitter.com/YemEmbassyNL/status/1246230003928518658,False,https://twitter.com/yemen_mofa/status/1245678474729336832,0,,,,,,,,[],,,,
1246169262546464768,1246169262546464768,2020-04-03 20:14:39 UTC,2020-04-03,20:14:39,0,2515899612,hagegeingob,Hage G. Geingob,,"Today, the President of China, H.E XI Jinping and I agreed during our telephone conversation to strengthen Africa’s response to Covid-19. I also expressed gratitude to President XI for China’s support and care of over 500 Namibian students in Wuhan and China during this pandemic.  https://t.co/KlidLIIay7",en,[],[],"['https://pbs.twimg.com/media/EUtIUu2XgAE5iIV.jpg', 'https://pbs.twimg.com/media/EUtIUu9XsAAaUQv.jpg', 'https://pbs.twimg.com/media/EUtIUu2XsAcoSBc.jpg']",133,102,887,[],[],https://twitter.com/hagegeingob/status/1246169262546464768,False,,1,https://pbs.twimg.com/media/EUtIUu2XgAE5iIV.jpg,,,,,,,[],,,,
1246116605827977217,1245366224676171783,2020-04-03 16:45:25 UTC,2020-04-03,16:45:25,0,2568763319,hezronkabuge,Hezron Kabuge,,@KenyaAirways I agree  you connect Africa. However getting the right telephone contacts for KQ is not easy. The numbers one get from internet always go unanswered. Please update your contacts in online and hard copies platforms like yellow pages.,en,[],[],[],0,0,1,[],[],https://twitter.com/HezronKabuge/status/1246116605827977217,False,,0,,,,,,,,"[{'screen_name': 'KenyaAirways', 'name': 'Kenya Airways', 'id': '18493366'}]",,,,
1246112815179542528,1246112815179542528,2020-04-03 16:30:21 UTC,2020-04-03,16:30:21,0,3246591496,zedomuhammad,Muhammad Omar,,Telephone conversation with President of South Africa Cyril Ramaphosa  https://t.co/8ewIW1NbfN via @KremlinRussia_E,en,"[{'screen_name': 'kremlinrussia_e', 'name': 'president of russia', 'id': '205622130'}]",['http://en.kremlin.ru/events/president/news/63139'],[],0,0,0,[],[],https://twitter.com/ZedoMuhammad/status/1246112815179542528,False,,0,,,,,,,,[],,,,
1246051247242657792,1246051247242657792,2020-04-03 12:25:42 UTC,2020-04-03,12:25:42,0,3040880860,icrc_africa,ICRC Africa,,Your mental health is just as important as your physical well-being. Our @KenyaRedCross partners are providing free telephone-based counseling services to those that need help. @IFRCAfrica,en,"[{'screen_name': 'kenyaredcross', 'name': 'kenya red cross', 'id': '138708473'}, {'screen_name': 'ifrcafrica', 'name': 'ifrc africa', 'id': '892995073'}]",[],[],0,0,4,[],[],https://twitter.com/ICRC_Africa/status/1246051247242657792,False,https://twitter.com/KenyaRedCross/status/1246047373475880960,0,,,,,,,,[],,,,
1246006448078950402,1246006448078950402,2020-04-03 09:27:41 UTC,2020-04-03,09:27:41,0,3378496205,couretech,COURE Software & Sys,,Don't let social distancing beat you up  Stay in touch with accurate data for your SMS/Voice traffic across Africa  Email- sales@coure-tech.com Telephone-  +(234)-1-631-1910  https://t.co/bQ4kXHH2zt  #Tech #africa #COVID19Pandemic  https://t.co/U6VG7dq7yi,en,[],['http://www.coure-tech.com'],['https://pbs.twimg.com/media/EUqytjUVAAI3K51.jpg'],0,0,0,"['tech', 'africa', 'covid19pandemic']",[],https://twitter.com/couretech/status/1246006448078950402,False,,1,https://pbs.twimg.com/media/EUqytjUVAAI3K51.jpg,,,,,,,[],,,,
1246003207966515201,1246003207966515201,2020-04-03 09:14:49 UTC,2020-04-03,09:14:49,0,3378496205,couretech,COURE Software & Sys,,Do you Know - That your ideal data could be another revenue stream.   Our ANQ Platform clean up these data; create services while making them available to targeted users.  Email- sales@coure-tech.com Telephone-  +(234)-1-631-1910  #Tech #Africa #COVID19 #StayHomeSaveLives  https://t.co/HIARUU1gPr,en,[],[],['https://pbs.twimg.com/media/EUqu1_EU0AEeTNB.png'],0,1,1,"['tech', 'africa', 'covid19', 'stayhomesavelives']",[],https://twitter.com/couretech/status/1246003207966515201,False,,1,https://pbs.twimg.com/media/EUqu1_EU0AEeTNB.png,,,,,,,[],,,,
1245775274077274112,1245775274077274112,2020-04-02 18:09:05 UTC,2020-04-02,18:09:05,0,188263406,carhire4lower,CarHire4Lower.com,,"Need South African Airways of South Africa Information? -  Customer Service Telephone Number, Corporate Contact Location &amp; South African Airways Email Address &amp; Social Media &amp; Flight Status.   https://t.co/o4xnQ2X0jA  #flysaa @flysaa  https://t.co/vkhsyUBdEN",en,"[{'screen_name': 'flysaa', 'name': 'saa - south africa', 'id': '136071451'}]",['https://www.carhire4lower.com/airlines/south-africa-airlines/south-african-airways-information.php'],['https://pbs.twimg.com/media/EUniAnCWAAQelHV.jpg'],0,0,0,['flysaa'],[],https://twitter.com/carhire4lower/status/1245775274077274112,False,,1,https://pbs.twimg.com/media/EUniAnCWAAQelHV.jpg,,,,,,,[],,,,
1245772855939420168,1245772855939420168,2020-04-02 17:59:28 UTC,2020-04-02,17:59:28,0,757880604255977476,thankputin,Thanks Putin,,"KremlinRussia_E: Telephone conversation with President of South Africa Cyril Ramaphosa: outcomes of the G20 Summit, fighting the coronavirus  https://t.co/VVeWNInn9U",en,[],['https://bit.ly/2x0cjab'],[],0,0,0,[],[],https://twitter.com/ThankPutin/status/1245772855939420168,False,,0,,,,,,,,[],,,,
1245771996107071501,1245771996107071501,2020-04-02 17:56:03 UTC,2020-04-02,17:56:03,0,205622130,kremlinrussia_e,President of Russia,,"Telephone conversation with President of South Africa Cyril Ramaphosa: outcomes of the G20 Summit, fighting the coronavirus  https://t.co/xF1HVHeB6M",en,[],['https://bit.ly/2x0cjab'],[],43,70,264,[],[],https://twitter.com/KremlinRussia_E/status/1245771996107071501,False,,0,,,,,,,,[],,,,
