id,conversation_id,created_at,date,time,timezone,user_id,username,name,place,tweet,language,mentions,urls,photos,replies_count,retweets_count,likes_count,hashtags,cashtags,link,retweet,quote_url,video,thumbnail,near,geo,source,user_rt_id,user_rt,retweet_id,reply_to,retweet_date,translate,trans_src,trans_dest
1209249259679309832,1209175609596878855,2019-12-23 23:07:44 UTC,2019-12-23,23:07:44,0,2791932779,refineafrica,Jonathan Stephenson,,"@News24 @J_chabalala The entire expanse of land was available to him but noooo, Zeus decides he wants to pick on @Eskom_SA and in a 3 second sadistic rage he chucks a bolt of lightening straight at the sub station in South Africa in protest after receiving another inflated elec bill. Next up...",en,"[{'screen_name': 'eskom_sa', 'name': 'eskom hld soc ltd', 'id': '466420346'}]",[],[],0,0,1,[],[],https://twitter.com/RefineAfrica/status/1209249259679309832,False,,0,,,,,,,,"[{'screen_name': 'News24', 'name': 'News24', 'id': '14697575'}, {'screen_name': 'J_chabalala', 'name': 'Jeanette Chabalala', 'id': '84281275'}]",,,,
1206823585551192064,1206823585551192064,2019-12-17 06:28:59 UTC,2019-12-17,06:28:59,0,778140350732984320,ethiosss,Ethiopian Space Science Society,,"Ethiopian First Remote Sensing Satellite (ETRSS-1) Ground receiving, control and command station antenna at the premises of Entoto Observatory and research center. #AddisAbaba #Ethiopia #Africa  https://t.co/W0oiZPTIAR",en,[],[],['https://pbs.twimg.com/media/EL9_mU0XkAEuxwM.jpg'],1,7,22,"['addisababa', 'ethiopia', 'africa']",[],https://twitter.com/ethiosss/status/1206823585551192064,False,,1,https://pbs.twimg.com/media/EL9_mU0XkAEuxwM.jpg,,,,,,,[],,,,
1154481605454397440,1154347959536033793,2019-07-25 20:00:38 UTC,2019-07-25,20:00:38,0,909399838235791366,odiraaemma,Emma Aniamalu,,"@CheezyCharles @UrbanRadio945 Happy birthday to a great &amp; entertaining radio station. I wish you the greatest in this country &amp; in Africa as a whole. But pls @bigbrother u should stop receiving some calls like ""this is brother Lui calling from Enugu, yeah Eby boy from transekulu.....etc.They hurts me.",en,[],[],[],0,0,1,[],[],https://twitter.com/OdiraaEmma/status/1154481605454397440,False,,0,,,,,,,,"[{'screen_name': 'CheezyCharles', 'name': 'CheezyCharles', 'id': '207567618'}, {'screen_name': 'UrbanRadio945', 'name': 'UrbanRadio 94.5FM', 'id': '3771807857'}]",,,,
1090170342251941888,1090170342251941888,2019-01-29 08:50:38 UTC,2019-01-29,08:50:38,0,20064098,yingeli,Ingrid Fischer 殷歌丽,,Who got the Multi-Million Euro contract to build Ethiopian satellite ground receiving station? - Space in Africa  https://t.co/4Ddz6875dF,en,[],['https://africanews.space/who-got-the-multi-million-euro-contract-to-build-ethiopian-satellite-ground-receiving-station/'],[],0,0,0,[],[],https://twitter.com/yingeli/status/1090170342251941888,False,,0,,,,,,,,[],,,,
1089773725296312322,1089773725296312322,2019-01-28 06:34:37 UTC,2019-01-28,06:34:37,0,175782583,myrukyr,エマニュエル.B,,Who got the Multi-Million Euro contract to build Ethiopian satellite ground receiving station? - Space in Africa Information somme toute intéressante !  https://t.co/emVpFtKw99,en,[],['https://africanews.space/who-got-the-multi-million-euro-contract-to-build-ethiopian-satellite-ground-receiving-station/'],[],0,0,0,[],[],https://twitter.com/Myrukyr/status/1089773725296312322,False,,0,,,,,,,,[],,,,
1089148779826167809,1089148779826167809,2019-01-26 13:11:19 UTC,2019-01-26,13:11:19,0,4873884449,lidarmonkey,LidarMonkey,,Who got the Multi-Million Euro contract to build Ethiopian satellite ground receiving station? - Space in Africa  https://t.co/6ylkLDWiC9 via @lidarmonkey #earth #observation,en,"[{'screen_name': 'lidarmonkey', 'name': 'lidarmonkey', 'id': '4873884449'}]",['https://africanews.space/who-got-the-multi-million-euro-contract-to-build-ethiopian-satellite-ground-receiving-station/?unique_ID=636841080130799124'],[],0,0,0,"['earth', 'observation']",[],https://twitter.com/LidarMonkey/status/1089148779826167809,False,,0,,,,,,,,[],,,,
1075316137414533120,1075316137414533120,2018-12-19 09:05:20 UTC,2018-12-19,09:05:20,0,618925206,rcmrd_,RCMRD,,The MODIS Fire Information System at RCMRD integrates #remotesensing and #gis technologies to deliver fire hotspot zones/points within Eastern and Southern Africa using MODIS data received via the MODIS receiving station at RCMRD.   https://t.co/V8kybruuIU #RCMRD  https://t.co/XwGglbc6M4,en,[],['https://www.rcmrd.org/archives/277-aberdare-forest-fires-detected-by-modis-fire-information-system-at-rcmrd1'],['https://pbs.twimg.com/media/DuxKTzUXgAE5DvX.jpg'],1,2,7,"['remotesensing', 'gis', 'rcmrd']",[],https://twitter.com/RCMRD_/status/1075316137414533120,False,,1,https://pbs.twimg.com/media/DuxKTzUXgAE5DvX.jpg,,,,,,,[],,,,
1057635324120072193,1057635324120072193,2018-10-31 14:08:05 UTC,2018-10-31,14:08:05,0,426037722,bamidele2luv,Bamidele Muhammed,,"Just when the third video of Ganduje receiving bribes is trending,  N.T.A the so called biggest TV station in Africa is showing the Empowerment of Street Hawkers by the shameless Ganduje. What a country",en,[],[],[],0,1,1,[],[],https://twitter.com/Bamidele2luv/status/1057635324120072193,False,,0,,,,,,,,[],,,,
1048064165062041602,1048064165062041602,2018-10-05 04:15:43 UTC,2018-10-05,04:15:43,0,247156136,lewismenya,Lewis Menya Jakoredo™,,"The satellite receiving station in Nairobi collects data from several earth observation satellites, which it shares with the RCMRD’s 20 member states in eastern and southern Africa. #RCMRDSpaceChallenge",en,[],[],[],1,4,1,['rcmrdspacechallenge'],[],https://twitter.com/LewisMenya/status/1048064165062041602,False,,0,,,,,,,,[],,,,
1045691954976165889,1045615514985418752,2018-09-28 15:09:24 UTC,2018-09-28,15:09:24,0,990625539357634560,rose_alice17,Rose Alice,,"@PlateauKillings @MKabrik @NigeriaMourns @AishaYesufu @obyezeks @EiENigeria @pius_adesanmi When I want to run this kind of issues on my TV station in Europe, I have started receiving insults from some people in Nigeria 🇳🇬, I wonder why? I am creating an awareness, because I am a black granmother and it hurts to see my continent of Africa been destroyed",en,[],[],[],1,1,4,[],[],https://twitter.com/rose_alice17/status/1045691954976165889,False,,0,,,,,,,,"[{'screen_name': 'PlateauKillings', 'name': 'Plateau Killing', 'id': '1011516127971717120'}, {'screen_name': 'MKabrik', 'name': 'Ms Baryat #EndSARs #EndPoliceBrutality #ReformNige', 'id': '486571730'}, {'screen_name': 'NigeriaMourns', 'name': 'NigeriaMourns', 'id': '998947263954202624'}, {'screen_name': 'AishaYesufu', 'name': 'Aisha Yesufu', 'id': '2531005222'}, {'screen_name': 'obyezeks', 'name': 'Oby Ezekwesili', 'id': '34082810'}, {'screen_name': 'EiENigeria', 'name': 'EiE Nigeria', 'id': '128022083'}, {'screen_name': 'pius_adesanmi', 'name': 'Pius Adesanmi', 'id': '3430890617'}]",,,,
1018000910864154624,1018000910864154624,2018-07-14 05:15:05 UTC,2018-07-14,05:15:05,0,861679744710057985,newsupdate24ext,NewsUpdate24 ☣️🌊☄️🌪️🌋🚔,,"VI-20180714-63890-EGY - Vehicle Accident - Egypt - Africa: Eighteen people who injured in Friday's train derailment at Marazeeq Station on Aswa Western Agricultural Road in Giza were discharged from hospitals after receiving treatment,…  https://t.co/KQ6fvPfYJj  - RSOE EDIS",en,[],['http://hisz.rsoe.hu/alertmap/database/?pageid=event_summary&edis_id=VI-20180714-63890-EGY&utm_source=nu24.org&utm_medium=twitter'],[],0,0,0,[],[],https://twitter.com/NewsUpdate24Ext/status/1018000910864154624,False,,0,,,,,,,,[],,,,
984866697579515906,984866697579515906,2018-04-13 18:51:33 UTC,2018-04-13,18:51:33,0,232536144,geekc0der,Tom Van den Bon,,"hehe, you can get an award for receiving and decoding images directly from the Space Station. Space station is making another pass over South Africa tonight. Hope to grab a few more images to complete the collection :)  #interkosmos #iss #sdr #sstv #space  https://t.co/0Y6rLSE3aS",en,[],[],['https://pbs.twimg.com/media/Dary9SPXkAAPjWh.jpg'],1,2,8,"['interkosmos', 'iss', 'sdr', 'sstv', 'space']",[],https://twitter.com/geekc0der/status/984866697579515906,False,,1,https://pbs.twimg.com/media/Dary9SPXkAAPjWh.jpg,,,,,,,[],,,,
975862748650393605,975817745139843072,2018-03-19 22:33:04 UTC,2018-03-19,22:33:04,0,902973105022390273,activehatebrit,Active Hate,,"@AlexEpstein @Schwarzenegger Exactly, I have a couple friends in africa, one who was injured in a mining accident and another who has severe asthma. Both were in hospitals receiving care to save their lives over the past couple of years. Without the electricity generated from the coal power station, the &gt;",en,[],[],[],1,0,0,[],[],https://twitter.com/activehatebrit/status/975862748650393605,False,,0,,,,,,,,"[{'screen_name': 'AlexEpstein', 'name': 'Alex Epstein', 'id': '32913997'}, {'screen_name': 'Schwarzenegger', 'name': 'Arnold', 'id': '12044602'}]",,,,
943373133972635648,943373133972635648,2017-12-20 06:50:56 UTC,2017-12-20,06:50:56,0,1461713154,taytbells,#SportsFanatic⚽🎾⛳🏀,,"Just receiving news of the passing away of Michelle Molatlou having have worked and partnered with a couple of presenters and radio station in South Africa, Mitchell was one person who would  always check on me esp when I was in SA #RIPMichelleMolatlou #Tshego",en,[],[],[],0,0,2,"['ripmichellemolatlou', 'tshego']",[],https://twitter.com/taytbells/status/943373133972635648,False,,0,,,,,,,,[],,,,
845029750775123970,845029750775123970,2017-03-23 21:49:27 UTC,2017-03-23,21:49:27,0,839733193225945089,wwwenaghana,www.enaghana.com,,UG VC Inaugurates West Africa Marine Satellite Receiving Station  https://t.co/gEoT9YA660,en,[],['http://enaghana.com/2017/03/23/ug-vc-inaugurates-west-africa-marine-satellite-receiving-station/'],[],0,0,0,[],[],https://twitter.com/WwwEnaghana/status/845029750775123970,False,,0,,,,,,,,[],,,,
844956251809288193,844956251809288193,2017-03-23 16:57:23 UTC,2017-03-23,16:57:23,0,3042903040,legonconnect,Tertiary Gist & Gossips,,UG VC Inaugurates West Africa Marine Satellite Receiving Station  https://t.co/zpubSlvoAk,en,[],['http://fb.me/8tu73CVXo'],[],0,0,0,[],[],https://twitter.com/legonconnect/status/844956251809288193,False,,0,,,,,,,,[],,,,
844847504961110017,844847504961110017,2017-03-23 09:45:16 UTC,2017-03-23,09:45:16,0,3042903040,legonconnect,Tertiary Gist & Gossips,,UG VC Inaugurates West Africa Marine Satellite Receiving Station  https://t.co/q4FGc57Etk,en,[],['http://fb.me/68Y798XOy'],[],0,0,0,[],[],https://twitter.com/legonconnect/status/844847504961110017,False,,0,,,,,,,,[],,,,
722783589310558208,722783589310558208,2016-04-20 13:46:51 UTC,2016-04-20,13:46:51,0,24674088,jamminjoe_us,JamminJoeTheTrueSmoothSaxophonist,,The Africa Union Commission (AUC) is set to inaugurate an AU-AMESD project satellite receiving station at the AUC...  https://t.co/zJPNNJrzYU,en,[],['http://fb.me/7oX2HvuCH'],[],0,0,0,[],[],https://twitter.com/jamminjoe_us/status/722783589310558208,False,,0,,,,,,,,[],,,,
633728766146056192,633728766146056192,2015-08-18 19:54:46 UTC,2015-08-18,19:54:46,0,17290967,mundogeo,MundoGEO,,SPOT 6/7 Complete Coverage Over South Africa in Just 3 Months: The SPOT 6 and SPOT 7 Direct Receiving Station ...  http://t.co/MFuUd81WTI,en,[],['http://bit.ly/1hmqQj9'],[],0,1,0,[],[],https://twitter.com/MundoGEO/status/633728766146056192,False,,0,,,,,,,,[],,,,
622144425423192064,622144425423192064,2015-07-17 20:42:44 UTC,2015-07-17,20:42:44,0,3332601569,profrmsimango,Prof R.M.Simango,,"Train has derailed at Booysens railway station in South Africa, multiple patients receiving medical care on scene!  http://t.co/mcKsT5lU8p",en,[],[],['https://pbs.twimg.com/media/CKJIC4VXAAExeWv.jpg'],0,0,0,[],[],https://twitter.com/ProfRMSimango/status/622144425423192064,False,,1,https://pbs.twimg.com/media/CKJIC4VXAAExeWv.jpg,,,,,,,[],,,,
622138913939963904,622138913939963904,2015-07-17 20:20:50 UTC,2015-07-17,20:20:50,0,40106211,ezratshisa,EZRA SIBANDA,,"Train has derailed at Booysens railway station in South Africa, multiple patients receiving medical care on scene!  http://t.co/qx2xhbaeX7",en,[],[],['https://pbs.twimg.com/media/CKJIC4VXAAExeWv.jpg'],0,5,1,[],[],https://twitter.com/EZRATSHISA/status/622138913939963904,False,,1,https://pbs.twimg.com/media/CKJIC4VXAAExeWv.jpg,,,,,,,[],,,,
593695445454467072,593695445454467072,2015-04-30 08:36:39 UTC,2015-04-30,08:36:39,0,3221242048,centmoko,cent moko,,@maquinjoseph hi maquin joe thats for receiving me and my team yesterday at your station.music africa awake sends its greeting,en,[],[],[],1,1,1,[],[],https://twitter.com/centmoko/status/593695445454467072,False,,0,,,,,,,,[],,,,
489021789096640512,489021789096640512,2014-07-15 12:20:54 UTC,2014-07-15,12:20:54,0,733407223,lees_sandbox,Lee Sanders,,Data direct! A ground receiving station is installed in Africa MODIS  @NOAA  #satellite #GIS  #remotesensing #maps  http://t.co/WNJkFXyFI8,en,"[{'screen_name': 'noaa', 'name': 'noaa', 'id': '14342564'}]",['http://bit.ly/WeKVxq'],[],0,0,0,"['satellite', 'gis', 'remotesensing', 'maps']",[],https://twitter.com/Lees_Sandbox/status/489021789096640512,False,,0,,,,,,,,[],,,,
475531816472805376,475531816472805376,2014-06-08 06:56:34 UTC,2014-06-08,06:56:34,0,389466047,enviroprojects,SustainableOS,,"New satellite data receiving station at SERVIR-Africa ""sees"" 75 percent of African continent: SERVIR-Africa an...  http://t.co/5RKSV2cumo",en,[],['http://bit.ly/1ppm7fs'],[],0,0,0,[],[],https://twitter.com/enviroprojects/status/475531816472805376,False,,0,,,,,,,,[],,,,
370221848568422400,370221848568422400,2013-08-21 16:32:21 UTC,2013-08-21,16:32:21,0,34924084,nikeyayoung,Nikeya N. Young,,"Yo!!! My song ""Get Yo Mind Right"" is receiving airplay on an XFM radio station based in Ghana, Africa !!! #THIS #GodIsGood #VICTORIOUSONE",en,[],[],[],1,1,0,"['this', 'godisgood', 'victoriousone']",[],https://twitter.com/nikeyayoung/status/370221848568422400,False,,0,,,,,,,,[],,,,
298433269509259265,298433269509259265,2013-02-04 14:10:10 UTC,2013-02-04,14:10:10,0,45589825,franklinfueling,Franklin Fueling,,"Are you receiving our Petrol Station blog news updates (dedicated to Europe, Middle East and Africa)? If not,...  http://t.co/OUEdSEgF",en,[],['http://fb.me/28SzNI56O'],[],0,0,0,[],[],https://twitter.com/FranklinFueling/status/298433269509259265,False,,0,,,,,,,,[],,,,
85836124886544384,85836124886544384,2011-06-28 22:25:01 UTC,2011-06-28,22:25:01,0,277683189,lowdeept,LOW DEEP T,,So we are receiving great news from South africa ..that my track big Love is now playlisted on the biggest radio station Metro Fm ..,en,[],[],[],0,0,0,[],[],https://twitter.com/LOWDEEPT/status/85836124886544384,False,,0,,,,,,,,[],,,,
