id,conversation_id,created_at,date,time,timezone,user_id,username,name,place,tweet,language,mentions,urls,photos,replies_count,retweets_count,likes_count,hashtags,cashtags,link,retweet,quote_url,video,thumbnail,near,geo,source,user_rt_id,user_rt,retweet_id,reply_to,retweet_date,translate,trans_src,trans_dest
1275698948666273793,1275698948666273793,2020-06-24 07:55:05 UTC,2020-06-24,07:55:05,0,1170380753751957504,action1218,MaG,,"@ALDO_Shoes @CallitSpring_SA I would like to send this appropriation tweet to Charne  a store manager at @CallitSpring_SA mall of Africa, She went beyond in assisting me to get through to the Aldo shop whose telephone lines were down that particular day",en,"[{'screen_name': 'callitspring_sa', 'name': 'call it spring sa', 'id': '1920027386'}, {'screen_name': 'callitspring_sa', 'name': 'call it spring sa', 'id': '1920027386'}]",[],[],1,0,0,[],[],https://twitter.com/Action1218/status/1275698948666273793,False,,0,,,,,,,,[],,,,
1275500964779372547,1275404287233982466,2020-06-23 18:48:22 UTC,2020-06-23,18:48:22,0,875606881804275712,sa_for_life,SA Proud,,"@HeritageZonela @JanBran06127566 I agree, rather look at your history with your own savagery, still very much alive today. Look at your history with you views and carry on with your telephone line stories. No wonder Africa is a disasterous continent with failed after failed country. We do not entertain fools.",en,[],[],[],1,0,0,[],[],https://twitter.com/SA_for_life/status/1275500964779372547,False,,0,,,,,,,,"[{'screen_name': 'HeritageZonela', 'name': ""Phumelele Maf 'esizwe Zonela"", 'id': '348502179'}, {'screen_name': 'JanBran06127566', 'name': 'Jan Brand', 'id': '853312367207251968'}]",,,,
1275454771567067136,1275454771567067136,2020-06-23 15:44:49 UTC,2020-06-23,15:44:49,0,69290737,afropages,Afropages,,Africa Check - Covid-19 : l’application « Covid » a-t-elle été installée sur vos téléphones à votre insu ?  https://t.co/EGBqn2z8cV  https://t.co/tSUuZt4Xey,fr,[],['http://tinyurl.com/y9ymvnkm'],['https://pbs.twimg.com/media/EbNTWufUEAQBKW5.jpg'],0,0,0,[],[],https://twitter.com/Afropages/status/1275454771567067136,False,,1,https://pbs.twimg.com/media/EbNTWufUEAQBKW5.jpg,,,,,,,[],,,,
1275409958469861379,1275178464287612930,2020-06-23 12:46:44 UTC,2020-06-23,12:46:44,0,236585543,designingschool,James Clarke,,@ASTsupportAAli My Great Grandfather ran the company that installed the submarine telephone cables between South Africa and India. He lived in Mauritius but died on board ship whilst travelling home to retire in Bristol and was buried at sea off the French New Guinea coast.,en,[],[],[],0,1,3,[],[],https://twitter.com/DesigningSchool/status/1275409958469861379,False,,0,,,,,,,,"[{'screen_name': 'ASTsupportAAli', 'name': 'Amjad Ali', 'id': '613446992'}]",,,,
1275359814852509703,1275359814852509703,2020-06-23 09:27:29 UTC,2020-06-23,09:27:29,0,1386392510,worldnewsnetwrk,WorldNews,,Telkom South Africa's telephone company considers spinning off it's towers. #TelkomSA,en,[],[],[],0,0,0,['telkomsa'],[],https://twitter.com/worldnewsnetwrk/status/1275359814852509703,False,,0,,,,,,,,[],,,,
1275355925742837760,1275355925742837760,2020-06-23 09:12:02 UTC,2020-06-23,09:12:02,0,21272440,technology,Bloomberg Technology,,South Africa’s former telephone landline monopoly is looking for more ways to make money out of its mobile phone towers business  https://t.co/Dc0xR6T6e4,en,[],['https://trib.al/O1sGeRz'],[],0,3,1,[],[],https://twitter.com/technology/status/1275355925742837760,False,,0,,,,,,,,[],,,,
1275322319196631041,1275291942012825602,2020-06-23 06:58:29 UTC,2020-06-23,06:58:29,0,1072548279186063361,horshedbookends,🇵🇷Jacob Dickens🇵🇷,,@vivianisstupid Yes! It seems astroturfed like a game of telephone that ends with the left’s cancelling has extended to sacred cow Toto’s Africa.,en,[],[],[],0,0,0,[],[],https://twitter.com/horshedbookends/status/1275322319196631041,False,,0,,,,,,,,[],,,,
1275293413416501250,1275293413416501250,2020-06-23 05:03:38 UTC,2020-06-23,05:03:38,0,255471924,mfa_russia,MFA Russia 🇷🇺,,"📞On June 22, #Russian Deputy FM Mikhail Bogdanov had a telephone conversation with Minister of State for Foreign Affairs of the #UAE @AnwarGargash. The diplomats discussed in detail the current agenda in the Middle East and North Africa.🔗 https://t.co/pmjkvXmvEb  https://t.co/1gpoz2nSvR",en,"[{'screen_name': 'anwargargash', 'name': 'د. أنور قرقاش', 'id': '348378205'}]",['https://is.gd/gy8Ug4'],['https://pbs.twimg.com/media/EbLAmJpXkAAWDNf.jpg'],0,11,17,"['russian', 'uae']",[],https://twitter.com/mfa_russia/status/1275293413416501250,False,,1,https://pbs.twimg.com/media/EbLAmJpXkAAWDNf.jpg,,,,,,,[],,,,
1275221397296558081,1275221397296558081,2020-06-23 00:17:28 UTC,2020-06-23,00:17:28,0,925691081286668289,uaeembassyhague,UAE Embassy-TheHAGUE,,"H.E. Dr. H Alotaiba UAE Ambassador to the Netherlands, discussed during a telephone conversation with Dr. Geoffrey van Leeuwen, Director of North Africa and Middle-East at the Dutch Ministry of Foreign affairs, bilateral relations between the two countries.  https://t.co/C0eF2Nrt1p",en,[],[],['https://pbs.twimg.com/media/EbJ_FeUX0AEH5Df.jpg'],0,3,4,[],[],https://twitter.com/UAEEmbassyHAGUE/status/1275221397296558081,False,,1,https://pbs.twimg.com/media/EbJ_FeUX0AEH5Df.jpg,,,,,,,[],,,,
1275072318960578562,1275072318960578562,2020-06-22 14:25:05 UTC,2020-06-22,14:25:05,0,632923508,bbgafrica,Bloomberg Africa,,South Africa’s former telephone landline monopoly is looking for more ways to make money out of its mobile phone towers business  https://t.co/LgSZP5PEtP,en,[],['https://trib.al/NpGPWgm'],[],0,3,10,[],[],https://twitter.com/BBGAfrica/status/1275072318960578562,False,,0,,,,,,,,[],,,,
1275042608960724992,1275042608960724992,2020-06-22 12:27:01 UTC,2020-06-22,12:27:01,0,632923508,bbgafrica,Bloomberg Africa,,South Africa’s former telephone landline monopoly is looking for more ways to make money out of its mobile phone towers business  https://t.co/LyEIiZ7ivH,en,[],['https://trib.al/7oycrnW'],[],0,2,4,[],[],https://twitter.com/BBGAfrica/status/1275042608960724992,False,,0,,,,,,,,[],,,,
1275023895247171589,1275023895247171589,2020-06-22 11:12:40 UTC,2020-06-22,11:12:40,0,588261604,bloombergasia,Bloomberg Asia,,South Africa’s former telephone landline monopoly is looking for more ways to make money out of its mobile phone towers business  https://t.co/zrzFejalwE,en,[],['https://trib.al/pfIApH8'],[],0,0,0,[],[],https://twitter.com/BloombergAsia/status/1275023895247171589,False,,0,,,,,,,,[],,,,
1275009902700871680,1275009902700871680,2020-06-22 10:17:03 UTC,2020-06-22,10:17:03,0,34713362,business,Bloomberg,,South Africa’s former telephone landline monopoly is looking for more ways to make money out of its mobile phone towers business  https://t.co/FnJT476P9M,en,[],['https://trib.al/EIEohKG'],[],3,9,21,[],[],https://twitter.com/business/status/1275009902700871680,False,,0,,,,,,,,[],,,,
1274995925870686208,1274995925870686208,2020-06-22 09:21:31 UTC,2020-06-22,09:21:31,0,632923508,bbgafrica,Bloomberg Africa,,South Africa’s former telephone landline monopoly is looking for more ways to make money out of its mobile phone towers business  https://t.co/ad2jc0I4ki,en,[],['https://trib.al/t7i5no9'],[],0,15,15,[],[],https://twitter.com/BBGAfrica/status/1274995925870686208,False,,0,,,,,,,,[],,,,
1274740081853636612,1274704888388255744,2020-06-21 16:24:53 UTC,2020-06-21,16:24:53,0,392126868,onyeomaawolo,Nyolins,,"@DavidHundeyin I was at Ifonyin market in 1984 and people were saying  "" hello"" to a small device they held to their ears.  I knew that hello was telephone language so I asked. That was a mobile phone!  Meanwhile Nigeria WAS ' Giant of Africa! '",en,[],[],[],1,2,5,[],[],https://twitter.com/onyeomaawolo/status/1274740081853636612,False,,0,,,,,,,,"[{'screen_name': 'DavidHundeyin', 'name': 'David Hundeyin', 'id': '3315017925'}]",,,,
1274365901949657089,1274365901949657089,2020-06-20 15:38:02 UTC,2020-06-20,15:38:02,0,1035612370872270854,royalmics,RoyalMics Entertainment,,"Fally Ipupa – Allo Téléphone: Fally Ipupa out with new music tagged – Allo Téléphone DOWNLOAD BELOW… The post Fally Ipupa – Allo Téléphone appeared first on Ghana Music, Kenya Music, Tanzania Music, Nigeria Music, Ugandan Music, South Africa Music,…  https://t.co/YcwWIrmw5X",ht,[],['http://dlvr.it/RZ1qC4'],[],1,0,0,[],[],https://twitter.com/royalmics/status/1274365901949657089,False,,0,,,,,,,,[],,,,
1274327622634409986,1271786636003758081,2020-06-20 13:05:55 UTC,2020-06-20,13:05:55,0,1224076939629072392,waltervictor_,™,,"Before Gaddafi made his simple yet grand gesture of transforming the connectivity of the continent, telephone calls made to Africa and outside Africa were ridiculously the most expensive in the world 🌐. It was a luxury to make a call that could last for more than five minutes.",en,[],[],[],1,4,6,[],[],https://twitter.com/WalterVictor_/status/1274327622634409986,False,,0,,,,,,,,[],,,,
1274327236003446785,1271786636003758081,2020-06-20 13:04:23 UTC,2020-06-20,13:04:23,0,1224076939629072392,waltervictor_,™,,"Connecting the entire continent by telephone 📞, television 📺, radio 📻 broadcasting  and the internet seemed a remote possibility for Africa. It only required the collective efforts of the continent to put an end to this.  https://t.co/wTydbx73WZ",en,[],[],['https://pbs.twimg.com/media/Ea9R3eoXkAA68--.png'],1,3,7,[],[],https://twitter.com/WalterVictor_/status/1274327236003446785,False,,1,https://pbs.twimg.com/media/Ea9R3eoXkAA68--.png,,,,,,,[],,,,
1274323579103051779,1271786636003758081,2020-06-20 12:49:51 UTC,2020-06-20,12:49:51,0,1224076939629072392,waltervictor_,™,,"At one point, it was unimaginably expensive to make a telephone call 📞 in Africa. Worse still, to make a call to another caller who is outside Africa 🌍. With a radical change, the gateway is open to contact anyone in any part of the world at the fastest time possible.  https://t.co/8wNVl2gfnt",en,[],[],['https://pbs.twimg.com/media/Ea9OinSWkAAFQOh.jpg'],1,6,10,[],[],https://twitter.com/WalterVictor_/status/1274323579103051779,False,,1,https://pbs.twimg.com/media/Ea9OinSWkAAFQOh.jpg,,,,,,,[],,,,
1274272408195792899,1274272408195792899,2020-06-20 09:26:31 UTC,2020-06-20,09:26:31,0,1115566601774956545,pierrocorpo,PierroCorpo,,🔴 @fallyipupa01 🇨🇩  ALLO TELEPHONE ☎️  ▶️  https://t.co/0UftbW8zKm - - - #pierrocorpo #fallyipupa #allôtéléphone #newvideo #newclip #videoclip #instavideo #newpost #congo #kinshasa #togo #africa #abidjan #video…  https://t.co/LVDqhjqhtT,in,"[{'screen_name': 'fallyipupa01', 'name': 'fally ipupa', 'id': '184688494'}]","['https://youtu.be/yVj-mH808gA', 'https://www.instagram.com/p/CBpthlEpOcJ/?igshid=ro3lztm28lnu']",[],0,0,0,"['pierrocorpo', 'fallyipupa', 'allôtéléphone', 'newvideo', 'newclip', 'videoclip', 'instavideo', 'newpost', 'congo', 'kinshasa', 'togo', 'africa', 'abidjan', 'video']",[],https://twitter.com/PierroCorpo/status/1274272408195792899,False,,0,,,,,,,,[],,,,
1274221377080496128,1274221377080496128,2020-06-20 06:03:44 UTC,2020-06-20,06:03:44,0,351967882,dareeeyy,Elephant Solo 🐘,,“Unveiling the intention of the govt to construct a telephone booth”  Africa my Africa,en,[],[],[],0,0,0,[],[],https://twitter.com/Dareeeyy/status/1274221377080496128,False,https://twitter.com/mynassah/status/1273993298059890688,0,,,,,,,,[],,,,
1274085490950627335,1274076969932591104,2020-06-19 21:03:47 UTC,2020-06-19,21:03:47,0,818859116,elspethelspeth,Elspeth 😷 #HoldThemToAccount,,@Elainebks The telephone number is for an organisation in South Africa so I've deleted my post.  https://t.co/maQUzobspd,en,[],[],['https://pbs.twimg.com/media/Ea51_09XkAI4ioc.jpg'],1,0,0,[],[],https://twitter.com/ElspethElspeth/status/1274085490950627335,False,,1,https://pbs.twimg.com/media/Ea51_09XkAI4ioc.jpg,,,,,,,"[{'screen_name': 'Elainebks', 'name': 'Elaine - #freeNazanin', 'id': '37769981'}]",,,,
1274048913260019712,1273993298059890688,2020-06-19 18:38:26 UTC,2020-06-19,18:38:26,0,3007149820,tatendattman,Tatenda Musasa,,@mynassah Let be serious Africa our leaders are taking us for a ride. How can elders gather to unveila telephone booth.,en,[],[],[],0,0,0,[],[],https://twitter.com/TatendaTtman/status/1274048913260019712,False,,0,,,,,,,,"[{'screen_name': 'mynassah', 'name': 'Idriss A. Nassah', 'id': '34536995'}]",,,,
1274005733336637440,1274005733336637440,2020-06-19 15:46:51 UTC,2020-06-19,15:46:51,0,3918185062,senegal7com,senegal7,,Vol de téléphone à l'arraché : Un maçon condamné -  https://t.co/s5fFHGPZ3n #Senegal #Kebetu #team221 #paris #buzz #africa  https://t.co/nFTOmnh1cf,fr,[],['https://senegal7.com/vol-de-telephone-a-larrache-un-macon-condamne/'],['https://pbs.twimg.com/media/Ea4tdngWAAEKtvY.jpg'],0,0,2,"['senegal', 'kebetu', 'team221', 'paris', 'buzz', 'africa']",[],https://twitter.com/senegal7com/status/1274005733336637440,False,,1,https://pbs.twimg.com/media/Ea4tdngWAAEKtvY.jpg,,,,,,,[],,,,
1273962329483489281,1273946073338449921,2020-06-19 12:54:23 UTC,2020-06-19,12:54:23,0,952293073,fedexhelp,FedEx Help,,"@EnricoGennari2 My apologies, I am unable to locate any other email address for South Africa. Please reach out to Toll Free telephone, 8000 33339 (Toll Free) or +27 10 300 1444 for assistance in requesting any additional contact information for your location.",en,[],[],[],1,0,0,[],[],https://twitter.com/FedExHelp/status/1273962329483489281,False,,0,,,,,,,,"[{'screen_name': 'EnricoGennari2', 'name': 'Enrico Gennari', 'id': '1113777972195074048'}]",,,,
1273845495908175872,1273845495908175872,2020-06-19 05:10:07 UTC,2020-06-19,05:10:07,0,913074278211473408,evertsdalgh,Evertsdal Guesthouse,,One of the few places that will be a big draw-card in this cold! The Residence with fireplace.  Our contact details: • Telephone: +27 (0)21 919 1752 • E-mail: info@evertsdal.com • Website:  https://t.co/2Rpfpm4zDq  #capetown #southafrica #africa #westerncape  https://t.co/kLryDfskX0,en,[],['https://evertsdal.com'],['https://pbs.twimg.com/media/Ea2bulJWAAE-S0a.jpg'],0,0,0,"['capetown', 'southafrica', 'africa', 'westerncape']",[],https://twitter.com/evertsdalgh/status/1273845495908175872,False,,1,https://pbs.twimg.com/media/Ea2bulJWAAE-S0a.jpg,,,,,,,[],,,,
1273338755164909568,1273338755164909568,2020-06-17 19:36:31 UTC,2020-06-17,19:36:31,0,399463138,kampetero,Peter Kamalingin B.L,,One of the most important prerequisites to dignity and independence of a people is when they can provide food for themselves. COVID-19 has presented major challenges to small food producers across Africa. Many can’t access the land  due to access restrains. Telephone is helpful  https://t.co/Mcm6NpCaLb,en,[],[],"['https://pbs.twimg.com/media/EavOyiZXkAE4KEq.jpg', 'https://pbs.twimg.com/media/EavOzVIX0AAbrH1.jpg', 'https://pbs.twimg.com/media/EavOzyvXkAQV-ci.jpg', 'https://pbs.twimg.com/media/EavO0fWXsAA3zdV.jpg']",0,0,2,[],[],https://twitter.com/kampetero/status/1273338755164909568,False,,1,https://pbs.twimg.com/media/EavOyiZXkAE4KEq.jpg,,,,,,,[],,,,
1273243902200471554,1273238094863622148,2020-06-17 13:19:36 UTC,2020-06-17,13:19:36,0,77520277,run421,Aaron McKean,,"@sheermean A folklorist and bees and South Africa the weirdo game of telephone that is internet myth making! But really, a guy who wanted to have something neat for his wife 🙃 I'm thinking there should be more folklorists",en,[],[],[],1,0,1,[],[],https://twitter.com/Run421/status/1273243902200471554,False,,0,,,,,,,,"[{'screen_name': 'sheermean', 'name': 'Shireen', 'id': '860295035518152705'}]",,,,
1273209095626072064,1273209095626072064,2020-06-17 11:01:18 UTC,2020-06-17,11:01:18,0,913074278211473408,evertsdalgh,Evertsdal Guesthouse,,"Evertsdal Guesthouse Pre #lockdown, Dinner by fire and candlelight light.  Contact details: • Telephone: +27 (0)21 919 1752 • E-mail: info@evertsdal.com • Website:  https://t.co/2Rpfpm4zDq  #capetown #southafrica #africa #westerncape #westerncapeaccommodation #northernsuburbs  https://t.co/Jrhm86eLPM",en,[],['https://evertsdal.com'],['https://pbs.twimg.com/media/EatY7AoWAAAHl2R.jpg'],0,0,0,"['lockdown', 'capetown', 'southafrica', 'africa', 'westerncape', 'westerncapeaccommodation', 'northernsuburbs']",[],https://twitter.com/evertsdalgh/status/1273209095626072064,False,,1,https://pbs.twimg.com/media/EatY7AoWAAAHl2R.jpg,,,,,,,[],,,,
1273200364578312193,1273200364578312193,2020-06-17 10:26:36 UTC,2020-06-17,10:26:36,0,3378496205,couretech,COURE Software & Sys,,Expand your SMS/Voice reach with access to South Africa data for efficient delivery.  Contact us today to find out more!  Email - Sales@coure-tech.com Telephone - +(234)-1-631-1910  #KYC #CustomerExperience #Africa  https://t.co/dw6S505YWO,en,[],[],['https://pbs.twimg.com/media/EatQ9NQXgAIAM5N.png'],0,0,0,"['kyc', 'customerexperience', 'africa']",[],https://twitter.com/couretech/status/1273200364578312193,False,,1,https://pbs.twimg.com/media/EatQ9NQXgAIAM5N.png,,,,,,,[],,,,
1272961185348976643,1272961185348976643,2020-06-16 18:36:11 UTC,2020-06-16,18:36:11,0,913074278211473408,evertsdalgh,Evertsdal Guesthouse,,"Various restaurants doing deliveries at Evertsdal Guesthouse, BUT, order room service from our kitchen.  Our contact details: • Telephone: +27 (0)21 919 1752 • E-mail: info@evertsdal.com • Website:  https://t.co/2Rpfpm4zDq  #capetown #southafrica #africa #westerncape  https://t.co/G5B7EQ2Srd",en,[],['https://evertsdal.com'],['https://pbs.twimg.com/media/Eap3cwjWAAI7Yb3.jpg'],0,0,0,"['capetown', 'southafrica', 'africa', 'westerncape']",[],https://twitter.com/evertsdalgh/status/1272961185348976643,False,,1,https://pbs.twimg.com/media/Eap3cwjWAAI7Yb3.jpg,,,,,,,[],,,,
1272959821969489921,1272959821969489921,2020-06-16 18:30:46 UTC,2020-06-16,18:30:46,0,720339873933053952,arraedlg,Arraed LG+,,"#Breaking_News The British Minister of State for Middle East and North Africa Affairs, in a telephone conversation with the President of the Presidential Council: #Britain condemns the mass graves discovered in #Tarhuna after its liberation from the aggressor militias. #Libya  https://t.co/N4sOY6l46f",en,[],[],['https://pbs.twimg.com/media/Eap2EpqWsAEqsWX.jpg'],0,0,1,"['breaking_news', 'britain', 'tarhuna', 'libya']",[],https://twitter.com/ArraedLG/status/1272959821969489921,False,,1,https://pbs.twimg.com/media/Eap2EpqWsAEqsWX.jpg,,,,,,,[],,,,
1272910639590244352,1272910639590244352,2020-06-16 15:15:20 UTC,2020-06-16,15:15:20,0,1271460461729460224,lopes_neilor,Neilor Lopes Siqueira,,"@realDonaldTrump yes sir, please have an american girl asking me for financial help in africa, but i have no way to help her, please if you can help me, she is starving! telephone +234 906 339 5805",en,[],[],[],0,0,0,[],[],https://twitter.com/lopes_neilor/status/1272910639590244352,False,,0,,,,,,,,[],,,,
1272838561897820165,1272569181280645120,2020-06-16 10:28:56 UTC,2020-06-16,10:28:56,0,4878825892,africa_yearning,Africa Yearning,,"@SizakeleMokoto @samanthanaanna There was a time, not so very long ago, when people use send letters to make appointments for telephone calls. Technology has its side effects.",en,[],[],[],0,0,0,[],[],https://twitter.com/africa_yearning/status/1272838561897820165,False,,0,,,,,,,,"[{'screen_name': 'SizakeleMokoto', 'name': '𝑺𝒊𝒛𝒂𝒌𝒆𝒍𝒆 𝑴𝒐𝒌𝒐𝒕𝒐', 'id': '1129109016829939712'}, {'screen_name': 'samanthanaanna', 'name': 'SamanthanaAnna_mathole', 'id': '1114570687623118848'}]",,,,
1272790169322573825,1272769362198433793,2020-06-16 07:16:38 UTC,2020-06-16,07:16:38,0,1024418724718292992,c_a_stegmann,Christian Stegmann,,"@shannonmattern Araba Sey ( https://t.co/MorvGfzjpp) has written on the history of cell phones/telephones, albeit more often in the context of the present, particularly with regard to Africa.",en,[],['https://cs.unu.edu/people/experts/10689.html'],[],1,0,1,[],[],https://twitter.com/c_a_stegmann/status/1272790169322573825,False,,0,,,,,,,,"[{'screen_name': 'shannonmattern', 'name': 'Shannon Mattern', 'id': '357916553'}]",,,,
1272548255629541377,1272548255629541377,2020-06-15 15:15:21 UTC,2020-06-15,15:15:21,0,44569137,zimeye,ZimEye,,The Mother Africa Trust together with Conservation &amp; Wildlife Fund have begun a collaborative exercise to collect this broken telephone cable along approx 40kms of the Hwange Boundary. This copper coated wire is responsible for most of the wire snares laid here....  https://t.co/0hyVMUEGOa,en,[],[],[],0,0,0,[],[],https://twitter.com/ZimEye/status/1272548255629541377,False,,1,https://pbs.twimg.com/ext_tw_video_thumb/1272547638005596164/pu/img/pWLgKuIMMXjv8W7F.jpg,,,,,,,[],,,,
1272467262792806400,1272455746274250752,2020-06-15 09:53:31 UTC,2020-06-15,09:53:31,0,64274719,erikaheidewald,"Erika Heidewald, Lorena Bobbitt 🔜 Bean Dad",,"now i’m not saying white immigrant families haven’t had it easier than Black people or immigrants from Asia, Africa, &amp; South America. we have. my grandpa was working at Bell Telephone in the 60s, not getting lynched or hit with fire hoses and denied service at lunch counters.",en,[],[],[],1,0,6,[],[],https://twitter.com/erikaheidewald/status/1272467262792806400,False,,0,,,,,,,,[],,,,
1272253903879507969,1272163186557493250,2020-06-14 19:45:42 UTC,2020-06-14,19:45:42,0,348633334,martinelli1332,Luisjo,,"@RedFoxFOMO @ArfonJ @Onecpblue @BorisJohnson @pritipatel @AndrewRTDavies Hardly the internet or the telephone is it? I’m not even white. I’m Spanish brown, but slagging off white people when they created EVERYTHING is idiotic. Europe is white and Latin land. Everyone else is a visitor. No one moves to Africa from here",en,[],[],[],0,0,0,[],[],https://twitter.com/Martinelli1332/status/1272253903879507969,False,,0,,,,,,,,"[{'screen_name': 'RedFoxFOMO', 'name': 'RedFoxFOMO', 'id': '988687415442313216'}, {'screen_name': 'ArfonJ', 'name': 'Arfon Jones 🏴\U000e0067\U000e0062\U000e0077\U000e006c\U000e0073\U000e007f🏴\U000e0067\U000e0062\U000e0077\U000e006c\U000e0073\U000e007f', 'id': '112696701'}, {'screen_name': 'BorisJohnson', 'name': 'Boris Johnson', 'id': '3131144855'}, {'screen_name': 'pritipatel', 'name': 'Priti Patel', 'id': '61660254'}, {'screen_name': 'AndrewRTDavies', 'name': 'Andrew RT Davies', 'id': '181936890'}]",,,,
1272207718871437317,1272207718871437317,2020-06-14 16:42:11 UTC,2020-06-14,16:42:11,0,976106332184023046,africarriere,afri-carrieres.xyz | Opportunités pour africains,,"APPEL: CINEASTES, VIDEO ENVOYEZ VOS FILMS POUR MOBILE FILM FESTIVAL AFRICA 2020 →  Réalisez un film de 1minutes avec votre téléphone mobile et participez au Mobile Film Festival Africa 2020 pour remporter jusqu'à…  https://t.co/3fLcmQByiU",fr,[],['https://www.instagram.com/p/CBbC8tFDblV/?igshid=1w5hlepr4qb85'],[],0,0,0,[],[],https://twitter.com/africarriere/status/1272207718871437317,False,,0,,,,,,,,[],,,,
1272203571136774144,1272203571136774144,2020-06-14 16:25:42 UTC,2020-06-14,16:25:42,0,1046185866836791296,empressrandom,Random Empress Theresa,,"I've made this point before but I'll make it again. CNN supposedly has a telephone poll, Theresa vs. a committee. And they get hundreds of thousands of calls from all over the world, including Africa. People south of the Sahara are calling CNN in numbers large enough to count.  https://t.co/jV91LWc5lE",en,[],[],['https://pbs.twimg.com/media/EafGUNIXsAEuc8A.png'],1,0,5,[],[],https://twitter.com/EmpressRandom/status/1272203571136774144,False,,1,https://pbs.twimg.com/media/EafGUNIXsAEuc8A.png,,,,,,,[],,,,
1272161768509505536,1272112732289019904,2020-06-14 13:39:35 UTC,2020-06-14,13:39:35,0,60738593,slmcowan,Shostakovich,,"@PaulVCooper1 @glasthomebury @flowesaunders68 Well obviously the motor car was invented in Africa, electronics, telephones, computers, modern medicine, literacy etc etc But most important of all the suppression of bonkers superstition which enabled wife and child abuse on a massive scale.",en,[],[],[],2,0,0,[],[],https://twitter.com/SLMcOwan/status/1272161768509505536,False,,0,,,,,,,,"[{'screen_name': 'PaulVCooper1', 'name': 'Paul Cooper', 'id': '75619779'}, {'screen_name': 'glasthomebury', 'name': 'Fat Trucker', 'id': '1155178988437934080'}, {'screen_name': 'flowesaunders68', 'name': 'Flowe68#NoToLockdown', 'id': '4195131059'}]",,,,
1271889543885660161,1270881606895534080,2020-06-13 19:37:52 UTC,2020-06-13,19:37:52,0,1193716004150562816,signor_girasole,IlSignorGirasole,,"@AliceQuinnRose ‘Cause it seems that passing the stories down orally from generation to generation would eventually turn into one big telephone game &amp; completely botch the story.   Also, writing stories down on paper isn’t a white ppl thing ffs. Asia and Africa have done it for millennia.  2/2",en,[],[],[],0,0,2,[],[],https://twitter.com/Signor_Girasole/status/1271889543885660161,False,,0,,,,,,,,"[{'screen_name': 'AliceQuinnRose', 'name': '✊🏿♠️Alice Quinn Rose\U0001f7e5\U0001f7e8', 'id': '1001951872993955841'}]",,,,
1271839210727710724,1271806250020417537,2020-06-13 16:17:52 UTC,2020-06-13,16:17:52,0,69172612,arabnews,Arab News,,#BREAKING: Egypt's Sisi discusses the Renaissance Dam negotiations developments with the President of South Africa over a telephone call  https://t.co/cbMWdWpawg  https://t.co/WxM9bBnkAw,en,[],['http://arab.news/8m3p4'],['https://pbs.twimg.com/tweet_video_thumb/EaZ68XfWoAAsnF_.jpg'],0,1,1,['breaking'],[],https://twitter.com/arabnews/status/1271839210727710724,False,,1,https://pbs.twimg.com/tweet_video_thumb/EaZ68XfWoAAsnF_.jpg,,,,,,,[],,,,
