id,conversation_id,created_at,date,time,timezone,user_id,username,name,place,tweet,language,mentions,urls,photos,replies_count,retweets_count,likes_count,hashtags,cashtags,link,retweet,quote_url,video,thumbnail,near,geo,source,user_rt_id,user_rt,retweet_id,reply_to,retweet_date,translate,trans_src,trans_dest
1309744418971418629,1309744418971418629,2020-09-26 06:39:38 UTC,2020-09-26,06:39:38,0,274114988,lizshehean,Liz Shehean,,@AsdaServiceTeam terrible service from you ‘helpline’ this morning. And being told there was nothing he could do from South Africa about no show delivery. Can I have a telephone number for someone who will help please.,en,[],[],[],1,0,0,[],[],https://twitter.com/LizShehean/status/1309744418971418629,False,,0,,,,,,,,[],,,,
1309484042350481409,1309439346097913857,2020-09-25 13:24:59 UTC,2020-09-25,13:24:59,0,1138899282143014913,israelkirabo,Kirabo Israel,,@catchtheman @PatohShanqueels 2006 was planned to be like that. If you were following M9's interview with KB in South Africa on a telephone interview on KFM with a CMI personal who was I studio. You would know it was planned.,en,[],[],[],0,2,1,[],[],https://twitter.com/IsraelKirabo/status/1309484042350481409,False,,0,,,,,,,,"[{'screen_name': 'catchtheman', 'name': 'Gilbert Baluku', 'id': '1292105869'}, {'screen_name': 'PatohShanqueels', 'name': 'Soldier↪', 'id': '853349550'}]",,,,
1308991913538785280,1308991913538785280,2020-09-24 04:49:26 UTC,2020-09-24,04:49:26,0,58435392,elsawiranda,Randa El Sawi,,Ericsson has been doing business in Ethiopia for 126 years making it the oldest country for #Ericsson in #Africa. Sales of telephone receivers commenced in 1894 and up until today we remain committed to this beautiful country as part of our commitment to keep #AfricaInMotion,en,[],[],[],0,0,0,"['ericsson', 'africa', 'africainmotion']",[],https://twitter.com/elsawiranda/status/1308991913538785280,False,https://twitter.com/EricssonMEA/status/1308797496966156288,0,,,,,,,,[],,,,
1308890142388695040,1308890142388695040,2020-09-23 22:05:02 UTC,2020-09-23,22:05:02,0,2267964218,curtisschin,🚶🏻Curtis S. Chin,,"Map of International Telephone Calling &amp; Dialling Codes  https://t.co/ahipaYu70P  Zone 1: North America 2: Africa 3–4: Europe 5: Rest of the Americas 6: Southeast Asia &amp; Oceania 7: Parts of former Soviet Union 8: East Asia 9: India, Middle East &amp; Rest of Asia Ht @simongerman600",en,"[{'screen_name': 'simongerman600', 'name': 'simon kuestenmacher', 'id': '359188534'}]",['https://smallbusinessprices.co.uk/international-telephone-codes/'],[],1,2,12,[],[],https://twitter.com/CurtisSChin/status/1308890142388695040,False,,0,,,,,,,,[],,,,
1308760461081554944,1308760461081554944,2020-09-23 13:29:44 UTC,2020-09-23,13:29:44,0,1284830606510227456,ralphsinger13,Ralph Singer,,TOA Electronics Africa are proud distributors of the Eaton VoCALL range of Fire Telephone and Disabled Refuge Systems. #Eaton #VoCALL #firetelephone #disabledrefuge #fireprotection #communication #savelives #firesafety #sans10400 #standards #firealarmsystems #TOA #EN54  https://t.co/G7Howsk63m,en,[],[],['https://pbs.twimg.com/media/Eimms82XgAExkW9.jpg'],0,0,0,"['eaton', 'vocall', 'firetelephone', 'disabledrefuge', 'fireprotection', 'communication', 'savelives', 'firesafety', 'sans10400', 'standards', 'firealarmsystems', 'toa', 'en54']",[],https://twitter.com/RalphSinger13/status/1308760461081554944,False,,1,https://pbs.twimg.com/media/Eimms82XgAExkW9.jpg,,,,,,,[],,,,
1308760190506991617,1308760190506991617,2020-09-23 13:28:39 UTC,2020-09-23,13:28:39,0,1286285518888669185,toaafrica,TOA Electronics Africa,,TOA Electronics Africa are proud distributors of the Eaton VoCALL range of Fire Telephone and Disabled Refuge Systems. #Eaton #VoCALL #firetelephone #disabledrefuge #fireprotection #communication #savelives #firesafety #sans10400 #standards #firealarmsystems #TOA #EN54  https://t.co/wBga0BdlHn,en,[],[],['https://pbs.twimg.com/media/EimmdMeXgAAZG7a.jpg'],0,2,2,"['eaton', 'vocall', 'firetelephone', 'disabledrefuge', 'fireprotection', 'communication', 'savelives', 'firesafety', 'sans10400', 'standards', 'firealarmsystems', 'toa', 'en54']",[],https://twitter.com/TOAAfrica/status/1308760190506991617,False,,1,https://pbs.twimg.com/media/EimmdMeXgAAZG7a.jpg,,,,,,,[],,,,
1308634883288375296,1303348451795701761,2020-09-23 05:10:44 UTC,2020-09-23,05:10:44,0,1207308056746504193,francis41645964,Francisco Oliveira de Sousa,,"@blktoppa Hi Good night , Francisco I am from Brasília Brasil you welcome Brasil ? I Love Africa telephone me +5561996165349 , whatsup +5561993362505",en,[],[],[],0,0,0,[],[],https://twitter.com/Francis41645964/status/1308634883288375296,False,,0,,,,,,,,"[{'screen_name': 'blktoppa', 'name': 'African King', 'id': '439279483'}]",,,,
1308463011632427014,1308463011632427014,2020-09-22 17:47:46 UTC,2020-09-22,17:47:46,0,842434586370007041,best_info_post,BestInfoPost,,Présentation du blog AFRIQUE NUMÉRIQUE  https://t.co/yhejDaIRMI #numérique #Afrique #Africa #digital #informatique #internet #ordinateurs #PC #MAC #GSM #telephone #reseau #web #servers #serveurs #datacenter #cloud #blockchain #data #bureautique #logiciels #applications,fr,[],['http://afriquenumerique.over-blog.com/2018/12/presentation-du-blog-afrique-numerique.html'],[],0,0,0,"['numérique', 'afrique', 'africa', 'digital', 'informatique', 'internet', 'ordinateurs', 'pc', 'mac', 'gsm', 'telephone', 'reseau', 'web', 'servers', 'serveurs', 'datacenter', 'cloud', 'blockchain', 'data', 'bureautique', 'logiciels', 'applications']",[],https://twitter.com/Best_Info_Post/status/1308463011632427014,False,,0,,,,,,,,[],,,,
1308407411586334722,1308347214851313665,2020-09-22 14:06:50 UTC,2020-09-22,14:06:50,0,1272899004850937859,terese_trott,Terese Trott,,"@Huawei So who’s calling everyone with an Huawei phone including mine, then hanging up for us to call back an expensive telephone line? Calls coming in by the dozen from Sierra Leone, Africa. More to the point, who gave them the information? Deliber",en,[],[],[],0,0,1,[],[],https://twitter.com/terese_trott/status/1308407411586334722,False,,0,,,,,,,,"[{'screen_name': 'Huawei', 'name': 'Huawei', 'id': '98047213'}]",,,,
1308044232704372737,1308044232704372737,2020-09-21 14:03:42 UTC,2020-09-21,14:03:42,0,1274239795972243461,brown_curves,#BrownSkin,,You can also #VOTELayconNonStop if you live outside Nigeria.  All you need is your email address and telephone number to register and vote on the Africa Magic website:  https://t.co/IMBFj5Y1PB Vote now! Let's do this for Laycon!💕💡  #BBNaija  #BBNaijaLockdown  https://t.co/IFj1yjlhLf,en,[],['https://africamagic.dstv.com/show/big-brother-nigeria-s5/vote'],['https://pbs.twimg.com/media/EicbS-xWAAIKbJG.jpg'],0,5,12,"['votelayconnonstop', 'bbnaija', 'bbnaijalockdown']",[],https://twitter.com/brown_curves/status/1308044232704372737,False,,1,https://pbs.twimg.com/media/EicbS-xWAAIKbJG.jpg,,,,,,,[],,,,
1308028249847541766,1308028249847541766,2020-09-21 13:00:11 UTC,2020-09-21,13:00:11,0,4020071151,furtherafrica,Further Africa,,#Botswana #Telecom makes clarion call for submission of #artifacts - #africa #museum #history #memorabilia #mobilephones #telephone #dialphone #oldtimes #antique #vintage  https://t.co/c355Xp4jUn,en,[],['https://furtherafrica.com/2020/09/21/botswana-telecom-makes-clarion-call-for-submission-of-artifacts/'],[],0,1,1,"['botswana', 'telecom', 'artifacts', 'africa', 'museum', 'history', 'memorabilia', 'mobilephones', 'telephone', 'dialphone', 'oldtimes', 'antique', 'vintage']",[],https://twitter.com/FurtherAfrica/status/1308028249847541766,False,,0,,,,,,,,[],,,,
1307958735306928133,1307958735306928133,2020-09-21 08:23:57 UTC,2020-09-21,08:23:57,0,756583854153105409,tracybergstedt,Tracy Bergstedt,,Id like to challenge south africa to a game of broken telephone,en,[],[],[],0,0,0,[],[],https://twitter.com/TracyBergstedt/status/1307958735306928133,False,,0,,,,,,,,[],,,,
1307869591457198082,1306081123252961280,2020-09-21 02:29:44 UTC,2020-09-21,02:29:44,0,1098292374,lesibarabalao,LesibaRabalao ,,"@DougieFalconer @StephenGrootes @SAfmRadio So the ANC leaves South Africa burning, squander our scarce resources to do what can be achieved by telephone or internet or regional intranet Yhoo",en,[],[],[],0,0,0,[],[],https://twitter.com/LesibaRabalao/status/1307869591457198082,False,,0,,,,,,,,"[{'screen_name': 'DougieFalconer', 'name': 'Doug Falconer', 'id': '180696304'}, {'screen_name': 'StephenGrootes', 'name': 'Stephen Grootes', 'id': '89149050'}, {'screen_name': 'SAfmRadio', 'name': 'SAfmRadio 📻', 'id': '84503659'}]",,,,
1307690943529787398,1303097303713157122,2020-09-20 14:39:51 UTC,2020-09-20,14:39:51,0,1207308056746504193,francis41645964,Francisco Oliveira de Sousa,,"@SoftRider2 Hi Good mirning , Francisco I am from Brasil I passyv babe , I Love Africa Africanos fuck me ? telephone me +5561996165349 , whatsup me +5561993362505  https://t.co/boFCWwirbi",en,[],[],['https://pbs.twimg.com/media/EiXZ-KvWkAAHU94.jpg'],0,0,0,[],[],https://twitter.com/Francis41645964/status/1307690943529787398,False,,1,https://pbs.twimg.com/media/EiXZ-KvWkAAHU94.jpg,,,,,,,"[{'screen_name': 'SoftRider2', 'name': 'Blanca Evangelista 🏳️\u200d🌈', 'id': '1115657530271617024'}]",,,,
1307454506066563072,1307432648768446476,2020-09-19 23:00:20 UTC,2020-09-19,23:00:20,0,763596433534496768,paul_rietschka,Paul Rietschka,,"@CMastication @rjurney Reminds me of when I lived in southern Africa, and ppl would steal telephone and electrical wire for the copper. I was once in Botswana and someone was calmly burning off the plastic coating as children were gleefully playing in the acrid smoke. I imagine your kids do this too?",en,[],[],[],1,0,1,[],[],https://twitter.com/paul_rietschka/status/1307454506066563072,False,,0,,,,,,,,"[{'screen_name': 'CMastication', 'name': 'JD Long', 'id': '43186378'}, {'screen_name': 'rjurney', 'name': 'Russell Jurney', 'id': '15831927'}]",,,,
1307300368532070401,1306968734838398976,2020-09-19 12:47:50 UTC,2020-09-19,12:47:50,0,1236335962684362757,sumsumnyame,Sumsum Nyame,,@PastorJohnHagee To saftyingies in Ghana West Africa I wouldn't disturbingies you telephone communicateningies number 1647-760-3726,en,[],[],[],0,0,0,[],[],https://twitter.com/SumsumNyame/status/1307300368532070401,False,,0,,,,,,,,"[{'screen_name': 'PastorJohnHagee', 'name': 'Pastor John Hagee', 'id': '21790160'}]",,,,
1307288925699006467,1307288925699006467,2020-09-19 12:02:22 UTC,2020-09-19,12:02:22,0,3918185062,senegal7com,senegal7,,"Vidéo - Birima Ndiaye adule Idy : ""Sama grand la damakay wo téléphone..."" -  https://t.co/rS9LNwQcvD #Senegal #Kebetu #team221 #paris #mali #africa  https://t.co/tbAjlHF9Ze",fr,[],['https://senegal7.com/video-birima-ndiaye-adule-idy-sama-grand-la-damakay-wo-telephone/'],['https://pbs.twimg.com/media/EiRsWYWXgAINh00.jpg'],0,1,0,"['senegal', 'kebetu', 'team221', 'paris', 'mali', 'africa']",[],https://twitter.com/senegal7com/status/1307288925699006467,False,,1,https://pbs.twimg.com/media/EiRsWYWXgAINh00.jpg,,,,,,,[],,,,
1306962014821113856,1306926480996347908,2020-09-18 14:23:21 UTC,2020-09-18,14:23:21,0,1236335962684362757,sumsumnyame,Sumsum Nyame,,@davidjeremiah Powersfulsibilityingies anilateringies all my enemieingies includingies Moneytarilyingies substancesingies Provisioningies withhelderingies to saftyingies in Ghana West Africa I wouldn't disturbingies you would you communicateningies with me with Ministries telephone,en,[],[],[],0,0,0,[],[],https://twitter.com/SumsumNyame/status/1306962014821113856,False,,0,,,,,,,,"[{'screen_name': 'davidjeremiah', 'name': 'David Jeremiah', 'id': '30011335'}]",,,,
1306946409367830530,1306946409367830530,2020-09-18 13:21:20 UTC,2020-09-18,13:21:20,0,2844684268,ismail_ittembe,Ismail Siraje Ittembe,,"I've added a website, telephone number, company address to SAVE AFRICA FARMERS DEVELOPMENT ASSOCIATION LTD on @OpenCorporates  https://t.co/pv1d7XziEl",en,"[{'screen_name': 'opencorporates', 'name': 'opencorporates', 'id': '216027858'}]",['https://j.mp/35ICnpg'],[],0,0,1,[],[],https://twitter.com/Ismail_Ittembe/status/1306946409367830530,False,,0,,,,,,,,[],,,,
1306945077332377601,1305836514040049665,2020-09-18 13:16:02 UTC,2020-09-18,13:16:02,0,1236335962684362757,sumsumnyame,Sumsum Nyame,,@JoelOsteen Includingies Moneytarilyingies substances Provisioningies withhelderingies to saftyingies in Ghana West Africa I wouldn't disturbingies you Apostle Joel Osteen my telephone communicateningies number is 1647-760-3726 I wouldn't disturbingies you Apostle Joel Osteen,en,[],[],[],0,0,0,[],[],https://twitter.com/SumsumNyame/status/1306945077332377601,False,,0,,,,,,,,"[{'screen_name': 'JoelOsteen', 'name': 'Joel Osteen', 'id': '20545055'}]",,,,
1306924780524720128,1306924780524720128,2020-09-18 11:55:23 UTC,2020-09-18,11:55:23,0,1155158440567877634,icloud_mx,iCloud_MX,,LOST PREMIUM PRODUCT SOLD BY : MOBILE TELEPHONE NETWORKS  COUNTRY : SOUTH AFRICA  https://t.co/UBOY8ba1if,en,[],[],"['https://pbs.twimg.com/media/EiMg8s3UYAQkRq3.jpg', 'https://pbs.twimg.com/media/EiMg92BVgAAFfoA.jpg']",2,0,3,[],[],https://twitter.com/icloud_mx/status/1306924780524720128,False,,1,https://pbs.twimg.com/media/EiMg8s3UYAQkRq3.jpg,,,,,,,[],,,,
1306713492364365826,1306696410000023553,2020-09-17 21:55:48 UTC,2020-09-17,21:55:48,0,307774911,fujiresan,𝗛𝗲𝗹𝘃𝗲𝘁𝗶𝗰𝗮 𝗕𝗼𝗹𝗱,,"@Daft_Duck essa é lindíssima também. Tem essas ""flautinhas"" sintetizadas em alguma música new wave ultra famosa (seria ""Africa""?).  desse disco da Junk eu sou apaixonado por ""telephone number"" mesmo, a braba. E sempre que eu olho essa capa eu fico !!!!!!!!!!!",pt,[],[],[],1,0,1,[],[],https://twitter.com/fujiresan/status/1306713492364365826,False,,0,,,,,,,,"[{'screen_name': 'Daft_Duck', 'name': 'Cyber figurante nas pegadinhas do Topa Tudo', 'id': '116848853'}]",,,,
1306678323142176768,1306678323142176768,2020-09-17 19:36:03 UTC,2020-09-17,19:36:03,0,305010536,kalaharidigital,Kalahari Digital,,Africa skipped the landline telephone for mobile networks.   The next iteration? Digitization. It is set to create major new disruptions and opportunities.   The question for business owners is: where will your company be 10 yrs from now?   Get a glimpse.   https://t.co/FABwOiHYma,en,[],['https://youtu.be/CaELQS5kTso'],[],0,0,0,[],[],https://twitter.com/kalaharidigital/status/1306678323142176768,False,,0,,,,,,,,[],,,,
1306533353210998784,1306533353210998784,2020-09-17 10:00:00 UTC,2020-09-17,10:00:00,0,1301822448657149952,wikitek_africa,Wikitek Africa,,"La 5G devrait marquer une percée dans les téléphones mobiles, sa vitesse et ses nouvelles utilisations secoueront le marché. 🤳  https://t.co/gUWVZdzb6X  #5G #China #usa #Réseau #téléphonique #INTERNET",fr,[],['https://wikitek.africa/digital/les-5-choses-a-savoir-au-sujet-de-la-5g/'],[],0,0,0,"['5g', 'china', 'usa', 'réseau', 'téléphonique', 'internet']",[],https://twitter.com/wikitek_africa/status/1306533353210998784,False,,0,,,,,,,,[],,,,
1306295831323119616,1306295831323119616,2020-09-16 18:16:10 UTC,2020-09-16,18:16:10,0,1286285518888669185,toaafrica,TOA Electronics Africa,,#TOA Electronics Southern Africa are proud distributors of the #Eaton #VoCALL range of Fire Telephone and Disabled Refuge Systems.  #firetelephone #communication #firesafety #firealarm  #buildingsafety #standards #SafetyCulture #sans10400 #DisabledRefuge  https://t.co/igsy5j6N8G,en,[],[],['https://pbs.twimg.com/media/EiDk_omXkAA0NgI.jpg'],0,1,1,"['toa', 'eaton', 'vocall', 'firetelephone', 'communication', 'firesafety', 'firealarm', 'buildingsafety', 'standards', 'safetyculture', 'sans10400', 'disabledrefuge']",[],https://twitter.com/TOAAfrica/status/1306295831323119616,False,,1,https://pbs.twimg.com/media/EiDk_omXkAA0NgI.jpg,,,,,,,[],,,,
1306252777056874496,1305800386708680707,2020-09-16 15:25:05 UTC,2020-09-16,15:25:05,0,32481708,marinagon,Marina Gonçalves,,"@IDEA_Africa @Int_IDEA Hi, I'm Marina Gonçalves, journalist for the magazine ""Época"", from Brazil. I would like to do a telephone interview with Kevin Casas-Zamora, to talk about the joint action of Latin American institutes to strengthen their democracies in the context of the Covid-19 pandemic.",en,[],[],[],0,0,0,[],[],https://twitter.com/marinagon/status/1306252777056874496,False,,0,,,,,,,,"[{'screen_name': 'IDEA_Africa', 'name': 'International IDEA Africa & West Asia', 'id': '3599283195'}, {'screen_name': 'Int_IDEA', 'name': 'International IDEA', 'id': '362343279'}]",,,,
1306240906807439360,1306240906807439360,2020-09-16 14:37:55 UTC,2020-09-16,14:37:55,0,3918185062,senegal7com,senegal7,,Ousmane Sonko  a appelé Lansana Gagny Sakho au téléphone -  https://t.co/HOACom8YpW #Senegal #Kebetu #team221 #paris #mali #africa  https://t.co/ukusGZPjPs,fr,[],['https://senegal7.com/ousmane-sonko-a-appele-lansana-gagny-sakho-au-telephone/'],['https://pbs.twimg.com/media/EiCzLrCWAAQpzE3.jpg'],0,1,2,"['senegal', 'kebetu', 'team221', 'paris', 'mali', 'africa']",[],https://twitter.com/senegal7com/status/1306240906807439360,False,,1,https://pbs.twimg.com/media/EiCzLrCWAAQpzE3.jpg,,,,,,,[],,,,
1306186570240675841,1306186570240675841,2020-09-16 11:02:00 UTC,2020-09-16,11:02:00,0,3378496205,couretech,COURE Software & Sys,,Imagine what problem your unused data could solve!  Let's help you create value  Contact us today!  Email - Sales@coure-tech.com Telephone - +(234)-1-631-1910  #Africa #Tech4All #technology #lockdown #Traffic #data  https://t.co/shwsBiviAn,en,[],[],['https://pbs.twimg.com/media/EiCBw4XU8AAZfm3.png'],0,0,0,"['africa', 'tech4all', 'technology', 'lockdown', 'traffic', 'data']",[],https://twitter.com/couretech/status/1306186570240675841,False,,1,https://pbs.twimg.com/media/EiCBw4XU8AAZfm3.png,,,,,,,[],,,,
1306172744212545543,1306172744212545543,2020-09-16 10:07:04 UTC,2020-09-16,10:07:04,0,960186930859298816,afrilanguages,#AfricanLanguagesMatter,,"In Africa people joke about the bush telegraph. Communication happens without telephones or paper; there’s a 6th sense I can’t describe in English. Often you know someone is coming, or someone is sick. - Waris Dirie  #AfricanLiteratureMatters  https://t.co/tMgvR6LI5q",en,[],[],['https://pbs.twimg.com/media/EiB1I26WsAApvLt.jpg'],1,1,2,['africanliteraturematters'],[],https://twitter.com/AfriLanguages/status/1306172744212545543,False,,1,https://pbs.twimg.com/media/EiB1I26WsAApvLt.jpg,,,,,,,[],,,,
1306055317457862656,1306049393661935622,2020-09-16 02:20:27 UTC,2020-09-16,02:20:27,0,1257692347187552257,chrisanethery,Chris Nethery,,"@wokyleeks @DannyHulse3 @RodneyCaston @thespybrief @Beatrix_1_Kiddo @AngletonsMerits LOL  F*ck you.  Anna looked better than Butina, even when she was making cocaine-influenced telephone calls to daddy in Africa.  https://t.co/I3Fh1W0jqL",en,[],[],['https://pbs.twimg.com/media/EiAKY9CWAAADaFS.jpg'],3,0,7,[],[],https://twitter.com/ChrisANethery/status/1306055317457862656,False,,1,https://pbs.twimg.com/media/EiAKY9CWAAADaFS.jpg,,,,,,,"[{'screen_name': 'wokyleeks', 'name': 'SF SCHOOL BONDS Wokyleeks', 'id': '1099623683054661633'}, {'screen_name': 'DannyHulse3', 'name': 'Danny Hulse ♌️🏳️\u200d🌈🇺🇸🐘🐈🦁🐋🌴', 'id': '970445068841533443'}, {'screen_name': 'RodneyCaston', 'name': 'Rodney Caston', 'id': '62694013'}, {'screen_name': 'thespybrief', 'name': 'The Spy Brief', 'id': '905154964829462528'}, {'screen_name': 'Beatrix_1_Kiddo', 'name': 'Sully🇺🇸\U0001f9ae🐾', 'id': '1194682700231299072'}, {'screen_name': 'AngletonsMerits', 'name': 'Angletons_Merits', 'id': '1194774490036756484'}]",,,,
1305877414841589761,1305877414841589761,2020-09-15 14:33:32 UTC,2020-09-15,14:33:32,0,1176851230439743491,jacquistaaden,Jacqui van Staaden,,@CottonOn can I please have a friggin telephone number for Cotton On South Africa please? I have no patience or inclination to send emails.,en,[],[],[],1,0,0,[],[],https://twitter.com/JacquiStaaden/status/1305877414841589761,False,,0,,,,,,,,[],,,,
1305425897684701192,1305425895776235521,2020-09-14 08:39:22 UTC,2020-09-14,08:39:22,0,316291124,bwgovernment,Botswana Government,,"On 11th September 2020, Honourable Dr. Lemogang Kwape, Minister of International Affairs and Cooperation, made a courtesy telephone call to Honourable Dr. Naledi Pandor, Minister of International Relations of the Republic of South Africa.",en,[],[],[],1,0,0,[],[],https://twitter.com/BWGovernment/status/1305425897684701192,False,,0,,,,,,,,[],,,,
1305425895776235521,1305425895776235521,2020-09-14 08:39:21 UTC,2020-09-14,08:39:21,0,316291124,bwgovernment,Botswana Government,,"TELEPHONE CALL BETWEEN HONOURABLE DR. LEMOGANG KWAPE, MINISTER OF INTERNATIONAL AFFAIRS AND HONOURABLE DR. NALEDI PANDOR, MINISTER OF INTERNATIONAL RELATIONS OF THE REPUBLIC OF SOUTH AFRICA",en,[],[],[],2,0,5,[],[],https://twitter.com/BWGovernment/status/1305425895776235521,False,,0,,,,,,,,[],,,,
1304835432685932544,1304835432685932544,2020-09-12 17:33:04 UTC,2020-09-12,17:33:04,0,36912627,agent_of_change,Carlos Martinez,,"""Instead of going into Africa with troops, destroying countries like the West did, the Chinese went to Addis Ababa, said we'd like to build you some airports, upgrade your railways, create a telephone system &amp; rebuild your roads.""  Thanks @yanisvaroufakis   https://t.co/TDUiuUoLQE",en,"[{'screen_name': 'yanisvaroufakis', 'name': 'yanis varoufakis', 'id': '124690469'}]",['https://www.youtube.com/watch?v=03l3Ra4bL_A&feature=youtu.be'],[],1,8,26,[],[],https://twitter.com/agent_of_change/status/1304835432685932544,False,,0,,,,,,,,[],,,,
1304630990711721984,1304630990711721984,2020-09-12 04:00:41 UTC,2020-09-12,04:00:41,0,1294671314481971202,fenegadanews,Fenegada news,,"Africa: Urukiko ryo muri africa yepfo, Johannesburg rwakatiye umugabo witwa joseph tebogo mhlanga w'imyaka 32 yamavuko kubera ibyaha yakoze byo gufata kungufu abagore 2 no kubiba telephone namafaranga  mukwakane 2011 no mukwagatanu 2011, gufata umwangavu wari uvuye kw'ishuri  https://t.co/InuVlU7K9j",tl,[],[],['https://pbs.twimg.com/media/Ehr6-OkWsAAJWp4.png'],0,0,1,[],[],https://twitter.com/Fenegadanews/status/1304630990711721984,False,,1,https://pbs.twimg.com/media/Ehr6-OkWsAAJWp4.png,,,,,,,[],,,,
1304577704642129921,1304169953780613120,2020-09-12 00:28:57 UTC,2020-09-12,00:28:57,0,756860893976072193,aridavidmelnick,Ari Melnick,,"@NumbaOneBastard @UtterPWNedNoob @carlson_ethan Literacy. The wheel. Deep wells. Railroads. Cars. Electrical tools, machinery. Written laws. Abolition of slavery. Telephones, medicine. All things that white people brought to Africa. All reasons why blacks in the West enjoy higher standard of living than those in Africa.",en,[],[],[],1,0,0,[],[],https://twitter.com/AriDavidMelnick/status/1304577704642129921,False,,0,,,,,,,,"[{'screen_name': 'NumbaOneBastard', 'name': 'Mayor of Lucky Boy, NV', 'id': '703003303798419456'}, {'screen_name': 'UtterPWNedNoob', 'name': 'armando', 'id': '79173051'}, {'screen_name': 'carlson_ethan', 'name': 'ethan, the socialist', 'id': '1101690932955500544'}]",,,,
1304349634131881984,1304349634131881984,2020-09-11 09:22:41 UTC,2020-09-11,09:22:41,0,1159387895700119558,miliadventure,MiliAdventureAfrica,,"Are you ready for self drive in Tanzania? Mili Adventure Africa, best car rental company for self drive safari in Tanzania. Contact us for more information: Email: info@mili.co.tz Telephone: +255 626 250 623  https://t.co/wmMxpBj0H7",en,[],[],['https://pbs.twimg.com/media/Ehn7EkLWsAE1Xzk.jpg'],0,0,1,[],[],https://twitter.com/MiliAdventure/status/1304349634131881984,False,,1,https://pbs.twimg.com/media/Ehn7EkLWsAE1Xzk.jpg,,,,,,,[],,,,
1304099305280679939,1304099305280679939,2020-09-10 16:47:58 UTC,2020-09-10,16:47:58,0,606781436,valeryridde,Valéry Ridde,,"Scoping review in process ""use of telephone in the implementation of citizen participation in the processes of developing health system strengthening reforms/policies in Sub-Saharan Africa""  https://t.co/CdbKNZNvKy @dheepa_rajan @CSOs4UHC @governance_hs",en,"[{'screen_name': 'dheepa_rajan', 'name': 'd. rajan', 'id': '801108708474372098'}, {'screen_name': 'csos4uhc', 'name': 'uhc2030 civil society engagement mechanism', 'id': '982258742191276033'}, {'screen_name': 'governance_hs', 'name': 'health systems governance collaborative', 'id': '865638447003738114'}]",['https://www.protocols.io/view/scoping-review-protocol-on-the-use-of-telephone-in-bky7kxzn'],[],0,7,6,[],[],https://twitter.com/ValeryRidde/status/1304099305280679939,False,,0,,,,,,,,[],,,,
1304046128707645440,1304046128707645440,2020-09-10 13:16:39 UTC,2020-09-10,13:16:39,0,3911859793,dialloarabiou1,Jalloh,,@africa_nostalgi information nouveau recensement au quartier Enta cité une carte contre un téléphone android voici ces images  https://t.co/pyd4nXKMsE,fr,[],[],"['https://pbs.twimg.com/media/EhjnB8AWkAIN1zT.jpg', 'https://pbs.twimg.com/media/EhjnB71WsAERZs5.jpg', 'https://pbs.twimg.com/media/EhjnB79WAAEarX1.jpg', 'https://pbs.twimg.com/media/EhjnB72WAAAxCNj.jpg']",0,0,0,[],[],https://twitter.com/dialloarabiou1/status/1304046128707645440,False,,1,https://pbs.twimg.com/media/EhjnB8AWkAIN1zT.jpg,,,,,,,[],,,,
1304014599147188226,1304014594743111681,2020-09-10 11:11:22 UTC,2020-09-10,11:11:22,0,1302942642892869633,welington_trump,Welington Abrahim Trump,,"Due To The Circumstance and The way I was Treated and  Still In Africa,and Didnt Say anything as we Just Said Hi and Him Give Me His Telephone Contact In Minnessotta +16124359510 and Since September 24 2019 Him Call Me We Kept communicated  and was This How I Was Fortunate To",en,[],[],[],1,0,0,[],[],https://twitter.com/welington_trump/status/1304014599147188226,False,,0,,,,,,,,[],,,,
