id,conversation_id,created_at,date,time,timezone,user_id,username,name,place,tweet,language,mentions,urls,photos,replies_count,retweets_count,likes_count,hashtags,cashtags,link,retweet,quote_url,video,thumbnail,near,geo,source,user_rt_id,user_rt,retweet_id,reply_to,retweet_date,translate,trans_src,trans_dest
1344766237147082759,1344766237147082759,2020-12-31 22:03:50 UTC,2020-12-31,22:03:50,0,1299145916,wakaaboutafrica,Waka About Africa,,NIN: NIMC Issues Fresh Guidelines For Applicants As 164 Million Telephone Users Are At Risk Of Being Deactivated  https://t.co/xf2613Vl1Y,en,[],['https://wakaaboutafrica.com/nin-nimc-issues-fresh-guidelines-for-applicants-as-164-million-telephone-users-are-at-risk-of-being-deactivated/'],[],0,0,0,[],[],https://twitter.com/WakaAboutAfrica/status/1344766237147082759,False,,0,,,,,,,,[],,,,
1344692529653018624,1344692529653018624,2020-12-31 17:10:56 UTC,2020-12-31,17:10:56,0,20577970,tmspalding,Tony,,"@Dyson just be aware anybody considering buying a Dyson vacuum, that they have done away with there mobile service teams. So now if you have a problem you could be a month or more without the cleaner. Telephone support in South Africa, made in God knows where. Don't buy.#dysonend",en,[],[],[],0,0,0,['dysonend'],[],https://twitter.com/tmspalding/status/1344692529653018624,False,,0,,,,,,,,[],,,,
1344659963940122624,1344659945149628421,2020-12-31 15:01:32 UTC,2020-12-31,15:01:32,0,1282026724486787072,pavvtri,pav;,,south africa the south african depression and anxiety group (SADAG)   https://t.co/oNYJUOondk telephone: 0800 567 567  SMS: 31393,en,[],['http://www.sadag.org'],[],1,0,1,[],[],https://twitter.com/pavvtri/status/1344659963940122624,False,,0,,,,,,,,[],,,,
1344629048161480704,1344629048161480704,2020-12-31 12:58:41 UTC,2020-12-31,12:58:41,0,203851222,africamar,África Mar,,"Try Bit2Me and get € 5 FREE!  Buy, sell, exchange, receive and send Bitcoin and other cryptocurrencies in seconds.  Easy, fast and with telephone support.  € 5 gift for your first purchase of € 100 or more!  https://t.co/rcbhPeSUEy",en,[],['https://bit2me.com?r=H18N1huxG'],[],1,1,1,[],[],https://twitter.com/Africamar/status/1344629048161480704,False,,0,,,,,,,,[],,,,
1344619211973390336,1344317009551630338,2020-12-31 12:19:36 UTC,2020-12-31,12:19:36,0,1337975910046298114,singhbaroness,Baroness Julie Singh,,@BorisJohnson We would like to invite you to premises what shouldn't exist written. Too discuss blacks should never of been in premises corruption via telephone. So remove not necessary temps from Africa from buisness plan manager of staff and files  https://t.co/yoOQ11V1Fj,en,[],[],['https://pbs.twimg.com/media/EqkMCieXMAEM7VM.jpg'],0,0,1,[],[],https://twitter.com/SinghBaroness/status/1344619211973390336,False,,1,https://pbs.twimg.com/media/EqkMCieXMAEM7VM.jpg,,,,,,,"[{'screen_name': 'BorisJohnson', 'name': 'Boris Johnson', 'id': '3131144855'}]",,,,
1344576716669394945,1344576716669394945,2020-12-31 09:30:44 UTC,2020-12-31,09:30:44,0,2360086488,lafricamobile,LAfricaMobile,,"Via nos plateformes SMS, USSD, VOCAL, AIRTIME, vous avez été des centaines à envoyer des millions de requêtes.  Et pour cela, nous vous disons MERCI🤝  Bonne et heureuse année 2021, nos meilleurs vœux!  Ensemble continuons à créer des liens sur le téléphone mobile. #LAfricamobile  https://t.co/LTh0c6sdqf",fr,[],[],['https://pbs.twimg.com/media/EqjlIueXAAAj807.jpg'],0,1,3,['lafricamobile'],[],https://twitter.com/LAfricaMobile/status/1344576716669394945,False,,1,https://pbs.twimg.com/media/EqjlIueXAAAj807.jpg,,,,,,,[],,,,
1344498537699143682,1344498537699143682,2020-12-31 04:20:05 UTC,2020-12-31,04:20:05,0,485644333,morninglivesabc,MorningLiveSABC,,Coming up after 07:00...  Kindly send your questions and/or comments related to South Africa's Covid-19 vaccine procurement process.  We will also open the telephone lines for you to interact directly with the experts:   011-714 5877/5861/5988   #MorningLive #SABCNews  https://t.co/xOr7rrJai0,en,[],[],['https://pbs.twimg.com/media/EqicQ0IXEAcvcSX.jpg'],65,17,48,"['morninglive', 'sabcnews']",[],https://twitter.com/MorningLiveSABC/status/1344498537699143682,False,,1,https://pbs.twimg.com/media/EqicQ0IXEAcvcSX.jpg,,,,,,,[],,,,
1344430851862441987,1344405042997170181,2020-12-30 23:51:08 UTC,2020-12-30,23:51:08,0,1168248645260648450,carykerns,Brandi Cary Izzy & The Itty Bitty Kitty Committee,,"@MetcalfeDavid Well put on that Lynx Africa and head on over to Waitrose! My friend! If all else fails, take Bluebell with you! You will have more telephone numbers than a phone book before you leave! 😉",en,[],[],[],0,0,1,[],[],https://twitter.com/CaryKerns/status/1344430851862441987,False,,0,,,,,,,,"[{'screen_name': 'MetcalfeDavid', 'name': 'Arlington Road and Bluebell', 'id': '1148013282109865985'}]",,,,
1344300450623987715,1344300447436320768,2020-12-30 15:12:57 UTC,2020-12-30,15:12:57,0,1042774998690226181,swifttelng,Swift Telephone Network,,"In August 2011, she was listed in Forbes 20 Youngest Power Women In Africa.  Born in Nigeria, Ehimuan completed her B.Eng. degree in Computer Engineering from Obafemi Awolowo University, Ile-Ife, with a first-class honours.",en,[],[],[],1,1,1,[],[],https://twitter.com/swifttelng/status/1344300450623987715,False,,0,,,,,,,,[],,,,
1344282795439435776,1344282795439435776,2020-12-30 14:02:48 UTC,2020-12-30,14:02:48,0,494029723,alertzaafrica,Alert South Africa,,#ShareAndCare #AfterEarthQuakes #SafetyTips Do Not you the telephone unless you have to report an Emergency keep the phone network open,en,[],[],[],0,0,0,"['shareandcare', 'afterearthquakes', 'safetytips']",[],https://twitter.com/AlertZaAfrica/status/1344282795439435776,False,,0,,,,,,,,[],,,,
1344177094486618112,1344177094486618112,2020-12-30 07:02:47 UTC,2020-12-30,07:02:47,0,1320612662695387138,mohamme27859094,Abubakar Mohammad,,"Imagine an Africa President bragging to other african leaders,He works with CIA he always have a telephone conversation with President Trump!",en,[],[],[],0,0,0,[],[],https://twitter.com/Mohamme27859094/status/1344177094486618112,False,,0,,,,,,,,[],,,,
1344167498233606144,1344167498233606144,2020-12-30 06:24:39 UTC,2020-12-30,06:24:39,0,2535862907,aichetou12,CHETOU....💞,,YOOOO REAALLYYY ??????? Vu qu’ils ont ramené un téléphone sans chargeur la voiture va venir sans moteur,fr,[],[],[],0,0,0,[],[],https://twitter.com/aichetou12/status/1344167498233606144,False,https://twitter.com/tmz/status/1344166337912954881,0,,,,,,,,[],,,,
1343923483269591040,1343923483269591040,2020-12-29 14:15:01 UTC,2020-12-29,14:15:01,0,3378496205,couretech,COURE Software & Sys,,Looking to broaden your marketing and communication strategy?   Then our All Number Query platform is the best solution.    Contact us today!  Email - Sales@coure-tech.com Telephone - +(234)-1-280-9119   #Africa #Tech4All #technology #lockdown #Traffic #data  #smsmarketing  https://t.co/rg5ZyfYSUp,en,[],[],['https://pbs.twimg.com/media/EqaTSTKXYAIieJL.png'],0,2,1,"['africa', 'tech4all', 'technology', 'lockdown', 'traffic', 'data', 'smsmarketing']",[],https://twitter.com/couretech/status/1343923483269591040,False,,1,https://pbs.twimg.com/media/EqaTSTKXYAIieJL.png,,,,,,,[],,,,
1343878188355760131,1343878188355760131,2020-12-29 11:15:02 UTC,2020-12-29,11:15:02,0,3378496205,couretech,COURE Software & Sys,,Minimize wasted time and resources associated with failed or undelivered messages using our Routing Service.  Contact us today to find out more!  Email - Sales@coure-tech.com Telephone - +(234)-1-280-9119  #Africa #Tech4All #technology #lockdown #Traffic #data #smsmarketing  https://t.co/fULq7h9Vmo,en,[],[],['https://pbs.twimg.com/media/EqZqFzDXEAAzdza.jpg'],0,1,0,"['africa', 'tech4all', 'technology', 'lockdown', 'traffic', 'data', 'smsmarketing']",[],https://twitter.com/couretech/status/1343878188355760131,False,,1,https://pbs.twimg.com/media/EqZqFzDXEAAzdza.jpg,,,,,,,[],,,,
1343866506036310017,1343866506036310017,2020-12-29 10:28:37 UTC,2020-12-29,10:28:37,0,3107807025,gracemanuelb,"Grace🦋🇳🇬(🇨🇦-IJN,Amen)",,"Via maintaining a relationship of infrastructural development with Africa. Their works in Addis Ababa comes to mind. (from building airports to telephone systems) with no strings attached. They have mastered the concept of “Soft Power”. In years to come, the fruits will show.",en,[],[],[],0,0,0,[],[],https://twitter.com/GraceManuelB/status/1343866506036310017,False,https://twitter.com/gracemanuelb/status/1343865498547720192,0,,,,,,,,[],,,,
1343853703426666498,1343853703426666498,2020-12-29 09:37:45 UTC,2020-12-29,09:37:45,0,1177498690358931457,africacybermag,Africa CyberSecurity Mag,,"#Alerte🚨 :   ▶️Une application de messagerie est un moyen de communication efficace et plus rapide, mais uniquement lorsqu'elle est sécurisée. Celles de votre téléphone 📱 le sont-elles ? #android #iOS14 #WhatsApp #TelegramTips #info #news 🔴Réponse 👇  https://t.co/q7X31KJI1H",fr,[],['https://cybersecuritymag.africa/niveau-securite-applications-de-messagerie-populaires'],[],0,0,0,"['alerte', 'android', 'ios14', 'whatsapp', 'telegramtips', 'info', 'news']",[],https://twitter.com/AfricaCyberMag/status/1343853703426666498,False,,0,,,,,,,,[],,,,
1343806579175378944,1343806579175378944,2020-12-29 06:30:29 UTC,2020-12-29,06:30:29,0,1339370158809202688,ktown4u_africa,ktown4u_Africa_Afrique,,❣ Annonce des gagnants  Les gagnants pour ktown4u Afrique Jeux-concours sont les suivants  @MhdHajar_twt @jackiebangtan7  @eymilaritzajorg    Veuillez nous envoyer les info suivantes via DM  1. Pays 2. Code postal 3. Ville 4. Adresse 5. Numéro de téléphone 6. Nom du destinataire,fr,"[{'screen_name': 'mhdhajar_twt', 'name': 'hajar mahmoud ⁷ ᴮᴱ #1 on hot100', 'id': '1123709391612592128'}, {'screen_name': 'jackiebangtan7', 'name': 'jackie⁷', 'id': '825252030776221697'}, {'screen_name': 'eymilaritzajorg', 'name': 'eymi laritza jorge c', 'id': '1894346852'}]",[],[],0,0,12,[],[],https://twitter.com/Ktown4u_AFRICA/status/1343806579175378944,False,,0,,,,,,,,[],,,,
1343666584573898752,1343479954407895045,2020-12-28 21:14:12 UTC,2020-12-28,21:14:12,0,1290299114580779009,salomon_prof,Prof.Salomon,,"@Annemwiza Ntakwigira kwa Africa mugihe tutarasobanukirwa ko kwishyira hamwe kw'ibihugu byacu Ari imbaraga zo gutera imbere byihuse.  Turi kure yo gusobanukirwa niyo mpamvu tukibona gutunga Imodoka Ari ibyabakire nyamara ari nka Telephone, Africa yarikeneye ubundi bukoroni bweruye.",tl,[],[],[],1,0,0,[],[],https://twitter.com/salomon_prof/status/1343666584573898752,False,,0,,,,,,,,"[{'screen_name': 'Annemwiza', 'name': 'NIWEMWIZA Anne Marie', 'id': '2179651476'}]",,,,
1343604054107316225,1343604054107316225,2020-12-28 17:05:44 UTC,2020-12-28,17:05:44,0,3695605996,techinafrica,techinafrica,,Escotel launched to power telephone towers in sub-Saharan Africa with green energy  https://t.co/UUfUOYhjMI #africa #africatech,en,[],['http://zpr.io/H4VHV'],[],0,0,0,"['africa', 'africatech']",[],https://twitter.com/techinafrica/status/1343604054107316225,False,,0,,,,,,,,[],,,,
1343575224193863682,1331611673371750403,2020-12-28 15:11:10 UTC,2020-12-28,15:11:10,0,1000118438629605377,walldrama,walldrama  دیوار اندوه,,"@TMobile_NL I wish i could use th telephone lines &amp; immigrate to th Netherlands &amp; take refuge there. I`m so annoyed in my country that I need someone to help me become a refugee in Europe.The people of Europe &amp; America are also going to Africa for help,&amp; no one cares about the people of Asia",en,[],[],[],0,0,0,[],[],https://twitter.com/walldrama/status/1343575224193863682,False,,0,,,,,,,,"[{'screen_name': 'TMobile_NL', 'name': 'T-Mobile Nederland', 'id': '39199794'}]",,,,
1343536668024967168,1343520144841207809,2020-12-28 12:37:58 UTC,2020-12-28,12:37:58,0,1217206986028257281,ndagijimanasue1,🇷🇼🇹🇿Mtoto wa 🇺🇬east Africa 🇧🇮🇰🇪,,@umusore_witunze 😂😂😂 umuntu wakoze telephone yasanze harimo missed call ya zlatan,in,[],[],[],1,0,1,[],[],https://twitter.com/NdagijimanaSue1/status/1343536668024967168,False,,0,,,,,,,,"[{'screen_name': 'umusore_witunze', 'name': 'Umusore wirwanyeho💪', 'id': '1210442247621283840'}]",,,,
1343375791745282048,1343252899237785601,2020-12-28 01:58:42 UTC,2020-12-28,01:58:42,0,512240787,lmbuli,☯️AceOfArts🧎🏿‍♂️,,"@noname Siyabonga... Ngikhumbula iTelephone (I Miss Telephone) #Forever Thank You @noname (Zulu = Africa = 🇿🇦) ""We are going to Live forever like Aliyaah...""",en,"[{'screen_name': 'noname', 'name': '🌱', 'id': '382763253'}]",[],[],0,0,1,['forever'],[],https://twitter.com/LMbuli/status/1343375791745282048,False,,0,,,,,,,,"[{'screen_name': 'noname', 'name': '🌱', 'id': '382763253'}]",,,,
1343313627269488641,1343313627269488641,2020-12-27 21:51:40 UTC,2020-12-27,21:51:40,0,1472840491,africanewshub,Africa News Hub,,Avertissement : #WhatsApp cessera de fonctionner sur certains téléphones à partir du 1er janvier 2021  https://t.co/CBMHSEIgdv,fr,[],['https://www.africanewshub.com/short/euS'],[],0,0,0,['whatsapp'],[],https://twitter.com/africanewshub/status/1343313627269488641,False,,0,,,,,,,,[],,,,
1343125670470291459,1343125670470291459,2020-12-27 09:24:48 UTC,2020-12-27,09:24:48,0,2703819902,smwanamilongo1,Saleh Mwanamilongo,,"Egypt, DR Congo presidents hold telephone conversation on bilateral ties | CGTN Africa #DRC #RDC ⁦@AlsisiOfficial⁩ ⁦@fatshi13⁩ ⁦@Presidence_RDC⁩ ⁦@AU_PSD⁩   https://t.co/1UFuVBn3j0",en,"[{'screen_name': 'alsisiofficial', 'name': 'abdelfattah elsisi', 'id': '2419191913'}, {'screen_name': 'fatshi13', 'name': 'félix a. tshisekedi', 'id': '3306155129'}, {'screen_name': 'presidence_rdc', 'name': 'présidence rdc 🇨🇩', 'id': '817736921027854336'}, {'screen_name': 'au_psd', 'name': 'african union peace', 'id': '138369105'}]",['https://africa.cgtn.com/2020/12/26/egypt-dr-congo-presidents-hold-telephone-conversation-on-bilateral-ties/'],[],0,1,1,"['drc', 'rdc']",[],https://twitter.com/SMwanamilongo1/status/1343125670470291459,False,,0,,,,,,,,[],,,,
1342771465385611264,1342724346880675840,2020-12-26 09:57:19 UTC,2020-12-26,09:57:19,0,1242817495725215744,calma1956,Calma,,"@TembaMliswa Christmas celebration is part of colonisation? If that’s the case then, cars aeroplanes roads trains telephones electricity schools medicine etc is all part of colonisation. The borders of this country was even cut out by them. There was no country in Africa. It was one landmass",en,[],[],[],1,0,2,[],[],https://twitter.com/calma1956/status/1342771465385611264,False,,0,,,,,,,,"[{'screen_name': 'TembaMliswa', 'name': 'Hon. Temba P. Mliswa', 'id': '760029905006592001'}]",,,,
1342768379007000576,1342768379007000576,2020-12-26 09:45:03 UTC,2020-12-26,09:45:03,0,892416604558036992,enact_africa,ENACT,,Best of 2020 &gt; Kenyans are at risk of losing money through the ‘one telephone ring and cut’ scam. Read more:  https://t.co/iPELGylzXp  https://t.co/tzDQrad4sh,en,[],['http://ow.ly/ZM2T50CtbaY'],['https://pbs.twimg.com/media/EqJ4ubaWMAQlpHy.jpg'],0,0,0,[],[],https://twitter.com/ENACT_Africa/status/1342768379007000576,False,,1,https://pbs.twimg.com/media/EqJ4ubaWMAQlpHy.jpg,,,,,,,[],,,,
1342568035501154304,1341823429045993472,2020-12-25 20:28:58 UTC,2020-12-25,20:28:58,0,1336744572957970435,alexrobbin6,alex robbin,,@DurleyTycle @cheefchimp @SameeraKhan @jakepaul He was born in Scotland? Meaning he's Scottish meaning a Scottish man built the telephone?  How is that hard to grasp?  If he went and built it in South Africa would South Africa be the ones that built the telephone?,en,[],[],[],0,0,0,[],[],https://twitter.com/alexrobbin6/status/1342568035501154304,False,,0,,,,,,,,"[{'screen_name': 'DurleyTycle', 'name': 'Tycle Durley', 'id': '1339032792349347840'}, {'screen_name': 'cheefchimp', 'name': 'logan 🐻', 'id': '1114505483816251392'}, {'screen_name': 'SameeraKhan', 'name': 'Khan', 'id': '116363549'}, {'screen_name': 'jakepaul', 'name': 'Jake Paul', 'id': '581301629'}]",,,,
1342470247589183489,1342470247589183489,2020-12-25 14:00:23 UTC,2020-12-25,14:00:23,0,3378496205,couretech,COURE Software & Sys,,Tick-Tock says the clock   Enjoy quick access to information on various  data resources across numerous channels using our ANQ platform  Contact us today!  Email - Sales@coure-tech.com Telephone - +(234)-1-280-9119   #Africa #Tech4All #technology  #data  #smsmarketing  https://t.co/5JLPPrAaGE,en,[],[],['https://pbs.twimg.com/media/EqFpk2BUcAALCF1.png'],0,1,0,"['africa', 'tech4all', 'technology', 'data', 'smsmarketing']",[],https://twitter.com/couretech/status/1342470247589183489,False,,1,https://pbs.twimg.com/media/EqFpk2BUcAALCF1.png,,,,,,,[],,,,
1342458725077024769,1342458725077024769,2020-12-25 13:14:36 UTC,2020-12-25,13:14:36,0,3081803211,ouedraogo_nadia,Nadia Ouedraogo,,"A new player in the #renewableenergy sector is emerging in #Africa: Escote to power telephone towers with #GreenEnergy. The first #solarPV systems (900) installed will prevent the #emission of &gt;6,240t of #CO2/year in #SierraLeone &amp; 10,092t/year in #Liberia  https://t.co/UMZxesLwFS",en,[],['https://www.afrik21.africa/en/africa-escotel-is-launched-to-power-telephone-towers-with-green-energy/'],[],0,3,3,"['renewableenergy', 'africa', 'greenenergy', 'solarpv', 'emission', 'co2', 'sierraleone', 'liberia']",[],https://twitter.com/ouedraogo_nadia/status/1342458725077024769,False,,0,,,,,,,,[],,,,
1342410988885319681,1342410988885319681,2020-12-25 10:04:55 UTC,2020-12-25,10:04:55,0,1330962815566442498,kaamae,Kaama Enterprises,,Kaama vous souhaite de passer de bonnes fêtes. Restez connectés pour le prochain dévoilement de notre premier produit. Téléphones : (+237) 653 256 129 / 696 820 407 Adresse Email : entreprisekama@yahoo.com Site web :  https://t.co/wqw4J7mcRk #joyeuxnoel#christmas#holidays#africa  https://t.co/AeJGmPe3Pd,fr,[],['https://lnkd.in/dHpfsw3'],['https://pbs.twimg.com/media/EqEy47FXUAAIcmd.jpg'],0,2,2,[],[],https://twitter.com/KaamaE/status/1342410988885319681,False,,1,https://pbs.twimg.com/media/EqEy47FXUAAIcmd.jpg,,,,,,,[],,,,
1342149075563671554,1342147491442139143,2020-12-24 16:44:10 UTC,2020-12-24,16:44:10,0,959052022526894081,langstonreview,The Langston Hughes Review,,"I had the pleasure once of having a telephone conversation w/ Ms. Cortez at her request. At some point, I asked her to comment on ""In the Morning,"" and here's one of she said: ""I was in Africa when I wrote that poem."" #IntheMorning",en,[],[],[],1,0,6,['inthemorning'],[],https://twitter.com/LangstonReview/status/1342149075563671554,False,,0,,,,,,,,[],,,,
1342006940726140928,1341980578329948161,2020-12-24 07:19:22 UTC,2020-12-24,07:19:22,0,708348166316417026,ownthedoors1,Ownthedoors,,@NomaSapien_ South Africa has the most expensive telephone calls. Sometimes it costs R1177 just to say hello,en,[],[],[],0,0,1,[],[],https://twitter.com/Ownthedoors1/status/1342006940726140928,False,,0,,,,,,,,"[{'screen_name': 'NomaSapien_', 'name': 'N☀️ma. Not Normal.', 'id': '1185509757018243072'}]",,,,
1341757559728959488,1341081065289641985,2020-12-23 14:48:25 UTC,2020-12-23,14:48:25,0,1327119831666208768,heryksen,HingaEryksen,,@KimKardashian #KKWHoliday#partner pic.twitter.com/aHV4COQUvd..am eryksen from Africa Kenya if u really mean yua wordz swee..😍😘😘am waitin for yua suprise...kim my telephone line is +254 705182205...al be mch thankfull..dia,en,[],[],[],0,0,0,[],[],https://twitter.com/HEryksen/status/1341757559728959488,False,,0,,,,,,,,"[{'screen_name': 'KimKardashian', 'name': 'Kim Kardashian West', 'id': '25365536'}]",,,,
1341722138487746560,1339613017638641664,2020-12-23 12:27:40 UTC,2020-12-23,12:27:40,0,623515451,diwan_vinod,Diwan,,"@EBACommittee @HjelmLh @Sida Thanks that @Sida @SidaCarin had followed this.The Sida supported program is not fully developed, it is still temporary, it need to look at functioning marker,biometricID, privacy of ID, bank infrastructure,mobile telephone. Mobile telephone has increased exponentially in Africa.",en,"[{'screen_name': 'sida', 'name': 'sida', 'id': '74703019'}, {'screen_name': 'sidacarin', 'name': 'carin jämtin', 'id': '888843645230755841'}]",[],[],0,0,0,[],[],https://twitter.com/diwan_vinod/status/1341722138487746560,False,,0,,,,,,,,"[{'screen_name': 'EBACommittee', 'name': 'EBA', 'id': '2525688516'}, {'screen_name': 'HjelmLh', 'name': 'Lisa Hjelm', 'id': '4225003725'}, {'screen_name': 'Sida', 'name': 'Sida', 'id': '74703019'}]",,,,
1341721258006863872,1339613017638641664,2020-12-23 12:24:10 UTC,2020-12-23,12:24:10,0,623515451,diwan_vinod,Diwan,,"@EBACommittee @HjelmLh @Sida Several countries in Asia &amp; Africa has studied the Indian system of biometric ID, privacy in unique identifier, mobile telephone infrastructure, banking etc. With a functioning market, cash support is the best way to eradicate extreme poverty.",en,[],[],[],1,0,0,[],[],https://twitter.com/diwan_vinod/status/1341721258006863872,False,,0,,,,,,,,"[{'screen_name': 'EBACommittee', 'name': 'EBA', 'id': '2525688516'}, {'screen_name': 'HjelmLh', 'name': 'Lisa Hjelm', 'id': '4225003725'}, {'screen_name': 'Sida', 'name': 'Sida', 'id': '74703019'}]",,,,
1341471561115688960,1341471561115688960,2020-12-22 19:51:58 UTC,2020-12-22,19:51:58,0,944836530866147328,kl_mabe,Katlego Mabe,,"Growing up in South Africa is quite problematic, more so if you black. Trying to navigate between African society norms (which are in most cases broken telephone) and morden law (the constitution) is never easy.",en,[],[],[],0,0,0,[],[],https://twitter.com/KL_mabe/status/1341471561115688960,False,,0,,,,,,,,[],,,,
1341298574290784256,1341031136152195083,2020-12-22 08:24:34 UTC,2020-12-22,08:24:34,0,110753603,nathanieljhall,Nathaniel J Hall,,@kev1n1985 @JWilliamJames It smacked of white guilt and saviour syndrome. Africa doesn’t need a few quid from a telephone fundraiser. It needs the west to stop rapping and pillaging it’s natural resources causing war and instability.,en,[],[],[],1,0,7,[],[],https://twitter.com/nathanieljhall/status/1341298574290784256,False,,0,,,,,,,,"[{'screen_name': 'kev1n1985', 'name': 'Kev', 'id': '236082865'}, {'screen_name': 'JWilliamJames', 'name': 'J. William James', 'id': '467809161'}]",,,,
1341159150311665667,1341139736900104193,2020-12-21 23:10:33 UTC,2020-12-21,23:10:33,0,2194381488,robtruthseeker,Robtruthseeker,,@khwezi_shange The only good thing is they can’t come after you for suprise medical billing what a joke like South Africa we are run by old men and women who think the dial telephone is the in thing,en,[],[],[],1,0,0,[],[],https://twitter.com/robtruthseeker/status/1341159150311665667,False,,0,,,,,,,,"[{'screen_name': 'khwezi_shange', 'name': 'Khwezi Shange', 'id': '4899050343'}]",,,,
1341028580227239939,1341005109275332610,2020-12-21 14:31:43 UTC,2020-12-21,14:31:43,0,757993833716129792,jmo1957,Jerry,,@lanacle @disclosetv Ya think. They just announced two new strains of the China virus one in Africa and one in Europe. Yeah they’re not going to let up. Oh did you hear this one’s really contagious. I believe you can get it talking to someone on the telephone.,en,[],[],[],1,0,0,[],[],https://twitter.com/JMO1957/status/1341028580227239939,False,,0,,,,,,,,"[{'screen_name': 'lanacle', 'name': 'Lana', 'id': '78779199'}, {'screen_name': 'disclosetv', 'name': 'Disclose.tv 🚨', 'id': '15392486'}]",,,,
1340718727646629888,1340718727646629888,2020-12-20 18:00:28 UTC,2020-12-20,18:00:28,0,316414167,alexnomads,AlexNomads 🌐 colivingvalley.com,,"It all started in South Africa, where students in Durban fitted 25 people in a phone booth in order to get into the Guinness Book of World Records. The craze soon traversed to England, where it was called ‘telephone booth squash’, but they managed to fit only 19 students.  https://t.co/SZpNVzO75Y",en,[],[],['https://pbs.twimg.com/media/EpswgGrWMAcpfzj.jpg'],0,0,0,[],[],https://twitter.com/AlexNomads/status/1340718727646629888,False,,1,https://pbs.twimg.com/media/EpswgGrWMAcpfzj.jpg,,,,,,,[],,,,
1339222423439347713,1339222423439347713,2020-12-16 14:54:41 UTC,2020-12-16,14:54:41,0,711810452175626240,georgschoener,ERNEUERBARE ENERGIEN,,AFRICA: Escotel is launched to power telephone towers with green energy  https://t.co/9PJNwSFjCl #Afrik21,en,[],['https://www.afrik21.africa/en/africa-escotel-is-launched-to-power-telephone-towers-with-green-energy/'],[],0,0,0,['afrik21'],[],https://twitter.com/GeorgSchoener/status/1339222423439347713,False,,0,,,,,,,,[],,,,
1339216243715354624,1339216243715354624,2020-12-16 14:30:08 UTC,2020-12-16,14:30:08,0,322182389,iben_arrogant,Yoko Kurama,,"I love when folks tell me I'm living off the government bc I get disability. BITCH you try standing 24 hours duties on and off, doing stupid shit like carrying a fuckin telephone pole for 12 mile runs, sleepin in a hole in the middle of africa...bitch! 😂",en,[],[],[],0,0,0,[],[],https://twitter.com/iBen_ArroGanT/status/1339216243715354624,False,,0,,,,,,,,[],,,,
1339029133901189120,1339029133901189120,2020-12-16 02:06:38 UTC,2020-12-16,02:06:38,0,2985114866,cctv_plus,CCTV+,,"""China stands ready to intensify high-level exchanges and strengthen comprehensive cooperative partnership with #Tanzania,"" Chinese President #XiJinping told his Tanzanian counterpart, John Magufuli during a telephone conversation on Tuesday. #China #Africa  https://t.co/GFXnZMqulm",en,[],[],['https://pbs.twimg.com/media/EpUvLqxVQAEdot8.png'],0,1,1,"['tanzania', 'xijinping', 'china', 'africa']",[],https://twitter.com/CCTV_Plus/status/1339029133901189120,False,,1,https://pbs.twimg.com/media/EpUvLqxVQAEdot8.png,,,,,,,[],,,,
