id,conversation_id,created_at,date,time,timezone,user_id,username,name,place,tweet,language,mentions,urls,photos,replies_count,retweets_count,likes_count,hashtags,cashtags,link,retweet,quote_url,video,thumbnail,near,geo,source,user_rt_id,user_rt,retweet_id,reply_to,retweet_date,translate,trans_src,trans_dest
1343122150379569154,1343122150379569154,2020-12-27 09:10:49 UTC,2020-12-27,09:10:49,0,14367849,selfdoubtist,Vallabhan,,"Wow, wonderful. Just this connectivity could change Algeria's fortunes for the better. But, the caveat is that it shouldn't come with burdensome national debt and having to surrender to China's economic domination. Ask Srilanka, their Hambantota port now in Chinese hands",en,[],[],[],0,0,1,[],[],https://twitter.com/SelfDoubtist/status/1343122150379569154,False,https://twitter.com/ErikSolheim/status/1343116919919022080,0,,,,,,,,[],,,,
1341698519825068032,1341698519825068032,2020-12-23 10:53:49 UTC,2020-12-23,10:53:49,0,4001506342,ac3_news,AfricaConnect3,,Closing off 2020 with great news from the R&amp;E community in #Algeria @CERISTDZ🗣️The international #connectivity has just been upgraded from 2.5 to 10 Gbps👩‍💻💪with the support of @europeaid 🇪🇺and #AfricaConnect3🌍! Check out our news item on @GEANTnews  https://t.co/mkelizsjyG  https://t.co/JlbNhtH1xb,en,"[{'screen_name': 'ceristdz', 'name': 'cerist', 'id': '545197400'}, {'screen_name': 'europeaid', 'name': 'europeaid 🇪🇺', 'id': '19722343'}, {'screen_name': 'geantnews', 'name': 'géant news', 'id': '119696983'}]",['http://bit.ly/3mJeSRN'],['https://pbs.twimg.com/media/Ep6rEWlXEAIf-2r.jpg'],0,5,8,"['algeria', 'connectivity', 'africaconnect3']",[],https://twitter.com/AC3_News/status/1341698519825068032,False,,1,https://pbs.twimg.com/media/Ep6rEWlXEAIf-2r.jpg,,,,,,,[],,,,
1331947061080711168,1331947061080711168,2020-11-26 13:05:00 UTC,2020-11-26,13:05:00,0,21303464,alykhansatchu,Aly-Khan Satchu,,"efforts to develop a Europe-to-Africa corridor through the Central Maghreb fundamentally revolve around Algeria's road connectivity within the Trans-African Highway system, starting in Algiers. @KASpoldimed @michaeltanchum  https://t.co/GSM073qKtL  https://t.co/p2U0M7ejGJ  https://t.co/4iwVa2leke",en,"[{'screen_name': 'kaspoldimed', 'name': 'kas regional program political dialogue south med', 'id': '1177163485819625473'}, {'screen_name': 'michaeltanchum', 'name': 'prof. michael tanchum', 'id': '3310505366'}]","['https://bit.ly/39de30i', 'http://bit.ly/2MzUZiI']",['https://pbs.twimg.com/media/EnrT42HXMAIb1yA.jpg'],0,0,1,[],[],https://twitter.com/alykhansatchu/status/1331947061080711168,False,,1,https://pbs.twimg.com/media/EnrT42HXMAIb1yA.jpg,,,,,,,[],,,,
1331915607575470085,1331915607575470085,2020-11-26 11:00:01 UTC,2020-11-26,11:00:01,0,21303464,alykhansatchu,Aly-Khan Satchu,,"Morocco, Algeria, and Egypt are the respective geo-political gatekeepers of three emerging trans- Mediterranean corridors of Africa-to-Europe connectivity.  @KASpoldimed @michaeltanchum   https://t.co/GSM073Illj   https://t.co/p2U0M6WIi9",en,"[{'screen_name': 'kaspoldimed', 'name': 'kas regional program political dialogue south med', 'id': '1177163485819625473'}, {'screen_name': 'michaeltanchum', 'name': 'prof. michael tanchum', 'id': '3310505366'}]","['https://bit.ly/39de30i', 'http://bit.ly/2MzUZiI']",[],0,1,2,[],[],https://twitter.com/alykhansatchu/status/1331915607575470085,False,,0,,,,,,,,[],,,,
1329003519408390145,1329003519408390145,2020-11-18 10:08:25 UTC,2020-11-18,10:08:25,0,418056061,russiangraintra,𝑺𝒘𝒊𝒕𝒕𝒆𝒓 ©️ Swithun Still,,#GLOBALGRAIN TRADER PANEL HAD THE BEST TURNOUT SO FAR with 165 attendees/ delegates tuning in. Sorry about my poor audio &amp; connectivity issues... 😠 It was very frustrating! If you missed my comments on Algeria 🇩🇿 or other aspects of the panel please let me know 🙏🏻 @Global_Grain,en,"[{'screen_name': 'global_grain', 'name': 'global grain events', 'id': '904026876'}]",[],[],3,0,4,['globalgrain'],[],https://twitter.com/RussianGrainTra/status/1329003519408390145,False,https://twitter.com/Stef_DiNardo/status/1328986015768457216,0,,,,,,,,[],,,,
1328266844134809600,1328266844134809600,2020-11-16 09:21:08 UTC,2020-11-16,09:21:08,0,768718077189947392,cdafricanews,China Daily Africa,,"Algerian Ambassador to China Ahcene Boukhelfa said Algeria's participation in the Belt and Road Initiative will enhance regional connectivity and facilitate trade, beneficial to the development of both Algeria and its neighbouring countries.  https://t.co/SpIp2wItUJ  https://t.co/wbxOhngBSZ",en,[],['http://global.chinadaily.com.cn/a/202011/15/WS5fb0c47fa31024ad0ba94212.html'],['https://pbs.twimg.com/media/Em7zpaIUUAEUxJy.png'],0,0,0,[],[],https://twitter.com/CDAfricaNews/status/1328266844134809600,False,,1,https://pbs.twimg.com/media/Em7zpaIUUAEUxJy.png,,,,,,,[],,,,
1327608609233018880,1327608609233018880,2020-11-14 13:45:32 UTC,2020-11-14,13:45:32,0,1257998445589041153,cdhkedition,China Daily Hong Kong,,"Algerian Ambassador to China Ahcene Boukhelfa said Algeria’s participation in the Belt and Road Initiative will enhance regional connectivity and facilitate trade, beneficial to the development of both Algeria and its neighbouring countries. #BRI #BeltAndRoad  https://t.co/jkLWJyLjiy",en,[],[],[],0,7,16,"['bri', 'beltandroad']",[],https://twitter.com/CDHKedition/status/1327608609233018880,False,,1,https://pbs.twimg.com/ext_tw_video_thumb/1327608478802690053/pu/img/XMaP-QfLSiPSvT5Q.jpg,,,,,,,[],,,,
1321946587170557952,1321946587170557952,2020-10-29 22:46:41 UTC,2020-10-29,22:46:41,0,372775156,sindoreai,Chouaib,,Can you guys @netblocks check about the connectivity in Algeria ? It seems like Facebook and Twitter are blocked right now,en,"[{'screen_name': 'netblocks', 'name': 'netblocks.org', 'id': '815297463695327234'}]",[],[],0,1,0,[],[],https://twitter.com/Sindoreai/status/1321946587170557952,False,,0,,,,,,,,[],,,,
1315935123884462082,1315935123884462082,2020-10-13 08:39:17 UTC,2020-10-13,08:39:17,0,1300131881376190464,polipoly5,polipoly,,@EU_Commission When can we expect update of the list of safe 3rd countries? It´s been weeks. The idea was you gradually add to the list to restore global connectivity. You´ve added none. #Serbia &amp; #Algeria deserve to be back on! @EU_Commission @vonderleyen #LoveIsNotTourism @IATA,en,"[{'screen_name': 'eu_commission', 'name': 'european commission 🇪🇺', 'id': '157981564'}, {'screen_name': 'vonderleyen', 'name': 'ursula von der leyen', 'id': '1146329871418843136'}, {'screen_name': 'iata', 'name': 'iata', 'id': '27067896'}]",[],[],0,3,6,"['serbia', 'algeria', 'loveisnottourism']",[],https://twitter.com/polipoly5/status/1315935123884462082,False,,0,,,,,,,,[],,,,
1315170616828399618,1315170616828399618,2020-10-11 06:01:24 UTC,2020-10-11,06:01:24,0,3310505366,michaeltanchum,Prof. Michael Tanchum,,"🇩🇿🇨🇳 China makes bid for its own Euro-Africa connectivity with deep sea port in Algeria.  My comments in this article by @AlexScipione via @agenzia_nova   Infrastrutture: Tanchum (Aies) a “Nova”, porto di Hamdania progetto win-win per Algeria e Cina  https://t.co/bEDf4hnwZl",en,"[{'screen_name': 'alexscipione', 'name': 'alessandro scipione', 'id': '3119450968'}, {'screen_name': 'agenzia_nova', 'name': 'agenzia nova', 'id': '329607652'}]",['https://www.agenzianova.com/a/5f7d866dc1bf87.34154792/3131170/2020-10-07/infrastrutture-tanchum-aies-a-nova-porto-di-hamdania-progetto-win-win-per-algeria-e-cina/linked'],[],0,17,33,[],[],https://twitter.com/michaeltanchum/status/1315170616828399618,False,,0,,,,,,,,[],,,,
1314953335276007425,1314953335276007425,2020-10-10 15:38:00 UTC,2020-10-10,15:38:00,0,117718644,chekiri,Yassine,,"I think it must be said, entv did a good job of keeping the live feed up on fb, considering internet connectivity issues in algeria",en,[],[],[],1,0,0,[],[],https://twitter.com/chekiri/status/1314953335276007425,False,,0,,,,,,,,[],,,,
1309117066948079626,1309117066948079626,2020-09-24 13:06:45 UTC,2020-09-24,13:06:45,0,1123891679134670848,ab_parr,Abi Parr,,"""Projects must come from the community"" say recipients of @UNHCRInnovation's Community #Connectivity Fund, supported by @MFA_Lu. Read about our recent project in Algeria and our successes and challenges supporting refugee-led innovation ➡️  https://t.co/hyMsxQN7xO",en,"[{'screen_name': 'unhcrinnovation', 'name': 'unhcr innovation', 'id': '596192833'}, {'screen_name': 'mfa_lu', 'name': 'mfa luxembourg 🇱🇺', 'id': '711866406950801408'}]",['https://bit.ly/2Hu1cew'],[],1,5,6,['connectivity'],[],https://twitter.com/Ab_parr/status/1309117066948079626,False,,0,,,,,,,,[],,,,
1305909668229775360,1305901744711323654,2020-09-15 16:41:42 UTC,2020-09-15,16:41:42,0,958693340,joj_peters,George,,@EAFIFADirect Continent. Nigeria/Ghana in West Africa. Egypt/Morocco/Algeria in North Africa. Kenya/Ethiopia in East Africa. In these difficult times in the world the least you can do is to not show bias and install atleast 1 more server for Africans. The connectivity is really poor. Thank you,en,[],[],[],3,1,4,[],[],https://twitter.com/Joj_peters/status/1305909668229775360,False,,0,,,,,,,,"[{'screen_name': 'EAFIFADirect', 'name': 'FIFA Direct Communication', 'id': '1182444574167334913'}]",,,,
1305551912322957314,1305551912322957314,2020-09-14 17:00:06 UTC,2020-09-14,17:00:06,0,106384090,devtelecoms,Developing Telecoms,,More subsea cable connectivity planned for Algeria #MiddleEastNorthAfrica #Algeria #SubseaCable #SEAMEWE4 #Medex #Orval/Alval  https://t.co/VHwVsOs41S  https://t.co/iyPDGqxcU9,en,[],['http://tinyurl.com/y2mblfr6'],['https://pbs.twimg.com/media/Eh5Ai56XsAEqskL.jpg'],0,0,0,"['middleeastnorthafrica', 'algeria', 'subseacable', 'seamewe4', 'medex', 'orval']",[],https://twitter.com/DevTelecoms/status/1305551912322957314,False,,1,https://pbs.twimg.com/media/Eh5Ai56XsAEqskL.jpg,,,,,,,[],,,,
1304506047688704000,1304498201798627338,2020-09-11 19:44:12 UTC,2020-09-11,19:44:12,0,921147788,philbe2,philBE,,"@SubCableNews @Algerie_Telecom @NebTgnt @secretdifa3 Questions arise about this anonymous ""4th submarine cable"", providentially appearing, ""deus ex machina"" like, at the very time Algeria is facing upcoming disruptions for planned maintenance on SMW4, one of their main global connectivity link…🤔   https://t.co/bjpg230GxX",en,[],['https://algeriepartplus.com/catastrophe-des-coupures-internet-programmees-des-ce-mois-de-septembre-2020/'],[],0,0,0,[],[],https://twitter.com/philBE2/status/1304506047688704000,False,,0,,,,,,,,"[{'screen_name': 'SubCableNews', 'name': 'Eckhard Bruckschen', 'id': '798194799530516480'}, {'screen_name': 'Algerie_Telecom', 'name': 'Algérie Télécom', 'id': '1305412064'}, {'screen_name': 'NebTgnt', 'name': 'Neb Tgnt', 'id': '968073567475851264'}, {'screen_name': 'secretdifa3', 'name': 'Secretdifa3 Akram Kharief', 'id': '18354774'}]",,,,
1304450268784930819,1303592077893292032,2020-09-11 16:02:34 UTC,2020-09-11,16:02:34,0,921147788,philbe2,philBE,,"@Afridigital @getsocial_io @Algerie_Telecom @NebTgnt @secretdifa3 Most suitable time indeed for a providential ""4th submarine cable"" to be put in service, considering one of the main cables providing 🇩🇿Algeria global connectivity, namely SMW4, might be out of service over the upcoming months for planned maintenance…🤔   https://t.co/bjpg22J5Gp",en,[],['https://algeriepartplus.com/catastrophe-des-coupures-internet-programmees-des-ce-mois-de-septembre-2020/'],[],0,0,0,[],[],https://twitter.com/philBE2/status/1304450268784930819,False,,0,,,,,,,,"[{'screen_name': 'Afridigital', 'name': 'Extensia', 'id': '214813724'}, {'screen_name': 'getsocial_io', 'name': 'GetSocial', 'id': '2152651916'}, {'screen_name': 'Algerie_Telecom', 'name': 'Algérie Télécom', 'id': '1305412064'}, {'screen_name': 'NebTgnt', 'name': 'Neb Tgnt', 'id': '968073567475851264'}, {'screen_name': 'secretdifa3', 'name': 'Secretdifa3 Akram Kharief', 'id': '18354774'}]",,,,
1302683522596044800,1302683502148751360,2020-09-06 19:02:09 UTC,2020-09-06,19:02:09,0,1233864281004937217,trintheworld,Turkey In The World,,"🔻“Turkey's effort in #Algeria, which borders the key Sahel nations of #Mauritania, #Mali, and #Niger, has greater importance for Turkey's connectivity with the rest of Africa.” 🇩🇿🇹🇷  https://t.co/tIe9lI1Lv5",en,[],[],['https://pbs.twimg.com/media/EhQPwb3XgBIGD9C.jpg'],1,6,23,"['algeria', 'mauritania', 'mali', 'niger']",[],https://twitter.com/TRintheworld/status/1302683522596044800,False,,1,https://pbs.twimg.com/media/EhQPwb3XgBIGD9C.jpg,,,,,,,[],,,,
1298942096225730560,1298942096225730560,2020-08-27 11:15:03 UTC,2020-08-27,11:15:03,0,106384090,devtelecoms,Developing Telecoms,,Algeria issues operators extra spectrum to tackle slow speeds #MiddleEastNorthAfrica #Algeria #Spectrum #Connectivity #Djezzy #MobilisAlgeriaTelecom #OoredooAlgeria  https://t.co/FMGkjXWtHT  https://t.co/f59M3PTRxK,en,[],['http://tinyurl.com/y2ma67zf'],['https://pbs.twimg.com/media/EgbE8_FWkAA0vT5.jpg'],0,0,0,"['middleeastnorthafrica', 'algeria', 'spectrum', 'connectivity', 'djezzy', 'mobilisalgeriatelecom', 'ooredooalgeria']",[],https://twitter.com/DevTelecoms/status/1298942096225730560,False,,1,https://pbs.twimg.com/media/EgbE8_FWkAA0vT5.jpg,,,,,,,[],,,,
1297299164800462848,1297299164800462848,2020-08-22 22:26:38 UTC,2020-08-22,22:26:38,0,2189003005,abdel_cheref,Abdelkader 🇩🇿 🇺🇸,,Algeria: outages and problems with internet connectivity  https://t.co/bUfe56vJf7,en,[],[],['https://pbs.twimg.com/media/EgDtzHsWoAM4J5Q.jpg'],0,0,3,[],[],https://twitter.com/Abdel_Cheref/status/1297299164800462848,False,,1,https://pbs.twimg.com/media/EgDtzHsWoAM4J5Q.jpg,,,,,,,[],,,,
1296540620278968320,1296540620278968320,2020-08-20 20:12:27 UTC,2020-08-20,20:12:27,0,815297463695327234,netblocks,NetBlocks.org,,Network data show a significant fall in internet connectivity in #Algeria from Wednesday night with high impact to state-owned telco Algérie Télécom; users report degraded service beginning shortly after new pricing and capping plans were rolled out; incident ongoing 📉  https://t.co/Q0qWTalgur,en,[],[],['https://pbs.twimg.com/media/Ef45msEWAAEE_oz.jpg'],45,119,310,['algeria'],[],https://twitter.com/netblocks/status/1296540620278968320,False,,1,https://pbs.twimg.com/media/Ef45msEWAAEE_oz.jpg,,,,,,,[],,,,
1291925941170638851,1291810342222172160,2020-08-08 02:35:21 UTC,2020-08-08,02:35:21,0,2295144991,aminezack,Amine Merz DZ 🇩🇿,,"@EAFIFADirect North Africa region (Algeria, Tunisia, Morocco, Egypt, Libya...)  What are your future plans if there are any, to improve connectivity issues there since there is no dedicated server for those countries or that region. Please answer this. We need servers here.",en,[],[],[],0,0,2,[],[],https://twitter.com/AmineZack/status/1291925941170638851,False,,0,,,,,,,,"[{'screen_name': 'EAFIFADirect', 'name': 'FIFA Direct Communication', 'id': '1182444574167334913'}]",,,,
1269646853328510977,1269646853328510977,2020-06-07 15:06:13 UTC,2020-06-07,15:06:13,0,1197004552261787648,zbcnewsonline_,ZBC News Online,,Leading African Countries in Airport Connectivity  1. Zimbabwe (63.5%)  2. Egypt (62.7%)  3. Morocco (57.3%)  4. Algeria (50.9%)  5. Ethiopia (49.6%)  6. Tunisia (46.7%)  7. Kenya (44.1%)  8. Nigeria (43.2%)  9. Mauritius (37.8%)  10. Tanzania (34.5%)  Source: WEF GCR 2020.,fi,[],[],[],0,0,0,[],[],https://twitter.com/ZBCNewsonline_/status/1269646853328510977,False,,0,,,,,,,,[],,,,
1261756803966214152,1261399006724456450,2020-05-16 20:33:59 UTC,2020-05-16,20:33:59,0,796904927750750208,americaneedshim,Lord Insecurity,,"@CDProd95 @justanotheran10 @NHTC @Mooresy1967 @CMOyeks It’s not a fair comparison. NZ’s infrastructure, pop density, connectivity between cities, demographics are TOTALLY FUCKING DIFFERENT. By all means compare NZ with Algeria as you did, I’m not disputing the fact the UK gov are doing badly I’m saying don’t compare us with NZ",en,[],[],[],2,0,0,[],[],https://twitter.com/americaneedshim/status/1261756803966214152,False,,0,,,,,,,,"[{'screen_name': 'CDProd95', 'name': 'Connor Dale', 'id': '87807596'}, {'screen_name': 'justanotheran10', 'name': 'C', 'id': '1213231546431197184'}, {'screen_name': 'NHTC', 'name': 'Maunga Iti', 'id': '28522901'}, {'screen_name': 'Mooresy1967', 'name': 'SM', 'id': '923987956297293824'}, {'screen_name': 'CMOyeks', 'name': 'Mobola', 'id': '20917482'}]",,,,
1255597374736605189,1255597374736605189,2020-04-29 20:38:36 UTC,2020-04-29,20:38:36,0,3088448057,datzdee6ix,GRATITUDE,,African Countries With The Best 4G internet coverage  South Africa  Egypt  Morocco  Algeria  Botswana  Source: 2019 Huawei Global Connectivity Index.,en,[],[],[],0,0,0,[],[],https://twitter.com/datzdee6ix/status/1255597374736605189,False,,0,,,,,,,,[],,,,
1255539985022926848,1255539985022926848,2020-04-29 16:50:33 UTC,2020-04-29,16:50:33,0,31362795,emeczy,emeka momah,,African Countries With The Best 4G internet coverage  South Africa  Egypt  Morocco  Algeria  Botswana  Source: 2019 Huawei Global Connectivity Index.,en,[],[],[],7,27,154,[],[],https://twitter.com/emeczy/status/1255539985022926848,False,,0,,,,,,,,[],,,,
1253739389664014336,1253739389664014336,2020-04-24 17:35:38 UTC,2020-04-24,17:35:38,0,20814874,prattandwhitney,Pratt & Whitney,,Our customers around the 🌎 continue to go the extra mile to help those in need. We 👏 Helvetic Airways for helping to maintain connectivity between Algeria and Switzerland by use of its GTF-powered @embraer E190-E2 ✈️ #AllTogether,en,"[{'screen_name': 'embraer', 'name': 'embraer', 'id': '398002001'}]",[],[],0,7,30,['alltogether'],[],https://twitter.com/prattandwhitney/status/1253739389664014336,False,https://twitter.com/helvetic_en/status/1253357965207392257,0,,,,,,,,[],,,,
1245309172863942656,1245029799371956226,2020-04-01 11:16:58 UTC,2020-04-01,11:16:58,0,1088798982,sedansmith,Seán Smith,,"@_Will_Brown JUDITH SCHEELE, Smugglers and Saints of the Sahara: regional connectivity in the twentieth century.  It offers an excellent ethnographic and anthropological study of social norms and local/regional economies in northern Mali and southern Algeria.   https://t.co/jEQZZOKKnW",en,[],['https://www.cambridge.org/core/books/smugglers-and-saints-of-the-sahara/85056593028F6C087AEBFC5725D07DB1'],[],0,1,6,[],[],https://twitter.com/SeDanSmith/status/1245309172863942656,False,,0,,,,,,,,"[{'screen_name': '_Will_Brown', 'name': 'Will Brown', 'id': '346527009'}]",,,,
1244957782157262851,1244957782157262851,2020-03-31 12:00:40 UTC,2020-03-31,12:00:40,0,1191000079760527361,pjokocha,Olisaeloka (PJ) Okocha,,"Rail connectivity between Nigeria and Algeria would be an absolute game changer. It would give our respective nations and surrounding nations access to the Mediterranean and Atlantic ports respectively and serve as conduit for trade b/w Equatorial West Africa, Sahel and Maghreb.  https://t.co/IsY5KpxUrK",en,[],[],['https://pbs.twimg.com/media/EUb6gApXgAA7JRM.jpg'],0,3,3,[],[],https://twitter.com/PJOkocha/status/1244957782157262851,False,,1,https://pbs.twimg.com/media/EUb6gApXgAA7JRM.jpg,,,,,,,[],,,,
1218682302714257408,1218672467901808642,2020-01-18 23:51:17 UTC,2020-01-18,23:51:17,0,1654046738,sadiqtyakasai,Sadiq T. Yakasai,,"@DrIsaPantami Hon Minister this is why a backup route for Internet connectivity via Niger-Algeria-Morocco or Chad-Libya-Egypt, as a second landing point in northern Nigeria is a crucial infra. We need to lead a consortium in partnership to build it. This isn't the first nor last time.",en,[],[],[],8,16,61,[],[],https://twitter.com/sadiqtyakasai/status/1218682302714257408,False,,0,,,,,,,,"[{'screen_name': 'DrIsaPantami', 'name': 'Isa Ali Pantami, PhD', 'id': '2748555327'}]",,,,
1218092667571265537,1218092667571265537,2020-01-17 08:48:17 UTC,2020-01-17,08:48:17,0,102428367,britishbirds,British Birds,,"Migratory connectivity of Eurasian Dotterels breeding in alpine Fennoscandia. All but two ring recoveries in winter were from North Africa: Morocco (1), Algeria (6) and Tunisia (1) #ornithology",en,[],[],[],0,4,24,['ornithology'],[],https://twitter.com/britishbirds/status/1218092667571265537,False,https://twitter.com/IBIS_journal/status/1217718368989601792,0,,,,,,,,[],,,,
1211371509618552833,1211371509618552833,2019-12-29 19:40:48 UTC,2019-12-29,19:40:48,0,1048952667995852802,zuhirbenslama,Zuhir Benslama,,The this is the worst thing that i read this year Algeria is getting worse and worse in crucial areas like technology and connectivity of course thanks to @Algerie_Telecom and thier junky engineers  https://t.co/Zctok9ZcQS,en,"[{'screen_name': 'algerie_telecom', 'name': 'algérie télécom', 'id': '1305412064'}]",['https://www.tsa-algerie.com/internet-fixe-et-mobile-lalgerie-parmi-les-pires-connexions-au-monde/amp/'],[],0,0,0,[],[],https://twitter.com/ZuhirBenslama/status/1211371509618552833,False,,0,,,,,,,,[],,,,
1204747984807878656,1204747984807878656,2019-12-11 13:01:17 UTC,2019-12-11,13:01:17,0,1693288640,unuehs,UN University - EHS,,"Q1 - What’s the biggest misconception or factor that’s often forgotten when designing for online delivery? 💭  ℹ️ - Internet connectivity was a real challenge to deliver the same experience across 4 different countries (Germany, Algeria, Mali and Niger).  #OnlineEduAfrica #altc  https://t.co/MufBj6Oml9",en,[],[],['https://pbs.twimg.com/media/ELgf59eXkAACT7p.png'],3,3,2,"['onlineeduafrica', 'altc']",[],https://twitter.com/UNUEHS/status/1204747984807878656,False,,1,https://pbs.twimg.com/media/ELgf59eXkAACT7p.png,,,,,,,[],,,,
1203004583024484352,1203004583024484352,2019-12-06 17:33:37 UTC,2019-12-06,17:33:37,0,2624030122,blueprintafric,BlueprintAfric,,African Countries With The Best 4G internet coverage  South Africa  Egypt  Morocco  Algeria  Botswana  Source: 2019 Huawei Global Connectivity Index.,en,[],[],[],0,1,4,[],[],https://twitter.com/blueprintafric/status/1203004583024484352,False,,0,,,,,,,,[],,,,
1202866423799959552,1202866423799959552,2019-12-06 08:24:38 UTC,2019-12-06,08:24:38,0,276404828,afrooomedia,Afroo~Media✊🏾,,African Countries With The Best 4G internet coverage  South Africa  Egypt  Morocco  Algeria  Botswana  Source: 2019 Huawei Global Connectivity Index. [© AfricaFactsZone] #FF,en,[],[],[],0,0,0,['ff'],[],https://twitter.com/afrooomedia/status/1202866423799959552,False,,0,,,,,,,,[],,,,
1202864204052611073,1202864204052611073,2019-12-06 08:15:49 UTC,2019-12-06,08:15:49,0,2281850753,asetown,temsil,,African Countries With The Best 4G internet coverage  South Africa  Egypt  Morocco  Algeria  Botswana  Source: 2019 Huawei Global Connectivity Index.,en,[],[],[],0,0,0,[],[],https://twitter.com/Asetown/status/1202864204052611073,False,,0,,,,,,,,[],,,,
1202843828677423105,1202843828677423105,2019-12-06 06:54:51 UTC,2019-12-06,06:54:51,0,949759958060593152,adamaudel,Adam Audel,,African Countries With The Best 4G internet coverage  South Africa  Egypt  Morocco  Algeria  Botswana  Source: 2019 Huawei Global Connectivity Index.,en,[],[],[],0,0,0,[],[],https://twitter.com/AdamAudel/status/1202843828677423105,False,,0,,,,,,,,[],,,,
1198636392634601473,1198636392634601473,2019-11-24 16:16:00 UTC,2019-11-24,16:16:00,0,1135649125439983616,iftymahfuz88,Iftekhar Mahfuz,,"#Bangladesh is one of the top 4 countries that achieved ‘remarkable' growth in digital economy in the last 4 years, according to GCI. Key drivers include mobile penetration and internet connectivity.  The other countries are #Ukraine, #SouthAfrica and #Algeria.  #বাংলাদেশ  https://t.co/WkhPF75Ryz",en,[],[],['https://pbs.twimg.com/media/EJ_s7dCU0AEB9g-.jpg'],0,0,0,"['bangladesh', 'ukraine', 'southafrica', 'algeria', 'বাংলাদেশ']",[],https://twitter.com/iftymahfuz88/status/1198636392634601473,False,,1,https://pbs.twimg.com/media/EJ_s7dCU0AEB9g-.jpg,,,,,,,[],,,,
1197355597638684672,1197355597638684672,2019-11-21 03:26:34 UTC,2019-11-21,03:26:34,0,30627476,urumurum,masudkarim মাসুদকরিম,,"#Huawei,@Huawei 'Global Connectivity Index 2019' report: #Bangladesh #Ukraine #SouthAfrica #Algeria are top four in digital economy growth  https://t.co/1oWCJ8Drvh #DigitalBangladesh #GCI2019 #FEtrademarket via @febdonline",en,"[{'screen_name': 'huawei', 'name': 'huawei', 'id': '98047213'}, {'screen_name': 'febdonline', 'name': 'the financial express', 'id': '2705672382'}]",['https://today.thefinancialexpress.com.bd/trade-market/bd-top-four-in-digital-economy-growth-1574271277'],[],0,0,0,"['huawei', 'bangladesh', 'ukraine', 'southafrica', 'algeria', 'digitalbangladesh', 'gci2019', 'fetrademarket']",[],https://twitter.com/urumurum/status/1197355597638684672,False,,0,,,,,,,,[],,,,
1192215035478712320,1192213990295920641,2019-11-06 22:59:49 UTC,2019-11-06,22:59:49,0,1055853740186632197,nelfeituri,Nada Elfeituri,,Pedestrian bridges are useful infrastructural elements that link districts in a mountainous city. Constantine is a great example of how bridges add character and connectivity to an urban area. #Algeria 🇩🇿  https://t.co/twS87gtQ5u,en,[],[],['https://pbs.twimg.com/media/EIuZOuRX0AAy8h-.jpg'],1,9,74,['algeria'],[],https://twitter.com/NElfeituri/status/1192215035478712320,False,,1,https://pbs.twimg.com/media/EIuZOuRX0AAy8h-.jpg,,,,,,,[],,,,
1191700463109967872,1191700463109967872,2019-11-05 12:55:05 UTC,2019-11-05,12:55:05,0,1078234566614224896,waya_media,WAYA Media,,"#MeetMENA - Meet Algeria, an emerging startup ecosystem that is fighting against obstacles such as a stagnating bureaucratic system, slow internet connectivity and an underdeveloped #wayamedia #algeria #startupecosystem  https://t.co/BFxGd3HIvp",en,[],[],[],1,0,1,"['meetmena', 'wayamedia', 'algeria', 'startupecosystem']",[],https://twitter.com/waya_media/status/1191700463109967872,False,,1,https://pbs.twimg.com/ext_tw_video_thumb/1191700295212044289/pu/img/_mfpNHWNRXo8BGl9.jpg,,,,,,,[],,,,
