id,conversation_id,created_at,date,time,timezone,user_id,username,name,place,tweet,language,mentions,urls,photos,replies_count,retweets_count,likes_count,hashtags,cashtags,link,retweet,quote_url,video,thumbnail,near,geo,source,user_rt_id,user_rt,retweet_id,reply_to,retweet_date,translate,trans_src,trans_dest
453514855744815105,453514855744815105,2014-04-08 12:49:02 UTC,2014-04-08,12:49:02,0,361118382,ifortknox,child putschist 🍂,,Angola building own communication satellite. What has USAID and UKAID done for us today? Lol,en,[],[],[],0,0,0,[],[],https://twitter.com/iFortknox/status/453514855744815105,False,,0,,,,,,,,[],,,,
453431297206407168,453431297206407168,2014-04-08 07:17:00 UTC,2014-04-08,07:17:00,0,315386187,nelsrodrigues,Nelson Rodrigues,,"#Markmedia: Communication Agency, #Web &amp; #Graphic #Design in Angola!  http://t.co/Mfxd4m5HoJ",fr,[],[],['https://pbs.twimg.com/media/BkrpXL5IcAAEFqU.jpg'],0,3,9,"['markmedia', 'web', 'graphic', 'design']",[],https://twitter.com/nelsrodrigues/status/453431297206407168,False,,1,https://pbs.twimg.com/media/BkrpXL5IcAAEFqU.jpg,,,,,,,[],,,,
452428878670475264,452428878670475264,2014-04-05 12:53:45 UTC,2014-04-05,12:53:45,0,1671264649,profngolakiluan,Prof.N'gola Kiluange,,"Angola: angolan communication system (ANGOSAT) is processed in Moscow,meaning Putin controls Angola's phone+ internet+ antyhing else.",en,[],[],[],0,0,0,[],[],https://twitter.com/ProfNgolaKiluan/status/452428878670475264,False,,0,,,,,,,,[],,,,
451478027378393089,451478027378393089,2014-04-02 21:55:24 UTC,2014-04-02,21:55:24,0,278166677,alexolesker,Alexander Olesker,,"Angola was over 90% illiterate at independence in 1975: ""lack of literacy among civil servants made written communication nearly useless""",en,[],[],[],0,0,0,[],[],https://twitter.com/AlexOlesker/status/451478027378393089,False,,0,,,,,,,,[],,,,
451318447486427137,451318447486427137,2014-04-02 11:21:17 UTC,2014-04-02,11:21:17,0,2313209563,goangoladaily,GO! Angola,,Planning Minister Announces Census Integrated Communication Network  http://t.co/x5ScdWlD66  http://t.co/5yBwUPTBEF #angola,en,[],"['http://bit.ly/1frtu2i', 'http://bit.ly/1iC9lt3']",[],0,0,0,['angola'],[],https://twitter.com/GOAngolaDaily/status/451318447486427137,False,,0,,,,,,,,[],,,,
449936603172306945,449936603172306945,2014-03-29 15:50:20 UTC,2014-03-29,15:50:20,0,1671264649,profngolakiluan,Prof.N'gola Kiluange,,"Angola: angolan communication system (ANGOSAT) is processed in Moscow, Putin controls Angola's phone+ internet+ antyhing else.",en,[],[],[],0,0,0,[],[],https://twitter.com/ProfNgolaKiluan/status/449936603172306945,False,,0,,,,,,,,[],,,,
449915499506569216,449915499506569216,2014-03-29 14:26:28 UTC,2014-03-29,14:26:28,0,1671264649,profngolakiluan,Prof.N'gola Kiluange,,"Angola: angolan communication system (ANGOSAT) is processed in Moscow,meaning Putin controls Angola's phone+ internet+ antyhing else.",en,[],[],[],0,0,0,[],[],https://twitter.com/ProfNgolaKiluan/status/449915499506569216,False,,0,,,,,,,,[],,,,
449317966992388098,449317966992388098,2014-03-27 22:52:05 UTC,2014-03-27,22:52:05,0,1671264649,profngolakiluan,Prof.N'gola Kiluange,,"Angola: angolan communication system (ANGOSAT) is processed in Moscow,meaning Putin controls Angola's phone+ internet+ antyhing else.",en,[],[],[],0,0,0,[],[],https://twitter.com/ProfNgolaKiluan/status/449317966992388098,False,,0,,,,,,,,[],,,,
449316849743048704,449316849743048704,2014-03-27 22:47:39 UTC,2014-03-27,22:47:39,0,1671264649,profngolakiluan,Prof.N'gola Kiluange,,"Angola: angolan communication system is (ANGOSAT)processed in Moscow,meaning Putin controls Angola's phone+ internet+ anything else.",en,[],[],[],0,0,0,[],[],https://twitter.com/ProfNgolaKiluan/status/449316849743048704,False,,0,,,,,,,,[],,,,
444313614103502848,444313614103502848,2014-03-14 03:26:35 UTC,2014-03-14,03:26:35,0,2173860253,mmi_angola,Angola RelatóriosMMI,,Official Reaffirms Engagement of Journalists in 2014 Census: [ANGOP]The director of social communication in ea...  http://t.co/D564D991iy,en,[],['http://bit.ly/1koGqXV'],[],0,0,0,[],[],https://twitter.com/MMI_Angola/status/444313614103502848,False,,0,,,,,,,,[],,,,
436173807481401344,436173807481401344,2014-02-19 16:21:54 UTC,2014-02-19,16:21:54,0,2288203286,albaneseal,Antonio Albanese,,Angola contro gli immigrati clandestini  http://t.co/nxnL3oLscK via @AGC Communication,it,"[{'screen_name': 'agc', 'name': 'agc', 'id': '255428508'}]",['http://www.agccommunication.eu/component/content/article/86-geopolitica/6565-angola-confini'],[],0,0,0,[],[],https://twitter.com/AlbaneseAl/status/436173807481401344,False,,0,,,,,,,,[],,,,
436152911484026880,436152911484026880,2014-02-19 14:58:52 UTC,2014-02-19,14:58:52,0,731855371,agencepannelle,Agence PANNELLE & Co,,"3ème pays pétrolier d'Afrique après le Nigeria et l'Angola, le pays axe sa communication sur ""le statut émergent en 2020"". #GuineeEquato",fr,[],[],[],0,0,0,['guineeequato'],[],https://twitter.com/AgencePannelle/status/436152911484026880,False,,0,,,,,,,,[],,,,
431081161373138946,431081161373138946,2014-02-05 15:05:32 UTC,2014-02-05,15:05:32,0,1745168100,insananinzoka,Alecto,,#Angola the next communication hub?  http://t.co/erTpUDJzIS via @sharethis,en,"[{'screen_name': 'sharethis', 'name': 'sharethis', 'id': '14116807'}]",['http://shar.es/QuoaM'],[],0,0,0,['angola'],[],https://twitter.com/insananinzoka/status/431081161373138946,False,,0,,,,,,,,[],,,,
430003785293762560,430003785293762560,2014-02-02 15:44:26 UTC,2014-02-02,15:44:26,0,2173860253,mmi_angola,Angola RelatóriosMMI,,Media Minister Praises Handball Players: [ANGOP]Angolan Social Communication minister José Luis de Matos highl...  http://t.co/dqsbsdyssw,fr,[],['http://bit.ly/1j2nP5K'],[],0,0,0,[],[],https://twitter.com/MMI_Angola/status/430003785293762560,False,,0,,,,,,,,[],,,,
430003060664840192,430003060664840192,2014-02-02 15:41:33 UTC,2014-02-02,15:41:33,0,1725910602,cameroonbiznews,Clarisse Domche,,Angola: Media Minister Praises Handball Players: [ANGOP]Angolan Social Communication minister José Luis de Mat...  http://t.co/UO4FKVC7EJ,fr,[],['http://bit.ly/1j2nP5K'],[],0,0,0,[],[],https://twitter.com/CameroonBizNews/status/430003060664840192,False,,0,,,,,,,,[],,,,
425979005091606528,425979005091606528,2014-01-22 13:11:23 UTC,2014-01-22,13:11:23,0,103920611,cassiayres,Cássia Ayres,,Portfolio of Corporate Communication  #africa #angola  http://t.co/ITvpxHHsrF via @SlideShare,en,"[{'screen_name': 'slideshare', 'name': 'slideshare', 'id': '9676152'}]",['http://www.slideshare.net/CssiaAyres/portfolio-corporate-communication?ref=http://cdn.embedly.com/widgets/media.html?src=http%3A%2F%2Fwww.slideshare.net%2Fslideshow%2Fembed_code%2F10372589&url=http%3A%2F%2Fwww.slideshare.net%2FCssiaAyres%2Fportfolio-corporate-communication&image=http%3A%2F%2Fcdn.slidesharecdn.com%2Fss_thumbnails%2Fportflio-comunicaocorporativaeng-111128141540-phpapp02-thumbnail-4.jpg%3Fcb%3D1390386946&key=b8949c0eb73c11e089614040d3dc5c07&type=text%2Fhtml&schema=slideshare'],[],0,0,0,"['africa', 'angola']",[],https://twitter.com/cassiayres/status/425979005091606528,False,,0,,,,,,,,[],,,,
425035111764328448,425035111764328448,2014-01-19 22:40:42 UTC,2014-01-19,22:40:42,0,2263385140,nosim_officiel,NoSim,,Activez NoSim Easy Call et bénéficiez de 3h de communication offerte vers l'Angola ou 1 vers. La RDC.,fr,[],[],[],0,0,0,[],[],https://twitter.com/NoSim_officiel/status/425035111764328448,False,,0,,,,,,,,[],,,,
423547718045151233,423547718045151233,2014-01-15 20:10:19 UTC,2014-01-15,20:10:19,0,334348716,africvillemagaz,Africvillemagazine,,New post: Angola: Cuando Cubango - Social Communication Building Announced  http://t.co/01mXo9JZqD,en,[],['http://bit.ly/LePNgm'],[],0,0,0,[],[],https://twitter.com/Africvillemagaz/status/423547718045151233,False,,0,,,,,,,,[],,,,
422724756253577216,422724756253577216,2014-01-13 13:40:10 UTC,2014-01-13,13:40:10,0,429206989,y7ya_mousa,yahya mousa,,"UNICEF Job: Information Communication Technology Specialist, P-3, Luanda, Angola (#Luanda)  http://t.co/hi6W3oSlsd #Job",fr,[],['http://workfor.us/unicef/1es36'],[],0,0,0,"['luanda', 'job']",[],https://twitter.com/y7ya_mousa/status/422724756253577216,False,,0,,,,,,,,[],,,,
421540415830237184,421540415830237184,2014-01-10 07:14:01 UTC,2014-01-10,07:14:01,0,233596271,unjoblist_dl,UN Job List Deadline,,"#UNICEF: Information Communication Technology Specialist, P-3, Luanda, Angola | Closing: 2014-01-23  http://t.co/J13pUps2jO #jobs",en,[],['http://unjl.org/job/?288241'],[],0,0,0,"['unicef', 'jobs']",[],https://twitter.com/UNJobList_DL/status/421540415830237184,False,,0,,,,,,,,[],,,,
421540414731354112,421540414731354112,2014-01-10 07:14:01 UTC,2014-01-10,07:14:01,0,233407792,unjoblist_ds,UN Job List Duty Stn,,"#UNICEF: Information Communication Technology Specialist, P-3, Luanda, Angola | In: Luanda, Angola  http://t.co/U7mZItA1Op #jobs",fr,[],['http://unjl.org/job/?288241'],[],0,0,0,"['unicef', 'jobs']",[],https://twitter.com/UNJobList_DS/status/421540414731354112,False,,0,,,,,,,,[],,,,
421540414068654080,421540414068654080,2014-01-10 07:14:01 UTC,2014-01-10,07:14:01,0,90736001,unjoblist,UN Job List,,"#UNICEF: Information Communication Technology Specialist, P-3, Luanda, Angola | Grade: P-3  http://t.co/Ekt20Yh4n6 #jobs",fr,[],['http://unjl.org/job/?288241'],[],0,0,1,"['unicef', 'jobs']",[],https://twitter.com/UNJobList/status/421540414068654080,False,,0,,,,,,,,[],,,,
415826205326077952,415826205326077952,2013-12-25 12:47:47 UTC,2013-12-25,12:47:47,0,334348716,africvillemagaz,Africvillemagazine,,New post: Angola: Minister Pledges to Continue Modernizing Social Communication  http://t.co/sJyLK03Uut,en,[],['http://bit.ly/1jI2cbI'],[],0,0,0,[],[],https://twitter.com/Africvillemagaz/status/415826205326077952,False,,0,,,,,,,,[],,,,
415321588444065792,415321588444065792,2013-12-24 03:22:37 UTC,2013-12-24,03:22:37,0,1374862837,aheartforafrica,heartforafrica,,Minister Pledges to Continue Modernizing Social Communication  http://t.co/IBgVYiMsgv #angola via @allafrica,en,"[{'screen_name': 'allafrica', 'name': 'allafrica.com', 'id': '16683014'}]",['http://allafrica.com/c/-52VPK'],[],0,0,0,['angola'],[],https://twitter.com/aheartforafrica/status/415321588444065792,False,,0,,,,,,,,[],,,,
415204419345854464,415204419345854464,2013-12-23 19:37:02 UTC,2013-12-23,19:37:02,0,190685193,africaacss,Africa Center,,Angola: Minister Pledges to Continue Modernizing Social Communication  http://t.co/nmW4Wlzxxy,en,[],['http://buff.ly/J95eW1'],[],0,1,0,[],[],https://twitter.com/AfricaACSS/status/415204419345854464,False,,0,,,,,,,,[],,,,
415153118184091648,415153118184091648,2013-12-23 16:13:11 UTC,2013-12-23,16:13:11,0,982992144,ictafrica1,ICT Africa,,Angola to Continue Modernizing Social Communication  http://t.co/hFCAC1mHM8,en,[],['http://dlvr.it/4YzrCD'],[],0,0,0,[],[],https://twitter.com/ICTAfrica1/status/415153118184091648,False,,0,,,,,,,,[],,,,
415148635035168768,415148635035168768,2013-12-23 15:55:22 UTC,2013-12-23,15:55:22,0,227306718,craftconcept,CraftConcept,,Angola: Minister Pledges to Continue Modernizing Social Communication  http://t.co/doGwHbbNGO,en,[],['http://dlvr.it/4YzZFk'],[],0,0,0,[],[],https://twitter.com/craftconcept/status/415148635035168768,False,,0,,,,,,,,[],,,,
415126962194378752,415126962194378752,2013-12-23 14:29:15 UTC,2013-12-23,14:29:15,0,358469041,rwitech,RwandanWomenInTech,,Africa ICT Update: Angola: Minister Pledges to Continue Modernizing Social Communication  http://t.co/i1d0tFtDf1,en,[],['http://ow.ly/2CmrMI'],[],0,0,0,[],[],https://twitter.com/RwiTech/status/415126962194378752,False,,0,,,,,,,,[],,,,
410608908856602625,410608908856602625,2013-12-11 03:16:07 UTC,2013-12-11,03:16:07,0,1374862837,aheartforafrica,heartforafrica,,CPLP Meeting Gathers Social Communication Technicians  http://t.co/ZpxtbWe9m3 #angola via @allafrica,en,"[{'screen_name': 'allafrica', 'name': 'allafrica.com', 'id': '16683014'}]",['http://allafrica.com/c/-51g4v'],[],0,0,0,['angola'],[],https://twitter.com/aheartforafrica/status/410608908856602625,False,,0,,,,,,,,[],,,,
410413376179671040,410413376179671040,2013-12-10 14:19:08 UTC,2013-12-10,14:19:08,0,982992144,ictafrica1,ICT Africa,,Angola's CPLP Meeting Gathers Social Communication Technicians  http://t.co/mNKhcWFnfv,en,[],['http://dlvr.it/4TdWK0'],[],0,0,0,[],[],https://twitter.com/ICTAfrica1/status/410413376179671040,False,,0,,,,,,,,[],,,,
406613840751632384,406613840751632384,2013-11-30 02:41:08 UTC,2013-11-30,02:41:08,0,334348716,africvillemagaz,Africvillemagazine,,New post: Angola: Social Communication Minister Advocates Women Cause  http://t.co/qAJjEwolRh,en,[],['http://bit.ly/1c2eeU2'],[],0,0,0,[],[],https://twitter.com/Africvillemagaz/status/406613840751632384,False,,0,,,,,,,,[],,,,
406311269906395136,406311269906395136,2013-11-29 06:38:50 UTC,2013-11-29,06:38:50,0,201728380,offshoreoiljobs,Offshore Jobs,,Communication Commissioning Engineer (FPSO) job in Angola | Job ID: 872402 | oil and gas Job Search  http://t.co/N3oixL3Vqk,en,[],['http://fb.me/6p3BqrJqa'],[],0,0,0,[],[],https://twitter.com/offshoreoiljobs/status/406311269906395136,False,,0,,,,,,,,[],,,,
406311259605200896,406311259605200896,2013-11-29 06:38:47 UTC,2013-11-29,06:38:47,0,201728380,offshoreoiljobs,Offshore Jobs,,NEW JOB ALERT: Communication Commissioning Engineer (FPSO) - Angola: American in USA is best choch fo...  http://t.co/PJpxS4rReI #oiljobs,en,[],['http://bit.ly/1ik6iGr'],[],0,0,0,['oiljobs'],[],https://twitter.com/offshoreoiljobs/status/406311259605200896,False,,0,,,,,,,,[],,,,
406305613627400192,406305613627400192,2013-11-29 06:16:21 UTC,2013-11-29,06:16:21,0,56665153,oilandgasjob,Oil & Gas Job Search,,New job alert: Communication Commissioning Engineer (FPSO) - Angola - 29 Nov: American in ...  http://t.co/pI2A7ggVo6 #oilandgasjobsearch,en,[],['http://bit.ly/1iZ57dc'],[],0,0,0,['oilandgasjobsearch'],[],https://twitter.com/OilandGasJob/status/406305613627400192,False,,0,,,,,,,,[],,,,
404298618812649472,404298618812649472,2013-11-23 17:21:16 UTC,2013-11-23,17:21:16,0,485888016,agcsegreteria,AGCcommunication,,Angola in piazza contro il governo  http://t.co/nE092YF1cp via @AGC Communication,it,"[{'screen_name': 'agc', 'name': 'agc', 'id': '255428508'}]",['http://www.agccommunication.eu/geopolitica/5702-angola-manifestazioni'],[],0,0,0,[],[],https://twitter.com/AGCsegreteria/status/404298618812649472,False,,0,,,,,,,,[],,,,
396298070800887808,396298070800887808,2013-11-01 15:29:57 UTC,2013-11-01,15:29:57,0,155325791,africannewsbot,African Newsbot,,Journalism Award to Mark Press Freedom Day: [ANGOP]Social Communication Ministry intends to gr...  http://t.co/mTmX239N51 #africa #angola,en,[],['http://bit.ly/1dYl2I7'],[],0,0,0,"['africa', 'angola']",[],https://twitter.com/AfricanNewsbot/status/396298070800887808,False,,0,,,,,,,,[],,,,
396249047507292160,396249047507292160,2013-11-01 12:15:09 UTC,2013-11-01,12:15:09,0,81159423,brikauskey,☆ Bryan  Bryce ™ ☆♣,,"Angola: Media Minister Reaffirms Commitment to Youth: [ANGOP]The Social Communication minister, José Luís de M...  http://t.co/2S8mUJHm8T",ca,[],['http://bit.ly/1dXvtvq'],[],0,0,0,[],[],https://twitter.com/brikauskey/status/396249047507292160,False,,0,,,,,,,,[],,,,
395080681799172098,395080681799172098,2013-10-29 06:52:29 UTC,2013-10-29,06:52:29,0,260883940,newsinsa,NewsInSA,,Angola: Minister On Staff Training for Better Communication  http://t.co/xzl6F4PWks,en,[],['http://goo.gl/9p1OD2'],[],0,0,0,[],[],https://twitter.com/NewsInSA/status/395080681799172098,False,,0,,,,,,,,[],,,,
392912130132824064,392912130132824064,2013-10-23 07:15:26 UTC,2013-10-23,07:15:26,0,334348716,africvillemagaz,Africvillemagazine,,New post: Angola: Social Communication Director Points Out Training As Priority  http://t.co/JlbEOGadoL,en,[],['http://bit.ly/1bdJMXC'],[],0,0,0,[],[],https://twitter.com/Africvillemagaz/status/392912130132824064,False,,0,,,,,,,,[],,,,
392449778090405889,392449778090405889,2013-10-22 00:38:13 UTC,2013-10-22,00:38:13,0,226921482,galaxybackbone,Galaxy Backbone,,"#GeGF2013 from Africa include Vice Minister, Public Administration of Angola,  Minister of Digital Economy, Communication &amp; Post of Gabon 1)",en,[],[],[],0,0,0,['gegf2013'],[],https://twitter.com/Galaxybackbone/status/392449778090405889,False,,0,,,,,,,,[],,,,
392449778077802496,392449778077802496,2013-10-22 00:38:13 UTC,2013-10-22,00:38:13,0,57468644,4eyedmonk,HENRY 🇳🇬,,"#GeGF2013 from Africa include Vice Minister, Public Administration of Angola,  Minister of Digital Economy, Communication &amp; Post of Gabon 1)",en,[],[],[],0,0,0,['gegf2013'],[],https://twitter.com/4eyedmonk/status/392449778077802496,False,,0,,,,,,,,[],,,,
387152829153959936,387152829153959936,2013-10-07 09:50:02 UTC,2013-10-07,09:50:02,0,81159423,brikauskey,☆ Bryan  Bryce ™ ☆♣,,"Angola: Media Minister Congratulates National Broadcasting Radio: [ANGOP]The Social Communication minister, Jo...  http://t.co/UThTk6FGCr",en,[],['http://bit.ly/1bPmdWF'],[],0,0,0,[],[],https://twitter.com/brikauskey/status/387152829153959936,False,,0,,,,,,,,[],,,,
387152826935169024,387152826935169024,2013-10-07 09:50:01 UTC,2013-10-07,09:50:01,0,1725910602,cameroonbiznews,Clarisse Domche,,"Angola: Media Minister Congratulates National Broadcasting Radio: [ANGOP]The Social Communication minister, Jo...  http://t.co/xtXKsZpQJ7",en,[],['http://bit.ly/1bPmdWF'],[],0,0,0,[],[],https://twitter.com/CameroonBizNews/status/387152826935169024,False,,0,,,,,,,,[],,,,
386044641898156032,386044641898156032,2013-10-04 08:26:29 UTC,2013-10-04,08:26:29,0,1053700656,faieza_iza,Faieza Robinson,,When my boyfriend is in Angola and it feels like he is next to me... Cos communication is the best ever. Love you baby.,en,[],[],[],1,0,0,[],[],https://twitter.com/faieza_iza/status/386044641898156032,False,,0,,,,,,,,[],,,,
381892826054664192,381892826054664192,2013-09-22 21:28:39 UTC,2013-09-22,21:28:39,0,97953064,totalmadstream,Live!,,What's new in Visual Communication? - Artist and Inmate Forge Unlikely Friendship in Angola Prison Documentary  http://t.co/s6VBZdzPov,en,[],['http://bit.ly/1gPYztD'],[],0,0,0,[],[],https://twitter.com/TotalMadStream/status/381892826054664192,False,,0,,,,,,,,[],,,,
378088913996247040,378088913996247040,2013-09-12 09:33:16 UTC,2013-09-12,09:33:16,0,334348716,africvillemagaz,Africvillemagazine,,New post: Angola: National Police Design Communication Strategy  http://t.co/dIxMAqRBy8,en,[],['http://bit.ly/15TE1Bl'],[],0,0,0,[],[],https://twitter.com/Africvillemagaz/status/378088913996247040,False,,0,,,,,,,,[],,,,
378080714040016896,378080714040016896,2013-09-12 09:00:41 UTC,2013-09-12,09:00:41,0,1725910602,cameroonbiznews,Clarisse Domche,,Angola: National Police Design Communication Strategy: [ANGOP]The first Broad Consultative Council of the medi...  http://t.co/JUdaX0uhSw,en,[],['http://bit.ly/1843emi'],[],0,0,0,[],[],https://twitter.com/CameroonBizNews/status/378080714040016896,False,,0,,,,,,,,[],,,,
378079579044204544,378079579044204544,2013-09-12 08:56:10 UTC,2013-09-12,08:56:10,0,155325791,africannewsbot,African Newsbot,,National Police Design Communication Strategy: [ANGOP]The first Broad Consultative Council of ...  http://t.co/NBUeFU6vJP #africa #angola,en,[],['http://bit.ly/1b8vU4G'],[],0,1,0,"['africa', 'angola']",[],https://twitter.com/AfricanNewsbot/status/378079579044204544,False,,0,,,,,,,,[],,,,
376344176755245056,376344176755245056,2013-09-07 14:00:18 UTC,2013-09-07,14:00:18,0,1583709217,smnewspaper,SM Newspaper,,"Luanda, Sep 7 (Prensa Latina) A delegation from the Ministry of Social Communication and mass media in Angola will...  http://t.co/5YPC1nBCiC",en,[],['http://fb.me/M6cxpYXf'],[],0,0,1,[],[],https://twitter.com/SMNewspaper/status/376344176755245056,False,,0,,,,,,,,[],,,,
370170201121501186,370170201121501186,2013-08-21 13:07:08 UTC,2013-08-21,13:07:08,0,285579458,globserver,glObserver,,Angola Communication Profile 2013 | glObserver Global Economics  http://t.co/lQIYqx5J4i,ca,[],['http://buff.ly/150hG4u'],[],0,0,0,[],[],https://twitter.com/globserver/status/370170201121501186,False,,0,,,,,,,,[],,,,
370170133781561344,370170133781561344,2013-08-21 13:06:51 UTC,2013-08-21,13:06:51,0,285579458,globserver,glObserver,,Angola Communication Profile 2013 | glObserver ...  http://t.co/sRXK3yiirX,fr,[],['http://fb.me/143VayhcE'],[],0,0,0,[],[],https://twitter.com/globserver/status/370170133781561344,False,,0,,,,,,,,[],,,,
369813262223028224,369813262223028224,2013-08-20 13:28:47 UTC,2013-08-20,13:28:47,0,1602710190,killerpassbots,killerpass Botswana,,About the proposed friendly against Angola on saturday it looks unlikely to happen.No official communication from BFA yet,en,[],[],[],0,2,0,[],[],https://twitter.com/KillerpassBOTS/status/369813262223028224,False,,0,,,,,,,,[],,,,
368756508097396736,368756508097396736,2013-08-17 15:29:37 UTC,2013-08-17,15:29:37,0,260895964,newsinafrica,NewsInAfrica,,Angola: Des gouverneurs en formation sur la communication et les techniques de présentation  http://t.co/lOz4l6j85l #Afrique,fr,[],['http://goo.gl/osRhQc'],[],0,1,0,['afrique'],[],https://twitter.com/NewsInAfrica/status/368756508097396736,False,,0,,,,,,,,[],,,,
365433484652716033,365433484652716033,2013-08-08 11:25:06 UTC,2013-08-08,11:25:06,0,854978390,magnusent_mag,MAGNUS ENT MAGAZINE,,Angola: Media Ready for Zé Dú Tournament: [ANGOP]Malanje -The social communication organs in northern Malanje ...  http://t.co/qgbyDvcOAj,und,[],['http://bit.ly/147FGLG'],[],0,0,0,[],[],https://twitter.com/MagnusEnt_Mag/status/365433484652716033,False,,0,,,,,,,,[],,,,
364947523892293632,364947523892293632,2013-08-07 03:14:04 UTC,2013-08-07,03:14:04,0,233596271,unjoblist_dl,UN Job List Deadline,,#UNICEF: Angola: Technical support to develop communication strategy on Birth R | Closing: 1970-01-01  http://t.co/Rtv6SAMaRT #jobs,en,[],['http://unjl.org/job/?282150'],[],0,0,0,"['unicef', 'jobs']",[],https://twitter.com/UNJobList_DL/status/364947523892293632,False,,0,,,,,,,,[],,,,
364947521451200512,364947521451200512,2013-08-07 03:14:04 UTC,2013-08-07,03:14:04,0,233407792,unjoblist_ds,UN Job List Duty Stn,,#UNICEF: Angola: Technical support to develop communication strategy on Bi | In: UN Children&amp;#039;s F  http://t.co/3VTUi9zJM8 #jobs,fr,[],['http://unjl.org/job/?282150'],[],0,0,0,"['unicef', 'jobs']",[],https://twitter.com/UNJobList_DS/status/364947521451200512,False,,0,,,,,,,,[],,,,
364947518569709569,364947518569709569,2013-08-07 03:14:03 UTC,2013-08-07,03:14:03,0,90736001,unjoblist,UN Job List,,"#UNICEF: Angola: Technical support to develop communication strategy on Birth Registration, J | Grade:   http://t.co/I8TZ5Uji8C #jobs",en,[],['http://unjl.org/job/?282150'],[],0,0,0,"['unicef', 'jobs']",[],https://twitter.com/UNJobList/status/364947518569709569,False,,0,,,,,,,,[],,,,
364870951332089858,364870951332089858,2013-08-06 22:09:48 UTC,2013-08-06,22:09:48,0,1313073236,jobistanafrica,Jobistan Africa,,"Angola: Technical support to develop communication strategy on Birth Registration, Justice for Childr...  http://t.co/eypy0NvvxM",en,[],['http://nblo.gs/NRAHC'],[],0,0,0,[],[],https://twitter.com/JobistanAfrica/status/364870951332089858,False,,0,,,,,,,,[],,,,
353162515666042882,353162515666042882,2013-07-05 14:44:39 UTC,2013-07-05,14:44:39,0,1570144238,clementboursin,Clément Boursin,,"Violences sexuelles contre les Congolaises expulsées d’Angola, @ACAT_France adresse une communication à   @UN_Women  http://t.co/EPNHCKxc6f",fr,"[{'screen_name': 'acat_france', 'name': 'acat', 'id': '253584635'}, {'screen_name': 'un_women', 'name': 'un women', 'id': '17137628'}]",['http://www.unwomen.org/fr/2013/06/call-for-communications-allegations-of-human-rights-violations-affecting-the-status-of-women-2/'],[],0,1,0,[],[],https://twitter.com/ClementBoursin/status/353162515666042882,False,,0,,,,,,,,[],,,,
352485871875928064,352485871875928064,2013-07-03 17:55:55 UTC,2013-07-03,17:55:55,0,334348716,africvillemagaz,Africvillemagazine,,New post: Angola: Infotur to Improve Angolan Communication At International Fair  http://t.co/VAU0mBdJdY,fr,[],['http://bit.ly/18wbpxJ'],[],0,0,0,[],[],https://twitter.com/Africvillemagaz/status/352485871875928064,False,,0,,,,,,,,[],,,,
352478280210853890,352478280210853890,2013-07-03 17:25:45 UTC,2013-07-03,17:25:45,0,63517235,ytcsouthafrica,YourTravelCompanion,,Angola: Infotur to Improve Angolan Communication At International Fair  http://t.co/JrYWiv5EG9,fr,[],['http://bit.ly/13slQjF'],[],0,0,0,[],[],https://twitter.com/YTCSouthAfrica/status/352478280210853890,False,,0,,,,,,,,[],,,,
352433563041402880,352433563041402880,2013-07-03 14:28:04 UTC,2013-07-03,14:28:04,0,507302916,afrika_reizen,Afrikareizen,,Angola: Infotur to Improve Angolan Communication At International Fair  http://t.co/wpI0ORimGo,fr,[],['http://goo.gl/cLXwf'],[],0,0,0,[],[],https://twitter.com/Afrika_reizen/status/352433563041402880,False,,0,,,,,,,,[],,,,
349644836032352256,349644261551124480,2013-06-25 21:46:39 UTC,2013-06-25,21:46:39,0,593805209,silver_zola,Maitland Niles,,@beny_angola communication numéro ya monde pona ko solola na bato,fr,[],[],[],0,0,0,[],[],https://twitter.com/Silver_zola/status/349644836032352256,False,,0,,,,,,,,[],,,,
347518393252978688,347518393252978688,2013-06-20 00:56:56 UTC,2013-06-20,00:56:56,0,519434875,tsa_wwpm,Worldwide Prayer Mtg,,"Angola Command share the gospel in Humbundu, Kikongo, Kimbundu, Lingala, Nchokwe, Ngangela and Portuguese. Pray for effective communication.",tl,[],[],[],0,0,0,[],[],https://twitter.com/TSA_WWPM/status/347518393252978688,False,,0,,,,,,,,[],,,,
335585564617240577,335585564617240577,2013-05-18 02:40:08 UTC,2013-05-18,02:40:08,0,875751637,mediamin,Media Ministry,,Angola Threatens to Shut Down Media � Global Voices: The Ministry of Communication of Angola ...  http://t.co/ebYgQMfZ6N #media #ministry,en,[],['http://tinyurl.com/aj5rcsq'],[],0,0,1,"['media', 'ministry']",[],https://twitter.com/mediamin/status/335585564617240577,False,,0,,,,,,,,[],,,,
