id,conversation_id,created_at,date,time,timezone,user_id,username,name,place,tweet,language,mentions,urls,photos,replies_count,retweets_count,likes_count,hashtags,cashtags,link,retweet,quote_url,video,thumbnail,near,geo,source,user_rt_id,user_rt,retweet_id,reply_to,retweet_date,translate,trans_src,trans_dest
1126148446208036864,1126148446208036864,2019-05-08 15:34:47 UTC,2019-05-08,15:34:47,0,720943717683765248,unicefangola,UNICEF Angola,,The Communication for Development Specialist will be part of our staff who work with behavior change and social mobilization. 😊 #C4D  Apply here:  https://t.co/S1wLzIdOMc #jobs #UNICEF #Angola  https://t.co/dmGDu5t5r3,en,[],['https://uni.cf/2YaBJJW'],['https://pbs.twimg.com/media/D6DhDI6WkAMgaW8.jpg'],0,3,2,"['c4d', 'jobs', 'unicef', 'angola']",[],https://twitter.com/UNICEFAngola/status/1126148446208036864,False,,1,https://pbs.twimg.com/media/D6DhDI6WkAMgaW8.jpg,,,,,,,[],,,,
1126032390030340096,1126032390030340096,2019-05-08 07:53:37 UTC,2019-05-08,07:53:37,0,3559682903,cdiscussion_com,cDiscussion.com,,"Bonjour,   Veuillez trouver ci-dessous les offres d'emploi du 07-05-2019 sur  https://t.co/gKlojgNZoP :  Poste | Entreprise | Ville / pays Communication for Development Specialist, P-3 | UNICEF | Luanda, Angola |...  https://t.co/eiwJC3vb27",fr,[],"['http://cDiscussion.com', 'https://www.cdiscussion.com/offre-d-emploi/']",[],0,0,0,[],[],https://twitter.com/cDiscussion_com/status/1126032390030340096,False,,0,,,,,,,,[],,,,
1125755753510391808,1125755753510391808,2019-05-07 13:34:21 UTC,2019-05-07,13:34:21,0,362560453,gustavoplacid0,Gustavo Plácido,,#Angola presidency: fuel shortages caused by lack of communication between Sonangol and state institutions. Will heads roll?   https://t.co/0egdzCMgaJ,en,[],['http://www.novojornal.co.ao/sociedade/interior/presidencia-justifica-crise-dos-combustiveis-com-ma-comunicacao-da-sonangol-70733.html'],[],0,4,4,['angola'],[],https://twitter.com/Gustavoplacid0/status/1125755753510391808,False,,0,,,,,,,,[],,,,
1125554864384303105,1125554864384303105,2019-05-07 00:16:06 UTC,2019-05-07,00:16:06,0,3323368879,workangola,Emprego em Angola,,"Angola: Communication for Development Specialist, P-3, Luanda, Angola, #110155 (6 months Temporary Appointment) -  https://t.co/R6fOSEpMYe",fr,[],['http://angola.jobrat.net/2019/05/07/angola-communication-for-development-specialist-p-3-luanda-angola-110155-6-months-temporary-appointment/'],[],0,0,0,[],[],https://twitter.com/workangola/status/1125554864384303105,False,,0,,,,,,,,[],,,,
1121770156433248256,1121770156433248256,2019-04-26 13:37:01 UTC,2019-04-26,13:37:01,0,876080419,rsq_solutions,The Sullivan Group,,What can we learn about the importance of communication from a physician working in Angola? More than you might think. Read on:   https://t.co/R1VRnTyURa #medicalerror #ptsafety  https://t.co/xTUB7M0egf,en,[],['https://hubs.ly/H0hC6_X0'],['https://pbs.twimg.com/media/D5FUAxfWsAAyPwa.png'],0,0,0,"['medicalerror', 'ptsafety']",[],https://twitter.com/RSQ_Solutions/status/1121770156433248256,False,,1,https://pbs.twimg.com/media/D5FUAxfWsAAyPwa.png,,,,,,,[],,,,
1121701956978917376,1121701956978917376,2019-04-26 09:06:01 UTC,2019-04-26,09:06:01,0,21182778,connects_africa,Connecting Africa,,"#ConnectingAfrica: Less than a week after Telstar was declared the winner of the fourth license to provide universal communication services in Angola, the country's president, João Lourenço, has decided to step in and annul the awarding of the license →  https://t.co/9TmScVUgTi",en,[],['http://spr.ly/6013E5ZLJ'],[],0,0,1,['connectingafrica'],[],https://twitter.com/Connects_Africa/status/1121701956978917376,False,,0,,,,,,,,[],,,,
1118582662682304513,1118582662682304513,2019-04-17 18:31:03 UTC,2019-04-17,18:31:03,0,1153763124,niti_bhan,Niti Bhan used to be The Prepaid Economy.,,"Issuing invoices for the purchase of goods or services have become mandatory for all taxpayers in Angola, a measure that aims to reduce the weight of the informal economy, alongside new rules of communication to the tax authorities.  https://t.co/oifsXp33Bt",en,[],['http://ow.ly/aMAp30osEH4'],[],0,0,0,[],[],https://twitter.com/niti_bhan/status/1118582662682304513,False,,0,,,,,,,,[],,,,
1118539319529152513,1118539319529152513,2019-04-17 15:38:49 UTC,2019-04-17,15:38:49,0,835956341646700545,africacommsweek,AfricaCommsWeek,,"Une stratège à découvrir : Stéphanie De Lima a un parcours notamment en #Angola, #AfriqueduSud, #Inde, #France qui a considérablement enrichi sa vision de la communication pour le continent africain.   Retrouvez-la sur #LinkedIn et sur #AfricaCommsWeek  https://t.co/0zK07z2Rds  https://t.co/5RxTpIR5b8",fr,[],['https://www.africacommunicationsweek.com/meet-top-30-africa-communications-professionals-follow/'],['https://pbs.twimg.com/media/D4XZkpiXkAIjBrN.jpg'],0,4,4,"['angola', 'afriquedusud', 'inde', 'france', 'linkedin', 'africacommsweek']",[],https://twitter.com/AfricaCommsWeek/status/1118539319529152513,False,,1,https://pbs.twimg.com/media/D4XZkpiXkAIjBrN.jpg,,,,,,,[],,,,
1116484593551593472,1116442470588538881,2019-04-11 23:34:05 UTC,2019-04-11,23:34:05,0,16132993,diasporaonline,Demba ☕️ ♻️,,"@EximBankUS Great news right from our #EXIMac19 Spring meeting in Washington DC. 2bn #investment secured by #Angola from China 10bn+ expected to follow from China  With a US 4bn MOU pack, it would take outreach &amp; #communication with local Angolese  SME/Is to understand US value proposition.  https://t.co/lTUH2dsXDA",en,[],[],[],0,0,1,"['eximac19', 'investment', 'angola', 'communication']",[],https://twitter.com/diasporaonline/status/1116484593551593472,False,,1,https://pbs.twimg.com/ext_tw_video_thumb/1116484387103760384/pu/img/UbJKsTrUSAcodXrn.jpg,,,,,,,"[{'screen_name': 'EximBankUS', 'name': 'Export-Import Bank', 'id': '222666657'}]",,,,
1109734967326769152,1109734967326769152,2019-03-24 08:33:28 UTC,2019-03-24,08:33:28,0,970077589,who_profits,Who Profits,,"Company profile: Nextcom is a publicly traded Israeli company specializing in communication infrastructure, renewable energy, security and civil engineering.   The company has a presence in Ghana, Senegal, and Angola. It was...  https://t.co/OjQETXPDQN",en,[],['https://whoprofits.org/company/nextcom-group/'],[],0,1,1,[],[],https://twitter.com/Who_Profits/status/1109734967326769152,False,,0,,,,,,,,[],,,,
1109570026397487105,1109570026397487105,2019-03-23 21:38:03 UTC,2019-03-23,21:38:03,0,761504698553757697,africangojobs,Ngojobsinafrica,,"Communication for Development (C4D) Consultant to support the Social Protection Programme (APROSOC), Angola  https://t.co/0SUjT2qsEc",fr,[],['https://ift.tt/2Fw3iqA'],[],0,0,0,[],[],https://twitter.com/AfricaNgojobs/status/1109570026397487105,False,,0,,,,,,,,[],,,,
1109133899437957121,1109133899437957121,2019-03-22 16:45:02 UTC,2019-03-22,16:45:02,0,15063810,trineuniversity,Trine University,,"Books are being collected at locations around the Trine University campus and the city of Angola for the Department of Humanities and Communication’s annual HAC Book Night on Wednesday, April 17.  https://t.co/BJxzqN1X5j #TrineU  https://t.co/fc4Q8L4CWP",en,[],['https://bit.ly/2UJpK4Q'],['https://pbs.twimg.com/media/D2RvZxNXcAAduOE.jpg'],0,1,7,['trineu'],[],https://twitter.com/TrineUniversity/status/1109133899437957121,False,,1,https://pbs.twimg.com/media/D2RvZxNXcAAduOE.jpg,,,,,,,[],,,,
1103055608666832896,1103055608666832896,2019-03-05 22:12:05 UTC,2019-03-05,22:12:05,0,4181501645,jowangata94,Jojo WANGATA 🦅,,"Le beau père plus de 30 ans au pouvoir,l’Angola cité parmi les pays les plus corrompus au monde,mais euh il veut être le censeur,le donneur des leçons sur la bonne gouvernance en Rdc,avec des journalistes qui font de la communication pure et simple,interview sans contradiction",fr,[],[],[],0,0,0,[],[],https://twitter.com/jowangata94/status/1103055608666832896,False,https://twitter.com/KBofasa/status/1102501203433480192,0,,,,,,,,[],,,,
1101607729309892608,1101599601797283840,2019-03-01 22:18:44 UTC,2019-03-01,22:18:44,0,2212110087,angola_peter,Mr Peter E. T. I. M,,@Ohloowatoscene Communication Understanding Love Attention. Not money all the time.,en,[],[],[],1,0,5,[],[],https://twitter.com/angola_peter/status/1101607729309892608,False,,0,,,,,,,,"[{'screen_name': 'Ohloowatoscene', 'name': 'Tosin🇳🇬🇨🇦👨', 'id': '228636817'}]",,,,
1099933208160993281,1099933208160993281,2019-02-25 07:24:47 UTC,2019-02-25,07:24:47,0,497776729,airtelrdc,Airtel RDC,,"Chers abonnés, avec 100 unités, bénéficiez de 9 minutes de communication vers l'Angola en composant *600*100#. Bondia #Angola ! Passez une bonne semaine.  https://t.co/PRJ78nM55F",fr,[],[],['https://pbs.twimg.com/media/D0O_aI_XgAECeIg.jpg'],0,0,1,['angola'],[],https://twitter.com/airtelrdc/status/1099933208160993281,False,,1,https://pbs.twimg.com/media/D0O_aI_XgAECeIg.jpg,,,,,,,[],,,,
1098390871509270529,1098390871509270529,2019-02-21 01:16:05 UTC,2019-02-21,01:16:05,0,3323368879,workangola,Emprego em Angola,,"Angola: Communication for Development Officer, (NO-1) Temporary Appointment for 6 months, Luanda, Angola ... -  https://t.co/j3QjYse82N",fr,[],['http://angola.jobrat.net/2019/02/21/angola-communication-for-development-officer-no-1-temporary-appointment-for-6-months-luanda-angola-109474-open-to-angolan-nationals-only/'],[],0,0,0,[],[],https://twitter.com/workangola/status/1098390871509270529,False,,0,,,,,,,,[],,,,
1098375604162973699,1098375604162973699,2019-02-21 00:15:25 UTC,2019-02-21,00:15:25,0,761504698553757697,africangojobs,Ngojobsinafrica,,"Communication for Development Officer, (NO-1) Temporary Appointment for 6 months, Luanda, Angola #109474 (Open to Angolan Nationals only)  https://t.co/XiR7SEetg5",en,[],['https://ift.tt/2E4v5wq'],[],0,0,0,[],[],https://twitter.com/AfricaNgojobs/status/1098375604162973699,False,,0,,,,,,,,[],,,,
1097543495881871360,1097543495881871360,2019-02-18 17:08:55 UTC,2019-02-18,17:08:55,0,131067977,dcapuia,Daniel Capuia,,Angola os continuing to modernize. #internet #5G #Communication  https://t.co/V6b3TNyIAJ,pt,[],[],[],0,0,0,"['internet', '5g', 'communication']",[],https://twitter.com/DCapuia/status/1097543495881871360,False,,1,https://pbs.twimg.com/ext_tw_video_thumb/1097543403321978880/pu/img/NCFqDbcXF-bmMM01.jpg,,,,,,,[],,,,
1092586580504530944,1092586580504530944,2019-02-05 00:51:54 UTC,2019-02-05,00:51:54,0,1032053042558816256,nootrlept,EPT Online,,🎯How to pronounce the #English Schwa. #nootrlaccent    https://t.co/IRLPIoC2Rd  #ESLteacher #ESL #communication #business #CustomerSuccess #CustomerEngagement #ASEAN #Pakistan #India #Bangladesh #AMU #EAC #COMESA #AU #Africa #SADC #Ethiopia #Angola #Asia #EU,en,[],['https://youtu.be/fvsVCIJtX8o'],[],0,2,1,"['english', 'nootrlaccent', 'eslteacher', 'esl', 'communication', 'business', 'customersuccess', 'customerengagement', 'asean', 'pakistan', 'india', 'bangladesh', 'amu', 'eac', 'comesa', 'au', 'africa', 'sadc', 'ethiopia', 'angola', 'asia', 'eu']",[],https://twitter.com/nootrlept/status/1092586580504530944,False,,0,,,,,,,,[],,,,
1091540718592626689,1091540718592626689,2019-02-02 03:36:01 UTC,2019-02-02,03:36:01,0,2739609063,bandu_49854,BANDU SHAMAMBA,,"RDC, qu’est ce qui expliquerait le coût trop élevé et exagéré de la communication (appels, sms, et internet) au pays contrairement à d’autres pays de la région (Uganda, Rwanda, Burundi, Tanzanie, Angola, etc). On a toujours dit le peuple d’abord, attendons voir alors...",fr,[],[],[],0,1,1,[],[],https://twitter.com/bandu_49854/status/1091540718592626689,False,,0,,,,,,,,[],,,,
1090315204657901569,1090312347036672000,2019-01-29 18:26:16 UTC,2019-01-29,18:26:16,0,1028181206192586752,muela84841619,Muela Humberto,,"@sindika_dokolo Quand vous avez colonisés Angola sans partage dans la domaine de communication les autres de Langa. Maintenant qu on vous réclame de ramener les capital pour construire le pays vous êtes devenus Langa,",fr,[],[],[],0,0,0,[],[],https://twitter.com/Muela84841619/status/1090315204657901569,False,,0,,,,,,,,"[{'screen_name': 'sindika_dokolo', 'name': 'Sindika Dokolo', 'id': '822374888459489286'}]",,,,
1089128231591206912,1089125671408943104,2019-01-26 11:49:40 UTC,2019-01-26,11:49:40,0,904783394051121153,sinfo_angola,Sinfo Angola,,@sotiridi Still bullying Multibilions companies? You are a monster!  Don't you understand that Journalists are used to the Good Old Times of one-way communication: Talk to a Camera and receive ZERO feedback,en,[],[],[],0,0,2,[],[],https://twitter.com/SINFO_ANGOLA/status/1089128231591206912,False,,0,,,,,,,,"[{'screen_name': 'sotiridi', 'name': 'Sotiri Dimpinoudis', 'id': '80571323'}]",,,,
1085880685670400001,1085880685670400001,2019-01-17 12:45:04 UTC,2019-01-17,12:45:04,0,73134627,freedom_academy,Freedom Academy,,"We had a GREAT turnout for our first Lunch &amp; Learn series in Angola yesterday on Effective Communication!  The next session is Weds, February 20th on the topic of Problem Solving. Call today to get on the list.  Lunch is provided!  https://t.co/IMcv2s6a7K",en,[],[],"['https://pbs.twimg.com/media/DxHSujkXcAMyUAz.jpg', 'https://pbs.twimg.com/media/DxHSuogU8AAvVvO.jpg']",0,0,1,[],[],https://twitter.com/Freedom_Academy/status/1085880685670400001,False,,1,https://pbs.twimg.com/media/DxHSujkXcAMyUAz.jpg,,,,,,,[],,,,
1081265943152594949,1081265943152594949,2019-01-04 19:07:44 UTC,2019-01-04,19:07:44,0,2427604446,ricksreturns,"Ladykay Radio Host,",,"ONE solution to Africa's problem is EFFECTIVE COMMUNICATION!  Africa,  Africa,  Angolians are concerned about their country's stability.  Angola President Joao Loureno wields iron-fist over governors and minsters firing.  https://t.co/FMZbefOwo9",en,[],['https://www.africanexponent.com/post/9610-angola-president-joo-loureno-wields-iron-fist-over-governors-and-minsters'],[],0,0,0,[],[],https://twitter.com/RicksReturns/status/1081265943152594949,False,,0,,,,,,,,[],,,,
1080753231163260928,1080753231163260928,2019-01-03 09:10:24 UTC,2019-01-03,09:10:24,0,703490188,iambakabu,UG patriot,,"understanding the Chinese loans to Uganda and Africa at large, is it evil 😈 or virtous??? Is this ""Angola model "" sustainable in the long run??   In response to the president's communication where he accused...  https://t.co/SxTeG6dpDC",en,[],['https://www.facebook.com/100005692961438/posts/1037701986429557/'],[],1,1,2,[],[],https://twitter.com/iambakabu/status/1080753231163260928,False,,0,,,,,,,,[],,,,
1080520514085498882,1080520514085498882,2019-01-02 17:45:40 UTC,2019-01-02,17:45:40,0,601436155,carofux,Carole Fuchs_Athle,,The name of the women's winner of Luanda Sao Silvestre 10km was erroneously reported by Angola's press agency. She is Tigist Mamuye and not Beyanesh Ayele (confirmed by an official from her club).   Communication mishap between the organisers and local media?  https://t.co/vV0cvZNIYx,en,[],[],['https://pbs.twimg.com/media/Dv7HidIWwAERUIk.jpg'],0,0,3,[],[],https://twitter.com/carofux/status/1080520514085498882,False,,1,https://pbs.twimg.com/media/Dv7HidIWwAERUIk.jpg,,,,,,,[],,,,
1075809975291838466,1075809975291838466,2018-12-20 17:47:40 UTC,2018-12-20,17:47:40,0,720943717683765248,unicefangola,UNICEF Angola,,"The #Ebola outbreak in #DRC prompted Angola to implement preventive actions. This week, UNICEF supported Min. of Health in training 35 health directors and supervisors of central level and bordering provinces on risk #communication and community engagement. 📷: Rui Luís/UNICEF  https://t.co/8Okyh8IZXf",en,[],[],['https://pbs.twimg.com/media/Du4LA3KW0AALY1S.jpg'],0,0,1,"['ebola', 'drc', 'communication']",[],https://twitter.com/UNICEFAngola/status/1075809975291838466,False,,1,https://pbs.twimg.com/media/Du4LA3KW0AALY1S.jpg,,,,,,,[],,,,
1072830971903442944,1072830971903442944,2018-12-12 12:30:10 UTC,2018-12-12,12:30:10,0,20253024,chigrl,𝕮𝖍𝖎,,"#OPEC crude oil production direct communication v secondary sources: #Angola, #Iran, and most notably #Venezuela have some major discrepancies #oott  https://t.co/8CnvZmnmuT",en,[],[],['https://pbs.twimg.com/media/DuN2AouVsAA3zJB.jpg'],5,27,42,"['opec', 'angola', 'iran', 'venezuela', 'oott']",[],https://twitter.com/chigrl/status/1072830971903442944,False,,1,https://pbs.twimg.com/media/DuN2AouVsAA3zJB.jpg,,,,,,,[],,,,
1071434672427728897,1071434672427728897,2018-12-08 16:01:46 UTC,2018-12-08,16:01:46,0,855396271644954624,franceangola,france angola,,"ANGOLA : Le ministre de la Communication sociale, João Melo, traite les militants reçus par João Lourenço PR,.. de « anti-gouvernement »  https://t.co/0Nk2lc3u9S",ca,[],['http://sosdictature.com/angola-le-ministre-de-la-communication-sociale-joao-melo-traite-les-militants-recus-par-joao-lourenco-pr-de-anti-gouvernement-ministro-trata-ativistas-recebidos-pelo-pr-de-anti-governamentais'],[],0,0,0,[],[],https://twitter.com/franceangola/status/1071434672427728897,False,,0,,,,,,,,[],,,,
1070972232728494085,1070972232728494085,2018-12-07 09:24:12 UTC,2018-12-07,09:24:12,0,125353290,danilojoventura,Danilo ventura,,"Last session to promote IATF in Angola. Invited: Minister of Commerce, Minister of Social Communication, Ambassador of Egypt, Secretary of the Commerce Sector, and sponsors of Pavilhao Angola.  https://t.co/R8ZWFYiBhJ",en,[],[],"['https://pbs.twimg.com/media/DtzbiTFXcAAe5GX.jpg', 'https://pbs.twimg.com/media/Dtzbi1LX4AA8FSC.jpg', 'https://pbs.twimg.com/media/DtzbjYGXgAAUZSw.jpg', 'https://pbs.twimg.com/media/Dtzbj09WkAAPPUr.jpg']",0,5,20,[],[],https://twitter.com/Danilojoventura/status/1070972232728494085,False,,1,https://pbs.twimg.com/media/DtzbiTFXcAAe5GX.jpg,,,,,,,[],,,,
1068086488313802752,1068086488313802752,2018-11-29 10:17:17 UTC,2018-11-29,10:17:17,0,497776729,airtelrdc,Airtel RDC,,Restez en contact avec vos proches se trouvant en Angola pendant 100 minutes de communication pour une recharge de 1000U.  Cool n'est-ce pas? Composez *600*1000# #AngolaBondia  https://t.co/zgBPFrFgZN,fr,[],[],['https://pbs.twimg.com/media/DtKa-DnWwAAD4as.jpg'],0,0,5,['angolabondia'],[],https://twitter.com/airtelrdc/status/1068086488313802752,False,,1,https://pbs.twimg.com/media/DtKa-DnWwAAD4as.jpg,,,,,,,[],,,,
1065305189794701313,1065305189794701313,2018-11-21 18:05:24 UTC,2018-11-21,18:05:24,0,262712411,xanvertex,⚡Vertex⚡,,So apparently ZUBA or ZARA came from Angola. But she understands Chewa and all other Zambian local languages. Communication is smooth but she can't speak. Kaya Che Bantu aba. The maid is speaking fluent Chewa and thr Angolan aint struggling. Okaayyy #Zuba,en,[],[],[],1,0,3,['zuba'],[],https://twitter.com/XanVertex/status/1065305189794701313,False,,0,,,,,,,,[],,,,
1064892987589705728,1064880309068533760,2018-11-20 14:47:27 UTC,2018-11-20,14:47:27,0,1064870295675244546,eiaudpic,EiaudPic,,@unam_na Okay I plan to do college of communication and information technology in Ongwediva. How do I apply for a job or study? because I'm in Angola and I do not know how to start ....,en,[],[],[],1,0,0,[],[],https://twitter.com/EiaudPic/status/1064892987589705728,False,,0,,,,,,,,"[{'screen_name': 'unam_na', 'name': '#MyUNAM', 'id': '376179981'}]",,,,
1063093958971154432,1063093958971154432,2018-11-15 15:38:45 UTC,2018-11-15,15:38:45,0,1005096853560537088,rahmatelevision,Rahma Television,,"Angola shuts 34 Churches. No fewer than 34 churches have been shut in Angola following an operation dubbed Operação Resgate (rescue operation), police confirmed. The national police director for communication, Mr Orlando Bernardo, said 19 churches were shut.  https://t.co/vGOg5996Ua",en,[],[],['https://pbs.twimg.com/media/DsDeTk0XcAEvTWW.jpg'],0,0,0,[],[],https://twitter.com/RahmaTelevision/status/1063093958971154432,False,,1,https://pbs.twimg.com/media/DsDeTk0XcAEvTWW.jpg,,,,,,,[],,,,
1063075307597561856,1063075307597561856,2018-11-15 14:24:38 UTC,2018-11-15,14:24:38,0,468469644,newsacrosafrica,News Across Africa,,"No fewer than 34 churches have been shut in Angola following an operation dubbed Operação Resgate (rescue operation), police confirmed. The national police director for communication, Mr Orlando...  https://t.co/daFLddZ3bp",en,[],['http://misspetitenaijablog.com/2018/11/15/angola-shuts-down-34-churches/'],[],0,0,0,[],[],https://twitter.com/NewsAcrosAfrica/status/1063075307597561856,False,,0,,,,,,,,[],,,,
1060998474597044224,1060998474597044224,2018-11-09 20:52:03 UTC,2018-11-09,20:52:03,0,876080419,rsq_solutions,The Sullivan Group,,"Case: Lessons from Angola in Medical Errors, Communication, Teamwork and End of Life. #medicalerror  https://t.co/IE84eqO0eq",en,[],['https://hubs.ly/H0ftyS00'],[],0,0,0,['medicalerror'],[],https://twitter.com/RSQ_Solutions/status/1060998474597044224,False,,0,,,,,,,,[],,,,
1057912363238744065,1057912363238744065,2018-11-01 08:28:57 UTC,2018-11-01,08:28:57,0,968788335207632896,icrc_safrica,ICRC Southern Africa,,"Our Communication Manager, @tendayi_sengwe, spoke to @TsepisoMakwetla about the situation of 50,000 people trapped at the border in #Kasai, #DRCongo after being expelled from #Angola",en,"[{'screen_name': 'tendayi_sengwe', 'name': 'tendayi sengwe', 'id': '1515471487'}, {'screen_name': 'tsepisomakwetla', 'name': 'tsepiso makwetla', 'id': '2762340050'}]",[],[],0,4,6,"['kasai', 'drcongo', 'angola']",[],https://twitter.com/ICRC_SAfrica/status/1057912363238744065,False,https://twitter.com/FirstTakeSA/status/1057893525742931968,0,,,,,,,,[],,,,
1057834308801646592,1057833290999193605,2018-11-01 03:18:47 UTC,2018-11-01,03:18:47,0,44593489,firsttakesa,First Take SA #FirstTakeSA 📻,,"[ON AIR] Tendayi Sengwe, Communication Manager for Southern Africa at the International Committee of the Red Cross (ICRC): They were asked to leave Angola by the government #FirstTakeSA #sabcnews",en,[],[],[],1,2,0,"['firsttakesa', 'sabcnews']",[],https://twitter.com/FirstTakeSA/status/1057834308801646592,False,,0,,,,,,,,[],,,,
1056890112519352320,1056882955249946624,2018-10-29 12:46:53 UTC,2018-10-29,12:46:53,0,991885410019233792,achprreport,Africa Human Rights Report,,"In 2017,  the government of Angola enacted a socio communication package which consists of press law, television laws and code of conduct for journalists. In this law, the ministry of social engagement is to be the editor of journalistic outputs, the law also criminalise",en,[],[],[],1,0,0,[],[],https://twitter.com/ACHPRreport/status/1056890112519352320,False,,0,,,,,,,,[],,,,
1056884454185201664,1056884454185201664,2018-10-29 12:24:24 UTC,2018-10-29,12:24:24,0,1047878305544908801,africa_nostalgi,Africa 2015 Nostalgie,,"Au menu d'#Africa2015 ce lundi:  -Comme invité l'ancien ministre de la Communication Alhousseine Makanera Kake,  -Des guineens d'Angola persécutés et menacés d'expulsion,  -Journée ville morte opposition,  -Crise dans l'éducation,  -Tournée du PM @IbrahimaKFofana en basse côte...  https://t.co/C69b116sgd",fr,"[{'screen_name': 'ibrahimakfofana', 'name': 'i. kassory fofana', 'id': '907290305338146816'}]",[],['https://pbs.twimg.com/media/DqrOzAXWsAAQ8bF.jpg'],2,4,18,['africa2015'],[],https://twitter.com/africa_nostalgi/status/1056884454185201664,False,,1,https://pbs.twimg.com/media/DqrOzAXWsAAQ8bF.jpg,,,,,,,[],,,,
1055796221447729152,1055781431312609283,2018-10-26 12:20:09 UTC,2018-10-26,12:20:09,0,841397938144346113,mawanokambeu,Mawano Kambeu,,"@lukonga The US State Department got it for me as they were holding a conference there. But prior to that I was starting the process of communicating with their consulate in Angola, which was a frustrating process as info and communication was not forthcoming",en,[],[],[],1,0,0,[],[],https://twitter.com/MawanoKambeu/status/1055796221447729152,False,,0,,,,,,,,"[{'screen_name': 'lukonga', 'name': 'Lukonga Lindunda', 'id': '46335364'}]",,,,
1052558546548731905,1052558546548731905,2018-10-17 13:54:47 UTC,2018-10-17,13:54:47,0,700429603538628609,stanysbujakera,Stanis Bujakera Tshiamala,,"#RDC: Dans quelques minutes, Conférence de presse du VPM Leonard She Okitundu. Les relations entre la RDC et l'Angola après les expulsions point principal de la communication  https://t.co/Jn78AMP33L",fr,[],[],"['https://pbs.twimg.com/media/DptwRRwW0AA94rN.jpg', 'https://pbs.twimg.com/media/DptwV0CW0AAOnBI.jpg']",0,3,5,['rdc'],[],https://twitter.com/StanysBujakera/status/1052558546548731905,False,,1,https://pbs.twimg.com/media/DptwRRwW0AA94rN.jpg,,,,,,,[],,,,
1047838752469528577,1047838752469528577,2018-10-04 13:20:01 UTC,2018-10-04,13:20:01,0,615034666,infoans_en,SalesianiNfoAgency,,Angola - Meeting of Delegates for Social Communication of Africa-Madagascar  https://t.co/gZwn2otZ9c  https://t.co/g6nPsrVs1X,en,[],['http://www.infoans.org/en/sections/news-photos/item/6462-angola-meeting-of-delegates-for-social-communication-of-africa-madagascar'],['https://pbs.twimg.com/media/Doqi6sGW0AAg86h.jpg'],0,0,0,[],[],https://twitter.com/infoANS_EN/status/1047838752469528577,False,,1,https://pbs.twimg.com/media/Doqi6sGW0AAg86h.jpg,,,,,,,[],,,,
1047838749130780672,1047838749130780672,2018-10-04 13:20:00 UTC,2018-10-04,13:20:00,0,615041050,infoans_fr,AgenceiNfoSalésienne,,Angola - Rencontre des Délégués pour la Communication Sociale de l'Afrique-Madagascar  https://t.co/HUnv5rcCZe  https://t.co/IKONt4PRNd,fr,[],['http://www.infoans.org/fr/sections/photos-nouvelles/item/6462-angola-rencontre-des-delegues-pour-la-communication-sociale-de-l-afrique-madagascar'],['https://pbs.twimg.com/media/DoqjTWyWwAEAduK.jpg'],0,0,0,[],[],https://twitter.com/infoANS_FR/status/1047838749130780672,False,,1,https://pbs.twimg.com/media/DoqjTWyWwAEAduK.jpg,,,,,,,[],,,,
