id,conversation_id,created_at,date,time,timezone,user_id,username,name,place,tweet,language,mentions,urls,photos,replies_count,retweets_count,likes_count,hashtags,cashtags,link,retweet,quote_url,video,thumbnail,near,geo,source,user_rt_id,user_rt,retweet_id,reply_to,retweet_date,translate,trans_src,trans_dest
1341056383236661248,1341056383236661248,2020-12-21 16:22:12 UTC,2020-12-21,16:22:12,0,847081690552041474,silnigeria,SIL Nigeria,,"#RT @SILintl: The #LanguageoftheDay in @theEthnologue is #Cokwe  Key Facts: 1. Spoken in #Angola    2. Population: 1,970,000 3. Status: Language of Wider Communication  Need language data? Purchase here:  https://t.co/MxLHaB5M0r  #LanugageMatters",en,"[{'screen_name': 'silintl', 'name': 'sil international', 'id': '3064641490'}, {'screen_name': 'theethnologue', 'name': 'ethnologue', 'id': '3103609528'}]",['http://bit.ly/2IOWLZz'],[],0,0,0,"['rt', 'languageoftheday', 'cokwe', 'angola', 'lanugagematters']",[],https://twitter.com/SILNigeria/status/1341056383236661248,False,,0,,,,,,,,[],,,,
1341049883961147394,1341049883961147394,2020-12-21 15:56:22 UTC,2020-12-21,15:56:22,0,3064641490,silintl,SIL International,,"The #LanguageoftheDay in @theEthnologue is #Cokwe  Key Facts: 1. Spoken in #Angola    2. Population: 1,970,000 3. Status: Language of Wider Communication  Need language data? Purchase here:  https://t.co/MT6o6BUfRz  #LanugageMatters",en,"[{'screen_name': 'theethnologue', 'name': 'ethnologue', 'id': '3103609528'}]",['http://bit.ly/2IOWLZz'],[],0,1,1,"['languageoftheday', 'cokwe', 'angola', 'lanugagematters']",[],https://twitter.com/SILintl/status/1341049883961147394,False,,0,,,,,,,,[],,,,
1339974185595105280,1339974185595105280,2020-12-18 16:41:56 UTC,2020-12-18,16:41:56,0,1193947351020441605,rahuljain7783,श्री भगवान ऊवाच,,श्री भगवान ऊवाच 🪔: The Hari Act an Act of Communication Transmission of the Planet 🌎 emerges from Manual T to Auto T to form the Divine Roop of Hari for Jan Kalyaan to Maha Raas to Hari संस्कार — a Keval gyāna to (@UN + @UN_Women) India 🇮🇳 🌎+ Angola 🇦🇴 = Hari वंदन 🙏,und,"[{'screen_name': 'un', 'name': 'united nations', 'id': '14159148'}, {'screen_name': 'un_women', 'name': 'un women', 'id': '17137628'}]",[],[],0,0,0,[],[],https://twitter.com/rahuljain7783/status/1339974185595105280,False,https://twitter.com/rahuljain7783/status/1339954040696913921,0,,,,,,,,[],,,,
1338001796967636992,1337996263359475714,2020-12-13 06:04:21 UTC,2020-12-13,06:04:21,0,804779614014963712,pedroquinda,Pedroquinda,,"@StanysBujakera Je me demande pourquoi la communication en RDC est incontrôlée? A elle même est un pouvoir, une Richesse, un pilliet pour le redressement du pays; l’exp avec USA d’où é sorti le mot fake new, avc l’Angola Isabel est devenu 1re fm milliardaire; q bénéficie du vodacom? Peup ou pas?",fr,[],[],[],0,0,0,[],[],https://twitter.com/pedroquinda/status/1338001796967636992,False,,0,,,,,,,,"[{'screen_name': 'StanysBujakera', 'name': 'Stanis Bujakera Tshiamala', 'id': '700429603538628609'}]",,,,
1331193927442042880,1331175362705973249,2020-11-24 11:12:19 UTC,2020-11-24,11:12:19,0,230404873,kelz360,Ngoma 🇿🇲,,@mwiyas @monicamusonda @Muvitv_online I was equally shocked and damn founded when Hon .S. Musokotwane reviewed on the interview.  Some of the borrowed funds could easily have been used in creating communication channels (Roads) between Zambia &amp; Angola to bolster trade.,en,[],[],[],1,0,2,[],[],https://twitter.com/kelz360/status/1331193927442042880,False,,0,,,,,,,,"[{'screen_name': 'mwiyas', 'name': 'Mwiya', 'id': '229105162'}, {'screen_name': 'monicamusonda', 'name': 'Monica Musonda', 'id': '1257560250'}, {'screen_name': 'Muvitv_online', 'name': 'Muvi TV', 'id': '748439770624307200'}]",,,,
1329461778250670084,1329460930879610895,2020-11-19 16:29:22 UTC,2020-11-19,16:29:22,0,766903142109683712,alfredtumba,alfred TUMBA KASEMWANA,,"@wembi_steve Sa craint,  une communication codé connaissant que kabila était aller demander un appui militaire en Angola. Que Dieu nous vienne en aide.",fr,[],[],[],1,0,1,[],[],https://twitter.com/AlfredTumba/status/1329461778250670084,False,,0,,,,,,,,"[{'screen_name': 'wembi_steve', 'name': 'Steve Wembi', 'id': '2407163681'}]",,,,
1329459598227615749,1329459598227615749,2020-11-19 16:20:43 UTC,2020-11-19,16:20:43,0,2714207655,pascal_mulegwa,Pascal Mulegwa,,"De retour à l’Etat - major Général des forces armées de la République démocratique du Congo (#FARDC) pour une « importante communication ». Le porte-parole militaire aborde la coopération militaire entre le pays et la France, les États - Unis et l’Angola.  https://t.co/5jsRJ6fiOt",fr,[],[],['https://pbs.twimg.com/media/EnMwc1FXcA08-dC.jpg'],2,2,35,['fardc'],[],https://twitter.com/pascal_mulegwa/status/1329459598227615749,False,,1,https://pbs.twimg.com/media/EnMwc1FXcA08-dC.jpg,,,,,,,[],,,,
1327320674470400000,1327320674470400000,2020-11-13 18:41:23 UTC,2020-11-13,18:41:23,0,956873045595033601,mtobo26,Michel TOBO,,#RDC Christian Luyindama s'est gravement blessé à l'entrainement de ce vendredi. Il sera probablement absent pour les deux rencontres face à l'Angola. La nouvelle a été annoncée par la direction de la communication de la Fecofa.  https://t.co/dC0YXnNEiY  https://t.co/qobfJq15ht,fr,[],[],"['https://pbs.twimg.com/media/EmuXHhGXEAEIXdL.jpg', 'https://pbs.twimg.com/media/EmuWE0YW4AEpkyN.jpg']",0,0,0,['rdc'],[],https://twitter.com/mtobo26/status/1327320674470400000,False,,1,https://pbs.twimg.com/media/EmuXHhGXEAEIXdL.jpg,,,,,,,[],,,,
1327319528225853440,1327319528225853440,2020-11-13 18:36:50 UTC,2020-11-13,18:36:50,0,818081599094980608,footcd,FOOT.CD,,#RDC Christian Luyindama s'est gravement blessé à l'entrainement de ce vendredi. Il sera probablement absent pour les deux rencontres face à l'Angola. La nouvelle a été annoncée par la direction de la communication de la Fecofa.  https://t.co/ob2C0EQsFo,fr,[],[],['https://pbs.twimg.com/media/EmuWE0YW4AEpkyN.jpg'],2,5,13,['rdc'],[],https://twitter.com/footcd/status/1327319528225853440,False,,1,https://pbs.twimg.com/media/EmuWE0YW4AEpkyN.jpg,,,,,,,[],,,,
1321364224258543616,1321364224258543616,2020-10-28 08:12:35 UTC,2020-10-28,08:12:35,0,998553011508203521,khusoko,Khusoko,,".@ericsson's 2020 Graduate Programme to Focus on Kenya, Nigeria, Sudan, and Angola. The program is designed to accelerate the training of young talents and innovators in Information and Communication Technologies (ICT).  https://t.co/qGaK4g0Clb",en,"[{'screen_name': 'ericsson', 'name': 'ericsson', 'id': '19017255'}]",['https://khusoko.com/2020/10/28/ericssons-2020-graduate-programme-to-focus-on-four-african-countries/'],[],0,0,1,[],[],https://twitter.com/khusoko/status/1321364224258543616,False,,0,,,,,,,,[],,,,
1321033770363985921,1321033770363985921,2020-10-27 10:19:29 UTC,2020-10-27,10:19:29,0,847824447658749954,adpp_angola,ADPP Angola,,"Activists of the #Covid19 Risk Communication and Community Engagement project in Uíge, funded by @omsAngola, are distributing leaflets and pamphlets with key messages in schools, on the streets, in markets and stores. #StayHome #Angola #EstamosJuntos  https://t.co/TKm1E5ryTO",en,"[{'screen_name': 'omsangola', 'name': 'república de angola', 'id': '1159508718133960704'}]",[],"['https://pbs.twimg.com/media/ElVAwJBWoAAdtyl.jpg', 'https://pbs.twimg.com/media/ElVAwKSXgAA7OkR.jpg']",1,0,1,"['covid19', 'stayhome', 'angola', 'estamosjuntos']",[],https://twitter.com/ADPP_Angola/status/1321033770363985921,False,,1,https://pbs.twimg.com/media/ElVAwJBWoAAdtyl.jpg,,,,,,,[],,,,
1321030898381475840,1321030898381475840,2020-10-27 10:08:04 UTC,2020-10-27,10:08:04,0,847824447658749954,adpp_angola,ADPP Angola,,"Activists from the #Covid-19 Risk Communication and Community Engagement project in Uíge, funded by @omsAngola, carried out an awareness campaign in the market to reach sellers with information about the prevention of Covid-19. #StayHome #Angola #EstamosJuntos  https://t.co/hJOXhKGGX2",en,"[{'screen_name': 'omsangola', 'name': 'república de angola', 'id': '1159508718133960704'}]",[],"['https://pbs.twimg.com/media/ElU9lyLXYAEv-IR.jpg', 'https://pbs.twimg.com/media/ElU9lykXUAE7Vhi.jpg']",1,0,6,"['covid', 'stayhome', 'angola', 'estamosjuntos']",[],https://twitter.com/ADPP_Angola/status/1321030898381475840,False,,1,https://pbs.twimg.com/media/ElU9lyLXYAEv-IR.jpg,,,,,,,[],,,,
1321029074421207040,1321029074421207040,2020-10-27 10:00:49 UTC,2020-10-27,10:00:49,0,847824447658749954,adpp_angola,ADPP Angola,,"Lobito’s Municipal Councillor together with activists performing a piece of theatre to correct misinformation about #Covid19, as part of the Risk Communication and Community Engagement project funded by @omsAngola #StayHome #Angola #EstamosJuntos  https://t.co/BCM6Rm3NzZ",en,"[{'screen_name': 'omsangola', 'name': 'república de angola', 'id': '1159508718133960704'}]",[],"['https://pbs.twimg.com/media/ElU7Z48XEAIi4oO.jpg', 'https://pbs.twimg.com/media/ElU7Z5SW0AAhflR.jpg']",1,0,1,"['covid19', 'stayhome', 'angola', 'estamosjuntos']",[],https://twitter.com/ADPP_Angola/status/1321029074421207040,False,,1,https://pbs.twimg.com/media/ElU7Z48XEAIi4oO.jpg,,,,,,,[],,,,
1319561459395973121,1319561448083869696,2020-10-23 08:49:02 UTC,2020-10-23,08:49:02,0,902011866091855873,incunabula,Incunabula,,"The compiler Fr. Bernardo Maria de Cannecattim, an Italian Capuchin missionary from Palermo, was prefect of the missions to Angola and the Congo. His preface notes the necessity of communication in Mbunda for advancing the Roman Catholic faith amongst the Angolan people.   2/2  https://t.co/cqYrF4F4rf",en,[],[],"['https://pbs.twimg.com/media/ElAForTX0AAMEP4.jpg', 'https://pbs.twimg.com/media/ElAForMWkAEDmWZ.jpg', 'https://pbs.twimg.com/media/ElAForLXEAAk1z1.jpg']",0,2,22,[],[],https://twitter.com/incunabula/status/1319561459395973121,False,,1,https://pbs.twimg.com/media/ElAForTX0AAMEP4.jpg,,,,,,,[],,,,
1316352410965676034,1305140621619978240,2020-10-14 12:17:26 UTC,2020-10-14,12:17:26,0,1302947425615831041,madalenapascoa9,Madalena Pascoal,,"@SCOANTBJoshua Good morning ,l work in the communication in Angola ,There are many  injustiças vc, My salary was 199.000.00 kuanzas ,reducede to  167.000.00 kuanzas . Jesus Cristo tothe legality. Thank you  Jesus.",en,[],[],[],1,0,0,[],[],https://twitter.com/MadalenaPascoa9/status/1316352410965676034,False,,0,,,,,,,,"[{'screen_name': 'SCOANTBJoshua', 'name': 'TB Joshua', 'id': '450831164'}]",,,,
1316007984649113608,1316007984649113608,2020-10-13 13:28:48 UTC,2020-10-13,13:28:48,0,818081599094980608,footcd,FOOT.CD,,"#RDC «Nous espérons prendre une victoire face au Maroc. Nous ferons tout pour gagner afin de bien préparer la double confrontation face à l’Angola», a déclaré Jordan Nkololo, le milieu offensif du Fc Riga (D1 Lettonie), à la direction de la Communication de la Fecofa.  https://t.co/Fmdxugly0r",fr,[],[],['https://pbs.twimg.com/media/EkNmRehX0AAwXBJ.jpg'],0,0,3,['rdc'],[],https://twitter.com/footcd/status/1316007984649113608,False,,1,https://pbs.twimg.com/media/EkNmRehX0AAwXBJ.jpg,,,,,,,[],,,,
1316007859851792384,1316007859851792384,2020-10-13 13:28:18 UTC,2020-10-13,13:28:18,0,956873045595033601,mtobo26,Michel TOBO,,"#RDC «Nous espérons prendre une victoire face au Maroc. Nous ferons tout pour gagner afin de bien préparer la double confrontation face à l’Angola», a déclaré Jordan Nkololo, le milieu offensif du Fc Riga (D1 Lettonie), à la direction de la Communication de la Fecofa.  https://t.co/qzXuODdJl0",fr,[],[],['https://pbs.twimg.com/media/EkNmGHCUYAMiBKn.jpg'],0,0,0,['rdc'],[],https://twitter.com/mtobo26/status/1316007859851792384,False,,1,https://pbs.twimg.com/media/EkNmGHCUYAMiBKn.jpg,,,,,,,[],,,,
1315999452495261696,1315999452495261696,2020-10-13 12:54:54 UTC,2020-10-13,12:54:54,0,818081599094980608,footcd,FOOT.CD,,"#RDC «On joue contre le Maroc en vue de la double confrontation face à l’Angola en novembre. Nous prendrons étape par étape. On est concentré d’abord pour ce match et on verra» Timothy Fayulu, le portier du FC Sion (D1 Suisse) à la direction de la Communication de la Fecofa.  https://t.co/tMdiKkNVm5",fr,[],[],['https://pbs.twimg.com/media/EkNehF8XcAUD-La.jpg'],0,0,2,['rdc'],[],https://twitter.com/footcd/status/1315999452495261696,False,,1,https://pbs.twimg.com/media/EkNehF8XcAUD-La.jpg,,,,,,,[],,,,
1315999351085371395,1315999351085371395,2020-10-13 12:54:30 UTC,2020-10-13,12:54:30,0,956873045595033601,mtobo26,Michel TOBO,,"#RDC «On joue contre le Maroc en vue de la double confrontation face à l’Angola en novembre. Nous prendrons étape par étape. On est concentré d’abord pour ce match et on verra» Timothy Fayulu, le portier du FC Sion (D1 Suisse) à la direction de la Communication de la Fecofa.  https://t.co/XyOsrRbfq3",fr,[],[],['https://pbs.twimg.com/media/EkNebDHXYAAx2af.jpg'],0,0,0,['rdc'],[],https://twitter.com/mtobo26/status/1315999351085371395,False,,1,https://pbs.twimg.com/media/EkNebDHXYAAx2af.jpg,,,,,,,[],,,,
1315377838665674752,1315368463393714176,2020-10-11 19:44:49 UTC,2020-10-11,19:44:49,0,1912689432,wellgas2,Gasamagera Wellars,,"@amb_tete Luther Rescova was an inspirational, dedicated and compassionate patriot. His contagious laughter eased communication and his exemplary character made of him an exceptional young leader. An immense loss fr Angola nd indeed for Africa. We grieve with you @amb_tete @RwandainAngola",en,"[{'screen_name': 'amb_tete', 'name': 'amb tete antonio', 'id': '807362807574446080'}, {'screen_name': 'rwandainangola', 'name': 'rwanda in angola', 'id': '4523353701'}]",[],[],0,2,4,[],[],https://twitter.com/wellgas2/status/1315377838665674752,False,,0,,,,,,,,"[{'screen_name': 'amb_tete', 'name': 'Amb Tete Antonio', 'id': '807362807574446080'}]",,,,
1311219481046388736,1311219481046388736,2020-09-30 08:21:00 UTC,2020-09-30,08:21:00,0,21303464,alykhansatchu,Aly-Khan Satchu,,"#China #Angola debt moratorium 'To my knowledge, relevant Chinese financial institutions have been in close communication with the Angolan side on relieving debt pressure, with major progress in discussions.'    https://t.co/M2Al5nHNNz  China Africa Win Win  https://t.co/cWvrcKEvhV",en,[],"['https://twitter.com/Markbohlund/status/1310854705099288577?s=20', 'https://bit.ly/3cAbUKP']",[],0,0,1,"['china', 'angola']",[],https://twitter.com/alykhansatchu/status/1311219481046388736,False,https://twitter.com/Markbohlund/status/1310854705099288577?s=20,0,,,,,,,,[],,,,
1311053205422452736,1311053205422452736,2020-09-29 21:20:17 UTC,2020-09-29,21:20:17,0,1147871399702343680,nyandeng17,Nyandeng A Garang🇸🇸🇰🇪🇨🇦#KenyiAnti-Corruption,,"#JobAlert UN Young Professionals exam: Global Communication, 31Oct 2020 Eligibility-Born on/after 1 Jan '88, 1st level degree. Nationalities e.g. Angola, Brazil, China, Congo, Gabon, Gambia, Lesotho, Liberia, Mozambique, Namibia, South Sudan, Sudan! #SSOT🇸🇸 https://t.co/LxgqJhjYxO",en,[],['https://careers.un.org/lbw/jobdetail.aspx?id=138706'],[],5,8,40,"['jobalert', 'ssot']",[],https://twitter.com/Nyandeng17/status/1311053205422452736,False,,0,,,,,,,,[],,,,
1311001975169916930,1311001975169916930,2020-09-29 17:56:42 UTC,2020-09-29,17:56:42,0,321691813,skatuu,Dr Shad Katuu 🌐,,"UN Young Professionals exam: Global Communication, 31 Oct 2020 Eligibility - Born on/after 1 Jan '88, 1st level degree. Nationalities incl. Angola, Brazil, China, Congo, Gabon, Gambia, Lesotho, Liberia, Mozambique, Namibia, South Sudan, Sudan et al  https://t.co/ltSLnQECc2",en,[],['https://careers.un.org/lbw/jobdetail.aspx?id=138706'],[],1,18,21,[],[],https://twitter.com/skatuu/status/1311001975169916930,False,,0,,,,,,,,[],,,,
1310854705099288577,1310854705099288577,2020-09-29 08:11:30 UTC,2020-09-29,08:11:30,0,3965329636,markbohlund,Mark Bohlund,,"#China says talks with #Angola on debt moratorium still ongoing. 'To my knowledge, relevant Chinese financial institutions have been in close communication with the Angolan side on relieving debt pressure, with major progress in discussions.'    https://t.co/0CSSJPCOQH",en,[],['https://www.fmprc.gov.cn/mfa_eng/xwfw_665399/s2510_665401/2511_665403/t1819548.shtml'],[],1,6,8,"['china', 'angola']",[],https://twitter.com/Markbohlund/status/1310854705099288577,False,,0,,,,,,,,[],,,,
1310760748339978240,1310760748339978240,2020-09-29 01:58:09 UTC,2020-09-29,01:58:09,0,587955457,shen_shiwei,Shen Shiwei沈诗伟,,"#Debt issues talked in #China #Angola leaders' recent phone call. 🇨🇳🇦🇴 1⃣️Relevant Chinese financial institutions in close communication with Angola on relieving debt pressure, with major progress in discussions.  https://t.co/YdSuB8YO3s",en,[],[],['https://pbs.twimg.com/media/EjDBiwNVoAEK6lG.jpg'],4,6,29,"['debt', 'china', 'angola']",[],https://twitter.com/shen_shiwei/status/1310760748339978240,False,,1,https://pbs.twimg.com/media/EjDBiwNVoAEK6lG.jpg,,,,,,,[],,,,
1306218134588788737,1306218134588788737,2020-09-16 13:07:26 UTC,2020-09-16,13:07:26,0,1083709762087407616,lpmconsulting_,LPM Consulting Group,,LPM Consulting Group est ravi d'accueillir BESOKE BONDELE Christelle au sein de son équipe en qualité  de responsable Marketing et Communication de nos filiales RDC et Angola.  #LPMConsultingGroup #Work  https://t.co/Ykwe4hoZds,fr,[],[],['https://pbs.twimg.com/media/EiCedgmWkAAgOiu.jpg'],0,3,6,"['lpmconsultinggroup', 'work']",[],https://twitter.com/LpmConsulting_/status/1306218134588788737,False,,1,https://pbs.twimg.com/media/EiCedgmWkAAgOiu.jpg,,,,,,,[],,,,
1306210301331877890,1306210301331877890,2020-09-16 12:36:18 UTC,2020-09-16,12:36:18,0,1083709762087407616,lpmconsulting_,LPM Consulting Group,,LPM Consulting Group is delighted to welcome Besoke Bondele Christelle to its team as Marketing and Communication Manager of our DRC and Angola subsidiaries.  #LPMconsultinggroup #work  https://t.co/nZ1VhFLTwg,en,[],[],['https://pbs.twimg.com/media/EiCXVgPWsAMKfYP.jpg'],0,2,4,"['lpmconsultinggroup', 'work']",[],https://twitter.com/LpmConsulting_/status/1306210301331877890,False,,1,https://pbs.twimg.com/media/EiCXVgPWsAMKfYP.jpg,,,,,,,[],,,,
1306206690631659521,1306206690631659521,2020-09-16 12:21:57 UTC,2020-09-16,12:21:57,0,1242753402502774789,luc_prosper,luc prosper moni,,Notre Nouvelle recrue au poste de Marketing and communication Manager pour la RDC et l’Angola @LpmConsulting_ Merci pour votre confiance  https://t.co/rZEAO2dw1B,fr,"[{'screen_name': 'lpmconsulting_', 'name': 'lpm consulting group', 'id': '1083709762087407616'}]",[],"['https://pbs.twimg.com/media/EiCUDZmWAAAAcZa.jpg', 'https://pbs.twimg.com/media/EiCUDZpWoAEVPN8.jpg']",0,1,4,[],[],https://twitter.com/Luc_prosper/status/1306206690631659521,False,,1,https://pbs.twimg.com/media/EiCUDZmWAAAAcZa.jpg,,,,,,,[],,,,
1305623676214272005,1305623676214272005,2020-09-14 21:45:16 UTC,2020-09-14,21:45:16,0,2655417158,wfaccmr,#WfacAt11,,Brief introdx:Participants of the virtual advocacy Training on #GenerationEquality #notregenerationegalite!   2. #Lunga_Izata Country: #Angola 🇦🇴 @LungaNoelia is a media &amp; communication professional w/ +3 years of progressive working experience in the Angolan Comms industry...1/2  https://t.co/5A64DyS9LQ,en,"[{'screen_name': 'lunganoelia', 'name': 'lunga noélia izata', 'id': '551744833'}]",[],['https://pbs.twimg.com/media/Eh6B0EbWAAAbTGK.jpg'],1,0,3,"['generationequality', 'notregenerationegalite', 'lunga_izata', 'angola']",[],https://twitter.com/WfacCmr/status/1305623676214272005,False,,1,https://pbs.twimg.com/media/Eh6B0EbWAAAbTGK.jpg,,,,,,,[],,,,
1304343596724781057,1304343596724781057,2020-09-11 08:58:41 UTC,2020-09-11,08:58:41,0,1257643115843903489,abdulazeezige,Grim Ripper😈,,"Sept9, Angola signed a MoU with Huawei to improve the country's higher education sector. It is focused on improving teaching&amp;learning process of teachers &amp; on empowering educational institutions to have training service in information &amp;communication technology sector. #chinacares  https://t.co/YaUDuQw7U1",en,[],[],['https://pbs.twimg.com/media/Ehn1lZWXkAAD5Wl.jpg'],0,0,0,['chinacares'],[],https://twitter.com/AbdulazeezIge/status/1304343596724781057,False,,1,https://pbs.twimg.com/media/Ehn1lZWXkAAD5Wl.jpg,,,,,,,[],,,,
1304316185627033601,1304316185627033601,2020-09-11 07:09:46 UTC,2020-09-11,07:09:46,0,803605730309926912,kicshb,Hakics,,"On Sept 9, Angola signed a MoU with Huawei to improve the country's higher education sector. It is focused on improving teaching&amp;learning process of teachers, and on empowering educational institutions to have training service in information and communication technology sector.  https://t.co/vvRzQBBi06",en,[],[],['https://pbs.twimg.com/media/EhncqEgWoAMcC-s.jpg'],0,0,0,[],[],https://twitter.com/KicsHB/status/1304316185627033601,False,,1,https://pbs.twimg.com/media/EhncqEgWoAMcC-s.jpg,,,,,,,[],,,,
1304264654030594049,1304264654030594049,2020-09-11 03:45:00 UTC,2020-09-11,03:45:00,0,1211892441529241601,ce_chinaeconomy,China Economy,,"On Sept 9, Angola signed a MoU with Huawei to improve the country's higher education sector. It is focused on improving teaching&amp;learning process of teachers, and on empowering educational institutions to have training service in information and communication technology sector.  https://t.co/ZWiaN8rfrH",en,[],[],['https://pbs.twimg.com/media/EhmQg10UcAA2rLZ.jpg'],0,2,1,[],[],https://twitter.com/CE_ChinaEconomy/status/1304264654030594049,False,,1,https://pbs.twimg.com/media/EhmQg10UcAA2rLZ.jpg,,,,,,,[],,,,
1303349978987855873,1303349978987855873,2020-09-08 15:10:24 UTC,2020-09-08,15:10:24,0,112337572,usui1965,Yoichiro Usui,,EU updated Angola on the proposals put forward in its Joint Communication “Towards a Comprehensive Strategy with Africa”.  https://t.co/LBoJLuIumX,en,[],['https://eeas.europa.eu/headquarters/headquarters-homepage/84859/joint-way-forward-5th-angola-eu-ministerial-meeting_en'],[],0,0,0,[],[],https://twitter.com/usui1965/status/1303349978987855873,False,,0,,,,,,,,[],,,,
1302872342360731648,1302871191967932417,2020-09-07 07:32:27 UTC,2020-09-07,07:32:27,0,1205162564252053506,littlebigideass,Little Big Ideas,,"He was corporate communication and Liaison Manager 4 KPMG in South Africa, Zimbabwe, Namibia, Zambia, Swaziland &amp; operated as the technical communication gatekeeper for the firm’s offices in the countries listed above as well as in Rwanda, Ghana, Nigeria, Angola, Egypt &amp; Lesotho",en,[],[],[],1,0,0,[],[],https://twitter.com/littlebigideass/status/1302872342360731648,False,,0,,,,,,,,[],,,,
1300824159849676800,1300824159849676800,2020-09-01 15:53:42 UTC,2020-09-01,15:53:42,0,117433286,adschina,Adam Segal,,"Huawei to complete technology park in Angola by end of 2021  https://t.co/fVDCmKaEX3  Last week, Huawei signed MOU with the Angolan Ministry of Foreign Affairs about talent training in information and communication technologies",en,[],['http://global.chinadaily.com.cn/a/202008/28/WS5f4896d0a310675eafc56259.html'],[],1,7,5,[],[],https://twitter.com/adschina/status/1300824159849676800,False,,0,,,,,,,,[],,,,
1298129804777070592,1297878702332706818,2020-08-25 05:27:18 UTC,2020-08-25,05:27:18,0,55525953,pinboard,Pinboard,,"@Angola_Maldives @thegrugq @mattyglesias @zeynep Sociology is ""all of human behavior"" so it's kind of a wash. But micro-targeting is in an important way the *opposite* of mass communication (which, incidentally, is an argument I never heard anyone make before Zeynep.)",en,[],[],[],0,0,1,[],[],https://twitter.com/Pinboard/status/1298129804777070592,False,,0,,,,,,,,"[{'screen_name': 'Angola_Maldives', 'name': 'Angola Maldives', 'id': '2402659790'}, {'screen_name': 'thegrugq', 'name': 'thaddeus e. grugq', 'id': '18983429'}, {'screen_name': 'mattyglesias', 'name': 'Matthew Yglesias 🍦', 'id': '15446531'}, {'screen_name': 'zeynep', 'name': 'zeynep tufekci', 'id': '65375759'}]",,,,
1297971709669064706,1297878702332706818,2020-08-24 18:59:05 UTC,2020-08-24,18:59:05,0,2402659790,angola_maldives,Angola Maldives,,@thegrugq @mattyglesias @zeynep Micro-targeting seems like exactly mass communication and sociology.,en,[],[],[],1,0,3,[],[],https://twitter.com/Angola_Maldives/status/1297971709669064706,False,,0,,,,,,,,"[{'screen_name': 'thegrugq', 'name': 'thaddeus e. grugq', 'id': '18983429'}, {'screen_name': 'mattyglesias', 'name': 'Matthew Yglesias 🍦', 'id': '15446531'}, {'screen_name': 'zeynep', 'name': 'zeynep tufekci', 'id': '65375759'}]",,,,
1296849722154590208,1296826611455623169,2020-08-21 16:40:42 UTC,2020-08-21,16:40:42,0,928241918320021505,oliviermbuyi3,Olivier MBUYI,,"@CRISPTSHIBASU @DSESANGA @AdamBombole @LubayaClaudel @Bernardlututala @Zoom_eco @CBosembe @Mapon_Matata Je craints que ça soit l'oeuvre d'un bureau de communication pour dédouaner Matata mais le congolais attendent les retombées, donc la production de Bukanga lonzo et non des discours d'experts. Est ce que Kinshasa est inondé ??? Ni était Minocongo, ns serions dépendant de l'Angola",fr,[],[],[],0,0,0,[],[],https://twitter.com/OlivierMBUYI3/status/1296849722154590208,False,,0,,,,,,,,"[{'screen_name': 'DSESANGA', 'name': 'Delly SESANGA HIPUNGU', 'id': '2149946350'}, {'screen_name': 'AdamBombole', 'name': 'Adam Bombole', 'id': '353986314'}, {'screen_name': 'LubayaClaudel', 'name': 'Lubaya Claudel André', 'id': '1266291403'}, {'screen_name': 'Bernardlututala', 'name': 'Bernard M. Lututala', 'id': '970223442871111681'}, {'screen_name': 'Zoom_eco', 'name': 'Zoom Eco', 'id': '3094568793'}, {'screen_name': 'CBosembe', 'name': 'Christian Bosembe', 'id': '1126804297499459585'}, {'screen_name': 'Mapon_Matata', 'name': 'Matata Ponyo Mapon', 'id': '2349940394'}]",,,,
