id,conversation_id,created_at,date,time,timezone,user_id,username,name,place,tweet,language,mentions,urls,photos,replies_count,retweets_count,likes_count,hashtags,cashtags,link,retweet,quote_url,video,thumbnail,near,geo,source,user_rt_id,user_rt,retweet_id,reply_to,retweet_date,translate,trans_src,trans_dest
1339524893751164930,1339509201622581249,2020-12-17 10:56:36 UTC,2020-12-17,10:56:36,0,1194755884066324480,boomboo99565009,#BOOM #BOOM #BOOM,,I found out something important on the video. The cell phone on the woman's hand. She is going to call Ida at 1:14 International Development Association - World Bank  https://t.co/rjjHoIWxYD helps the world's poorest countries. Overseen. Afghanistan · Bangladesh · Benin ·  https://t.co/Bg5P5GeAuJ,en,[],['http://ida.worldbank.org'],"['https://pbs.twimg.com/media/EpbxZYgUYAMi21l.jpg', 'https://pbs.twimg.com/media/EpbxpYlU8AAZjev.jpg', 'https://pbs.twimg.com/media/EpbyMBfVoAISfbH.png']",2,3,9,[],[],https://twitter.com/BOOMBOO99565009/status/1339524893751164930,False,,1,https://pbs.twimg.com/media/EpbxZYgUYAMi21l.jpg,,,,,,,[],,,,
1314911616350199809,1314911616350199809,2020-10-10 12:52:13 UTC,2020-10-10,12:52:13,0,847762840098353152,lovette_grant,Ada✨,,"Last year, in Benin, my friend was taken to the police station for no reason! He was forced to write a false statement and was made to sleep in the cell. He couldn't call anyone because his phone was seized. His bail was N500,000. This can't continue!  #EndSarsNow #SarsMustGo",en,[],[],[],1,10,7,"['endsarsnow', 'sarsmustgo']",[],https://twitter.com/lovette_grant/status/1314911616350199809,False,,0,,,,,,,,[],,,,
1314565949325008897,1314565949325008897,2020-10-09 13:58:40 UTC,2020-10-09,13:58:40,0,2297798961,sane_sammie,Chukwuemeka🧘‍♂️,,Traveled to Benin twice last year for my clearance and to collect my result from uniben.Slept in the cell twice cause I refused to unlock my phone directly in front of the school gate. I got written up for impersonation by the SARS officials.  This has to end #EndSARSImmediately,en,[],[],[],0,0,0,['endsarsimmediately'],[],https://twitter.com/Sane_Sammie/status/1314565949325008897,False,,0,,,,,,,,[],,,,
1313337208141746176,1313337208141746176,2020-10-06 04:36:05 UTC,2020-10-06,04:36:05,0,1313148540596768769,freedomheart400,Freedom Heart ♣,,"2 years ago I was getting beating by Nigeria sars in Benin G R A no one soul  help me everyone mind they business, this not funny they stole my phone with mean they take my cell phone with them.",en,[],[],[],1,0,0,[],[],https://twitter.com/Freedomheart400/status/1313337208141746176,False,,0,,,,,,,,[],,,,
1312828614702960641,1312697032012976128,2020-10-04 18:55:07 UTC,2020-10-04,18:55:07,0,1672665024,adrenaline_w,JayD,,"@segalink @PoliceNG @SIAF_NG Was arrested in Benin at the airport rd. I was supposed to be my friends best man but arrived the wedding a day after my flight cos I was locked in a cell. My phone was searched and ntin found, my bags too nothing found. I bailed myself to meet up with the wedding 20k...#EndSARS",en,[],[],[],1,0,0,['endsars'],[],https://twitter.com/Adrenaline_w/status/1312828614702960641,False,,0,,,,,,,,"[{'screen_name': 'segalink', 'name': ""SEGA L'éveilleur®🚨"", 'id': '14879097'}, {'screen_name': 'PoliceNG', 'name': 'Nigeria Police Force', 'id': '470130723'}, {'screen_name': 'SIAF_NG', 'name': 'SIAF_NG', 'id': '933616676964270081'}]",,,,
1312478213914857472,1312471344739577856,2020-10-03 19:42:45 UTC,2020-10-03,19:42:45,0,1735153903,bentdaniels,iqwetublaq🇨🇾,,A phone from OwO since it’s cheaper there.   So just imagine me been thrown into the Cell in Benin all the way from Edo/Ondo boarder those thoughts and the threats they kept making while we were in the bus made me negotiate with them and they drained my account,en,[],[],[],1,0,0,[],[],https://twitter.com/bentdaniels/status/1312478213914857472,False,,0,,,,,,,,[],,,,
1312473681960996865,1312471344739577856,2020-10-03 19:24:45 UTC,2020-10-03,19:24:45,0,1735153903,bentdaniels,iqwetublaq🇨🇾,,They immediately tagged that one a cultist...   They have a special guy that checks phones they call him Operator. Operator (early 30s) told me I’m not making any call and I’m paying 1million or else they’re taking me to Benin and they’d forget about me in the cell.,en,[],[],[],1,0,0,[],[],https://twitter.com/bentdaniels/status/1312473681960996865,False,,0,,,,,,,,[],,,,
1287621184700313601,1287621184700313601,2020-07-27 05:29:47 UTC,2020-07-27,05:29:47,0,1272737690870374401,seo85298984,SEO Jahangir Hossain,,"#Benin #Mobile #Database is a huge collection of cell phone number list of original people staying at Benin along with their names, addresses, emails, etc.  https://t.co/YAgpJLHfXJ",en,[],['https://www.bcellphonelist.com/benin-mobile-database/'],[],0,0,0,"['benin', 'mobile', 'database']",[],https://twitter.com/SEO85298984/status/1287621184700313601,False,,0,,,,,,,,[],,,,
1282732312489340930,1282732312489340930,2020-07-13 17:43:09 UTC,2020-07-13,17:43:09,0,37241329,msfisk111,Shirley Ann Fisk,,"7/13/20, 12:37pm, my apt... nothing new except that I saw my cell phone bill and nearly croaked. Texts from Russia, Poland, Benin &amp; Turkmenistan to me? Who what when where why how? Spam. Ok. I requested spam blocks and I’m taking a break now.",en,[],[],[],0,0,0,[],[],https://twitter.com/msfisk111/status/1282732312489340930,False,,0,,,,,,,,[],,,,
1281369221172264960,1281369221172264960,2020-07-09 23:26:43 UTC,2020-07-09,23:26:43,0,1247338507091283970,upcomingjeffrey,jeffrey.up_coming,,Chairman dey sell phones for Accra Circle wey he go Benin.Mallam talk am say he dey won buy cell aa chairman give am soap...Rydees chairman mmom turn Alata samina😂💔#benin,en,[],[],[],0,2,6,['benin'],[],https://twitter.com/UpcomingJeffrey/status/1281369221172264960,False,,0,,,,,,,,[],,,,
1281204270541529095,1281204270541529095,2020-07-09 12:31:16 UTC,2020-07-09,12:31:16,0,1262714937513779200,ghananewshome,GhanaNewsHome,,Is Someone Spying On Your Cell Phone? 10 Ways to Tell &amp; How to Stop Them  https://t.co/Ekr5MjFBvl  Benin #ItCanBe #helpingotherschallenge #MadeinLagos  mallam,en,[],['https://ghananewshome.com/is-someone-spying-on-your-cell-phone-10-ways-to-tell-how-to-stop-them/'],[],0,3,1,"['itcanbe', 'helpingotherschallenge', 'madeinlagos']",[],https://twitter.com/ghananewshome/status/1281204270541529095,False,,0,,,,,,,,[],,,,
1274055133496848385,1273858274761289728,2020-06-19 19:03:09 UTC,2020-06-19,19:03:09,0,1054265353151410176,dan_d_don,Danny⚡,,"@JChyville @Richardpaul06 @JJExclusive1 @offwhite_o @Olawherz @Sonjoe_Kutuh @iamblobz @bluegirlolu @Blaaq_ie @_mide96 @Tife_fabunmi @hay_whye @Ha_yles @FettyisBack This guy, u done stay warri before or Benin. Person wey done experience am dey tell you. With your suit and  tie, you go chop slap. My friend slept in a cell, they saw an international number on his phone, his own brother that stays abroad was d one that called.",en,[],[],[],1,0,0,[],[],https://twitter.com/Dan_D_Don/status/1274055133496848385,False,,0,,,,,,,,"[{'screen_name': 'JChyville', 'name': 'JOHEL👽', 'id': '1118834850188996608'}, {'screen_name': 'JJExclusive1', 'name': 'DUKE OF LAUTECH', 'id': '1053159057740181505'}, {'screen_name': 'offwhite_o', 'name': 'Retired sinner 🀄', 'id': '1073222120359030784'}, {'screen_name': 'Olawherz', 'name': 'Wherz9', 'id': '898813951542165504'}, {'screen_name': 'Sonjoe_Kutuh', 'name': 'MONITORING_SPIRIT', 'id': '991460466407944192'}, {'screen_name': 'iamblobz', 'name': 'Alhaji Blobz👳', 'id': '748925574354051072'}, {'screen_name': 'bluegirlolu', 'name': ""Unilag's Finest ✨"", 'id': '1160404127475798016'}, {'screen_name': 'Blaaq_ie', 'name': '🍷 Daddy oyoyo', 'id': '994117275497254913'}, {'screen_name': '_mide96', 'name': '🍷 ɪᴠᴏʀʏ', 'id': '1118502220226547712'}, {'screen_name': 'Tife_fabunmi', 'name': 'Tife 🌚', 'id': '1047218585289072641'}, {'screen_name': 'hay_whye', 'name': '𝙰𝚈𝙾 𝙾𝙵 𝟹𝟶𝙱𝙶 😈', 'id': '4765012662'}, {'screen_name': 'Ha_yles', 'name': 'Hayles 🀄️', 'id': '1168853159437111301'}, {'screen_name': 'FettyisBack', 'name': 'a-Spec 🌷', 'id': '1279431464506077184'}]",,,,
1253792053588373505,1253790297462538243,2020-04-24 21:04:54 UTC,2020-04-24,21:04:54,0,1115953638290132992,dirtydiamon_d,💎Soul Kween💎,,"@hellomike01 Yeah he was arrested but I was in benin &amp; he was in ph..i think he had issues with road safety officer he slept in a cell. Called him &amp; he was crying on the phone like a baby 😂he had no one to help out,he relied on me bc he knows what I could do. I helped him raise d money up",en,[],[],[],1,0,3,[],[],https://twitter.com/DirtyDiamon_d/status/1253792053588373505,False,,0,,,,,,,,"[{'screen_name': 'hellomike01', 'name': 'MIKE 👑 🇳🇬', 'id': '2197865100'}]",,,,
1226936284872105985,1226936284872105985,2020-02-10 18:29:40 UTC,2020-02-10,18:29:40,0,3291227346,yanickfolly,Yanick Folly,,An Albino child is playing with a cell phone under a tree. #albinos #village #benin #bénin #people #lensculture #magnumphotos #reportage #reportagespotlight #africa #unicef #life #visitbenin #visiterlebenin #wasexo #5dmarkiv #canon #canonfrance ©️ Yanick Folly📍 Ouassa-Péhunco  https://t.co/VI0ULwTPMD,en,[],[],['https://pbs.twimg.com/media/EQbz8zlW4AAZt6A.jpg'],0,4,8,"['albinos', 'village', 'benin', 'bénin', 'people', 'lensculture', 'magnumphotos', 'reportage', 'reportagespotlight', 'africa', 'unicef', 'life', 'visitbenin', 'visiterlebenin', 'wasexo', '5dmarkiv', 'canon', 'canonfrance']",[],https://twitter.com/yanickfolly/status/1226936284872105985,False,,1,https://pbs.twimg.com/media/EQbz8zlW4AAZt6A.jpg,,,,,,,[],,,,
1200342644796338176,1200314499573661696,2019-11-29 09:16:02 UTC,2019-11-29,09:16:02,0,3303594130,extraordinarymg,Onyeashie Taiwo #EndSars,,"@oti_pr We are iyanu auto connect we sell foreign and Nigeria used Cars of your choice at a very moderate price here in BENIN CITY, EDO STATE, NIGERIA...cell phone number :+2349062373209, Twitter@ Autoiyanu,IG:iyanuconnect_ Please re tweet, my customers are on your timeline🙏 #AdsWithOT  https://t.co/8chdHKpAW8",en,[],[],['https://pbs.twimg.com/media/EKh5QAxWkAAlN4u.jpg'],0,1,0,['adswithot'],[],https://twitter.com/extraordinaryMG/status/1200342644796338176,False,,1,https://pbs.twimg.com/media/EKh5QAxWkAAlN4u.jpg,,,,,,,"[{'screen_name': 'oti_pr', 'name': 'Mazi 30 billion OT #EndSars', 'id': '1022794793909473280'}]",,,,
1200332223775424512,1200306147997159424,2019-11-29 08:34:37 UTC,2019-11-29,08:34:37,0,3303594130,extraordinarymg,Onyeashie Taiwo #EndSars,,"@DrJoeAbah We are iyanu auto connect we sell foreign and Nigeria used Cars of your choice at a very moderate price here in BENIN CITY, EDO STATE, NIGERIA...cell phone number :+2349062373209, Twitter@ Autoiyanu,IG:iyanuconnect_ Please re tweet, my customers are on your timeline🙏 #Nigerian  https://t.co/v0dkLGH8Oj",en,[],[],['https://pbs.twimg.com/media/EKhvyr2XkAAnAZk.jpg'],0,0,0,['nigerian'],[],https://twitter.com/extraordinaryMG/status/1200332223775424512,False,,1,https://pbs.twimg.com/media/EKhvyr2XkAAnAZk.jpg,,,,,,,"[{'screen_name': 'DrJoeAbah', 'name': 'Dr. Joe Abah', 'id': '2257546388'}]",,,,
1189156319682535424,1189156319682535424,2019-10-29 12:25:34 UTC,2019-10-29,12:25:34,0,1043484974417162240,newscentraltv,News Central TV,,"""For the 2 years I spent there, I never spoke to my parents. We had just one cell phone to call home. If the credit ran out, that was all for that day.""  Read eye-witness stories from victims of abuse by preacher Solomon Folorunsho in #Nigeria's Benin city. https://t.co/mMLERGPvs1",en,[],['https://newscentral.africa/benin-based-camp-accused-of-refugee-abuse/'],[],0,2,0,['nigeria'],[],https://twitter.com/NewsCentralTV/status/1189156319682535424,False,,0,,,,,,,,[],,,,
1187382778855411714,1186988240559063042,2019-10-24 14:58:09 UTC,2019-10-24,14:58:09,0,200179375,jen_stunna,FLAWLESS SKIN ENTHUSIAST✨,,"@segalink They also harass &amp; torture young boys/girls, search them against their will, go through their phones &amp; whether or not anything incriminating is found, they drag them to State CID benin, throw them into cells &amp; start demanding 100k upwards for their release!",en,[],[],[],0,0,1,[],[],https://twitter.com/Jen_Stunna/status/1187382778855411714,False,,0,,,,,,,,"[{'screen_name': 'segalink', 'name': ""SEGA L'éveilleur®🚨"", 'id': '14879097'}]",,,,
1184727230708146177,1184718225952649216,2019-10-17 07:05:57 UTC,2019-10-17,07:05:57,0,3303594130,extraordinarymg,Onyeashie Taiwo #EndSars,,"@OgbeniDipo We are Iyanu Auto Connect we sell foreign and Nigeria used Cars of your choice at a very moderate price here in BENIN CITY, EDO STATE, NIGERIA...cell phone number :+2349062373209, Twitter@ Autoiyanu,IG:iyanuconnect_ Please retweet 🙏, #MSMEThursdayWithDipo  https://t.co/iCvie6Uaiu",en,[],[],['https://pbs.twimg.com/media/EHD_EHkWwAAGQW9.jpg'],0,3,2,['msmethursdaywithdipo'],[],https://twitter.com/extraordinaryMG/status/1184727230708146177,False,,1,https://pbs.twimg.com/media/EHD_EHkWwAAGQW9.jpg,,,,,,,"[{'screen_name': 'OgbeniDipo', 'name': 'Dr. Dípò Awójídé', 'id': '153529375'}]",,,,
1184112927680454657,1183986571890089984,2019-10-15 14:24:56 UTC,2019-10-15,14:24:56,0,3303594130,extraordinarymg,Onyeashie Taiwo #EndSars,,"@iSlimfit We are iyanu auto connect we sell foreign and Nigeria used Cars of your choice at a very moderate price here in BENIN CITY, EDO STATE, NIGERIA...cell phone number :+2349062373209, Twitter@ Autoiyanu,IG:iyanuconnect_ Please re tweet #GrowMyHustleWithWale  https://t.co/clny7xAyZl",en,[],[],['https://pbs.twimg.com/media/EG7Qa_vX4AA4mBH.jpg'],0,1,1,['growmyhustlewithwale'],[],https://twitter.com/extraordinaryMG/status/1184112927680454657,False,,1,https://pbs.twimg.com/media/EG7Qa_vX4AA4mBH.jpg,,,,,,,"[{'screen_name': 'iSlimfit', 'name': 'Wale Adetona', 'id': '90316203'}]",,,,
1172820540828082176,1172648216778567681,2019-09-14 10:33:01 UTC,2019-09-14,10:33:01,0,1118942004,pokoschmurda,Lucky,,"We are iyanu auto connect we sell foreign and Nigeria used Cars of your choice at a very moderate price here in BENIN CITY, EDO STATE, NIGERIA...cell phone number :+2349062373209, Twitter@ Autoiyanu,IG:iyanuconnect_ Please re tweet, my customers are on your timeline🙏 #Nigerian  https://t.co/lfrIR1Hpsw",en,[],[],['https://pbs.twimg.com/media/EEayD0bXYAENecg.jpg'],0,1,1,['nigerian'],[],https://twitter.com/pokoschmurda/status/1172820540828082176,False,,1,https://pbs.twimg.com/media/EEayD0bXYAENecg.jpg,,,,,,,[],,,,
1171083855752847360,1170950153211207680,2019-09-09 15:32:03 UTC,2019-09-09,15:32:03,0,215944482,frankcastlehyke,Faranpojo Tolani Joshua,,@SirWoley I'm glad you out bro... During my stay in Benin.. I was attacked by hoodlums and my phone was taken forcefully... I wanted to track the gadget so I went in my NYSC Khaki..when I saw the cell they had petty thieves..i pitied the guys and even my attackers and I told the police.,en,[],[],[],1,2,3,[],[],https://twitter.com/FrankCastleHyke/status/1171083855752847360,False,,0,,,,,,,,[],,,,
1153304255815737344,1153248672303472642,2019-07-22 14:02:16 UTC,2019-07-22,14:02:16,0,3303594130,extraordinarymg,Onyeashie Taiwo #EndSars,,"@Isaac_Tadongdi We are Iyanu Auto Connect we sell foreign and Nigeria used Cars of your choice at a very moderate price here in BENIN CITY, EDO STATE, NIGERIA...cell phone number :+2349062373209, Twitter@ Autoiyanu,IG:iyanuconnect_ Thank you .",en,[],[],[],0,2,1,[],[],https://twitter.com/extraordinaryMG/status/1153304255815737344,False,,0,,,,,,,,"[{'screen_name': 'Isaac_Tadongdi', 'name': 'Isaac 🇳🇬', 'id': '2547986412'}]",,,,
1150705874190684162,1150687770983223296,2019-07-15 09:57:14 UTC,2019-07-15,09:57:14,0,3303594130,extraordinarymg,Onyeashie Taiwo #EndSars,,"@Isaac_Tadongdi We are Iyanu Auto Connect we sell foreign and Nigerian used Cars of your choice at a very moderate price here in BENIN CITY, EDO STATE, NIGERIA...cell phone number :+2349062373209,Twitter@ Autoiyanu,IG:iyanuconnect_ Please re tweet, my customers are on your timeline🙏 #Nigerian  https://t.co/XFPrVgZ2Lq",en,[],[],['https://pbs.twimg.com/media/D_gg4ehX4AAGvNG.jpg'],0,5,5,['nigerian'],[],https://twitter.com/extraordinaryMG/status/1150705874190684162,False,,1,https://pbs.twimg.com/media/D_gg4ehX4AAGvNG.jpg,,,,,,,"[{'screen_name': 'Isaac_Tadongdi', 'name': 'Isaac 🇳🇬', 'id': '2547986412'}]",,,,
1148629941396889609,1148157575642460160,2019-07-09 16:28:13 UTC,2019-07-09,16:28:13,0,228006815,mchafoo,Afolabi Olaniyi S.,,"@emaxyz13 @atiku Do you expect the last born in Benin republic or Togo to have a cell phone before we start using phones in Nigeria? Was it Obasanjo that dragged MTN to Nigeria? It only came at the right time. So sad you are thinking that way, horrible...",en,[],[],[],1,0,0,[],[],https://twitter.com/MCHAFOO/status/1148629941396889609,False,,0,,,,,,,,"[{'screen_name': 'emaxyz13', 'name': 'aláyè Captain', 'id': '727657520475582464'}, {'screen_name': 'atiku', 'name': 'Atiku Abubakar', 'id': '177583133'}]",,,,
1148553774304247808,1148483558169882624,2019-07-09 11:25:33 UTC,2019-07-09,11:25:33,0,3303594130,extraordinarymg,Onyeashie Taiwo #EndSars,,"@Blackdotmandy @Alex_Houseof308 @_COLO__ @tteri_za @osaxedosa @originalosas @Sazzy_imas @JenniferOsarie1 @Emzo_lee We are Iyanu Auto Connect we sell foreign and Nigerian used Cars of your choice at a very moderate price here in BENIN CITY, EDO STATE, NIGERIA...cell phone number :+2348073871890, Twitter@ Autoiyanu,IG:iyanuconnect_ Please re tweet,my customers are on your timeline🙏 #Nigerians",en,[],[],[],0,0,0,['nigerians'],[],https://twitter.com/extraordinaryMG/status/1148553774304247808,False,,0,,,,,,,,"[{'screen_name': 'Blackdotmandy', 'name': 'BDM| Blogger', 'id': '513007666'}, {'screen_name': 'Alex_Houseof308', 'name': 'Four-eyed Edo Boy™', 'id': '385986859'}, {'screen_name': 'tteri_za', 'name': 'Desola🇳🇬', 'id': '962833316356546560'}, {'screen_name': 'originalosas', 'name': 'Osagie', 'id': '956501461827047424'}, {'screen_name': 'Sazzy_imas', 'name': 'Dapo', 'id': '196087049'}, {'screen_name': 'JenniferOsarie1', 'name': 'Omo Benin Pataki👍🔥', 'id': '1032544177211494400'}]",,,,
1143645711491391489,1143330496333717504,2019-06-25 22:22:40 UTC,2019-06-25,22:22:40,0,68799943,tdenney79,Tommy Denney,,"The cell phone towers in Benin are notoriously dodgy, so my pics aren’t going through to her.   I’m afraid my angel may be tuckered out for the night.  https://t.co/loCeYkrlDu",en,[],[],['https://pbs.twimg.com/media/D98LtfTXkAAAiIm.jpg'],2,0,1,[],[],https://twitter.com/TDenney79/status/1143645711491391489,False,,1,https://pbs.twimg.com/media/D98LtfTXkAAAiIm.jpg,,,,,,,[],,,,
1138489022362398724,1138489022362398724,2019-06-11 16:51:49 UTC,2019-06-11,16:51:49,0,3388208903,obasiyayi,Amb Iyayi Moses 💡,,There's a police officer I know of that his cell phone has been collected thrice by robbers in Benin city along third east circular road. Somethings still baffles me these days.@GuardianNigeria @TheNationNews @segalink,en,"[{'screen_name': 'guardiannigeria', 'name': 'the guardian nigeria', 'id': '57320024'}, {'screen_name': 'thenationnews', 'name': 'the nation nigeria', 'id': '85318467'}, {'screen_name': 'segalink', 'name': ""sega l'éveilleur®🚨"", 'id': '14879097'}]",[],[],0,0,0,[],[],https://twitter.com/ObasIyayi/status/1138489022362398724,False,,0,,,,,,,,[],,,,
1131795425894309888,1131456340453462016,2019-05-24 05:33:51 UTC,2019-05-24,05:33:51,0,3303594130,extraordinarymg,Onyeashie Taiwo #EndSars,"{'type': 'Point', 'coordinates': [6.3843102, 5.6195938]}","@OgbeniDipo I'm just seeing this tweet. 😖💔 But!!  We are iyanu auto connect we sell foreign and Nigeria used Cars of your choice at a very moderate price here in BENIN CITY, EDO STATE, NIGERIA...cell phone number:+2348073871890,Twitter@ Autoiyanu,IG:iyanuconnect_ #MSMEThursdayWithDipo  https://t.co/OqqlHYTUuG",en,[],[],['https://pbs.twimg.com/media/D7Tx7emX4AAGTNR.jpg'],0,1,0,['msmethursdaywithdipo'],[],https://twitter.com/extraordinaryMG/status/1131795425894309888,False,,1,https://pbs.twimg.com/media/D7Tx7emX4AAGTNR.jpg,,,,,,,"[{'screen_name': 'OgbeniDipo', 'name': 'Dr. Dípò Awójídé', 'id': '153529375'}]",,,,
1128460329510420480,1128460329510420480,2019-05-15 00:41:22 UTC,2019-05-15,00:41:22,0,1068082003885592576,zim24_news,Zim24News,,Buhari's WAEC Certificate; Nigerian Soldiers Quote Trump; Kenya To Make Cell Phones; Benin Republic  https://t.co/O0z22JlaMg  https://t.co/4CPi36a1ka,en,[],['https://www.zim24news.com/2019/05/15/buharis-waec-certificate-nigerian-soldiers-quote-trump-kenya-to-make-cell-phones-benin-republic/'],['https://pbs.twimg.com/media/D6kYsIOXsAAuQ1J.jpg'],0,1,0,[],[],https://twitter.com/zim24_news/status/1128460329510420480,False,,1,https://pbs.twimg.com/media/D6kYsIOXsAAuQ1J.jpg,,,,,,,[],,,,
1127300928082722816,1127300928082722816,2019-05-11 19:54:20 UTC,2019-05-11,19:54:20,0,16105912,gracela999,Grace Makes Scents,,Getting scam calls from Africa ! Don’t pick up your cell phone unless you know who is calling ! #Benin #scam #despicable,en,[],[],[],0,1,1,"['benin', 'scam', 'despicable']",[],https://twitter.com/gracela999/status/1127300928082722816,False,,0,,,,,,,,[],,,,
1126590887805382656,1126590887805382656,2019-05-09 20:52:53 UTC,2019-05-09,20:52:53,0,229348650,wolfeling,Andrew Wolfe,,"In every African country except Benin, more households have cell phones than electricity.  https://t.co/oA3o0GlrJG  The cell-phone-to-electrified-household ratio is the highest in #Chad, which counts 7.6 households with cell phones for every electrified home!  (Source: USAID data)  https://t.co/BJnDJ0IHyv",en,[],['http://bit.ly/2Yhx7ll'],['https://pbs.twimg.com/media/D6JzmHhUIAAzEKN.jpg'],1,0,0,['chad'],[],https://twitter.com/WolfeLing/status/1126590887805382656,False,,1,https://pbs.twimg.com/media/D6JzmHhUIAAzEKN.jpg,,,,,,,[],,,,
1124804608432451584,1124804608432451584,2019-05-04 22:34:51 UTC,2019-05-04,22:34:51,0,780517716713021440,excusesbot,Work Excuses Bot,,They accidentally shipped my cell phone to Benin so that's why I couldn't do my project.,en,[],[],[],0,0,0,[],[],https://twitter.com/ExcusesBot/status/1124804608432451584,False,,0,,,,,,,,[],,,,
1123882244588879874,1123543844224630789,2019-05-02 09:29:42 UTC,2019-05-02,09:29:42,0,3303594130,extraordinarymg,Onyeashie Taiwo #EndSars,,"@GbemiOO Hi! ❤️ We are iyanu auto connect we sell foreign and Nigeria used Cars of your choice at a very moderate price here in BENIN CITY, EDO STATE, NIGERIA...cell phone number :+2348073871890, Twitter@ Autoiyanu,IG:iyanuconnect_  https://t.co/jiB7GB7ifW",en,[],[],['https://pbs.twimg.com/media/D5jU8OAWwAAsiTy.jpg'],0,1,1,[],[],https://twitter.com/extraordinaryMG/status/1123882244588879874,False,,1,https://pbs.twimg.com/media/D5jU8OAWwAAsiTy.jpg,,,,,,,"[{'screen_name': 'GbemiOO', 'name': 'Gbemi O-O', 'id': '42209165'}]",,,,
1117861701922316291,1117861701922316291,2019-04-15 18:46:13 UTC,2019-04-15,18:46:13,0,595320602,ngxgzg,Alubarika,,"I just remembered that Police kpake one boy in Benin because they checked his phone and saw a message saying ""What will Lord Baelish do next?"", yes, it was a GOT message.  Them say the boy na cultist, e sleep cell. 🙃",en,[],[],[],1,6,0,[],[],https://twitter.com/ngxgzg/status/1117861701922316291,False,,0,,,,,,,,[],,,,
1102924951961722881,1102909734850453505,2019-03-05 13:32:54 UTC,2019-03-05,13:32:54,0,301989551,bi_creezy,Bach Abioro Ibrahim,,@GyangChuwang4 @MBuhari Country wey get government Na country wey get education job road water and security. If talk now u go say obj bring cell phone but u forget say all d country even small Benin 🇧🇯 don Dey use phone b4 us and na force we force him  And after Na through corruption e come,en,[],[],[],1,2,3,[],[],https://twitter.com/BI_Creezy/status/1102924951961722881,False,,0,,,,,,,,"[{'screen_name': 'GyangChuwang4', 'name': 'Gyang Chuwang', 'id': '976923934879899648'}, {'screen_name': 'MBuhari', 'name': 'Muhammadu Buhari', 'id': '2936714848'}]",,,,
1095474268354367488,1095474268354367488,2019-02-13 00:06:33 UTC,2019-02-13,00:06:33,0,730752304920559618,collinsfranci16,collins francis,,The Nigeria Police Force had on February 6 arrested six suspects for beating a 24-year-old woman accused of stealing a cell phone in Benin.  The suspects went as far as stripping the young lady and forcing pepper into her private part.   #StopJungleJustice,en,[],[],[],0,0,4,['stopjunglejustice'],[],https://twitter.com/collinsfranci16/status/1095474268354367488,False,,0,,,,,,,,[],,,,
1093504067836489729,1093504067836489729,2019-02-07 13:37:40 UTC,2019-02-07,13:37:40,0,1067798803720413186,naejahits,NAEJAHITS™️,,"Police nab 6 suspects who assaulted woman in #Benin. . . The Nigeria Police Force said it had arrested six suspects, (name withheld), for beating a 24 year-old woman accused of cell phone theft in Benin. . . The Force Spokesman, ACP Frank Mba, who disclo…  https://t.co/NyFEcUrJbd  https://t.co/PMo6AAaHhG",en,[],['http://bit.ly/2MUeiAm'],['https://pbs.twimg.com/media/DyzoJ5TWsAEFrt8.jpg'],0,0,0,['benin'],[],https://twitter.com/naejahits/status/1093504067836489729,False,,1,https://pbs.twimg.com/media/DyzoJ5TWsAEFrt8.jpg,,,,,,,[],,,,
1093494171900567552,1093494171900567552,2019-02-07 12:58:21 UTC,2019-02-07,12:58:21,0,248929204,leadershipnga,LEADERSHIP Newspaper,,"The Nigeria Police Force said it had arrested six suspects, (name withheld), for beating a 24 year-old woman accused of stealing a cell phone in Benin. The Force Spokesman, ACP Frank...  https://t.co/Jfrkdp4hKw",en,[],['https://leadership.ng/2019/02/07/jungle-justice-police-nab-6-suspects-for-assault-in-benin/'],[],1,3,8,[],[],https://twitter.com/LeadershipNGA/status/1093494171900567552,False,,0,,,,,,,,[],,,,
