id,conversation_id,created_at,date,time,timezone,user_id,username,name,place,tweet,language,mentions,urls,photos,replies_count,retweets_count,likes_count,hashtags,cashtags,link,retweet,quote_url,video,thumbnail,near,geo,source,user_rt_id,user_rt,retweet_id,reply_to,retweet_date,translate,trans_src,trans_dest
1051904797694136321,1051904797694136321,2018-10-15 18:37:01 UTC,2018-10-15,18:37:01,0,132187223,gerrtm_,Mosankomane,,Never used to understand what this whole “Botswana is behind in terms of internet coverage &amp; connectivity” till now. I live 30km outside of the biggest city and no service provider can get me a connection. Had to resort to a VSAT connection. Amazing!,en,[],[],[],0,0,0,[],[],https://twitter.com/GerrtM_/status/1051904797694136321,False,,0,,,,,,,,[],,,,
1051830372936404992,1051830372936404992,2018-10-15 13:41:17 UTC,2018-10-15,13:41:17,0,3431374869,wildcru_ox,"WildCRU, Oxford",,"The focus of WildCRU's workshop is the modelling of lion landscape connectivity, led by Dr Andy Loveridge, identifying core areas and corridors for the benefit of people and wildlife in #KAZA and #Botswana #landscapemodelling #wildlifeconservation #transkalaharipredatorprogramme  https://t.co/13lAPsY48q",en,[],[],"['https://pbs.twimg.com/media/DpjZJ3iX4AEZXSx.jpg', 'https://pbs.twimg.com/media/DpjaGXlX4AE-TL2.jpg']",0,4,18,"['kaza', 'botswana', 'landscapemodelling', 'wildlifeconservation', 'transkalaharipredatorprogramme']",[],https://twitter.com/WildCRU_Ox/status/1051830372936404992,False,,1,https://pbs.twimg.com/media/DpjZJ3iX4AEZXSx.jpg,,,,,,,[],,,,
1051822203912810498,1051822203912810498,2018-10-15 13:08:49 UTC,2018-10-15,13:08:49,0,3431374869,wildcru_ox,"WildCRU, Oxford",,Dr Zaneta Kaszta illustrates the stakeholder process of WildCRU's landscape connectivity toolkit as previously modelled in Sabah. The presentation highlights the potential for integrating human wildlife coexistence into landscape planning  in Botswana and the KAZA landscape  https://t.co/pgrkhnKa0A,en,[],[],"['https://pbs.twimg.com/media/DpjSk5RXgAEiQyI.jpg', 'https://pbs.twimg.com/media/DpjSnKSX4AA1JGw.jpg']",0,1,3,[],[],https://twitter.com/WildCRU_Ox/status/1051822203912810498,False,,1,https://pbs.twimg.com/media/DpjSk5RXgAEiQyI.jpg,,,,,,,[],,,,
1051774260367290368,1051774260367290368,2018-10-15 09:58:19 UTC,2018-10-15,09:58:19,0,3431374869,wildcru_ox,"WildCRU, Oxford",,"'International perspective on importance of landscape connectivity and prioritisation methods', Dr Sam Cushman presenting to the participants of WildCRU's Landscape Connectivity Workshop in Botswana #landscapeconnectivity #wildlifeconservation  https://t.co/zpr3iy39rY",en,[],[],"['https://pbs.twimg.com/media/DpimgVpXUAAUXQm.jpg', 'https://pbs.twimg.com/media/DpimiCLX4AAIcGM.jpg', 'https://pbs.twimg.com/media/DpimjqBWsAAHe5V.jpg']",0,0,4,"['landscapeconnectivity', 'wildlifeconservation']",[],https://twitter.com/WildCRU_Ox/status/1051774260367290368,False,,1,https://pbs.twimg.com/media/DpimgVpXUAAUXQm.jpg,,,,,,,[],,,,
1051765037726146560,1051765037726146560,2018-10-15 09:21:40 UTC,2018-10-15,09:21:40,0,3431374869,wildcru_ox,"WildCRU, Oxford",,Day 1 of WildCRU's Landscape Connectivity Workshops in Botswana and Zimbabwe. Delegates from government departments and NGO's closing the gap between science and policy @MokolodiReserve  https://t.co/7bv1OJt0QI,en,"[{'screen_name': 'mokolodireserve', 'name': 'mokolodi reserve ', 'id': '897021703'}]",[],"['https://pbs.twimg.com/media/DpieUTZXoAAMgUF.jpg', 'https://pbs.twimg.com/media/Dpiec1PWsAAQPfC.jpg']",0,0,12,[],[],https://twitter.com/WildCRU_Ox/status/1051765037726146560,False,,1,https://pbs.twimg.com/media/DpieUTZXoAAMgUF.jpg,,,,,,,[],,,,
1050762593688801280,1050762593688801280,2018-10-12 14:58:19 UTC,2018-10-12,14:58:19,0,53203282,lindenbirns,Plane Talking PR,,"#AASA2018 Top execs from Air Botswana, Air Namibia, SAA, Airlik and Proflight Zambia debate the issues on obstacles to connectivity, foreign investment, role of low cost airlines and fragmented African markets  https://t.co/IjCDiGeKBD",en,[],[],['https://pbs.twimg.com/media/DpUO_ePXgAMuvdJ.jpg'],0,1,2,['aasa2018'],[],https://twitter.com/LindenBirns/status/1050762593688801280,False,,1,https://pbs.twimg.com/media/DpUO_ePXgAMuvdJ.jpg,,,,,,,[],,,,
1044779057072795649,1044779057072795649,2018-09-26 02:41:52 UTC,2018-09-26,02:41:52,0,992695620,brandbotswana,Our Botswana 🇧🇼,,"#Bloomberg Business interview with @BogoloKenewendo, #Botswana Minister of Investment, Trade, &amp; Industry. Botswana seeking new global air connectivity agreements to support Tourism sector growth &amp;  expansion into clean energy production... https://t.co/PKhT4LHuee",en,"[{'screen_name': 'bogolokenewendo', 'name': 'bogolo kenewendo', 'id': '1904450964'}]",['http://bloomberg.com/live'],[],0,0,1,"['bloomberg', 'botswana']",[],https://twitter.com/BrandBotswana/status/1044779057072795649,False,,0,,,,,,,,[],,,,
1043905810227744768,1043905810227744768,2018-09-23 16:51:54 UTC,2018-09-23,16:51:54,0,878226858235613188,roarwn,Roar Wildlife News,,"KaZa - Namibia, Angola, Zimbabwe, Botswana, Zambia: Restoring Ecosystems 'A key objective of KAZA is to ensure connectivity between key wildlife areas, and where necessary, join fragmented wildlife habitats in...  https://t.co/p4eB2t0q0I",en,[],['https://www.facebook.com/roarwildlifenews/posts/1600153220089472'],[],0,0,0,[],[],https://twitter.com/RoarWN/status/1043905810227744768,False,,0,,,,,,,,[],,,,
1035571669283348480,1035571669283348480,2018-08-31 16:55:00 UTC,2018-08-31,16:55:00,0,1006284919,bocrabw,BOCRA,,"#ITUWORLD Botswana is excited to be part of this grand ICT spectacle. Come visit us at Stand 3C01. We will be talking regulation, connectivity, innovation and investment.#Botswanapavilion#3C01",en,[],[],[],0,0,2,['ituworld'],[],https://twitter.com/BOCRAbw/status/1035571669283348480,False,,0,,,,,,,,[],,,,
1029119177599143937,1028670560128122880,2018-08-13 21:35:06 UTC,2018-08-13,21:35:06,0,701391197101805568,whatithinkza,#Pi What I Think,,"@PhronesisBookin @Botswana The continent to watch out for. Millennial Mindset is being created across Africa with connectivity growing, it's a very interesting time to be alive!",en,[],[],[],0,0,0,[],[],https://twitter.com/WhatIThinkza/status/1029119177599143937,False,,0,,,,,,,,"[{'screen_name': 'PhronesisBookin', 'name': 'Phronesis Booking', 'id': '2797737111'}, {'screen_name': 'Botswana', 'name': 'Botswana', 'id': '7841202'}]",,,,
1027088038374121472,1027088038374121472,2018-08-08 07:04:05 UTC,2018-08-08,07:04:05,0,14260571,thinktankthuto,Think Tank Thuto,,"RT Go_Botswana: As part of improving broadband connectivity &amp; in keeping up with global trends, BITC has ensured availability of complimentary Wi-Fi access at all the four international Airports. See the login intrustions #GoBotswana #InvetsBotswana  https://t.co/kgvAY6FaPK",en,[],[],['https://pbs.twimg.com/media/DjgLeMLXgAAfmBH.jpg'],0,0,0,"['gobotswana', 'invetsbotswana']",[],https://twitter.com/ThinkTankThuto/status/1027088038374121472,False,,1,https://pbs.twimg.com/media/DjgLeMLXgAAfmBH.jpg,,,,,,,[],,,,
1025014330390130689,1024581799501090816,2018-08-02 13:43:54 UTC,2018-08-02,13:43:54,0,3388814543,sitholesinclair,Senza,,@Go_Botswana @OfficialMasisi Excellent move this. Puts the country in touch with global trends towards increased connectivity. Thumbs up to you!!,en,[],[],[],0,1,1,[],[],https://twitter.com/sitholesinclair/status/1025014330390130689,False,,0,,,,,,,,"[{'screen_name': 'Go_Botswana', 'name': 'BITC', 'id': '2371929956'}, {'screen_name': 'OfficialMasisi', 'name': 'Dr. Mokgweetsi E.K Masisi', 'id': '3236507891'}]",,,,
1024596994713628673,1024596994713628673,2018-08-01 10:05:34 UTC,2018-08-01,10:05:34,0,324538766,hennymaps,#Hennymaps,,"As part of improving broadband connectivity &amp; in keeping up with global trends, @Go_Botswana has ensured availability of complimentary Wi-Fi access at all the four international Airports in Botswana. Follow the login instructions. #GoBotswana #InvestBotswana #ilovebotswana🇧🇼  https://t.co/gOxvREBDux",en,"[{'screen_name': 'go_botswana', 'name': 'bitc', 'id': '2371929956'}]",[],['https://pbs.twimg.com/media/DjgZgbkWsAAKdkY.jpg'],0,1,2,"['gobotswana', 'investbotswana', 'ilovebotswana']",[],https://twitter.com/hennymaps/status/1024596994713628673,False,,1,https://pbs.twimg.com/media/DjgZgbkWsAAKdkY.jpg,,,,,,,[],,,,
1024581799501090816,1024581799501090816,2018-08-01 09:05:11 UTC,2018-08-01,09:05:11,0,2371929956,go_botswana,BITC,,"As part of improving broadband connectivity &amp; in keeping up with global trends, BITC has ensured availability of complimentary Wi-Fi access at all the four international Airports. See the login intrustions #GoBotswana #InvetsBotswana  https://t.co/Q9BRvvexww",en,[],[],['https://pbs.twimg.com/media/DjgLeMLXgAAfmBH.jpg'],3,22,27,"['gobotswana', 'invetsbotswana']",[],https://twitter.com/Go_Botswana/status/1024581799501090816,False,,1,https://pbs.twimg.com/media/DjgLeMLXgAAfmBH.jpg,,,,,,,[],,,,
1022232692602142729,1022232692602142729,2018-07-25 21:30:40 UTC,2018-07-25,21:30:40,0,622217914,mooketsibtekere,MooketsiBTekere,,The seed was planted and will spread across Botswana-thanks to expert master trainer @speediecelt from Ireland.  Today Botswana shows it is seedling at the speed of lightning with CODING &amp; DIGITAL connectivity=schools  @Galwayec3  @CamdenTrust  @ACW_RCI  @BWGovernment  @scratch  https://t.co/XbNDZwTO4H,en,"[{'screen_name': 'speediecelt', 'name': 'brendan smith', 'id': '68471639'}, {'screen_name': 'camdentrust', 'name': 'the camden education trust', 'id': '1006657386403201024'}, {'screen_name': 'acw_rci', 'name': 'africacodeweek rci', 'id': '3375934456'}, {'screen_name': 'bwgovernment', 'name': 'botswana government', 'id': '316291124'}, {'screen_name': 'scratch', 'name': 'scratch team', 'id': '15538226'}]",['https://twitter.com/acwbotswana/status/1022028575824904192'],[],0,2,3,[],[],https://twitter.com/MooketsiBTekere/status/1022232692602142729,False,https://twitter.com/acwbotswana/status/1022028575824904192,0,,,,,,,,[],,,,
1021868122435985408,1021868122435985408,2018-07-24 21:22:00 UTC,2018-07-24,21:22:00,0,226879413,vsateventseries,VSAT Series,,"Telco, bank in VSAT alliance to boost internet connectivity in Botswana - ITWeb Africa  https://t.co/3WQkDsvJqZ",en,[],['http://spr.ly/6014DSn7u'],[],0,0,0,[],[],https://twitter.com/VSATEventSeries/status/1021868122435985408,False,,0,,,,,,,,[],,,,
1021343290975825920,1021343290975825920,2018-07-23 10:36:30 UTC,2018-07-23,10:36:30,0,892792496,263chat,263Chat.com 🇿🇼,,#PotrazUSF Maitengwe’s provincial represantative emotionally thanking @Potraz_zw for bringing Connectivity to the area where residents have for years resorted to using Botswana’s close networks such as Mascom Wireless &amp; MTN but without access to daily needs like @EcoCashZW  https://t.co/rcmL7J7aqd,en,"[{'screen_name': 'potraz_zw', 'name': 'potraz', 'id': '775336109790400512'}, {'screen_name': 'ecocashzw', 'name': 'ecocash zimbabwe', 'id': '1654770775'}]",[],['https://pbs.twimg.com/media/DiyKQrzW0AAOgQJ.jpg'],1,2,6,['potrazusf'],[],https://twitter.com/263Chat/status/1021343290975825920,False,,1,https://pbs.twimg.com/media/DiyKQrzW0AAOgQJ.jpg,,,,,,,[],,,,
1017692421898080257,1017692421898080257,2018-07-13 08:49:15 UTC,2018-07-13,08:49:15,0,809332202995585024,empoweredbw,EmPowerMe,,"Our end-to-end solution can be fully integrated with all types of network connectivity, including USSD, SMS and Web gateways - all in real time. @EuniceKira CEO #FinTech meeting with Bank of #Botswana &amp; @bankofcanada  https://t.co/UIu4gitu8E",en,"[{'screen_name': 'eunicekira', 'name': '#festivecurfew', 'id': '1032571021'}, {'screen_name': 'bankofcanada', 'name': 'bank of canada', 'id': '14980721'}]",[],['https://pbs.twimg.com/media/Dh-RePMWAAAcw7O.jpg'],0,4,2,"['fintech', 'botswana']",[],https://twitter.com/EmPoweredBW/status/1017692421898080257,False,,1,https://pbs.twimg.com/media/Dh-RePMWAAAcw7O.jpg,,,,,,,[],,,,
1012613658529222656,1012613658529222656,2018-06-29 08:28:04 UTC,2018-06-29,08:28:04,0,423329902,itwebafrica,ITWeb Africa,,"Telco, bank in VSAT alliance to boost internet connectivity in Botswana:  https://t.co/XEyPtI5l4p",en,[],['http://www.itwebafrica.com/networks/619-botswana/244467-telco-bank-in-vsat-alliance-to-boost-internet-connectivity-in-botswana#.WzXtidbOGxE.twitter'],[],0,1,0,[],[],https://twitter.com/ITWebAfrica/status/1012613658529222656,False,,0,,,,,,,,[],,,,
1006929708796317696,1006929708796317696,2018-06-13 16:02:05 UTC,2018-06-13,16:02:05,0,196074569,mmogende,Modiri Mogende,,Botswana moves to reduce connectivity costs.  https://t.co/OGVSjrMEKz,en,[],['https://twitter.com/BWGovernment/status/1006900912797855744'],[],0,1,4,[],[],https://twitter.com/mmogende/status/1006929708796317696,False,https://twitter.com/BWGovernment/status/1006900912797855744,0,,,,,,,,[],,,,
1003700351181127680,1003655539849490433,2018-06-04 18:09:46 UTC,2018-06-04,18:09:46,0,622217914,mooketsibtekere,MooketsiBTekere,,"@KGeorgieva @WorldBankAfrica @PaulKagame We also need to see a significant part of @WorldBankAfrica to address lack of connectivity,digital skills and entrepreneurs motivation for Africa...attention to many jobs that have digital elements in Botswana as pilot. I'm ready to share more...",en,"[{'screen_name': 'worldbankafrica', 'name': 'world bank africa', 'id': '135187648'}]",[],[],0,0,2,[],[],https://twitter.com/MooketsiBTekere/status/1003700351181127680,False,,0,,,,,,,,"[{'screen_name': 'KGeorgieva', 'name': 'Kristalina Georgieva', 'id': '123109597'}, {'screen_name': 'WorldBankAfrica', 'name': 'World Bank Africa', 'id': '135187648'}, {'screen_name': 'PaulKagame', 'name': 'Paul Kagame', 'id': '37601149'}]",,,,
998850314420805632,998850314420805632,2018-05-22 08:57:27 UTC,2018-05-22,08:57:27,0,324538766,hennymaps,#Hennymaps,,"As part of improving broadband connectivity &amp; in keeping up with global trends, @Go_Botswana has ensured availability of complimentary WIFI access at all the four international airports(Gaborone, Francistown, Maun &amp; Kasane) in Botswana.  https://t.co/N3GLcpF4ym",en,"[{'screen_name': 'go_botswana', 'name': 'bitc', 'id': '2371929956'}]",[],['https://pbs.twimg.com/media/Ddyg_nfVwAARbua.jpg'],1,6,8,[],[],https://twitter.com/hennymaps/status/998850314420805632,False,,1,https://pbs.twimg.com/media/Ddyg_nfVwAARbua.jpg,,,,,,,[],,,,
998543546469748736,998543546469748736,2018-05-21 12:38:28 UTC,2018-05-21,12:38:28,0,2371929956,go_botswana,BITC,,"As part of improving broadband connectivity &amp; in keeping up with global trends, BITC has ensured availability of complimentary WIFI access at all the four international airports.  https://t.co/EuL36rite1",en,[],[],['https://pbs.twimg.com/media/DduJfTsV0AA1JPC.jpg'],1,7,13,[],[],https://twitter.com/Go_Botswana/status/998543546469748736,False,,1,https://pbs.twimg.com/media/DduJfTsV0AA1JPC.jpg,,,,,,,[],,,,
994582015902208004,994576025836277760,2018-05-10 14:16:45 UTC,2018-05-10,14:16:45,0,316291124,bwgovernment,Botswana Government,,"and seamless connectivity to the two main largest cities in Botswana, Gaborone and Francistown including the tourism capital city of Maun.”",en,[],[],[],1,3,10,[],[],https://twitter.com/BWGovernment/status/994582015902208004,False,,0,,,,,,,,[],,,,
993383620638363648,993383620638363648,2018-05-07 06:54:45 UTC,2018-05-07,06:54:45,0,854647764483010561,kcs_kalahari,Kalahari Conservation Society,,An uplifting #conservation story for Monday from #Botswana. Restoration of previously lost largest and longest known land migrations in the world of #Wildebeast and #Zebra.  Migrations are vital for ecosystem connectivity and health. @Botswana @UoLondon  https://t.co/ciaaAA0SqS,en,"[{'screen_name': 'botswana', 'name': 'botswana', 'id': '7841202'}, {'screen_name': 'uolondon', 'name': 'university of london', 'id': '555195877'}]",['https://news.nationalgeographic.com/2018/05/botswana-africa-revived-largest-mammal-zebra-migration/'],[],0,0,2,"['conservation', 'botswana', 'wildebeast', 'zebra']",[],https://twitter.com/kcs_kalahari/status/993383620638363648,False,,0,,,,,,,,[],,,,
978277741400416258,978277741400416258,2018-03-26 14:29:23 UTC,2018-03-26,14:29:23,0,78371959,akrolikowski,"Aaron Krolikowski, PhD",,Millions of dollars earmarked for increasing #internet #connectivity are going unspent in #Africa   https://t.co/822XUlRpob   #BurkinaFaso #Kenya #Madagascar #Botswana  https://t.co/S5dKC9gVMu,en,[],['https://qz.com/1232703/african-governments-are-withholding-millions-of-dollars-meant-to-increase-internet-access/'],['https://pbs.twimg.com/media/DZOKQ2XW0AA_3J3.jpg'],0,0,1,"['internet', 'connectivity', 'africa', 'burkinafaso', 'kenya', 'madagascar', 'botswana']",[],https://twitter.com/AKrolikowski/status/978277741400416258,False,,1,https://pbs.twimg.com/media/DZOKQ2XW0AA_3J3.jpg,,,,,,,[],,,,
973194177218514944,973194177218514944,2018-03-12 13:49:07 UTC,2018-03-12,13:49:07,0,1472840491,africanewshub,Africa News Hub,,#Botswana : Budget constraints limits the spread of fibre connectivity - #BoFiNet  https://t.co/ENjDxOBDBc,en,[],['https://www.africanewshub.com/short/3QE'],[],0,0,0,"['botswana', 'bofinet']",[],https://twitter.com/africanewshub/status/973194177218514944,False,,0,,,,,,,,[],,,,
967017571651383296,967017571651383296,2018-02-23 12:45:30 UTC,2018-02-23,12:45:30,0,52692766,safari_dot_com,Safari.com,,"It’s official! Kasane International Airport  is a new world-class airport! Aligned with international airport standards, the airport now offers a larger attractive terminal, extended runway &amp; Wi-Fi connectivity. A promise of seamless &amp; reliable travel in Botswana.  https://t.co/gwkZHWwuR5",en,[],[],"['https://pbs.twimg.com/media/DWuJWneXUAAZCYX.jpg', 'https://pbs.twimg.com/media/DWuJWxPXUAECXfR.jpg', 'https://pbs.twimg.com/media/DWuJWnzX4AYiSk9.jpg']",0,1,5,[],[],https://twitter.com/safari_dot_com/status/967017571651383296,False,,1,https://pbs.twimg.com/media/DWuJWneXUAAZCYX.jpg,,,,,,,[],,,,
966703132129550337,966697890881163266,2018-02-22 15:56:01 UTC,2018-02-22,15:56:01,0,2371929956,go_botswana,BITC,,"@BWmercy Good day Mercy,  The connectivity is an enabler for doing business. As part of improving our ease of Doing Business and to remain globally competitive as a country. It is another way through which we can gauge ourselves in terms of the quality of service that we deliver.",en,[],[],[],1,0,0,[],[],https://twitter.com/Go_Botswana/status/966703132129550337,False,,0,,,,,,,,"[{'screen_name': 'BwMercy', 'name': 'Mercy_Bw', 'id': '1217692126852546561'}]",,,,
966696986228510720,966696986228510720,2018-02-22 15:31:36 UTC,2018-02-22,15:31:36,0,2371929956,go_botswana,BITC,,"As part of improving broadband connectivity and in keeping up with global trends, BITC has ensured availability of complimentary wi-fi  access at all the four international airports namely; Sir Seretse Khama International Airport, Francistown International Airport, Kasane &amp; Maun.  https://t.co/fHMpjC273a",en,[],[],['https://pbs.twimg.com/media/DWplwv_XUAAVKSW.jpg'],0,16,14,[],[],https://twitter.com/Go_Botswana/status/966696986228510720,False,,1,https://pbs.twimg.com/media/DWplwv_XUAAVKSW.jpg,,,,,,,[],,,,
966370365814530049,966370365814530049,2018-02-21 17:53:44 UTC,2018-02-21,17:53:44,0,737217529056272384,officialbrandbw,Brand Botswana,,LAUNCHING AIRPORT WIFI |   Advancing e-Tourism and easy connectivity in Botswana's airports and access points....  https://t.co/9mxEF3Ef7u,en,[],['https://fb.me/1iVFZICQO'],[],0,0,0,[],[],https://twitter.com/OfficialBrandBW/status/966370365814530049,False,,0,,,,,,,,[],,,,
961221181356544000,961221181356544000,2018-02-07 12:52:42 UTC,2018-02-07,12:52:42,0,613683161,e_auri,Auri,,Greetings from Windhoek! Fascinating to be a part of this regional initiative to support #entrepreneurship and the connectivity of #startup ecosystems in Southern #Africa. Skilled people with amazing focus on #entrepreneurs!   #Namibia #Botswana #SouthAfrica #Tanzania #Zambia  https://t.co/8hVsWjEwG1,en,[],['https://twitter.com/saisprogramme/status/961211915396616199'],[],0,2,10,"['entrepreneurship', 'startup', 'africa', 'entrepreneurs', 'namibia', 'botswana', 'southafrica', 'tanzania', 'zambia']",[],https://twitter.com/e_auri/status/961221181356544000,False,https://twitter.com/saisprogramme/status/961211915396616199,0,,,,,,,,[],,,,
960431320185925633,960421054765289472,2018-02-05 08:34:05 UTC,2018-02-05,08:34:05,0,316291124,bwgovernment,Botswana Government,,"35. As Botswana moves to the next level of a knowledge-based economy, investment in information and communications technology (ICT) becomes critical. The development of an ICT backbone infrastructure is necessary for equitable and affordable access to broadband connectivity.",en,[],[],[],1,2,2,[],[],https://twitter.com/BWGovernment/status/960431320185925633,False,,0,,,,,,,,[],,,,
956769146158514176,956765681940357120,2018-01-26 06:01:55 UTC,2018-01-26,06:01:55,0,3066666563,frankhook,Francis Hook,,"@nasirembe2010 Both low population and high GDP per capita.  Botswana geographically as big as Kenya but quite arid for the better part.  Mauritius has inherent challenges as an island (power generation, connectivity). But yes, we can and should do better.",en,[],[],[],1,0,0,[],[],https://twitter.com/FrankHook/status/956769146158514176,False,,0,,,,,,,,"[{'screen_name': 'nasirembe2010', 'name': 'Justus Wany', 'id': '246743280'}]",,,,
955561329049382914,955561329049382914,2018-01-22 22:02:28 UTC,2018-01-22,22:02:28,0,59982540,seshupomoshodi,Pastor Prophet SAM,,Something needs to be done about this. I feel this issue of internet connectivity in Botswana is a concern of national security. cc @DIS,en,"[{'screen_name': 'dis', 'name': 'dis', 'id': '109631267'}]",[],[],0,0,0,[],[],https://twitter.com/seshupomoshodi/status/955561329049382914,False,,0,,,,,,,,[],,,,
955352262620205057,955352262620205057,2018-01-22 08:11:43 UTC,2018-01-22,08:11:43,0,153526467,bashamagwape,Basha Magwape Azania,,"Botswana is central. I say that to our leaders who might be at #Davos. #Botswana is central in #SADC, may we #openborders and increase economic and digital connectivity. CC @BWGovernment @Go_Botswana  https://t.co/AyyXUTDyt9",en,"[{'screen_name': 'bwgovernment', 'name': 'botswana government', 'id': '316291124'}, {'screen_name': 'go_botswana', 'name': 'bitc', 'id': '2371929956'}]",['https://twitter.com/nematombo/status/954837336717778945'],[],1,0,1,"['davos', 'botswana', 'sadc', 'openborders']",[],https://twitter.com/bashamagwape/status/955352262620205057,False,https://twitter.com/nematombo/status/954837336717778945,0,,,,,,,,[],,,,
945547692893143040,945547692893143040,2017-12-26 06:51:52 UTC,2017-12-26,06:51:52,0,788201294863355904,mjenzi_cloud,Mjenzi Cloud,,Merry Christmas all! 2018 looks to be a promising here for  https://t.co/XsU58NbhxC building connectivity for young startups in Botswana and Australia. Watch out!,en,[],['http://Mjenzi.com'],[],0,0,2,[],[],https://twitter.com/mjenzi_cloud/status/945547692893143040,False,,0,,,,,,,,[],,,,
940493974766096384,940492604973596672,2017-12-12 08:10:11 UTC,2017-12-12,08:10:11,0,357435536,streetruffian75,Will,,"@Telstra I was going to receive a call but obviously that message was lost somewhere between Lahore and Bombay! Everything is offshore, you may as well call yourselves Feeble or Meagre, lamentable or in fact worthless. We are ranked behind Botswana and Zaire for connectivity!",en,[],[],[],0,0,0,[],[],https://twitter.com/StreetRuffian75/status/940493974766096384,False,,0,,,,,,,,"[{'screen_name': 'Telstra', 'name': 'Telstra', 'id': '61636429'}]",,,,
938345693713969152,938105263617462273,2017-12-06 09:53:41 UTC,2017-12-06,09:53:41,0,1174189992,telonezw,Tel·One,,@MuchiraTitus @Techzim @RewardKangai Good day. We sincerely apologize for the inconveniences caused due to faults occurred on our main links through South Africa and Botswana.Our back-up link through Mozambique has  remained active and rerouted automatically but with limited connectivity.,en,[],[],[],0,1,0,[],[],https://twitter.com/TelOneZW/status/938345693713969152,False,,0,,,,,,,,"[{'screen_name': 'MuchiraTitus', 'name': 'Titus M Muchirahondo', 'id': '962326465'}, {'screen_name': 'Techzim', 'name': 'Techzim', 'id': '82800626'}, {'screen_name': 'RewardKangai', 'name': 'Reward Kangai', 'id': '729294131193876481'}]",,,,
934736452839075840,934467091247218688,2017-11-26 10:51:51 UTC,2017-11-26,10:51:51,0,131882590,arvind_mehra,Arvind Mehra,,@neelammathews Yes - Airvan 10 takes away fuel constraint but regional connectivity does not allow single engine turbines - small point to point connectivity will do wonders in these small planes - a country like Botswana thrives on tourism and these aircraft land on patchy runways -do wonders,en,[],[],[],0,2,3,[],[],https://twitter.com/arvind_mehra/status/934736452839075840,False,,0,,,,,,,,"[{'screen_name': 'neelammathews', 'name': 'neelam mathews', 'id': '101464091'}]",,,,
931164899228741632,931121672849108992,2017-11-16 14:19:46 UTC,2017-11-16,14:19:46,0,337806076,motselisimatsel,Motselisi Matsela,,@lgchefa Mxxxm.. ....it's so sad. What stopped us from dealing with Botswana directly? Maybe infrastructural requirement for connectivity from Lesotho to Botswana?? Thinking loud here.,en,[],[],[],1,0,0,[],[],https://twitter.com/MotselisiMatsel/status/931164899228741632,False,,0,,,,,,,,"[{'screen_name': 'lgchefa', 'name': 'Lehlohonolo Chefa', 'id': '280537946'}]",,,,
930695886702891008,930695886702891008,2017-11-15 07:16:05 UTC,2017-11-15,07:16:05,0,236672654,lead_botswana,LEAD,,Had a great roundtable discussion on Internet Connectivity in Botswana with leaders in the industry from PS and Gov.  Thnx ABC &amp; US Ambass.  https://t.co/DZKQIL8AWr,en,[],[],['https://pbs.twimg.com/media/DOp--e8WkAEjaqL.jpg'],0,2,2,[],[],https://twitter.com/LEAD_Botswana/status/930695886702891008,False,,1,https://pbs.twimg.com/media/DOp--e8WkAEjaqL.jpg,,,,,,,[],,,,
