id,conversation_id,created_at,date,time,timezone,user_id,username,name,place,tweet,language,mentions,urls,photos,replies_count,retweets_count,likes_count,hashtags,cashtags,link,retweet,quote_url,video,thumbnail,near,geo,source,user_rt_id,user_rt,retweet_id,reply_to,retweet_date,translate,trans_src,trans_dest
927124943938179074,927124943938179074,2017-11-05 10:46:26 UTC,2017-11-05,10:46:26,0,820205379044917248,your_botswana,YourBotswana,, https://t.co/CYpHQ1wMkr - BPC in drive to increase electricity connectivity through nationwide solar plants  https://t.co/UiTADXObEH,en,[],['http://yourbotswana.com/index.php/2017/11/05/bpc-in-drive-to-increase-electricity-connectivity-through-nationwide-solar-plants/'],['https://pbs.twimg.com/media/DN3PFhAX4AAQs2z.jpg'],0,0,0,[],[],https://twitter.com/Your_Botswana/status/927124943938179074,False,,1,https://pbs.twimg.com/media/DN3PFhAX4AAQs2z.jpg,,,,,,,[],,,,
924989636337954816,924989636337954816,2017-10-30 13:21:29 UTC,2017-10-30,13:21:29,0,26254137,simonhodson99,Simon Hodson 🇪🇺🏳️‍🌈,,#Botswana connectivity #odos #opendata #openscience  https://t.co/AH06gVmkBR,en,[],[],"['https://pbs.twimg.com/media/DNY5J6BW0AEVeKz.jpg', 'https://pbs.twimg.com/media/DNY5J6HWAAAmQoX.jpg']",0,2,2,"['botswana', 'odos', 'opendata', 'openscience']",[],https://twitter.com/simonhodson99/status/924989636337954816,False,,1,https://pbs.twimg.com/media/DNY5J6BW0AEVeKz.jpg,,,,,,,[],,,,
903527974099701760,903527974099701760,2017-09-01 08:00:30 UTC,2017-09-01,08:00:30,0,214813724,afridigital,Extensia,,KT Rwanda Networks to Provide Broadband Connectivity Solution to Botswana Fiber Networks - Extensia  https://t.co/xfFXB3GhR0,en,[],['http://extensia-ltd.com/kt-rwanda-networks-provide-broadband-connectivity-solution-thailands-advanced-info-service-botswana-fiber-networks/'],[],0,0,0,[],[],https://twitter.com/Afridigital/status/903527974099701760,False,,0,,,,,,,,[],,,,
902096996286201856,902096996286201856,2017-08-28 09:14:18 UTC,2017-08-28,09:14:18,0,900784937321758720,chiaracolizzi,Chiara Colizzi,,The high connectivity to social media in #Botswana makes it a great market for #YAPILI Download the App:  https://t.co/pDurff9nce  https://t.co/8TtcajE8mD,en,[],['https://play.google.com/store/apps/details?id=com.yapili.yapili&hl=en'],['https://pbs.twimg.com/media/DITidsRWAAAxZWd.jpg'],0,0,1,"['botswana', 'yapili']",[],https://twitter.com/ChiaraColizzi/status/902096996286201856,False,,1,https://pbs.twimg.com/media/DITidsRWAAAxZWd.jpg,,,,,,,[],,,,
869901300460343296,869901300460343296,2017-05-31 13:00:06 UTC,2017-05-31,13:00:06,0,804689196149514241,hotspotsbw,Botswana Hotspots,,Botswana Hotspots offers a 24hour connectivity at anytime from all our hotspots across the country. Connect with...  https://t.co/WImIy6Ew3L,en,[],['http://fb.me/4E5KXVkVc'],[],0,0,0,[],[],https://twitter.com/hotspotsbw/status/869901300460343296,False,,0,,,,,,,,[],,,,
865263876547411968,865263876547411968,2017-05-18 17:52:38 UTC,2017-05-18,17:52:38,0,252688418,aiglenoir5,Kivange Egide Aigle,,#SEACOM launches 2 new #PoPs in #Rwanda &amp; #Botswana both landlocked countries relied on costly international #connectivity via #satellite,en,[],[],[],0,1,0,"['seacom', 'pops', 'rwanda', 'botswana', 'connectivity', 'satellite']",[],https://twitter.com/aiglenoir5/status/865263876547411968,False,,0,,,,,,,,[],,,,
862788990998646784,862788990998646784,2017-05-11 21:58:19 UTC,2017-05-11,21:58:19,0,2302022472,modimobw,Andrew,,"RANT: I am the biggest advocator of BOTSWANA Pty Ltd, apparently I have FIBER under the ocean CONNECTIVITY??...  https://t.co/ZZPzwPYwN3",en,[],['http://fb.me/1an3PoRfL'],[],0,0,0,[],[],https://twitter.com/ModimoBW/status/862788990998646784,False,,0,,,,,,,,[],,,,
846374946012102657,846374946012102657,2017-03-27 14:54:46 UTC,2017-03-27,14:54:46,0,804689196149514241,hotspotsbw,Botswana Hotspots,,Even when you are travelling you can still stay connected with Botswana Hotspots. Enjoy connectivity from...  https://t.co/KL5Rs6p9f7,en,[],['http://fb.me/7Fi6JBL78'],[],0,0,0,[],[],https://twitter.com/hotspotsbw/status/846374946012102657,False,,0,,,,,,,,[],,,,
845258925234671616,845258925234671616,2017-03-24 13:00:06 UTC,2017-03-24,13:00:06,0,804689196149514241,hotspotsbw,Botswana Hotspots,,Even when you are travelling you can still stay connected with Botswana Hotspots. Enjoy connectivity from...  https://t.co/VdxletdnS4,en,[],['http://fb.me/1imegpTpF'],[],0,0,0,[],[],https://twitter.com/hotspotsbw/status/845258925234671616,False,,0,,,,,,,,[],,,,
838756490123087873,838756490123087873,2017-03-06 14:21:45 UTC,2017-03-06,14:21:45,0,1058589098,systemoneco,SystemOne,,#Botswana is the 1st country participating in the Deep #Data Dive using information collected from our #GxAlert platform! #connectivity  https://t.co/bGQY6NDyrK,en,[],[],['https://pbs.twimg.com/media/C6PckmPWAAEUfIv.jpg'],1,0,0,"['botswana', 'data', 'gxalert', 'connectivity']",[],https://twitter.com/SystemOneCo/status/838756490123087873,False,,1,https://pbs.twimg.com/media/C6PckmPWAAEUfIv.jpg,,,,,,,[],,,,
829027202989703169,829027202989703169,2017-02-07 18:01:02 UTC,2017-02-07,18:01:02,0,2771312012,afrolutionist,The Afrolutionist,,"""Botswana is not rated by the Global Connectivity Index while other African countries are. We have a lot of work to do."" #FNBBudgetReview",en,[],[],[],0,3,3,['fnbbudgetreview'],[],https://twitter.com/Afrolutionist/status/829027202989703169,False,,0,,,,,,,,[],,,,
821672011902685185,821672011902685185,2017-01-18 10:54:08 UTC,2017-01-18,10:54:08,0,23504561,tumelo2k,Vish(vas),,@ruckuswireless @RuckusChannel @ruckusgirl Ruckus provides Wi-Fi connectivity to Botswana stadia | Botswana  https://t.co/5FGlbIvnHb,en,"[{'screen_name': 'ruckuschannel', 'name': 'ruckus partners', 'id': '2450746544'}, {'screen_name': 'ruckusgirl', 'name': 'jeanette lee', 'id': '41477810'}]",['http://www.biztechafrica.com/article/ruckus-wireless-provides-wi-fi-connectivity-botswa/12102/'],[],0,0,0,[],[],https://twitter.com/tumelo2k/status/821672011902685185,False,,0,,,,,,,,[],,,,
815594863446151169,815594863446151169,2017-01-01 16:25:43 UTC,2017-01-01,16:25:43,0,38263207,keseromeo,🇧🇼 Romeo 🇿🇦 🇱🇸,"{'type': 'Point', 'coordinates': [-28.214776, 28.3206909]}","I enjoyed being in Botswana but the problem is/was internet connectivity, this thing of always going to #Mascom for settings is stressing",en,[],[],[],0,0,0,['mascom'],[],https://twitter.com/KeSeRomeo/status/815594863446151169,False,,0,,,,,,,,[],,,,
814781437312462848,814781296358596608,2016-12-30 10:33:27 UTC,2016-12-30,10:33:27,0,266230824,eminentgrey,Letlhogonolo Moremi,,Botswana internet connectivity is trash,en,[],[],[],0,0,0,[],[],https://twitter.com/EminentGrey/status/814781437312462848,False,,0,,,,,,,,[],,,,
801759351555981312,801759351555981312,2016-11-24 12:08:20 UTC,2016-11-24,12:08:20,0,14260571,thinktankthuto,Think Tank Thuto,,"Singapore leads in ICT and connectivity. So what are the prospects of Botswana, becoming the Singapore of Africa?…  https://t.co/NeVnbX0fzX",en,[],['https://twitter.com/i/web/status/801756777297670144'],[],0,0,0,[],[],https://twitter.com/ThinkTankThuto/status/801759351555981312,False,,0,,,,,,,,[],,,,
801757828335730689,801757828335730689,2016-11-24 12:02:16 UTC,2016-11-24,12:02:16,0,3269430409,tcobw,TCOBW,,"Singapore leads in ICT and connectivity. So what are the prospects of Botswana, becoming the Singapore of Africa?…  https://t.co/GK1EiHr6Wi",en,[],['https://twitter.com/i/web/status/801756777297670144'],[],0,0,0,[],[],https://twitter.com/tcobw/status/801757828335730689,False,,0,,,,,,,,[],,,,
801757558612574208,801757558612574208,2016-11-24 12:01:12 UTC,2016-11-24,12:01:12,0,741290539782283266,mathangwanebwa,Mathangwanebwa,,"Singapore leads in ICT and connectivity. So what are the prospects of Botswana, becoming the Singapore of Africa?…  https://t.co/99ZAvqZ49w",en,[],['https://twitter.com/i/web/status/801756777297670144'],[],0,0,0,[],[],https://twitter.com/mathangwanebwa/status/801757558612574208,False,,0,,,,,,,,[],,,,
801756777297670144,801756777297670144,2016-11-24 11:58:06 UTC,2016-11-24,11:58:06,0,1925935140,yourbih,BIH,,"Singapore leads in ICT and connectivity. So what are the prospects of Botswana, becoming the Singapore of Africa? #GlobalExpoBotswana  https://t.co/sNE4sekFsk",en,[],[],['https://pbs.twimg.com/media/CyBpgZKWIAAKYOY.jpg'],0,0,0,['globalexpobotswana'],[],https://twitter.com/YourBIH/status/801756777297670144,False,,1,https://pbs.twimg.com/media/CyBpgZKWIAAKYOY.jpg,,,,,,,[],,,,
798424485393301504,798424485393301504,2016-11-15 07:16:45 UTC,2016-11-15,07:16:45,0,637048996,portoverview,Port Overview,,Renewed initiatives to promote dry port connectivity between Walvis Bay and Botswana hinterland :  https://t.co/GgZByoTsME,en,[],['http://goo.gl/Y65e7y'],[],0,0,0,[],[],https://twitter.com/PortOverview/status/798424485393301504,False,,0,,,,,,,,[],,,,
797800539090223104,797800539090223104,2016-11-13 13:57:25 UTC,2016-11-13,13:57:25,0,1409739313,zoskimorake,No Human is Limited!,,That guy with the best internet connectivity there is in Botswana  https://t.co/Gj6KZZfiIE,en,[],['https://twitter.com/JoMongalo/status/797800151385600000'],[],0,0,0,[],[],https://twitter.com/ZoskiMorake/status/797800539090223104,False,0,0,,,,,,,,[],,,,
793371781457256448,792568731486543872,2016-11-01 08:39:07 UTC,2016-11-01,08:39:07,0,2850692358,benliquidkenya,Ben Roberts,,That is why the new JV has formed. Connectivity is our business. @EconsultKeith @Botswana @liquidtelecom @BPCBw,en,"[{'screen_name': 'econsultkeith', 'name': 'keith jefferis', 'id': '2200071666'}, {'screen_name': 'botswana', 'name': 'botswana', 'id': '7841202'}, {'screen_name': 'liquidtelecom', 'name': 'liquid telecom', 'id': '3064327593'}, {'screen_name': 'bpcbw', 'name': 'botswana power corp', 'id': '3232875855'}]",[],[],0,0,0,[],[],https://twitter.com/benliquidkenya/status/793371781457256448,False,,0,,,,,,,,[],,,,
756968456600297473,756967072324841472,2016-07-23 21:45:18 UTC,2016-07-23,21:45:18,0,122030990,kinnareads,Kinna Likimani,,@KofiSeySimpson We should move to Botswana where they're working on improving rural connectivity to entice folks to visit villages.,en,[],[],[],1,0,0,[],[],https://twitter.com/kinnareads/status/756968456600297473,False,,0,,,,,,,,"[{'screen_name': 'KofiSeySimpson', 'name': 'Kofi', 'id': '1038113810'}]",,,,
743628640198365186,743628640198365186,2016-06-17 02:17:38 UTC,2016-06-17,02:17:38,0,206647063,sammke_,Samuel,,"Private sector should push connectivity: Botswana’s Minister of Transport and Communication, Tshenolo Mabeo, ...  https://t.co/y2vq9RGUAt",en,[],['http://bit.ly/265eQq8'],[],0,0,0,[],[],https://twitter.com/sammKe_/status/743628640198365186,False,,0,,,,,,,,[],,,,
743433330331254788,743433330331254788,2016-06-16 13:21:32 UTC,2016-06-16,13:21:32,0,1725753668,telecomcameroon,Arnaud Simo,,"Private sector should push connectivity: Botswana’s Minister of Transport and Communication, Tshenolo Mabeo, ...  https://t.co/6AoXFYFWlT",en,[],['http://bit.ly/1Ytxm8T'],[],0,0,0,[],[],https://twitter.com/TelecomCameroon/status/743433330331254788,False,,0,,,,,,,,[],,,,
741306182648750081,741306182648750081,2016-06-10 16:29:01 UTC,2016-06-10,16:29:01,0,1193255372,ais_africa,Africa Internet Summit,,Goodbye #AISbotswana and thanks to our connectivity sponsor  BOFINET #botswana #afrinic24. See you all at the AIS'17!,en,[],[],[],0,1,0,"['aisbotswana', 'botswana', 'afrinic24']",[],https://twitter.com/AIS_Africa/status/741306182648750081,False,,0,,,,,,,,[],,,,
741306182615240704,741306182615240704,2016-06-10 16:29:01 UTC,2016-06-10,16:29:01,0,35525548,afrinic,AFRINIC-The Regional Internet Registry for Africa,,Goodbye #AISbotswana and thanks to our connectivity sponsor  BOFINET #botswana #afrinic24. See you all at the AIS'17!,en,[],[],[],0,1,0,"['aisbotswana', 'botswana', 'afrinic24']",[],https://twitter.com/AFRINIC/status/741306182615240704,False,,0,,,,,,,,[],,,,
738644925038747648,738644925038747648,2016-06-03 08:14:08 UTC,2016-06-03,08:14:08,0,35525548,afrinic,AFRINIC-The Regional Internet Registry for Africa,,Thanks to our #AISbotswana connectivity sponsor  BOFINET #botswana #afrinic24,en,[],[],[],0,1,0,"['aisbotswana', 'botswana', 'afrinic24']",[],https://twitter.com/AFRINIC/status/738644925038747648,False,,0,,,,,,,,[],,,,
738644914850799617,738644914850799617,2016-06-03 08:14:05 UTC,2016-06-03,08:14:05,0,1193255372,ais_africa,Africa Internet Summit,,Thanks to our #AISbotswana connectivity sponsor  BOFINET #botswana #afrinic24,en,[],[],[],0,0,0,"['aisbotswana', 'botswana', 'afrinic24']",[],https://twitter.com/AIS_Africa/status/738644914850799617,False,,0,,,,,,,,[],,,,
731914741929672705,731914741929672705,2016-05-15 18:30:47 UTC,2016-05-15,18:30:47,0,7841202,botswana,Botswana,,"AIS'16 #aisbotswana- ' beyond connectivity: Internet for the development of #Africa ""from 29/05 to 10/06   https://t.co/aC4eOMaxw2",en,[],['https://twitter.com/ais_africa/status/722017619843354624'],[],0,6,2,"['aisbotswana', 'africa']",[],https://twitter.com/Botswana/status/731914741929672705,False,https://twitter.com/ais_africa/status/722017619843354624,0,,,,,,,,[],,,,
723409681868185600,723409681868185600,2016-04-22 07:14:43 UTC,2016-04-22,07:14:43,0,50650343,victorbaatweng,Victor Baatweng,,@Hatab_Botswana  believe that market force can play out the issue if internet connectivity in the industry. #hatabconference,en,[],[],[],0,0,0,['hatabconference'],[],https://twitter.com/VictorBaatweng/status/723409681868185600,False,,0,,,,,,,,[],,,,
723408730922962945,723408730922962945,2016-04-22 07:10:56 UTC,2016-04-22,07:10:56,0,50650343,victorbaatweng,Victor Baatweng,,@Hatab_Botswana  has agreed that internet connectivity should not form part of the grading criteria for tourism facilities. #hatabconference,en,[],[],[],0,0,0,['hatabconference'],[],https://twitter.com/VictorBaatweng/status/723408730922962945,False,,0,,,,,,,,[],,,,
686390030051454976,686390030051454976,2016-01-11 03:31:50 UTC,2016-01-11,03:31:50,0,262861996,thekingkiid,kwame nkrumah,,#Botswana whats the best network provider with regards to data connectivity/prices?,en,[],[],[],0,0,0,['botswana'],[],https://twitter.com/thekingkiid/status/686390030051454976,False,,0,,,,,,,,[],,,,
685462293459648512,685462293459648512,2016-01-08 14:05:20 UTC,2016-01-08,14:05:20,0,636303540,jaftaserero,Jafta Serero,,@orange deploys enhanced connectivity for France's 1st 100% connected stadium. But a donkey cart for Botswana...  https://t.co/2MnE2WCuKU,en,[],[],['https://pbs.twimg.com/media/CYNAUPRUwAA7rNn.jpg'],0,0,0,[],[],https://twitter.com/JaftaSerero/status/685462293459648512,False,,1,https://pbs.twimg.com/media/CYNAUPRUwAA7rNn.jpg,,,,,,,[],,,,
683242607648964608,683242607648964608,2016-01-02 11:05:06 UTC,2016-01-02,11:05:06,0,37663707,designindaba,Design Indaba,,Botswana's Project Kgolagano provides internet connectivity to local hospitals and clinics.  https://t.co/YMuESCxwad  https://t.co/uUxg1qVHSa,en,[],['http://inda.ba/1RDazFF'],['https://pbs.twimg.com/media/CW1RNkfWwAEs1rQ.png'],0,8,2,[],[],https://twitter.com/designindaba/status/683242607648964608,False,,1,https://pbs.twimg.com/media/CW1RNkfWwAEs1rQ.png,,,,,,,[],,,,
673869948012396545,673869948012396545,2015-12-07 14:21:30 UTC,2015-12-07,14:21:30,0,246688128,ya_didim,Yaya♥,,The Y’ello Era: Connectivity for your Enterprise | Botswana Gazette  https://t.co/5j1oWVfthE via @gazettebw,en,"[{'screen_name': 'gazettebw', 'name': 'the botswana gazette', 'id': '1443084667'}]",['http://www.gazettebw.com/?p=13080'],[],0,0,0,[],[],https://twitter.com/Ya_DidiM/status/673869948012396545,False,,0,,,,,,,,[],,,,
671686404888502272,671686404888502272,2015-12-01 13:44:52 UTC,2015-12-01,13:44:52,0,2430630222,tonydos1,TonyDos,,It takes a while for uptake in technology to be specific in Botswana its about two years..Maybe this may change with connectivity,en,[],[],[],0,0,0,[],[],https://twitter.com/TonyDos1/status/671686404888502272,False,,0,,,,,,,,[],,,,
671259477082046464,671259477082046464,2015-11-30 09:28:25 UTC,2015-11-30,09:28:25,0,2597823481,disruptafrica,Disrupt Africa,,Botswana’s Hello Cabs adapts Uber model for connectivity challenges  https://t.co/mLRp2BHqAr,ca,[],['http://disrupt-africa.com/2015/11/botswanas-hello-cabs-adapts-uber-model-for-connectivity-challenges/'],[],0,2,1,[],[],https://twitter.com/DisruptAfrica/status/671259477082046464,False,,0,,,,,,,,[],,,,
669924385818591232,669924385818591232,2015-11-26 17:03:14 UTC,2015-11-26,17:03:14,0,6833082,hsherman,Howard Sherman 😷,,"""Botswana’s Hello Cabs adapts Uber model for connectivity challenges"" via @DisruptAfrica  https://t.co/jAAgURgiMK",ca,"[{'screen_name': 'disruptafrica', 'name': 'disrupt africa', 'id': '2597823481'}]",['http://bit.ly/1TeJBC0'],[],0,0,0,[],[],https://twitter.com/hsherman/status/669924385818591232,False,,0,,,,,,,,[],,,,
669475637782970368,669475637782970368,2015-11-25 11:20:04 UTC,2015-11-25,11:20:04,0,2597823481,disruptafrica,Disrupt Africa,,Botswana’s Hello Cabs adapts Uber model for connectivity challenges  https://t.co/mLRp2BpPbR,ca,[],['http://disrupt-africa.com/2015/11/botswanas-hello-cabs-adapts-uber-model-for-connectivity-challenges/'],[],0,2,1,[],[],https://twitter.com/DisruptAfrica/status/669475637782970368,False,,0,,,,,,,,[],,,,
669420517061959681,669420517061959681,2015-11-25 07:41:03 UTC,2015-11-25,07:41:03,0,107755674,africatechie,Rebecca Enonchong,,Botswana’s Hello Cabs adapts Uber model for connectivity challenges  https://t.co/Gv23Mozxxq,ca,[],['http://appste.ch/1MQI0hB'],[],0,5,6,[],[],https://twitter.com/africatechie/status/669420517061959681,False,,0,,,,,,,,[],,,,
669418934584664064,669418934584664064,2015-11-25 07:34:45 UTC,2015-11-25,07:34:45,0,3972057172,hcteuk,High Court Taxi Enfo,,Africa Botswana's Hello Cabs adapts Uber model for connectivity challenges  https://t.co/RjIaXOO0av #ubered,ca,[],['http://bit.ly/1T2GIUk'],[],0,0,0,['ubered'],[],https://twitter.com/HCTEuk/status/669418934584664064,False,,0,,,,,,,,[],,,,
669418932453945344,669418932453945344,2015-11-25 07:34:45 UTC,2015-11-25,07:34:45,0,3972057172,hcteuk,High Court Taxi Enfo,,Botswana's Hello Cabs adapts Uber model for connectivity challenges  https://t.co/otc59LTULO #ubered,ca,[],['http://bit.ly/1T2GFHZ'],[],0,0,0,['ubered'],[],https://twitter.com/HCTEuk/status/669418932453945344,False,,0,,,,,,,,[],,,,
669404412897533952,669404412897533952,2015-11-25 06:37:03 UTC,2015-11-25,06:37:03,0,3294328558,bitnaija,#bitnaija,,Botswana’s Hello Cabs adapts Uber model for connectivity challenges: Botswanan taxi hailing app Hell...  https://t.co/wgbonIrlxB #Bitnaija,en,[],['http://bit.ly/1HlQlNk'],[],0,0,0,['bitnaija'],[],https://twitter.com/bitnaija/status/669404412897533952,False,,0,,,,,,,,[],,,,
669404400566292480,669404400566292480,2015-11-25 06:37:00 UTC,2015-11-25,06:37:00,0,2241021001,dpighana,DPI Ghana,,Botswana’s Hello Cabs adapts Uber model for connectivity challenges: Botswanan taxi hailing app Hello Cabs bel...  https://t.co/Pwk9HrKcWD,en,[],['http://bit.ly/1HlQlNk'],[],0,0,0,[],[],https://twitter.com/dpighana/status/669404400566292480,False,,0,,,,,,,,[],,,,
669400233009352704,669400233009352704,2015-11-25 06:20:27 UTC,2015-11-25,06:20:27,0,892792496,263chat,263Chat.com 🇿🇼,,Botswana’s Hello Cabs adapts Uber model for connectivity challenges  https://t.co/zBeP6kyCHK #DisruptAfrica #Tech #263Chat,ca,[],['http://ift.tt/1lgZ09x'],[],0,0,0,"['disruptafrica', 'tech', '263chat']",[],https://twitter.com/263Chat/status/669400233009352704,False,,0,,,,,,,,[],,,,
669395613331525632,669395613331525632,2015-11-25 06:02:05 UTC,2015-11-25,06:02:05,0,2597823481,disruptafrica,Disrupt Africa,,Botswana’s Hello Cabs adapts Uber model for connectivity challenges  https://t.co/mLRp2BpPbR @hellocabs @SCDube,ca,"[{'screen_name': 'hellocabs', 'name': 'hello cabs', 'id': '68500115'}, {'screen_name': 'scdube', 'name': 'sc dube', 'id': '819144703694307329'}]",['http://disrupt-africa.com/2015/11/botswanas-hello-cabs-adapts-uber-model-for-connectivity-challenges/'],[],0,6,7,[],[],https://twitter.com/DisruptAfrica/status/669395613331525632,False,,0,,,,,,,,[],,,,
662195320315625472,662195320315625472,2015-11-05 09:10:42 UTC,2015-11-05,09:10:42,0,481917775,energystcat,Energyst CAT Rental,,#SAPP plans new South Africa-Botswana #power transmission line  to enhance connectivity &amp; #electricity trading for Southern African region.,en,[],[],[],0,0,0,"['sapp', 'power', 'electricity']",[],https://twitter.com/EnergystCAT/status/662195320315625472,False,,0,,,,,,,,[],,,,
644455805194911744,644455805194911744,2015-09-17 10:20:12 UTC,2015-09-17,10:20:12,0,392081064,dtnbotswana,DTN Botswana,,DTN Botswana: ICT Use Demand Rises: [Botswana Daily News] Kasane -Connectivity has become the difference betwe...  http://t.co/AjlFuaR0dX,en,[],['http://bit.ly/1P2e18a'],[],0,0,0,[],[],https://twitter.com/DTNBotswana/status/644455805194911744,False,,0,,,,,,,,[],,,,
644455795220873216,644455795220873216,2015-09-17 10:20:09 UTC,2015-09-17,10:20:09,0,392081064,dtnbotswana,DTN Botswana,,DTN Botswana: ICT Use Demand Rises: [Botswana Daily News] Kasane -Connectivity has become the difference betwe...  http://t.co/RcILbN4voH,en,[],['http://bit.ly/1P2dZNJ'],[],0,0,0,[],[],https://twitter.com/DTNBotswana/status/644455795220873216,False,,0,,,,,,,,[],,,,
641551080611008512,641551080611008512,2015-09-09 09:57:51 UTC,2015-09-09,09:57:51,0,3432448485,dentalstudiobw,Seema Chawla,,Power cuts blamed for slow internet connectivity - #Botswana  http://t.co/2x6r0CdLO4  http://t.co/Dh5IgkvEp7,en,[],['http://ow.ly/RYeZ2'],['https://pbs.twimg.com/media/COc_Tv2W8AAPF4Z.jpg'],0,0,0,['botswana'],[],https://twitter.com/DentalStudioBW/status/641551080611008512,False,,1,https://pbs.twimg.com/media/COc_Tv2W8AAPF4Z.jpg,,,,,,,[],,,,
626737712733798400,626737712733798400,2015-07-30 12:54:49 UTC,2015-07-30,12:54:49,0,1635363439,bushwayssafaris,Bush Ways Safaris,,Poor flight and internet connectivity blight Botswana’s tourism! @Botswana  http://t.co/8XJDhoPdF5,en,"[{'screen_name': 'botswana', 'name': 'botswana', 'id': '7841202'}]",['http://en.starafrica.com/news/poor-flight-and-internet-connectivity-blight-botswanas-tourism.html'],[],0,0,0,[],[],https://twitter.com/BushWaysSafaris/status/626737712733798400,False,,0,,,,,,,,[],,,,
626529654090797057,626529654090797057,2015-07-29 23:08:04 UTC,2015-07-29,23:08:04,0,289415319,botswana_tours,Botswana tours,,Poor flight and internet connectivity blight Botswana's tourism -  http://t.co/Jd8SMR5f4X  http://t.co/WlsZIJdPkE,en,[],"['http://StarAfrica.com', 'http://dlvr.it/Bh4j1d']",[],0,0,0,[],[],https://twitter.com/Botswana_tours/status/626529654090797057,False,,0,,,,,,,,[],,,,
626423363531976704,626423363531976704,2015-07-29 16:05:42 UTC,2015-07-29,16:05:42,0,1584343075,wepushcontent,WPC,,Poor flight and internet connectivity blight Botswana’s tourism #Africa #business  http://t.co/77sKbo0dpd @afrinnovator,en,"[{'screen_name': 'afrinnovator', 'name': 'africa business', 'id': '89423018'}]",['http://dlvr.it/Bgwr6k'],[],0,0,0,"['africa', 'business']",[],https://twitter.com/WePushContent/status/626423363531976704,False,,0,,,,,,,,[],,,,
626389572608397312,626389572608397312,2015-07-29 13:51:26 UTC,2015-07-29,13:51:26,0,619014898,apa_news,APANEWS,,"Poor flight and internet connectivity blight Botswana's tourism: - ENGLISH  /  BOTSWANA | BOTSWANA,  ECONOMIE ...  http://t.co/mFD5KL5ybz",en,[],['http://bit.ly/1h4UWqR'],[],0,0,0,[],[],https://twitter.com/apa_news/status/626389572608397312,False,,0,,,,,,,,[],,,,
623387681825890304,623382940077133824,2015-07-21 07:02:59 UTC,2015-07-21,07:02:59,0,239878430,lordelvo,Khumoitsile Wealthsmith,,"@CurateBW Maitlamo has 7 pillars, Government online (e-Government), Connecting Botswana, Connectivity Laws &amp; Policy (e-Legislation)...",en,[],[],[],0,0,0,[],[],https://twitter.com/LordElvo/status/623387681825890304,False,,0,,,,,,,,[],,,,
608314688552759296,608314688552759296,2015-06-09 16:48:18 UTC,2015-06-09,16:48:18,0,63524348,epysamson,Epic,,"Yall are better. In Botswana it takes 2 hours to download 1GB ""@uZamo_: The excuses for poor internet connectivity in RSA always get to me""",en,[],[],[],0,0,0,[],[],https://twitter.com/epysamson/status/608314688552759296,False,,0,,,,,,,,[],,,,
603862581141463040,603862581141463040,2015-05-28 09:57:13 UTC,2015-05-28,09:57:13,0,255925055,apo_source,APO Group English,,".@PCCWGlobal’ cross-border optimal #connectivity includes #Malawi,#Tanzania,#Kenya,#Zambia,#Botswana,#Namibia,...  http://t.co/LLz70y8yJA",en,"[{'screen_name': 'pccwglobal', 'name': 'pccw global', 'id': '448493314'}]",['http://www.apo.af/ElUivD'],[],0,0,0,"['connectivity', 'malawi', 'tanzania', 'kenya', 'zambia', 'botswana', 'namibia']",[],https://twitter.com/APO_source/status/603862581141463040,False,,0,,,,,,,,[],,,,
600001677123579906,600001677123579906,2015-05-17 18:15:21 UTC,2015-05-17,18:15:21,0,403093403,usaid_digital,USAID Digital,,Got 3 minutes? Check out how connectivity innovations are improving health services through telemedicine in Botswana  http://t.co/ZYBqeFzkQa,en,[],['http://mediadl.microsoft.com/mediadl/www/m/middleeast/4afrika/Botswana_TVWS.mp4'],[],1,2,2,[],[],https://twitter.com/USAID_Digital/status/600001677123579906,False,,0,,,,,,,,[],,,,
593343224632193024,593343224632193024,2015-04-29 09:17:03 UTC,2015-04-29,09:17:03,0,2247268026,mmasekgoam,Masire-Mwamba,,"Botswana from a land-locked to a land-linked country,transport, connectivity,national strategy.#diversification #vision2016 #competitiveness",en,[],[],[],0,5,3,"['diversification', 'vision2016', 'competitiveness']",[],https://twitter.com/mmasekgoam/status/593343224632193024,False,,0,,,,,,,,[],,,,
