id,conversation_id,created_at,date,time,timezone,user_id,username,name,place,tweet,language,mentions,urls,photos,replies_count,retweets_count,likes_count,hashtags,cashtags,link,retweet,quote_url,video,thumbnail,near,geo,source,user_rt_id,user_rt,retweet_id,reply_to,retweet_date,translate,trans_src,trans_dest
1164161043200991232,1164161043200991232,2019-08-21 13:03:16 UTC,2019-08-21,13:03:16,0,291098738,niiafoteyquaye,Ing. Nii Afotey Kwei 🇬🇭🇬🇭🇬🇭,,"#WithAllDueRespect GUESS WHAT, in this village the ONLY place to get reception is to place your cellphone in the small sachet hanging under this shed on the rosewood trees cut into benches. It is a border town between Ghana and Burkina Faso.   Cc:   MTNGhana Vodafone Ghana",en,[],[],[],0,0,0,['withallduerespect'],[],https://twitter.com/niiafoteyquaye/status/1164161043200991232,False,,0,,,,,,,,[],,,,
1164159041888800770,1164159041888800770,2019-08-21 12:55:19 UTC,2019-08-21,12:55:19,0,1124075001689378816,mahamababella,Bella 🇬🇭,,"#WithAllDueRespect GUESS WHAT, in this village the ONLY place to get reception is to place your cellphone in the small sachet hanging under this shed on the rosewood trees cut into benches. It is a border town between Ghana and Burkina Faso.   Cc:   MTNGhana Vodafone Ghana",en,[],[],[],1,0,0,['withallduerespect'],[],https://twitter.com/MahamabaBella/status/1164159041888800770,False,,0,,,,,,,,[],,,,
1164156101132206081,1164156101132206081,2019-08-21 12:43:38 UTC,2019-08-21,12:43:38,0,1106086023124135936,amatailor,Ama Corona 🇬🇭 🇬🇭 🇬🇭,,"#WithAllDueRespect GUESS WHAT, in this village the ONLY place to get reception is to place your cellphone in the small sachet hanging under this shed on the rosewood trees cut into benches. It is a border town between Ghana and Burkina Faso.   Cc:   MTNGhana Vodafone Ghana",en,[],[],[],0,0,1,['withallduerespect'],[],https://twitter.com/AmaTailor/status/1164156101132206081,False,,0,,,,,,,,[],,,,
1164155043681116160,1164155043681116160,2019-08-21 12:39:26 UTC,2019-08-21,12:39:26,0,17406917,elikemkotoko,Elikem E. K. Kotoko 🇬🇭,,"GUESS WHAT, in this village the ONLY place to get reception is to place your cellphone in the small sachet hanging under this shed on the rosewood trees cut into benches. It is a border town between Ghana and Burkina Faso.   Cc:   @MTNGhana Vodafone Ghana",en,"[{'screen_name': 'mtnghana', 'name': 'mtn ghana', 'id': '226493139'}]",[],[],3,1,8,[],[],https://twitter.com/ElikemKotoko/status/1164155043681116160,False,,0,,,,,,,,[],,,,
1092708154763288578,1092708154763288578,2019-02-05 08:55:00 UTC,2019-02-05,08:55:00,0,2255184786,pm4action,Performance Monitoring for Action,,"Fascinating! New #research finds women in #BurkinaFaso who own a #cellphone are more likely to report modern #contraceptive use, and method mix among cell phone owners is more diverse.  https://t.co/sYuHMH7PzF #familyplanning #contraception #populationsurvey #mobiletech #research  https://t.co/il5LHmwYqV",en,[],['https://bit.ly/2S5zppc'],['https://pbs.twimg.com/media/DyhKMitWoAA1IV6.jpg'],0,1,3,"['research', 'burkinafaso', 'cellphone', 'contraceptive', 'familyplanning', 'contraception', 'populationsurvey', 'mobiletech', 'research']",[],https://twitter.com/PM4Action/status/1092708154763288578,False,,1,https://pbs.twimg.com/media/DyhKMitWoAA1IV6.jpg,,,,,,,[],,,,
1040100423766564864,1040100423766564864,2018-09-13 04:50:39 UTC,2018-09-13,04:50:39,0,4051049297,mrwolfgangpt,🅼🆁.🆆🅾🅻🅵🅶🅰🅽🅶,,Everybody and their mother in the cellphone industry makes phones with dual Sim capacity because smart. Only #apple in their infinite wisdom insert a normal Sim and a fuckin eSim into their new phones that doesnt even get a subscription plan here(central Europe not Burkina Faso),en,[],[],[],1,0,1,['apple'],[],https://twitter.com/MrWolfgangPT/status/1040100423766564864,False,,0,,,,,,,,[],,,,
931582760484995073,931560387673317381,2017-11-17 18:00:12 UTC,2017-11-17,18:00:12,0,89327703,harlingg,Guy Harling,,"@leecrawfurd All of the above, indeed. The best unique identifier I've found to date: last four digits of cellphone number (yours, your family's). But even that is likely to be limited in rural Burkina Faso, for e.g.",en,[],[],[],1,0,0,[],[],https://twitter.com/harlingg/status/931582760484995073,False,,0,,,,,,,,"[{'screen_name': 'leecrawfurd', 'name': 'Lee Crawfurd', 'id': '51403755'}]",,,,
837733312546418688,837733312546418688,2017-03-03 18:36:00 UTC,2017-03-03,18:36:00,0,17951262,mehulkamdar,Very Old Man,,Scammer from #BurkinaFaso uses @gmail ID: westernunion2506@gmail.com when he doesn't use his cellphone # 229 68 99 3819,en,"[{'screen_name': 'gmail', 'name': 'gmail', 'id': '38679388'}]",[],[],0,0,0,['burkinafaso'],[],https://twitter.com/mehulkamdar/status/837733312546418688,False,,0,,,,,,,,[],,,,
692766104800907268,692766104800907268,2016-01-28 17:48:05 UTC,2016-01-28,17:48:05,0,38778248,colinfreeze,Colin Freeze,,"... @geoffreyyork either that, or they just asked the Burkina Faso equivalent of Bell for a cellphone ""tower dump""",en,"[{'screen_name': 'geoffreyyork', 'name': 'geoffrey york', 'id': '42953038'}]",[],[],1,0,1,[],[],https://twitter.com/Colinfreeze/status/692766104800907268,False,,0,,,,,,,,[],,,,
691729008317370368,691729008317370368,2016-01-25 21:07:01 UTC,2016-01-25,21:07:01,0,2979440313,fveydocs,FVEYdocs.org,,"""RCMP use cellphone data in bid to find Burkina Faso attackers ""  https://t.co/c4zhnP1JMQ by @geoffreyyork in @globeandmail",en,"[{'screen_name': 'geoffreyyork', 'name': 'geoffrey york', 'id': '42953038'}, {'screen_name': 'globeandmail', 'name': 'the globe and mail', 'id': '8736882'}]",['http://www.theglobeandmail.com/news/world/rcmp-using-cellphone-data-in-bid-to-track-down-burkina-faso-attackers/article28367071/'],[],0,0,0,[],[],https://twitter.com/fveydocs/status/691729008317370368,False,,0,,,,,,,,[],,,,
691723951114973185,691723951114973185,2016-01-25 20:46:56 UTC,2016-01-25,20:46:56,0,21483809,treadstone71llc,Treadstone 71,,RCMP use cellphone data in bid to find Burkina Faso attackers  https://t.co/y9NimeDg6L  https://t.co/Mt61Yt3z62,en,[],['http://algo.fyi/1284ad'],['https://pbs.twimg.com/media/CZl_RL4WQAA_1-q.jpg'],0,0,1,[],[],https://twitter.com/Treadstone71LLC/status/691723951114973185,False,,1,https://pbs.twimg.com/media/CZl_RL4WQAA_1-q.jpg,,,,,,,[],,,,
691704411933036544,691704411933036544,2016-01-25 19:29:17 UTC,2016-01-25,19:29:17,0,206959312,zubeirb,ZubeirB,,#RCMP use cellphone data in bid to find Burkina Faso attackers  https://t.co/fTiwO0cEAY #CDNpoli #Canada #BurkinaFaso #Ouagadougou #Africa,en,[],['http://fw.to/iPDvkAk'],[],0,0,0,"['rcmp', 'cdnpoli', 'canada', 'burkinafaso', 'ouagadougou', 'africa']",[],https://twitter.com/ZubeirB/status/691704411933036544,False,,0,,,,,,,,[],,,,
691653972923420672,691653972923420672,2016-01-25 16:08:52 UTC,2016-01-25,16:08:52,0,258110148,timmspat,Pat Timms 🇨🇦 🇬🇷,,RCMP use cellphone data in bid to find Burkina Faso attackers  https://t.co/TF8qDnXltF,en,[],['http://fw.to/C5YTINl'],[],0,0,0,[],[],https://twitter.com/timmspat/status/691653972923420672,False,,0,,,,,,,,[],,,,
691644170327474176,691644170327474176,2016-01-25 15:29:54 UTC,2016-01-25,15:29:54,0,513251462,markb10043160,Mark B 🇨🇦🇩🇪,,RCMP use cellphone data in bid to find Burkina Faso attackers  https://t.co/fO9yE0ELfI,en,[],['http://fw.to/C5YTINl'],[],0,0,0,[],[],https://twitter.com/MarkB10043160/status/691644170327474176,False,,0,,,,,,,,[],,,,
691626964122087428,691626964122087428,2016-01-25 14:21:32 UTC,2016-01-25,14:21:32,0,16272844,johangreg,Greg Johansen 🏳️‍🌈🎾🇨🇦(🏠294),"{'type': 'Point', 'coordinates': [51.043478, -114.105744]}",#RCMP use cellphone data in bid to find #BurkinaFaso attackers  https://t.co/sC77rWEnBy,en,[],['http://www.theglobeandmail.com/news/world/rcmp-using-cellphone-data-in-bid-to-track-down-burkina-faso-attackers/article28367071/'],[],0,0,0,"['rcmp', 'burkinafaso']",[],https://twitter.com/johangreg/status/691626964122087428,False,,0,,,,,,,,[],,,,
691624555836678145,691624555836678145,2016-01-25 14:11:58 UTC,2016-01-25,14:11:58,0,18449371,iirss_global,"Dr. Abbee Corb, CMAS",,RCMP use cellphone data in bid to find Burkina Faso attackers  https://t.co/yNZ0BD82ng,en,[],['http://fw.to/C5YTINl'],[],0,0,0,[],[],https://twitter.com/IIRSS_Global/status/691624555836678145,False,,0,,,,,,,,[],,,,
691612233915326464,691612233915326464,2016-01-25 13:23:00 UTC,2016-01-25,13:23:00,0,135847759,maryse1403,Maryse Beaupré,,RCMP use cellphone data in bid to find Burkina Faso attackers  https://t.co/1873AIlaBZ,en,[],['http://fw.to/C5YTINl'],[],0,0,0,[],[],https://twitter.com/Maryse1403/status/691612233915326464,False,,0,,,,,,,,[],,,,
691603130170109952,691603130170109952,2016-01-25 12:46:50 UTC,2016-01-25,12:46:50,0,8736882,globeandmail,The Globe and Mail,,RCMP use cellphone data in bid to find Burkina Faso attackers  https://t.co/kEiVES4vSb from @geoffreyyork  https://t.co/RxuFJqDTRl,en,"[{'screen_name': 'geoffreyyork', 'name': 'geoffrey york', 'id': '42953038'}]",['http://trib.al/i8X3G7f'],['https://pbs.twimg.com/media/CZkRYb6WYAEytWN.jpg'],1,7,1,[],[],https://twitter.com/globeandmail/status/691603130170109952,False,,1,https://pbs.twimg.com/media/CZkRYb6WYAEytWN.jpg,,,,,,,[],,,,
691598311082627072,691598311082627072,2016-01-25 12:27:41 UTC,2016-01-25,12:27:41,0,88729890,antoinebluebear,Antoine Normand,,RCMP use cellphone data in bid to find Burkina Faso attackers  https://t.co/C10pYkeeRl,en,[],['http://fw.to/C5YTINl'],[],0,0,1,[],[],https://twitter.com/antoinebluebear/status/691598311082627072,False,,0,,,,,,,,[],,,,
691596780585119744,691596780585119744,2016-01-25 12:21:36 UTC,2016-01-25,12:21:36,0,2931673021,commmeci,Commme Ça,,RCMP use cellphone data..find Burkina Faso attackers /via @globeandmail  https://t.co/xjEOKYRbYM WHY DOES RCMP EXPOSE INVESTIGATIVE DETAILS??,en,"[{'screen_name': 'globeandmail', 'name': 'the globe and mail', 'id': '8736882'}]",['http://www.theglobeandmail.com/news/world/rcmp-using-cellphone-data-in-bid-to-track-down-burkina-faso-attackers/article28367071/?utm_source=twitter.com&utm_medium=Referrer:+Social+Network+/+Media&utm_campaign=Shared+Web+Article+Links'],[],0,0,0,[],[],https://twitter.com/commmeci/status/691596780585119744,False,,0,,,,,,,,[],,,,
691594006560673792,691594006560673792,2016-01-25 12:10:35 UTC,2016-01-25,12:10:35,0,47459386,danlebla,Daniel Leblanc,,RCMP use cellphone data in bid to find Burkina Faso attackers  https://t.co/7hP2Mfnzt6 via @geoffreyyork,en,"[{'screen_name': 'geoffreyyork', 'name': 'geoffrey york', 'id': '42953038'}]",['http://tgam.ca/EN2n'],[],0,1,0,[],[],https://twitter.com/danlebla/status/691594006560673792,False,,0,,,,,,,,[],,,,
691511058154942464,691511058154942464,2016-01-25 06:40:58 UTC,2016-01-25,06:40:58,0,55693536,debbydonnelly,Debborah Donnelly,,#RCMP use cellphone data in bid to find Burkina Faso attackers - good!  Use what you can to find justice!  https://t.co/r9yOlfvt1t,en,[],['http://www.theglobeandmail.com/news/world/rcmp-using-cellphone-data-in-bid-to-track-down-burkina-faso-attackers/article28367071/'],[],0,0,0,['rcmp'],[],https://twitter.com/DebbyDonnelly/status/691511058154942464,False,,0,,,,,,,,[],,,,
691453730596786176,691453730596786176,2016-01-25 02:53:10 UTC,2016-01-25,02:53:10,0,3300872831,24365news_de,24365News Canada,,RCMP use cellphone data in bid to find Burkina Faso attackers has been published in  on  https://t.co/8bpTQ78zI5,en,[],['http://goo.gl/Cw44bA'],[],0,0,0,[],[],https://twitter.com/24365News_DE/status/691453730596786176,False,,0,,,,,,,,[],,,,
691441900444868608,691441900444868608,2016-01-25 02:06:10 UTC,2016-01-25,02:06:10,0,8736882,globeandmail,The Globe and Mail,,RCMP using cellphone data in bid to track down Burkina Faso attackers  https://t.co/mfbOX1ri09,en,[],['http://trib.al/6fndKH0'],[],0,11,13,[],[],https://twitter.com/globeandmail/status/691441900444868608,False,,0,,,,,,,,[],,,,
691441571921813505,691441571921813505,2016-01-25 02:04:51 UTC,2016-01-25,02:04:51,0,3300872831,24365news_de,24365News Canada,,RCMP using cellphone data in bid to track down Burkina Faso attackers has been published in  on  https://t.co/NGX0V46vbG,en,[],['http://goo.gl/GNEjEr'],[],0,0,0,[],[],https://twitter.com/24365News_DE/status/691441571921813505,False,,0,,,,,,,,[],,,,
691440655600635904,691440655600635904,2016-01-25 02:01:13 UTC,2016-01-25,02:01:13,0,4000080152,thedonologues,The Donologues,,RCMP using cellphone data in bid to track down Burkina Faso attackers - The Globe and Mail  https://t.co/SSi2HcYRmb,en,[],['http://ow.ly/3aw3jr'],[],0,0,0,[],[],https://twitter.com/thedonologues/status/691440655600635904,False,,0,,,,,,,,[],,,,
460514723860316161,460514723860316161,2014-04-27 20:24:00 UTC,2014-04-27,20:24:00,0,14338960,geoffdahl,Geoff Dahl,,Burkina Faso's watchdog fines cellphone firms $12 million for poor service  http://t.co/TsHpYrhAgI,en,[],['http://buff.ly/1iqSR7k'],[],0,0,0,[],[],https://twitter.com/geoffdahl/status/460514723860316161,False,,0,,,,,,,,[],,,,
459437063184453633,459437063184453633,2014-04-24 21:01:46 UTC,2014-04-24,21:01:46,0,2278469449,mobiletabletbuy,Mobile Tablet,,Burkina watchdog fines cellphone firms $12 million for poor service: OUAGADOUGOU (Reuters) - Burkina Faso's co...  http://t.co/fGSmKgJ3pw,en,[],['http://binged.it/1fvh1HT'],[],0,0,0,[],[],https://twitter.com/mobiletabletbuy/status/459437063184453633,False,,0,,,,,,,,[],,,,
459435358313119746,459435358313119746,2014-04-24 20:54:59 UTC,2014-04-24,20:54:59,0,1201216794,dope_oracle,WORLD NEWS NOW,,Burkina watchdog fines cellphone firms $12 million for poor service: OUAGADOUGOU (Reuters) - Burkina Faso's co...  http://t.co/VLP7ijQmGA,en,[],['http://tinyurl.com/ko75ykl'],[],0,0,0,[],[],https://twitter.com/Dope_Oracle/status/459435358313119746,False,,0,,,,,,,,[],,,,
459427214019145729,459427214019145729,2014-04-24 20:22:38 UTC,2014-04-24,20:22:38,0,171670963,ifollowbkyo,Sponge,,Burkina watchdog fines cellphone firms $12 million for poor service: OUAGADOUGOU (Reuters) - Burkina Faso's co...  http://t.co/H1SpQLquyG,en,[],['http://bit.ly/1jHQRCZ'],[],0,0,0,[],[],https://twitter.com/IFollowBkYo/status/459427214019145729,False,,0,,,,,,,,[],,,,
415107242514321408,415107242514321408,2013-12-23 13:10:53 UTC,2013-12-23,13:10:53,0,265090025,sawbosm,SAWBO,,@SAWBOsm #cellphone  #Animation #natural #insecticide #neem #organic #farming #San for #Burkina Faso download free@  http://t.co/f8XwSGysA4,en,[],['http://sawbo-illinois.org/mobile/project.php?name=NEEM01&language=SBD'],[],0,0,0,"['cellphone', 'animation', 'natural', 'insecticide', 'neem', 'organic', 'farming', 'san', 'burkina']",[],https://twitter.com/SAWBOsm/status/415107242514321408,False,,0,,,,,,,,[],,,,
413270356279832577,413270356279832577,2013-12-18 11:31:45 UTC,2013-12-18,11:31:45,0,265090025,sawbosm,SAWBO,,@SAWBOsm #cellphone #3gp #Animation #natural #insecticide #neem #organic #Mossi #Moore #BurkinaFaso download free@  http://t.co/MAb7m5dY2I,en,[],['http://sawbo-illinois.org/mobile/project.php?name=NEEM01&language=MOS'],[],0,0,0,"['cellphone', '3gp', 'animation', 'natural', 'insecticide', 'neem', 'organic', 'mossi', 'moore', 'burkinafaso']",[],https://twitter.com/SAWBOsm/status/413270356279832577,False,,0,,,,,,,,[],,,,
409627536436371458,409627536436371458,2013-12-08 10:16:29 UTC,2013-12-08,10:16:29,0,265090025,sawbosm,SAWBO,,@SAWBOsm #cellphone #3gp #Animation #natural #insecticide from #neem in #Fulfulde for #BurkinaFaso for free @  http://t.co/dY7f3OGbAb,en,[],['http://sawbo-illinois.org/mobile/project.php?name=NEEM01&language=FUH'],[],0,2,1,"['cellphone', '3gp', 'animation', 'natural', 'insecticide', 'neem', 'fulfulde', 'burkinafaso']",[],https://twitter.com/SAWBOsm/status/409627536436371458,False,,0,,,,,,,,[],,,,
408977240471252992,408977240471252992,2013-12-06 15:12:27 UTC,2013-12-06,15:12:27,0,265090025,sawbosm,SAWBO,,@SAWBOsm #cellphone #3gp #Animation #natural #insecticide from #neem in #Dioula for #Burkina #Faso for free @  http://t.co/6xMEZOZVXY,en,[],['http://sawbo-illinois.org/mobile/project.php?name=NEEM01&language=DYU'],[],0,0,0,"['cellphone', '3gp', 'animation', 'natural', 'insecticide', 'neem', 'dioula', 'burkina', 'faso']",[],https://twitter.com/SAWBOsm/status/408977240471252992,False,,0,,,,,,,,[],,,,
408145440580714496,408145440580714496,2013-12-04 08:07:10 UTC,2013-12-04,08:07:10,0,265090025,sawbosm,SAWBO,,@SAWBOsm #cellphone #3gp #Animation #natural #insecticide from #neem in #Mossi / #Moore for #Burkina #Faso for free @  http://t.co/MAb7m5dY2I,en,[],['http://sawbo-illinois.org/mobile/project.php?name=NEEM01&language=MOS'],[],0,2,0,"['cellphone', '3gp', 'animation', 'natural', 'insecticide', 'neem', 'mossi', 'moore', 'burkina', 'faso']",[],https://twitter.com/SAWBOsm/status/408145440580714496,False,,0,,,,,,,,[],,,,
299204551700013057,299204551700013057,2013-02-06 17:14:58 UTC,2013-02-06,17:14:58,0,402724588,gotvkenya,GOtvKenya,,Reminder- @OrangeKenya is giving away a cellphone for a correct prediction on the 2nd semifinal (Burkina Faso v Ghana)(KO 9PM) #GOtvSports,en,"[{'screen_name': 'orangekenya', 'name': 'orange kenya', 'id': '861583283771060224'}]",[],[],2,1,0,['gotvsports'],[],https://twitter.com/GOtvKenya/status/299204551700013057,False,,0,,,,,,,,[],,,,
299202709813350400,299202709813350400,2013-02-06 17:07:39 UTC,2013-02-06,17:07:39,0,395194959,dstv_kenya,DStv Kenya,,Nobody got the predictions right. So for the 2nd match courtesy @OrangeKenya predict Burkina Faso v Ghana to win the cellphone #DStvSports,en,"[{'screen_name': 'orangekenya', 'name': 'orange kenya', 'id': '861583283771060224'}]",[],[],16,0,0,['dstvsports'],[],https://twitter.com/DStv_Kenya/status/299202709813350400,False,,0,,,,,,,,[],,,,
299186260470280192,299186260470280192,2013-02-06 16:02:17 UTC,2013-02-06,16:02:17,0,402724588,gotvkenya,GOtvKenya,,Reminder; @OrangeKenya is giving away a cellphone for a correct prediction on the 2nd semifinal (Burkina Faso v Ghana)(KO 9PM) #GOtvSports.,en,"[{'screen_name': 'orangekenya', 'name': 'orange kenya', 'id': '861583283771060224'}]",[],[],1,0,0,['gotvsports'],[],https://twitter.com/GOtvKenya/status/299186260470280192,False,,0,,,,,,,,[],,,,
257561463974133760,257561463974133760,2012-10-14 19:20:12 UTC,2012-10-14,19:20:12,0,40559520,ampasteve,ampa steve,,Least watchd! RT @AfroEgysoccer: Burkina Faso v CA Republic looks like a seventies game....Erm...Game seemed to be filmed by a cellphone....,en,[],[],[],0,0,0,[],[],https://twitter.com/ampasteve/status/257561463974133760,False,,0,,,,,,,,[],,,,
257560680281042944,257560680281042944,2012-10-14 19:17:06 UTC,2012-10-14,19:17:06,0,371251860,lotfiwada,Lotfi Wada,,Burkina Faso v CA Republic looks like a seventies game....Erm...Game seemed to be filmed by a cellphone....,en,[],[],[],1,0,0,[],[],https://twitter.com/LotfiWada/status/257560680281042944,False,,0,,,,,,,,[],,,,
84133179157520384,84019145980645376,2011-06-24 05:38:07 UTC,2011-06-24,05:38:07,0,203933632,kufamotsa,GM,,@NickKristof my observation Nick is the cellphone guys do a better job in service delivery 4all than the burkina faso government!,en,[],[],[],0,0,0,[],[],https://twitter.com/kufamotsa/status/84133179157520384,False,,0,,,,,,,,[],,,,
78410427498889216,78410427498889216,2011-06-08 10:37:57 UTC,2011-06-08,10:37:57,0,18647850,daniellecass,Danielle Cass,,Witnessed in taxi to #hcdc: Burkina Faso cab driver with textbook in lap teaching his American-born son algebra exponents via cellphone,en,[],[],[],0,1,0,['hcdc'],[],https://twitter.com/daniellecass/status/78410427498889216,False,,0,,,,,,,,[],,,,
64069667567841280,64069667567841280,2011-04-29 20:52:53 UTC,2011-04-29,20:52:53,0,90069405,jessjsinclair,Jessica Sinclair,,Christian music in the Kaansa language of Burkina Faso now available via cellphone!  http://bit.ly/ju5dDC #ethnoarts @WycliffeGA #missions,en,"[{'screen_name': 'wycliffega', 'name': 'wycliffe ga', 'id': '49739767'}]",[],[],0,1,0,"['ethnoarts', 'missions']",[],https://twitter.com/jessjsinclair/status/64069667567841280,False,,0,,,,,,,,[],,,,
64061700130881536,64061700130881536,2011-04-29 20:21:14 UTC,2011-04-29,20:21:14,0,271961989,burkinanotizie,Burkina Notizie,,Christian music in the Kaansa language of Burkina Faso now available via cellphone  http://bit.ly/l0qVmE  http://aepiot.ro/real-time/Burkina,en,[],[],[],0,0,0,[],[],https://twitter.com/BurkinaNotizie/status/64061700130881536,False,,0,,,,,,,,[],,,,
64058008312881152,64058008312881152,2011-04-29 20:06:33 UTC,2011-04-29,20:06:33,0,49739767,wycliffega,Wycliffe GA,,Christian music in the Kaansa language of Burkina Faso now available via cellphone  http://bit.ly/l0qVmE,en,[],[],[],0,0,0,[],[],https://twitter.com/WycliffeGA/status/64058008312881152,False,,0,,,,,,,,[],,,,
