id,conversation_id,created_at,date,time,timezone,user_id,username,name,place,tweet,language,mentions,urls,photos,replies_count,retweets_count,likes_count,hashtags,cashtags,link,retweet,quote_url,video,thumbnail,near,geo,source,user_rt_id,user_rt,retweet_id,reply_to,retweet_date,translate,trans_src,trans_dest
1205125065890766848,1205125065890766848,2019-12-12 13:59:40 UTC,2019-12-12,13:59:40,0,1161056695671562241,yaoberanger1,Yao Beranger,,"Avant l'attaque, Un avion aurait survolé la zone. La communication aurait été brouillée.  Les soldats ont été encerclés. Dignement ils ont combattu. Après le massacre. L'avion aurait de nouveau survolé la zone...  Burkina Faso, Mali, Niger .",fr,[],[],[],0,0,0,[],[],https://twitter.com/YaoBeranger1/status/1205125065890766848,False,,0,,,,,,,,[],,,,
1204093708695752709,1204093704967000066,2019-12-09 17:41:25 UTC,2019-12-09,17:41:25,0,753653099714129920,ndcpartnership,NDC Partnership,,"Burkina Faso outlined seven components to its NDC Partnership Plan including: strategy, capacity building, mitigation, adaptation, progress reporting, financing and communication. #NDCAction",en,[],[],[],1,3,1,['ndcaction'],[],https://twitter.com/ndcpartnership/status/1204093708695752709,False,,0,,,,,,,,[],,,,
1203977841882411008,1203977841882411008,2019-12-09 10:01:00 UTC,2019-12-09,10:01:00,0,343343440,sagessia,KIENDREBEOGO,,"Avis de recrutement d'un(e) Expert(e) Capitalisation et Communication stratégique -  https://t.co/t4JBnApLJE, l'actualité au Burkina Faso  https://t.co/bXf06vnxRD",fr,[],"['http://leFaso.net', 'https://lefaso.net/spip.php?article93443']",[],0,0,0,[],[],https://twitter.com/sagessia/status/1203977841882411008,False,,0,,,,,,,,[],,,,
1202883491186302978,1202883491186302978,2019-12-06 09:32:27 UTC,2019-12-06,09:32:27,0,1004516488458440705,dirobenoittoe,TOE Diro Benoît Wilfried,,"Et enfin, c'est aujourd'hui (6 decembre 2019) le grand jour pour les blogueurs du Burkina Faso. Un grand événement pour des acteurs du monde du digital/Communication... Bonne chance surtout aux candidats des differentes catégories.  @blogawardsBF  @BlogueursBF  https://t.co/BI5BSCTI0Q",fr,"[{'screen_name': 'blogawardsbf', 'name': 'burkina golden blog awards', 'id': '1191319109843267584'}, {'screen_name': 'blogueursbf', 'name': 'association des blogueurs du burkina', 'id': '2510490180'}]",[],['https://pbs.twimg.com/media/ELEYDtnXkAIYHTq.jpg'],0,0,1,[],[],https://twitter.com/DiroBenoitTOE/status/1202883491186302978,False,,1,https://pbs.twimg.com/media/ELEYDtnXkAIYHTq.jpg,,,,,,,[],,,,
1202728103811993601,1202728103811993601,2019-12-05 23:15:00 UTC,2019-12-05,23:15:00,0,67690947,onuinfo,ONU Info,,"Originaire du #BurkinaFaso🇧🇫, Ilias Sawadogo est #volontaire international de la Francophonie.  Il est chargé de la communication au Bureau de @jayathmadw, l’Envoyée spéciale du Secrétaire général de l'ONU🇺🇳 pour la jeunesse (@UNYouthEnvoy).  @OIFfrancophonie | @UN4Youth | @ONUBF  https://t.co/9oOsDViCvc",fr,"[{'screen_name': 'jayathmadw', 'name': 'jayathma wickramanayake', 'id': '121673766'}, {'screen_name': 'unyouthenvoy', 'name': 'un youth envoy', 'id': '2923724679'}, {'screen_name': 'un4youth', 'name': 'unyouth', 'id': '105328660'}, {'screen_name': 'onubf', 'name': 'onu burkina faso', 'id': '753875877809778688'}]",[],[],1,7,28,"['burkinafaso', 'volontaire']",[],https://twitter.com/ONUinfo/status/1202728103811993601,False,,1,https://pbs.twimg.com/media/ELDHTC4XkAEyJQR.jpg,,,,,,,[],,,,
1202692376537550860,1202692376537550860,2019-12-05 20:53:02 UTC,2019-12-05,20:53:02,0,126093744,ouagaman_bf,Wedrawgo Wenkuny,,Nos autorités n'expliquent pas assez à l'opinion en quoi consistent les accords de défense avec la France ou d'autres alliés. Le champ de de la communication en temps de guerre a été abandonné aux djihadistes qui sont en train de gagner la guerre des médias. #BurkinaFaso,fr,[],[],[],0,1,0,['burkinafaso'],[],https://twitter.com/OuagaMan_BF/status/1202692376537550860,False,,0,,,,,,,,[],,,,
1202551835841761281,1202551835841761281,2019-12-05 11:34:34 UTC,2019-12-05,11:34:34,0,126093744,ouagaman_bf,Wedrawgo Wenkuny,,Le mutisme des pouvoirs publics face au french bashing est assez inquiétant. Gagner la bataille de la communication c'est aussi gagner la guerre. #BurkinaFaso,fr,[],[],[],0,1,0,['burkinafaso'],[],https://twitter.com/OuagaMan_BF/status/1202551835841761281,False,,0,,,,,,,,[],,,,
1202548768215830528,1202548768215830528,2019-12-05 11:22:23 UTC,2019-12-05,11:22:23,0,126093744,ouagaman_bf,Wedrawgo Wenkuny,,La communication des islamistes a conquis les masses dans certains pays du sahel. Elle a aussi gagné des élites qui ont désormais du mal  a cacher le sentiment anti- français qui les animent. C'est déjà une victoire pour les djihadistes. #BurkinaFaso #G5,fr,[],[],[],0,1,0,"['burkinafaso', 'g5']",[],https://twitter.com/OuagaMan_BF/status/1202548768215830528,False,,0,,,,,,,,[],,,,
1201529575773261824,1201529575773261824,2019-12-02 15:52:28 UTC,2019-12-02,15:52:28,0,69290737,afropages,Afropages,,Le Faso - 40e session de la Conférence générale de l'UNESCO : Le ministère de la Communication du Burkina Faso y a pris part  https://t.co/LdGRwXz6sv,fr,[],['http://tinyurl.com/s4tujlj'],[],0,0,0,[],[],https://twitter.com/Afropages/status/1201529575773261824,False,,0,,,,,,,,[],,,,
1201101856145104896,1201101856145104896,2019-12-01 11:32:52 UTC,2019-12-01,11:32:52,0,2319406039,alaindabilougou,Alain DABILOUGOU,,"La communication, est une arme vraiment négligée au #BurkinaFaso. Ce ne sont pourtant pas les communicateurs professionnels de renom qui manquent ici.",fr,[],[],[],0,1,6,['burkinafaso'],[],https://twitter.com/AlainDABILOUGOU/status/1201101856145104896,False,,0,,,,,,,,[],,,,
1200004371410489344,1200004371410489344,2019-11-28 10:51:51 UTC,2019-11-28,10:51:51,0,833322414,willsanwidi,Will Sanwidi™,,"Communication et géopolitique : « Tout le monde parle de l’Afrique sauf les Africains eux-mêmes », déplore Pr Charles Moumouni de l’Université Laval de Québec -  https://t.co/AtZwnjz0S0, l'actualité au Burkina Faso  https://t.co/GJa6Yq6r1f",fr,[],"['http://leFaso.net', 'https://lefaso.net/spip.php?article93416']",[],0,1,0,[],[],https://twitter.com/willsanwidi/status/1200004371410489344,False,,0,,,,,,,,[],,,,
1199993837017554945,1199993837017554945,2019-11-28 10:10:00 UTC,2019-11-28,10:10:00,0,1171730605123481601,tvgabon24en,Gabon24 english,,#Burkina Faso 🇧🇫higher education : opening monday of the 11th edition of the african universities of communication of Ouagadougou (UACO) #Gabon24,en,[],[],[],0,0,0,"['burkina', 'gabon24']",[],https://twitter.com/tvgabon24En/status/1199993837017554945,False,,0,,,,,,,,[],,,,
1199968671147470849,1199968671147470849,2019-11-28 08:30:00 UTC,2019-11-28,08:30:00,0,779822699757576192,tvgabon24,Gabon24,,#Burkina Faso 🇧🇫 enseignement supérieur : ouverture depuis lundi de la 11ème édition des «universités africaines de la communication de Ouagadougou (UACO) #Gabon24,fr,[],[],[],0,0,0,"['burkina', 'gabon24']",[],https://twitter.com/tvgabon24/status/1199968671147470849,False,,0,,,,,,,,[],,,,
1199863874469523456,1199863874469523456,2019-11-28 01:33:34 UTC,2019-11-28,01:33:34,0,816450513700995072,charharinst,Charhar Institute,,"On November 23rd, a delegation of young diplomats from Burkina Faso visited the Charhar Institute and both sides had a seminar at the Communication University of China (CUC) on ""The History and Status Quo of Chinese Brands and Media"".  See more at:  https://t.co/cV61tZzRJd  https://t.co/dVzVNMLzTR",en,[],['http://en.charhar.org.cn/index.php?a=shows&catid=5&id=50091484'],['https://pbs.twimg.com/media/EKbF09sUEAUjpJp.jpg'],0,0,0,[],[],https://twitter.com/CharharINST/status/1199863874469523456,False,,1,https://pbs.twimg.com/media/EKbF09sUEAUjpJp.jpg,,,,,,,[],,,,
1199771757969887233,1199771757969887233,2019-11-27 19:27:32 UTC,2019-11-27,19:27:32,0,814936395609477121,traorekie1,Traore Idrissa,,"Communication et géopolitique : « Tout le monde parle de l’Afrique sauf les Africains eux-mêmes », déplore Pr Charles Moumouni de l’Université Laval de Québec -  https://t.co/5ux2mp2oL3, l'actualité au Burkina Faso  https://t.co/wLYeGX8gcD",fr,[],"['http://leFaso.net', 'https://lefaso.net/spip.php?article93416']",[],0,0,0,[],[],https://twitter.com/traorekie1/status/1199771757969887233,False,,0,,,,,,,,[],,,,
1199621550527459329,1199621550527459329,2019-11-27 09:30:40 UTC,2019-11-27,09:30:40,0,25489714,yambundi,YAMEOGO Janvier,,"Communication et géopolitique : « Tout le monde parle de l’Afrique sauf les Africains eux-mêmes », déplore Pr Charles Moumouni de l’Université Laval de Québec -  https://t.co/v1b23btdbl, l'actualité au Burkina Faso  https://t.co/iLgDS1bQA7",fr,[],"['http://leFaso.net', 'https://lefaso.net/spip.php?article93416']",[],0,0,1,[],[],https://twitter.com/yambundi/status/1199621550527459329,False,,0,,,,,,,,[],,,,
1199351880738058240,1199351880738058240,2019-11-26 15:39:05 UTC,2019-11-26,15:39:05,0,871522130,kanazoesoul,Kanazoe Souleymane,,Mise en œuvre de la TNT : Seul le Burkina Faso a achevé la transition - Ministère de la Communication et des Relations…  https://t.co/wTFhmDQpNa,fr,[],['https://www.communication.gov.bf/informations/actualites/articles?tx_news_pi1%5Baction%5D=detail&tx_news_pi1%5Bcontroller%5D=News&tx_news_pi1%5Bnews%5D=150&cHash=6a1c3c1fb08d3106a620800ee3a13e26'],[],0,0,0,[],[],https://twitter.com/kanazoesoul/status/1199351880738058240,False,,0,,,,,,,,[],,,,
1199293786230329344,1199293786230329344,2019-11-26 11:48:15 UTC,2019-11-26,11:48:15,0,760402465992929281,presidencebf,Présidence du Faso,,"Ouverture ce matin, dans la salle polyvalente de la présidence du Faso, d'un séminaire gouvernemental portant sur la Communication du Ministère de la Défense national et des anciens Combattants. Une rencontre présidée par @ChristopheDabir #BurkinaFaso #lwili  https://t.co/XcFiM5ly8d",fr,"[{'screen_name': 'christophedabir', 'name': 'christophe joseph marie dabire', 'id': '1087492000029556739'}]",[],"['https://pbs.twimg.com/media/EKS_TvCW4AABKtu.jpg', 'https://pbs.twimg.com/media/EKS_UTnXUAEgUmX.jpg', 'https://pbs.twimg.com/media/EKS_U2cW4AU81X_.jpg', 'https://pbs.twimg.com/media/EKS_VZ5W4AEnCSu.jpg']",2,1,19,"['burkinafaso', 'lwili']",[],https://twitter.com/presidencebf/status/1199293786230329344,False,,1,https://pbs.twimg.com/media/EKS_TvCW4AABKtu.jpg,,,,,,,[],,,,
1199263852845817856,1199263852845817856,2019-11-26 09:49:18 UTC,2019-11-26,09:49:18,0,2319406039,alaindabilougou,Alain DABILOUGOU,,"Ouverture ce matin à Ouagadougou d'un séminaire gouvernemental sur la Communication du ministère de la Défense. Il était temps, surtout en ces temps où la guerre contre le terrorisme se mène de plus en plus sur le plan communicationnel #BurkinaFaso #lwili",fr,[],[],[],0,0,1,"['burkinafaso', 'lwili']",[],https://twitter.com/AlainDABILOUGOU/status/1199263852845817856,False,,0,,,,,,,,[],,,,
1199075680732041218,1199075680732041218,2019-11-25 21:21:34 UTC,2019-11-25,21:21:34,0,909686414232752128,jigiafrica,Jigi,,Le ministre de la Communication du #Mali Yaya Sangaré participe à la 11e édition des Universités africaines de la communication de Ouagadougou (UACO) qui voit échanger du 25 au 27 novembre 2019 au #BurkinaFaso les professionnels de la communication et du journalisme.  https://t.co/y8Udhn2yNf,fr,[],[],"['https://pbs.twimg.com/media/EKP47fsXYAEeUWC.jpg', 'https://pbs.twimg.com/media/EKP47fvWkAIyu0P.jpg']",0,1,2,"['mali', 'burkinafaso']",[],https://twitter.com/JigiAfrica/status/1199075680732041218,False,,1,https://pbs.twimg.com/media/EKP47fsXYAEeUWC.jpg,,,,,,,[],,,,
1199054710097010688,1199054685195440129,2019-11-25 19:58:14 UTC,2019-11-25,19:58:14,0,856505781172285442,cenozo_afrique,@CENOZO,,Trésorier général : Abdoulaye DIALLO (#BurkinaFaso) Membre chargé de la formation : Anas ANAS (#Ghana) Membre chargé des relations extérieures et de la communication : Davide DEMBELE (#Mali) Membre chargé des partenariats : Arlinda NEVES (#CapeVert)  https://t.co/od8iq9d9Sz,fr,[],[],['https://pbs.twimg.com/media/EKPl5QmW4AAcVbp.jpg'],0,6,5,"['burkinafaso', 'ghana', 'mali', 'capevert']",[],https://twitter.com/CENOZO_Afrique/status/1199054710097010688,False,,1,https://pbs.twimg.com/media/EKPl5QmW4AAcVbp.jpg,,,,,,,[],,,,
1198986528556552199,1198986528556552199,2019-11-25 15:27:19 UTC,2019-11-25,15:27:19,0,760402465992929281,presidencebf,Présidence du Faso,,".@rochkaborepf a reçu en audience, ce lundi, une délégation de ministres en charge de la communication de la sous-région, invités aux 11e Universités africaines de la Communication de Ouagadougou #UACO  #BurkinaFaso #Lwili  https://t.co/7OCIgVR4zc",fr,"[{'screen_name': 'rochkaborepf', 'name': 'roch kabore', 'id': '3353383450'}]",[],"['https://pbs.twimg.com/media/EKOn324WkAAMA-3.jpg', 'https://pbs.twimg.com/media/EKOn4gSW4AEA4ZC.jpg']",2,2,22,"['uaco', 'burkinafaso', 'lwili']",[],https://twitter.com/presidencebf/status/1198986528556552199,False,,1,https://pbs.twimg.com/media/EKOn324WkAAMA-3.jpg,,,,,,,[],,,,
1198985405544173570,1198985405544173570,2019-11-25 15:22:51 UTC,2019-11-25,15:22:51,0,3353383450,rochkaborepf,Roch KABORE,,Je salue la participation active des ministres de la communication de l'Uemoa aux 11èmes Universités Africaines de la Communication (UACO). Leur présence à Ouagadougou en ce début de semaine est un vibrant témoignage de solidarité envers le Burkina Faso.  https://t.co/9jUSlg30wT,fr,[],[],"['https://pbs.twimg.com/media/EKOm1EoXYAExkT4.jpg', 'https://pbs.twimg.com/media/EKOm2vbXsAAlPSX.jpg']",5,13,118,[],[],https://twitter.com/rochkaborepf/status/1198985405544173570,False,,1,https://pbs.twimg.com/media/EKOm1EoXYAExkT4.jpg,,,,,,,[],,,,
1198967953548566528,1198967953548566528,2019-11-25 14:13:30 UTC,2019-11-25,14:13:30,0,1087492000029556739,christophedabir,Christophe Joseph Marie DABIRE,,"La construction d’une autre image de l’Afrique est bien possible. L’image positive d’un continent d’avenir, aux énormes potentialités, et non une Afrique de misère et de pauvreté. Merci aux experts de la communication pour la réflexion lancée à Ouagadougou.#BurkinaFaso #UACO2019  https://t.co/SCcRHHrly1",fr,[],[],"['https://pbs.twimg.com/media/EKOW-8ZWwAIMeno.jpg', 'https://pbs.twimg.com/media/EKOW-8rXYAAT_Pd.jpg', 'https://pbs.twimg.com/media/EKOW-8TWkAEWF8V.jpg', 'https://pbs.twimg.com/media/EKOW-8SWsAAysGI.jpg']",2,9,31,"['burkinafaso', 'uaco2019']",[],https://twitter.com/ChristopheDabir/status/1198967953548566528,False,,1,https://pbs.twimg.com/media/EKOW-8ZWwAIMeno.jpg,,,,,,,[],,,,
1198946907399368713,1198946907399368713,2019-11-25 12:49:52 UTC,2019-11-25,12:49:52,0,894911078114762753,jeanroamba,Jean Damase ROAMBA,,"«L'#Afrique a mauvaise presse dans le monde. Elle doit rapidement prendre en main sa géopolitique de la communication en -communiquant sur sa puissance historique, -exploitant sa puissance démographique, -valorisant ses hommes.» Pr Charles Moumouni.  #UACO2019 #BurkinaFaso  https://t.co/EdmP7ma2po",fr,[],[],['https://pbs.twimg.com/media/EKOD065WwAE82tK.jpg'],0,2,2,"['afrique', 'uaco2019', 'burkinafaso']",[],https://twitter.com/JeanRoamba/status/1198946907399368713,False,,1,https://pbs.twimg.com/media/EKOD065WwAE82tK.jpg,,,,,,,[],,,,
1198934172326383616,1198934172326383616,2019-11-25 11:59:16 UTC,2019-11-25,11:59:16,0,894911078114762753,jeanroamba,Jean Damase ROAMBA,,"Ouverture officielle de la 11e édition des Universités africaines de Ouagadougou (AUCO) sous le thème : #communication et #géopolitique,  construire une autre image de L'#Afrique. C'est partie pour trois jours de débats enrichissants. #UACO2019 #BurkinaFaso #Lwili  https://t.co/FALHqORSzM",fr,[],[],['https://pbs.twimg.com/media/EKN4PkxXkAIRG0P.jpg'],0,1,3,"['communication', 'géopolitique', 'afrique', 'uaco2019', 'burkinafaso', 'lwili']",[],https://twitter.com/JeanRoamba/status/1198934172326383616,False,,1,https://pbs.twimg.com/media/EKN4PkxXkAIRG0P.jpg,,,,,,,[],,,,
1198931922132623365,1198931922132623365,2019-11-25 11:50:19 UTC,2019-11-25,11:50:19,0,1218102721,stefanomanservi,Stefano Manservisi,,"Grand plaisir revenir au #BurkinaFaso &amp; adresser les travaux de #UACO :construire un’autre image de #Afrique .L’Afrique doit pas se voir avec les yeux des autres,la communication n’est pas incantation,commence dans les cœurs &amp; les realités des africains.A raconter sans moderation  https://t.co/W1qXBwBJQA",fr,[],[],['https://pbs.twimg.com/media/EKN2FXZW4AATQPC.jpg'],0,2,4,"['burkinafaso', 'uaco', 'afrique']",[],https://twitter.com/stefanomanservi/status/1198931922132623365,False,,1,https://pbs.twimg.com/media/EKN2FXZW4AATQPC.jpg,,,,,,,[],,,,
1198926425065246720,1198926425065246720,2019-11-25 11:28:29 UTC,2019-11-25,11:28:29,0,1066259685613948928,nina_some,Somé Nina,,#Universités #Africaines de la #Communication de Ouagadougou 2019. 11ème édition #UACO2019 #lwili #BurkinaFaso  https://t.co/ygBLdqkVe7,fr,[],[],['https://pbs.twimg.com/media/EKNxKXOXkAAUZuN.jpg'],0,0,2,"['universités', 'africaines', 'communication', 'uaco2019', 'lwili', 'burkinafaso']",[],https://twitter.com/nina_some/status/1198926425065246720,False,,1,https://pbs.twimg.com/media/EKNxKXOXkAAUZuN.jpg,,,,,,,[],,,,
1198570365892648960,1198570365892648960,2019-11-24 11:53:38 UTC,2019-11-24,11:53:38,0,65612337,dieuson1,Dieudonné LANKOANDE,,"""Nous n'avons pas de bases étrangères au Burkina Faso. Mais nous avons des domaines sur lesquels nos pays coopèrent, notamment avec la France"", Rémis Dandjinou, ministre de la communication @remisdandjinou #Burkina  https://t.co/ErxalRSFaM",fr,"[{'screen_name': 'remisdandjinou', 'name': 'remis  dandjinou', 'id': '478441883'}]",[],['https://pbs.twimg.com/media/EKItYhIWsAATfp6.jpg'],0,0,3,['burkina'],[],https://twitter.com/Dieuson1/status/1198570365892648960,False,,1,https://pbs.twimg.com/media/EKItYhIWsAATfp6.jpg,,,,,,,[],,,,
1197603340156383234,1197427226209161216,2019-11-21 19:51:01 UTC,2019-11-21,19:51:01,0,1189284084880678912,albertocassong3,Alberto cass,,"@politicocd Les troupes françaises qui sont à Mali, Niger, Burkina Faso etc...n'ont rien fait,ce sont eux les auteurs de cette querre de l'est, Qu'ils nous donne les appareils militaires,et de communication,la logistique,les fardc sont capables d'en finir avec les ADF.",fr,[],[],[],0,0,0,[],[],https://twitter.com/AlbertoCassong3/status/1197603340156383234,False,,0,,,,,,,,"[{'screen_name': 'politicocd', 'name': 'POLITICO.CD', 'id': '702216426984235011'}]",,,,
1197101407779860481,1197101407779860481,2019-11-20 10:36:31 UTC,2019-11-20,10:36:31,0,637360357,robindotfr,Robin Schoubert,,"Communication très intéressante de Halizata Sana sur l'actualisation des figures d'autorité au Burkina Faso, à travers l'étude d'un groupe familial sur WhatsApp #CMCL19  https://t.co/KYJMFiGIVg",fr,[],[],['https://pbs.twimg.com/media/EJz1YHXX0AAmnzt.jpg'],0,1,3,['cmcl19'],[],https://twitter.com/robindotfr/status/1197101407779860481,False,,1,https://pbs.twimg.com/media/EJz1YHXX0AAmnzt.jpg,,,,,,,[],,,,
1196790227982897153,1196790227982897153,2019-11-19 14:00:00 UTC,2019-11-19,14:00:00,0,719350401,msf_westafrica,MSF Western & Central Africa,,"#LaVoixDuTerrain - Nos équipes sur le terrain sont notre force. 💪🏾  Une grande partie du staff travaillant pour @MSF est engagé localement. Médical &amp; paramédical, finance, logistique, administration, communication…  Découvrez leurs portraits! #LaForceMSF #BurkinaFaso  https://t.co/mhlIPvC9ql",fr,"[{'screen_name': 'msf', 'name': 'msf international', 'id': '2195671183'}]",[],['https://pbs.twimg.com/media/EJvAt3NWoAIG2-X.jpg'],0,2,1,"['lavoixduterrain', 'laforcemsf', 'burkinafaso']",[],https://twitter.com/MSF_WestAfrica/status/1196790227982897153,False,,1,https://pbs.twimg.com/media/EJvAt3NWoAIG2-X.jpg,,,,,,,[],,,,
1196761592928591873,1196761592928591873,2019-11-19 12:06:13 UTC,2019-11-19,12:06:13,0,719350401,msf_westafrica,MSF Western & Central Africa,,"#LaVoixDuTerrain - Nos équipes sur le terrain sont notre force💪🏾.  Une grande partie du staff travaillant pour @MSF est engagé localement. Médical &amp; paramédical, finance, logistique, administration, communication…  Découvrez leurs portraits! #LaForceMSF #BurkinaFaso  https://t.co/LrHww0mfwC",fr,"[{'screen_name': 'msf', 'name': 'msf international', 'id': '2195671183'}]",[],['https://pbs.twimg.com/media/EJvAUcXWsAA5DQF.jpg'],0,3,2,"['lavoixduterrain', 'laforcemsf', 'burkinafaso']",[],https://twitter.com/MSF_WestAfrica/status/1196761592928591873,False,,1,https://pbs.twimg.com/media/EJvAUcXWsAA5DQF.jpg,,,,,,,[],,,,
1196329049439850496,1196041230469271552,2019-11-18 07:27:26 UTC,2019-11-18,07:27:26,0,1481316108,damulirae,damulira red eagle 🇺🇬 🇰🇪,,@Lumala12Abdu What happened to you after the Burkina Faso game? @OfficialFUFA has not come up with any official communication.,en,"[{'screen_name': 'officialfufa', 'name': 'fufa', 'id': '311929309'}]",[],[],0,0,0,[],[],https://twitter.com/DamuliraE/status/1196329049439850496,False,,0,,,,,,,,"[{'screen_name': 'Lumala12Abdu', 'name': 'Lumala Abdu', 'id': '851129517263519745'}]",,,,
1195405527804715011,1195405527804715011,2019-11-15 18:17:42 UTC,2019-11-15,18:17:42,0,69290737,afropages,Afropages,,Le Faso - Coopération Burkina Faso-UNICEF : 90% de taux de réalisation en matière de communication  https://t.co/jr25vRsIoW,fr,[],['http://tinyurl.com/up88oe9'],[],0,0,0,[],[],https://twitter.com/Afropages/status/1195405527804715011,False,,0,,,,,,,,[],,,,
1195379811109294080,1195379811109294080,2019-11-15 16:35:30 UTC,2019-11-15,16:35:30,0,1191319109843267584,blogawardsbf,Burkina Golden Blog Awards,,"Ignace SAMPELGO est responsable de la startup dénommée E-Touma. E-Touma est une startup de communication, de marketing et de mise en relation entre employeurs et chercheurs d'emplois au Burkina Faso #BGBA2019 #ABBurkina #MBC2019 #ImpactSocial  https://t.co/FYiufur2kn  https://t.co/cXHAjTIPAM",fr,[],['https://www.facebook.com/nuitdesblogueurs/photos/a.2581954218537160/2582085301857385/?type=3&theater'],['https://pbs.twimg.com/media/EJbXOP_X0AA1uqw.jpg'],0,0,0,"['bgba2019', 'abburkina', 'mbc2019', 'impactsocial']",[],https://twitter.com/blogawardsBF/status/1195379811109294080,False,,1,https://pbs.twimg.com/media/EJbXOP_X0AA1uqw.jpg,,,,,,,[],,,,
1195342225263276032,1195342225263276032,2019-11-15 14:06:09 UTC,2019-11-15,14:06:09,0,601911813,lefaso_net,Lefaso_net,,"Recrutement de volontaires : « Je suis prêt et j’ai toujours été prêt », Noussourou Guiro, chargé de communication du Mouvement plus rien ne sera comme avant (M-PRESCA)  https://t.co/CDWrVwPdB4 #BurkinaFaso #lwili  https://t.co/OVQvFPRwaN",fr,[],['https://lefaso.net/spip.php?article93183'],['https://pbs.twimg.com/media/EJa1amDWoAUjvCQ.jpg'],2,2,9,"['burkinafaso', 'lwili']",[],https://twitter.com/Lefaso_net/status/1195342225263276032,False,,1,https://pbs.twimg.com/media/EJa1amDWoAUjvCQ.jpg,,,,,,,[],,,,
1194180636707295232,1194175542913851392,2019-11-12 09:10:25 UTC,2019-11-12,09:10:25,0,45159157,kathryntoure,Kathryn Toure,,Nos chercheurs publient dans les journaux scientifiques — activité importante. Pour qui? Nos chercheurs doivent aussi connecter avec nos communautés. Le FONFID soutient une culture de communication autour de la recherche. ~Hamidou Tamboura #burkinafaso @SGCIAfrica  #sgci2019,fr,"[{'screen_name': 'sgciafrica', 'name': 'sgciafrica', 'id': '714686473828757504'}]",[],[],0,0,1,"['burkinafaso', 'sgci2019']",[],https://twitter.com/kathryntoure/status/1194180636707295232,False,,0,,,,,,,,[],,,,
1193895467043762176,1193895467043762176,2019-11-11 14:17:15 UTC,2019-11-11,14:17:15,0,601911813,lefaso_net,Lefaso_net,,#BurkinaFaso Le ministère de la communication dément les informations faisant état de l'instauration d'une rafle générale et d'un couvre-feu à Ouagadougou. Le gouvernement dénonce un acte de désinformation de personnes qui veulent déstabiliser le Burkina  https://t.co/hBPB8ur2Tu  https://t.co/Gw5htnSHyJ,fr,[],['https://lefaso.net/spip.php?article93082'],['https://pbs.twimg.com/media/EJGRlxNW4AEVzKQ.jpg'],5,4,35,['burkinafaso'],[],https://twitter.com/Lefaso_net/status/1193895467043762176,False,,1,https://pbs.twimg.com/media/EJGRlxNW4AEVzKQ.jpg,,,,,,,[],,,,
1193848653275975686,1193848653275975686,2019-11-11 11:11:14 UTC,2019-11-11,11:11:14,0,77834693,bafredy,BASSOLE Y.S.Frederic,,"L'armée du #Burkina doit se mettre à jour de la communication digital. Créer et animer un compte sur les réseaux sociaux pour véhiculer l'information au plus grand nombre,  à l'image de #tsahal.  Ceci évitera la mes-information au #BurkinaFaso",fr,[],[],[],0,0,3,"['burkina', 'tsahal', 'burkinafaso']",[],https://twitter.com/bafredy/status/1193848653275975686,False,,0,,,,,,,,[],,,,
1192556782914285569,1192556782914285569,2019-11-07 21:37:48 UTC,2019-11-07,21:37:48,0,2738286887,kassusklay44,Karim Ammar,,"#BurkinaFaso #Terrorisme  Situation toujours confuse, apres 24 heures, impossible d'etablir un bilan definitif. 37, 47, 67, ou 98 morts, nul ne peut confirmer. Nous attendons tous la communication du l'administration de la mine de #Semafo #Boungou. Le président #Rock-KABORE  https://t.co/7c0foBcIeJ",fr,[],[],['https://pbs.twimg.com/media/EIzQCAvWkAA-rLO.jpg'],1,0,0,"['burkinafaso', 'terrorisme', 'semafo', 'boungou', 'rock']",[],https://twitter.com/kassusklay44/status/1192556782914285569,False,,1,https://pbs.twimg.com/media/EIzQCAvWkAA-rLO.jpg,,,,,,,[],,,,
