id,conversation_id,created_at,date,time,timezone,user_id,username,name,place,tweet,language,mentions,urls,photos,replies_count,retweets_count,likes_count,hashtags,cashtags,link,retweet,quote_url,video,thumbnail,near,geo,source,user_rt_id,user_rt,retweet_id,reply_to,retweet_date,translate,trans_src,trans_dest
1326783431137763329,1326783400959729665,2020-11-12 07:06:35 UTC,2020-11-12,07:06:35,0,1266851977771864065,fxaffairs,Fxaffairs,,"Nigeria, Ghana, Senegal, Ivory Coast, Burkina Faso, Guinea, Liberia, and Mali, with the aim of delivering high-speed internet broadband in the region.   https://t.co/ECtdgozt21  #orangetelecom #nigeria #Ghana",en,[],['http://Linkin.bio/fxaffairs'],[],0,0,3,"['orangetelecom', 'nigeria', 'ghana']",[],https://twitter.com/fxaffairs/status/1326783431137763329,False,,0,,,,,,,,[],,,,
1281234992765468672,1281234992765468672,2020-07-09 14:33:21 UTC,2020-07-09,14:33:21,0,14660387,techloy,Techloy 😷,,"Nigerian broadband company @Mainoneservice is expanding its West African operations to meet growing demand for connectivity amid the coronavirus pandemic, as it plans to complete a data node in Ghana by the first quarter of 2021 and build another in Burkina Faso.  (Bloomberg)",en,"[{'screen_name': 'mainoneservice', 'name': 'mainone', 'id': '175425927'}]",[],[],0,0,1,[],[],https://twitter.com/techloy/status/1281234992765468672,False,,0,,,,,,,,[],,,,
1266660072660271107,1266660072660271107,2020-05-30 09:17:49 UTC,2020-05-30,09:17:49,0,3353335223,bucltd,British University Consultants Ltd,,MainOne Partners World Bank To Deliver Bulk Broadband Connectivity In Burkina Faso -  https://t.co/Di5hu0Fmtd @mfidieHQ,en,"[{'screen_name': 'mfidiehq', 'name': 'mfidie.com', 'id': '706433856887455744'}]",['https://mfidie.com/mainone-partners-world-bank-to-deliver-bulk-broadband-connectivity-in-burkina-faso/'],[],0,0,0,[],[],https://twitter.com/BUCLtd/status/1266660072660271107,False,,0,,,,,,,,[],,,,
1266541936858607619,1266541936858607619,2020-05-30 01:28:23 UTC,2020-05-30,01:28:23,0,447245028,theafricamentor,Africa Mentor,,MainOne Partners World Bank To Deliver Bulk Broadband Connectivity In Burkina Faso   https://t.co/skXJLhRp6N  https://t.co/2eAIWs4cZj via @theafricamentor #africa #africabiz  https://t.co/muZ7vX4bmn,en,"[{'screen_name': 'theafricamentor', 'name': 'africa mentor', 'id': '447245028'}]","['http://twib.in/l/GBM9jnb66jMp', 'http://twib.in/l/68rq5kpnKaGE']",['https://pbs.twimg.com/media/EZOpLgaWsAAJ9Ft.png'],0,0,0,"['africa', 'africabiz']",[],https://twitter.com/TheAfricaMentor/status/1266541936858607619,False,,1,https://pbs.twimg.com/media/EZOpLgaWsAAJ9Ft.png,,,,,,,[],,,,
1266385201510453249,1266385201510453249,2020-05-29 15:05:34 UTC,2020-05-29,15:05:34,0,1238090617760239616,teckexpertsdot1,Teckexpertsdotcom,,#MainOne Partners #WorldBank to Deliver Bulk #Broadband Connectivity in #BurkinaFaso.  #lockdownextension  #thematter  Buhari Trump THUGS POTUS  #teckexpertsdotcom #teck #teckexperts   https://t.co/kg9t8PfBFV,en,[],['https://teckexperts.com/mainone-partners-world-bank-to-deliver-bulk-broadband-connectivity-in-burkina-faso-2336.html'],[],0,1,0,"['mainone', 'worldbank', 'broadband', 'burkinafaso', 'lockdownextension', 'thematter', 'teckexpertsdotcom', 'teck', 'teckexperts']",[],https://twitter.com/Teckexpertsdot1/status/1266385201510453249,False,,0,,,,,,,,[],,,,
1266370144474820613,1266370144474820613,2020-05-29 14:05:45 UTC,2020-05-29,14:05:45,0,1410511351,_thedreamdaily,The Dream Daily,,"MainOne, World Bank Connect Burkina Faso To Broadband Internet  https://t.co/hs7B3bT3jG",en,[],['http://www.thedreamdaily.com/mainone-world-bank-connect-burkina-faso-to-broadband-internet/'],[],0,0,0,[],[],https://twitter.com/_thedreamdaily/status/1266370144474820613,False,,0,,,,,,,,[],,,,
1266158059631542273,1266158059631542273,2020-05-29 00:03:00 UTC,2020-05-29,00:03:00,0,59545848,zcorum,ZCorum,,Nigeria: MainOne Partners World Bank to Deliver Bulk #Broadband Connectivity in Burkina Faso. @technextdotng  https://t.co/mFIG7rP8Bs,en,"[{'screen_name': 'technextdotng', 'name': 'technext.ng', 'id': '881613862843404288'}]",['https://zcrm.us/2zvT89B'],[],0,1,2,['broadband'],[],https://twitter.com/ZCorum/status/1266158059631542273,False,,0,,,,,,,,[],,,,
1266029695000248320,1266029695000248320,2020-05-28 15:32:55 UTC,2020-05-28,15:32:55,0,881613862843404288,technextdotng,TechNext.ng,,New post: MainOne Partners World Bank to Deliver Bulk Broadband Connectivity in Burkina Faso  https://t.co/3FKJpIM35C,en,[],['https://technext.ng/2020/05/28/mainone-partners-world-bank-to-deliver-bulk-broadband-connectivity-in-burkina-faso/'],[],0,1,3,[],[],https://twitter.com/technextdotng/status/1266029695000248320,False,,0,,,,,,,,[],,,,
1263749808394776576,1263749808394776576,2020-05-22 08:33:28 UTC,2020-05-22,08:33:28,0,2479942974,vizocom1,Vizocom,,"Reach out to Vizocom to get one of the best fiber internet services in Burkina Faso, Mali and Niger. We utilize the latest technologies to facilitate business-critical operations. Send your queries to sales@vizocom.com.  #vizocom #fiberinternet #broadband  https://t.co/CvxH2fuW0W",en,[],[],['https://pbs.twimg.com/media/EYm9uqcWAAA7jw7.jpg'],0,0,3,"['vizocom', 'fiberinternet', 'broadband']",[],https://twitter.com/vizocom1/status/1263749808394776576,False,,1,https://pbs.twimg.com/media/EYm9uqcWAAA7jw7.jpg,,,,,,,[],,,,
1262352993288101890,1262352993288101890,2020-05-18 12:03:01 UTC,2020-05-18,12:03:01,0,161616306,africabizz,AfricaBizz,,Onatel picks Radwin Jet Duo base station to meet broadband demands in #BurkinaFaso  https://t.co/5QDble8l12  https://t.co/MYVOrPgj2d,en,[],['https://bit.ly/3bJ96Ke'],['https://pbs.twimg.com/media/EYTHV3tXQAIGl_G.png'],0,1,0,['burkinafaso'],[],https://twitter.com/AfricaBizz/status/1262352993288101890,False,,1,https://pbs.twimg.com/media/EYTHV3tXQAIGl_G.png,,,,,,,[],,,,
1183927709904375809,1183927709904375809,2019-10-15 02:08:57 UTC,2019-10-15,02:08:57,0,20832710,nathanmhansen,Nathan M. Hansen,,.1% of people in Burkina Faso have fixed broadband Internet access. What a fascinating place to review and e-sign one's divorce petition. Had to be done while in Burkina Faso I suppose @IlhanMN. #IlhanOmar  https://t.co/dRVph5NhZX,en,"[{'screen_name': 'ilhanmn', 'name': 'ilhan omar', 'id': '783792992'}]",[],['https://pbs.twimg.com/media/EG4n9_eW4AAnICr.jpg'],1,1,6,['ilhanomar'],[],https://twitter.com/nathanmhansen/status/1183927709904375809,False,,1,https://pbs.twimg.com/media/EG4n9_eW4AAnICr.jpg,,,,,,,[],,,,
1164898061228728320,1164898061228728320,2019-08-23 13:51:55 UTC,2019-08-23,13:51:55,0,1019196799091912708,picante_media,PICANTE News,,"Burkina Faso Telecoms, Mobile and Broadband Statistics and Analyses 2019 –  https://t.co/JhlLcEUxHc  https://t.co/WW10EEMqIL",en,[],"['http://ResearchAndMarkets.com', 'https://picante.today/business-wire/2019/08/23/76711/burkina-faso-telecoms-mobile-and-broadband-statistics-and-analyses-2019-researchandmarkets-com/']",[],0,0,0,[],[],https://twitter.com/Picante_Media/status/1164898061228728320,False,,0,,,,,,,,[],,,,
1164895587570814976,1164895587570814976,2019-08-23 13:42:05 UTC,2019-08-23,13:42:05,0,976297820532518914,newsfrombw,Latest News from Business Wire,,"Burkina Faso Telecoms, Mobile and Broadband Statistics and Analyses 2019 -  https://t.co/guyiBzPH8C  https://t.co/ie35TtYNTR  https://t.co/xDXxyyzTHz",en,[],"['http://ResearchAndMarkets.com', 'http://dlvr.it/RBlbkD']",['https://pbs.twimg.com/media/ECqKXRLU0AA7BXh.jpg'],0,0,0,[],[],https://twitter.com/NewsFromBW/status/1164895587570814976,False,,1,https://pbs.twimg.com/media/ECqKXRLU0AA7BXh.jpg,,,,,,,[],,,,
1127191748508291074,1127191748508291074,2019-05-11 12:40:29 UTC,2019-05-11,12:40:29,0,3074796713,wirelessbroadb,WIRELESS BROADBAND SARL,,"When it hits Africa especially in Benin, Niger, Burkina Faso, Togo and Mali, internet connections become very slow or even non-existent. Why not try #WIRELESS BROADBAND? #Safe, #stable, and #permanent even when it's busy or during bad weather you have traffic",en,[],[],[],0,0,0,"['wireless', 'safe', 'stable', 'permanent']",[],https://twitter.com/wirelessbroadb/status/1127191748508291074,False,,0,,,,,,,,[],,,,
1120425690246066176,1120425690246066176,2019-04-22 20:34:35 UTC,2019-04-22,20:34:35,0,3074796713,wirelessbroadb,WIRELESS BROADBAND SARL,,"If you need guaranteed Internet access, WIRELESS BROADBAND offers the most affordable in the West African market. All our services are available in Niger, Burkina Faso, Mali, Benin, Togo, Guinea, Tchad and a good brief in the West African subregion. More… https://t.co/XR61rHScxr",en,[],['https://lnkd.in/dMuRugh'],[],0,0,0,[],[],https://twitter.com/wirelessbroadb/status/1120425690246066176,False,,0,,,,,,,,[],,,,
1116485662885048320,1116481651125694466,2019-04-11 23:38:19 UTC,2019-04-11,23:38:19,0,27162486,proofofsteve,Steven Budgen - @ProofOfSteve,,@MarkYusko Yes they are kidding themselves. Let them try to tell that to Burkina Faso who have some of the highest broadband costs in the world ($961 per month)  https://t.co/NP2akCNdKj,en,[],[],['https://pbs.twimg.com/media/D36NyiWUwAAdXhI.jpg'],0,0,1,[],[],https://twitter.com/ProofOfSteve/status/1116485662885048320,False,,1,https://pbs.twimg.com/media/D36NyiWUwAAdXhI.jpg,,,,,,,"[{'screen_name': 'MarkYusko', 'name': 'Mark W. Yusko', 'id': '254280603'}]",,,,
1113789070231076864,1113789070231076864,2019-04-04 13:03:02 UTC,2019-04-04,13:03:02,0,388152072,ses_networks,SES Networks,,It is estimated that developing nations need just 10% more #broadband #connectivity to drive 1.38% increase in GDP. Our work with the government in Burkina Faso is facilitating economic opportunity. #BoldandProven #Africa  https://t.co/NunG3w4ZNG  https://t.co/sOtrZqUVxi,en,[],['https://www.ses.com/blog/connecting-africa-through-collaboration'],[],0,1,3,"['broadband', 'connectivity', 'boldandproven', 'africa']",[],https://twitter.com/SES_Networks/status/1113789070231076864,False,,1,https://pbs.twimg.com/ext_tw_video_thumb/1113788952417394690/pu/img/H7QB0AZKMYSADoq5.jpg,,,,,,,[],,,,
1091736678367199235,1091736678367199235,2019-02-02 16:34:42 UTC,2019-02-02,16:34:42,0,15320772,procer,Jim Vandiver,,"Mining Digest 376 – Feb 1, 2019: Acid Rain, Ambulance Strike Teams, Border Wall Discussion, Brexit Discussion, Broadband Networking Concepts, Burkina Faso Murder, Cancer Bone Pain, Coal Company Compensation, Communicating on the Internet, Controversial…  https://t.co/3IiqSyFPUE",en,[],['https://virginiajim.wordpress.com/2019/02/02/mining-digest-376-feb-1-2019-acid-rain-ambulance-strike-teams-border-wall-discussion-brexit-discussion-broadband-networking-concepts-burkina-faso-murder-cancer-bone-pain-coal-compan/'],[],0,0,0,[],[],https://twitter.com/procer/status/1091736678367199235,False,,0,,,,,,,,[],,,,
1088727424521654273,1088727424521654273,2019-01-25 09:17:00 UTC,2019-01-25,09:17:00,0,21182778,connects_africa,Connecting Africa,,"#ConnectingAfrica: @orange is bringing high-speed, #LTE-based mobile broadband services to Burkina Faso following the award of a 15-year #4G license →  https://t.co/ynSeS83UTh",en,"[{'screen_name': 'orange', 'name': 'orange', 'id': '296824934'}]",['http://spr.ly/6010EPVp8'],[],0,1,0,"['connectingafrica', 'lte', '4g']",[],https://twitter.com/Connects_Africa/status/1088727424521654273,False,,0,,,,,,,,[],,,,
1087365702544248832,1087365702544248832,2019-01-21 15:06:00 UTC,2019-01-21,15:06:00,0,21182778,connects_africa,Connecting Africa,,"#ConnectingAfrica: @orange is bringing high-speed, #LTE-based mobile broadband services to Burkina Faso following the award of a 15-year #4G license →  https://t.co/nFDXHiyLDY",en,"[{'screen_name': 'orange', 'name': 'orange', 'id': '296824934'}]",['http://spr.ly/6013EOQe3'],[],0,0,0,"['connectingafrica', 'lte', '4g']",[],https://twitter.com/Connects_Africa/status/1087365702544248832,False,,0,,,,,,,,[],,,,
1075553109596925953,1075553109596925953,2018-12-20 00:46:58 UTC,2018-12-20,00:46:58,0,3074796713,wirelessbroadb,WIRELESS BROADBAND SARL,,"EACH #CHILD ONLINE: #Wireless_Broadband in its revolutionary #ECO program to give wide access to #African schools (#Niger, Burkina #Faso, #Benin, Mali).  Wireless Broadband will provide #technologies and equipment to bring the Internet to thousands of #sc… https://t.co/bjK2RuywbS",en,[],['https://lnkd.in/dpJqSUu'],[],0,0,0,"['child', 'wireless_broadband', 'eco', 'african', 'niger', 'faso', 'benin', 'technologies', 'sc']",[],https://twitter.com/wirelessbroadb/status/1075553109596925953,False,,0,,,,,,,,[],,,,
1029012352706826240,1029012352706826240,2018-08-13 14:30:37 UTC,2018-08-13,14:30:37,0,625899825,gomimosa,Mimosa by Airspan,,"Discover how VTS, an ISP in Burkina Faso, has deployed @GoMimosa B11 point-to-point backhaul radios to boost its network  https://t.co/SkPAGlYWPd #fiberfast #nofibernoproblem #fixedwireless #mimosanetworks #mimosab11 #broadband",en,"[{'screen_name': 'gomimosa', 'name': 'mimosa by airspan', 'id': '625899825'}]",['https://mimosa.co/case-studies/vts'],[],0,4,6,"['fiberfast', 'nofibernoproblem', 'fixedwireless', 'mimosanetworks', 'mimosab11', 'broadband']",[],https://twitter.com/GoMimosa/status/1029012352706826240,False,,0,,,,,,,,[],,,,
992856448341299205,992856448341299205,2018-05-05 19:59:58 UTC,2018-05-05,19:59:58,0,938419883745869824,theworldindex,World Index,,Average cost of a broadband plan per month.  🇮🇷 Iran: $5.37 🇺🇦 Ukraine: $5.51 🇷🇺 Russia: $9.93 🇲🇩 Moldova: $10.80 🇪🇬 Egypt: $12.42 🇺🇸 US: $66.17 🇦🇪 UAE: $155.16 🇲🇱 Mali: $163.44 🇱🇦 Laos: $231.03 🇳🇦 Namibia: $440.67 🇧🇫 Burkina Faso: $961.22  (Cable .co.uk),en,[],[],[],0,4,6,[],[],https://twitter.com/theworldindex/status/992856448341299205,False,,0,,,,,,,,[],,,,
975558782922215424,975558782922215424,2018-03-19 02:25:13 UTC,2018-03-19,02:25:13,0,211211567,gwenolefloch,Gwénolé Floc'h,,"Saviez vous que le pays dans lequel le coût d'accès à #internet est le moins cher est l'Iran , et qu'il est 178x plus élevé au Burkina Faso ? #broadband #FAI #Internet  https://t.co/LSOWXCbLsE",fr,[],['https://twitter.com/wef/status/975522369958825985'],[],0,1,0,"['internet', 'broadband', 'fai', 'internet']",[],https://twitter.com/gwenolefloch/status/975558782922215424,False,https://twitter.com/wef/status/975522369958825985,0,,,,,,,,[],,,,
969652404428967936,969652404428967936,2018-03-02 19:15:23 UTC,2018-03-02,19:15:23,0,157341054,jamieszymko,Jamie Szymkowiak,,News headlines in Germany  1) Trump’s trade tariffs 2) Broadband issues 3) SPD dilemmas  4) May’s speech (focused on NI border) 5) Burkina Faso 6) Syria 7) Weather,en,[],[],[],0,0,2,[],[],https://twitter.com/jamieszymko/status/969652404428967936,False,,0,,,,,,,,[],,,,
967692049007939584,967692049007939584,2018-02-25 09:25:37 UTC,2018-02-25,09:25:37,0,938419883745869824,theworldindex,World Index,,Average cost of a broadband plan per month.  🇮🇷 Iran: $5.37 🇺🇦 Ukraine: $5.51 🇷🇺 Russia: $9.93 🇲🇩 Moldova: $10.80 🇪🇬 Egypt: $12.42 🇺🇸 US: $66.17 🇦🇪 UAE: $155.16 🇲🇱 Mali: $163.44 🇱🇦 Laos: $231.03 🇳🇦 Namibia: $440.67 🇧🇫 Burkina Faso: $961.22  (Cable .co.uk),en,[],[],[],0,0,4,[],[],https://twitter.com/theworldindex/status/967692049007939584,False,,0,,,,,,,,[],,,,
966567140605267968,966567140605267968,2018-02-22 06:55:38 UTC,2018-02-22,06:55:38,0,938419883745869824,theworldindex,World Index,,Average cost of a broadband plan per month.  🇮🇷 Iran: $5.37 🇺🇦 Ukraine: $5.51 🇷🇺 Russia: $9.93 🇲🇩 Moldova: $10.80 🇪🇬 Egypt: $12.42 🇺🇸 US: $66.17 🇦🇪 UAE: $155.16 🇲🇱 Mali: $163.44 🇱🇦 Laos: $231.03 🇳🇦 Namibia: $440.67 🇧🇫 Burkina Faso: $961.22  (Cable .co.uk),en,[],[],[],0,2,7,[],[],https://twitter.com/theworldindex/status/966567140605267968,False,,0,,,,,,,,[],,,,
963795981140742145,963795981140742145,2018-02-14 15:24:03 UTC,2018-02-14,15:24:03,0,11390302,wmjpatriot,🍏Beff 🍏Jezos🍏,,Average cost of a broadband plan per month.  🇮🇷 Iran: $5.37 🇺🇦 Ukraine: $5.51 🇷🇺 Russia: $9.93 🇲🇩 Moldova: $10.80 🇪🇬 Egypt: $12.42 🇺🇸 US: $66.17 🇦🇪 UAE: $155.16 🇲🇱 Mali: $163.44 🇱🇦 Laos: $231.03 🇳🇦 Namibia: $440.67 🇧🇫 Burkina Faso: $961.22  (Cable .co.uk),en,[],[],[],0,0,0,[],[],https://twitter.com/wmjpatriot/status/963795981140742145,False,,0,,,,,,,,[],,,,
963707025829126144,963707025829126144,2018-02-14 09:30:34 UTC,2018-02-14,09:30:34,0,938419883745869824,theworldindex,World Index,,Average cost of a broadband plan per month.  🇮🇷 Iran: $5.37 🇺🇦 Ukraine: $5.51 🇷🇺 Russia: $9.93 🇲🇩 Moldova: $10.80 🇪🇬 Egypt: $12.42 🇺🇸 US: $66.17 🇦🇪 UAE: $155.16 🇲🇱 Mali: $163.44 🇱🇦 Laos: $231.03 🇳🇦 Namibia: $440.67 🇧🇫 Burkina Faso: $961.22  (Cable .co.uk),en,[],[],[],0,3,17,[],[],https://twitter.com/theworldindex/status/963707025829126144,False,,0,,,,,,,,[],,,,
961603759188127744,961603759188127744,2018-02-08 14:12:56 UTC,2018-02-08,14:12:56,0,46158178,consumers_int,Consumers Int,,"These stats highlight huge global disparity in the average costs of broadband plans, ranging from $5 in Iran to $961 in Burkina Faso. More must be done to ensure consumers are given fair &amp; affordable internet access  https://t.co/XvpLqbmzHq #BetterDigitalWorld  https://t.co/mDvif0llLe",en,[],"['http://bit.ly/2BLOwvA', 'https://twitter.com/wef/status/961577907423498248']",[],0,3,3,['betterdigitalworld'],[],https://twitter.com/Consumers_Int/status/961603759188127744,False,https://twitter.com/wef/status/961577907423498248,0,,,,,,,,[],,,,
960128748510203905,960128748510203905,2018-02-04 12:31:46 UTC,2018-02-04,12:31:46,0,495865032,indiangujarathi,Shubham Gujarathi 🇮🇳,,The most and least expensive countries for Broadband: ◆ Least Expensive: Iran ($5.37/month) ◆ Most Expensive: Burkina Faso: ($961.22/month)  https://t.co/dtzpjRy7HF,en,[],[],['https://pbs.twimg.com/media/DVMP_VJX0AYwEHv.jpg'],0,2,1,[],[],https://twitter.com/IndianGujarathi/status/960128748510203905,False,,1,https://pbs.twimg.com/media/DVMP_VJX0AYwEHv.jpg,,,,,,,[],,,,
954001038754762752,954001038754762752,2018-01-18 14:42:26 UTC,2018-01-18,14:42:26,0,9592092,yazid,Yazid,,Most/least expensive broadband in the world (avg USD/mth):  1. Iran🇮🇷$5.37 2. Ukraine🇺🇦$5.51 3. Russia🇷🇺$9.93 4. Moldova🇲🇩$10.80  193. Brunei🇧🇳$267.87 194. Namibia🇳🇦$440.67 195. Papua New Guinea🇵🇬$597.20 196. Burkina Faso🇧🇫$961.22   https://t.co/T8eHny2BW4,en,[],['http://wef.ch/2qXDrTj'],[],1,54,48,[],[],https://twitter.com/Yazid/status/954001038754762752,False,,0,,,,,,,,[],,,,
952907010734993409,952907010734993409,2018-01-15 14:15:10 UTC,2018-01-15,14:15:10,0,4924745954,hni321service,3-2-1 Service,,"Monthly broadband prices across Africa range from prices much lower than the US average price (several countries), to nearly $1000 (Burkina Faso).   https://t.co/zPtSSorKkd",en,[],['http://ow.ly/LRvL30hLLmu'],[],0,0,0,[],[],https://twitter.com/HNI321Service/status/952907010734993409,False,,0,,,,,,,,[],,,,
952903356569325568,952903356569325568,2018-01-15 14:00:38 UTC,2018-01-15,14:00:38,0,3002892827,hniorg,Human Network Intl.,,"Monthly broadband prices across Africa range from prices much lower than the US average price (several countries), to nearly $1000 (Burkina Faso).   https://t.co/A8fBb7UVFp",en,[],['http://ow.ly/LRvL30hLLmu'],[],0,1,0,[],[],https://twitter.com/HniOrg/status/952903356569325568,False,,0,,,,,,,,[],,,,
951730311611731968,951730311611731968,2018-01-12 08:19:23 UTC,2018-01-12,08:19:23,0,3147209958,markets_reports,Markets & Reports,,"Burkina Faso – Telecoms, Mobile and Broadband – Statistics and Analyses  https://t.co/4wongVROXT",en,[],['https://www.marketsandreports.com/product/burkina-faso-telecoms-mobile-and-broadband-statistics-and-analyses/'],[],0,0,0,[],[],https://twitter.com/Markets_Reports/status/951730311611731968,False,,0,,,,,,,,[],,,,
950370985315794945,950370985315794945,2018-01-08 14:17:54 UTC,2018-01-08,14:17:54,0,864855702896082945,congolestic,CONGOLESTIC ~ Inno▪Net▪Tech▪Botics,,The Most &amp; Least Expensive Countries for #Broadband | Cost per month in US Dollars. #Data #Internet #Fibber #DataCost #BurkinaFaso #Airtime #Africa  https://t.co/H0PIvCznX4,en,[],[],"['https://pbs.twimg.com/media/DTBlX8EXcAA_rpD.jpg', 'https://pbs.twimg.com/media/DTBlX77XkAEJEwW.jpg']",0,0,0,"['broadband', 'data', 'internet', 'fibber', 'datacost', 'burkinafaso', 'airtime', 'africa']",[],https://twitter.com/Congolestic/status/950370985315794945,False,,1,https://pbs.twimg.com/media/DTBlX8EXcAA_rpD.jpg,,,,,,,[],,,,
940533066816110593,940533066816110593,2017-12-12 10:45:32 UTC,2017-12-12,10:45:32,0,904226437925711872,drzamanrokon,Dr.Zaman,,"""#Iran offers the world's cheapest #broadband, with an average monthly cost of USD 5.37. #Burkina Faso is the most expensive, with an average package price of USD 954.54 per month, demonstrating a vast disparity in the cost of broadband across the world""--recent study indicates",en,[],[],[],1,1,0,"['iran', 'broadband', 'burkina']",[],https://twitter.com/DrZamanRokon/status/940533066816110593,False,,0,,,,,,,,[],,,,
937826394926698497,937826394926698497,2017-12-04 23:30:11 UTC,2017-12-04,23:30:11,0,860111514862309377,e85lab,emerge85,,"Burkina Faso, Namibia, Zimbabwe, and Mali have the most expensive broadband internet in Africa. The cheapest is in North Africa. Overall, broadband internet is still too expensive for many Africans.  https://t.co/csbYbNELIY via @qzafrica",en,"[{'screen_name': 'qzafrica', 'name': 'quartz africa', 'id': '3044665445'}]",['http://e85.io/2AKsHLQ'],[],0,0,0,[],[],https://twitter.com/e85lab/status/937826394926698497,False,,0,,,,,,,,[],,,,
937614959005052929,937614959005052929,2017-12-04 09:30:00 UTC,2017-12-04,09:30:00,0,3044665445,qzafrica,Quartz Africa,,"Burkina Faso, Namibia, Zimbabwe and Mali have the most expensive broadband internet in Africa. The cheapest is in North Africa  Overall, broadband internet is still too expensive for many Africans  https://t.co/EXdKjiSWTk via @qzafrica",en,"[{'screen_name': 'qzafrica', 'name': 'quartz africa', 'id': '3044665445'}]",['http://qz.com/1139432'],[],3,40,24,[],[],https://twitter.com/qzafrica/status/937614959005052929,False,,0,,,,,,,,[],,,,
937408796363804672,937408796363804672,2017-12-03 19:50:47 UTC,2017-12-03,19:50:47,0,1853842795,clarespencer,Clare Spencer,,"The world’s most expensive fixed line broadband services are in Burkina Faso, where the average monthly cost of a broadband package is around $965 (£730)   https://t.co/opPxJ7sY2Q",en,[],['http://www.computerweekly.com/news/450430279/African-countries-have-worlds-most-expensive-broadband'],[],1,4,5,[],[],https://twitter.com/clarespencer/status/937408796363804672,False,,0,,,,,,,,[],,,,
936691106397515776,936690999228854273,2017-12-01 20:18:57 UTC,2017-12-01,20:18:57,0,1333052750,hyperplanes,Matthew Martin,,"It costs almost $1,000 to get broadband in Burkina Faso",en,[],[],[],0,0,0,[],[],https://twitter.com/hyperplanes/status/936691106397515776,False,,0,,,,,,,,[],,,,
935882378886696961,935882378886696961,2017-11-29 14:45:21 UTC,2017-11-29,14:45:21,0,22958166,david_barnard,david_barnard,,#Broadband #internet is still too expensive for many Africans. #BurkinaFaso most expensive. #Egypt cheapest  https://t.co/1YUbLaTVlZ @qzafrica #Africa,en,"[{'screen_name': 'qzafrica', 'name': 'quartz africa', 'id': '3044665445'}]",['http://goo.gl/5eqftz'],[],0,3,4,"['broadband', 'internet', 'burkinafaso', 'egypt', 'africa']",[],https://twitter.com/david_barnard/status/935882378886696961,False,,0,,,,,,,,[],,,,
935013791648976896,935013791648976896,2017-11-27 05:13:54 UTC,2017-11-27,05:13:54,0,4333884073,colman_it,COLMAN_IT,,Want the cheapest broadband in the world? Move to Iran ($5.37 per month) The most expensive one was Burkina Faso ($954.54)  https://t.co/cMocHTDENs #TechTrends #tech #technology #technologies #IT #TechNews #TechnologyNews #itnews #Geek #gadgets #devices #news #technical #internet  https://t.co/Lqm8bpdUct,en,[],['https://shep.carto.com/builder/33b14fc4-dc24-4a3b-803d-70a4c62b7c47/embed'],['https://pbs.twimg.com/media/DPnWEdAV4AErGMC.jpg'],0,0,1,"['techtrends', 'tech', 'technology', 'technologies', 'it', 'technews', 'technologynews', 'itnews', 'geek', 'gadgets', 'devices', 'news', 'technical', 'internet']",[],https://twitter.com/COLMAN_IT/status/935013791648976896,False,,1,https://pbs.twimg.com/media/DPnWEdAV4AErGMC.jpg,,,,,,,[],,,,
934025455551750145,934025455551750145,2017-11-24 11:46:36 UTC,2017-11-24,11:46:36,0,896553375596019712,hair_groom,Ahaana,,"#Iran ￼🇮🇷 offers the world's cheapest #broadband , an average monthly cost of USD 5.37 #BurkinaFaso 🇧🇫the most expensive, with an average package price of USD 954.54 per month, demonstrating a vast #disparity in the cost of broadband  https://t.co/1AuXyoLb9r",en,[],['https://www.cable.co.uk/media-centre/release/new-worldwide-broadband-price-league-unveiled/'],[],0,0,0,"['iran', 'broadband', 'burkinafaso', 'disparity']",[],https://twitter.com/Hair_Groom/status/934025455551750145,False,,0,,,,,,,,[],,,,
933030306587824128,933030306587824128,2017-11-21 17:52:14 UTC,2017-11-21,17:52:14,0,236145777,leemutunga,Lee🇰🇪,,The monthly average broadband cost in burkina faso is 1000 usd lol unbelievable!!,en,[],[],[],0,0,0,[],[],https://twitter.com/LeeMutunga/status/933030306587824128,False,,0,,,,,,,,[],,,,
932937676638097409,932937676638097409,2017-11-21 11:44:09 UTC,2017-11-21,11:44:09,0,20231318,dengar,🔸 Chris A. Matenaers,,"Think broadband in the UK is expensive? It costs almost $1,000 a month in Burkina Faso  https://t.co/oyvo2hIBs2",en,[],['https://buff.ly/2A116Dq'],[],0,0,0,[],[],https://twitter.com/dengar/status/932937676638097409,False,,0,,,,,,,,[],,,,
