id,conversation_id,created_at,date,time,timezone,user_id,username,name,place,tweet,language,mentions,urls,photos,replies_count,retweets_count,likes_count,hashtags,cashtags,link,retweet,quote_url,video,thumbnail,near,geo,source,user_rt_id,user_rt,retweet_id,reply_to,retweet_date,translate,trans_src,trans_dest
1048202266740756480,1048202266740756480,2018-10-05 13:24:29 UTC,2018-10-05,13:24:29,0,722393304504131585,c2abcom,2ABCOM Agence 360°,,#JIEFABOBO2018 Nous sommes dans le dernier virage pour les Journées Internationales de l’Entrepreneuriat des Femmes Africaines (JIEFA) au Burkina Faso. #opportunitésdaffaires #partenariat #mecenat #formation #communication #developpement  https://t.co/jrkL0IaQe1,fr,[],[],['https://pbs.twimg.com/media/Dov2ZEuXoAIVwq6.jpg'],0,1,1,"['jiefabobo2018', 'opportunitésdaffaires', 'partenariat', 'mecenat', 'formation', 'communication', 'developpement']",[],https://twitter.com/C2abcom/status/1048202266740756480,False,,1,https://pbs.twimg.com/media/Dov2ZEuXoAIVwq6.jpg,,,,,,,[],,,,
1045280131168849920,1045280131168849920,2018-09-27 11:52:58 UTC,2018-09-27,11:52:58,0,963666904383672322,comcec_en,COMCEC,,"“Training on Crisis Communication in Tourism for Selected Muslim Countries” has been conducted in #Bamako with the support of the #COMCEC Project Funding. 25 participants from #Mali, #BurkinaFaso, #Mauritania, #Niger and #Senegal attended the training program. @OIC_OCI  https://t.co/OglaxX5BlN",en,"[{'screen_name': 'oic_oci', 'name': 'oic', 'id': '329562672'}]",[],"['https://pbs.twimg.com/media/DoGUi3PXsAEAw7X.jpg', 'https://pbs.twimg.com/media/DoGUi3PXkAAurQa.jpg', 'https://pbs.twimg.com/media/DoGUi3SXsAU7hdo.jpg']",0,0,0,"['bamako', 'comcec', 'mali', 'burkinafaso', 'mauritania', 'niger', 'senegal']",[],https://twitter.com/COMCEC_EN/status/1045280131168849920,False,,1,https://pbs.twimg.com/media/DoGUi3PXsAEAw7X.jpg,,,,,,,[],,,,
1043537286313529344,1043537286313529344,2018-09-22 16:27:31 UTC,2018-09-22,16:27:31,0,808701533747609601,fasodiffusionbf,Faso Diffusion,,#Culture #Wasexo #Afrique #DigitalBenin #ScenesEmergentes #Ouaga2018 #IITOuaga #IIT70 #Gambidi2018 #lwili... Burkina-Faso/ 70 ans de ITI : Des journalistes et community managers en recyclage pour la communication sur l’activité  https://t.co/qKSZMv9GGS,fr,[],['http://dekartcom.net/burkina-faso-70-ans-de-iti-des-journalistes-et-community-managers-en-recyclage-pour-la-communication-sur-lactivite/'],[],0,0,1,"['culture', 'wasexo', 'afrique', 'digitalbenin', 'scenesemergentes', 'ouaga2018', 'iitouaga', 'iit70', 'gambidi2018', 'lwili']",[],https://twitter.com/fasodiffusionbf/status/1043537286313529344,False,,0,,,,,,,,[],,,,
1043236143179943937,1043236143179943937,2018-09-21 20:30:53 UTC,2018-09-21,20:30:53,0,741714781179158528,jeanbaptistenco,Jean-Baptiste,,C'est un plaisir d'être au #BurkinaFaso et former des personnes en #DigitalMarketing #SocialMedia   #Communication #AcademieDigitale  https://t.co/j6ioZfGrdY,fr,[],[],['https://pbs.twimg.com/media/DnpRssoXcAA1ioC.jpg'],0,0,0,"['burkinafaso', 'digitalmarketing', 'socialmedia', 'communication', 'academiedigitale']",[],https://twitter.com/JeanBaptisteNCO/status/1043236143179943937,False,,1,https://pbs.twimg.com/media/DnpRssoXcAA1ioC.jpg,,,,,,,[],,,,
1043220824466116612,1043220824466116612,2018-09-21 19:30:01 UTC,2018-09-21,19:30:01,0,3363973401,upcvictoire,UPCVictoire,,Clôture des 2èmes Journées Parlementaires UPC 2018  L'honorable Henriette Zoumbaré a fait le rapport de synthèse des travaux qui était axé  sur le système sécuritaire du Burkina Faso. La communication a été...  https://t.co/44TetcCj4V,fr,[],['https://www.facebook.com/286786121433171/posts/1752993808145721/'],[],0,0,0,[],[],https://twitter.com/UPCVictoire/status/1043220824466116612,False,,0,,,,,,,,[],,,,
1043211380541796352,1043211380541796352,2018-09-21 18:52:29 UTC,2018-09-21,18:52:29,0,1396712288,unfpabf,UNFPA Burkina Faso,,"C’est faisant suite à la rencontre régionale organisée en Guinée Conakry en mai 2018 autour du thème: «Culture, communication et dividende démographique» dans le cadre du projet SWEDD, que le Burkina Faso s'est...  https://t.co/JqYZ1n4age",fr,[],['https://www.facebook.com/UnfpaBurkinaFaso/posts/931989343654994'],[],0,2,1,[],[],https://twitter.com/UNFPABF/status/1043211380541796352,False,,0,,,,,,,,[],,,,
1043088982211538945,1043088982211538945,2018-09-21 10:46:07 UTC,2018-09-21,10:46:07,0,180700395,vsf_belgium,DZG-VSF Belgium,,"L’expérience Junior te tente mais tu hésites encore ? Lis le témoignage d’Annelies, experte Junior en communication au Burkina Faso de 2016 à 2018, et postule avant ce lundi 24 septembre (12h) pour notre poste au Niger 👉  https://t.co/GCIboeMamy  https://t.co/R3vOwpotyP",fr,[],"['https://goo.gl/ZHUzDh', 'https://veterinairessansfrontieres.be/actualites/etre-junior-dans-le-sud/']",[],0,0,0,[],[],https://twitter.com/VSF_Belgium/status/1043088982211538945,False,,0,,,,,,,,[],,,,
1042774891542573056,1042774857732239361,2018-09-20 13:58:02 UTC,2018-09-20,13:58:02,0,3363973401,upcvictoire,UPCVictoire,,"#BurkinaFaso : Elle a notamment souhaité le renforcement des moyens d'action des FDS, la mise de l'accent sur une communication qui rassemble les filles et fils du pays, rassure les burkinabè et a  rappelé qu'elle a initié une  collecte de fonds en vue de soutenir les FDS.  https://t.co/XK4Mqakyhb",fr,[],[],['https://pbs.twimg.com/media/DniuO2oW4AEqE9R.jpg'],1,1,0,['burkinafaso'],[],https://twitter.com/UPCVictoire/status/1042774891542573056,False,,1,https://pbs.twimg.com/media/DniuO2oW4AEqE9R.jpg,,,,,,,[],,,,
1042552005930049536,1042552005930049536,2018-09-19 23:12:22 UTC,2018-09-19,23:12:22,0,826482251470925827,fasoamazone,Faso Amazone,,Le ministère en charge de la Communication ouvre un débat sur la liberté de la presse au Burkina Faso  https://t.co/62pDWCUc7a via @FasoAmazone,fr,"[{'screen_name': 'fasoamazone', 'name': 'faso amazone', 'id': '826482251470925827'}]",['http://www.fasoamazone.net/2018/09/19/le-ministere-en-charge-de-la-communication-ouvre-un-debat-sur-la-liberte-de-la-presse-au-burkina-faso/'],[],0,0,0,[],[],https://twitter.com/FasoAmazone/status/1042552005930049536,False,,0,,,,,,,,[],,,,
1042530821830262784,1042530821830262784,2018-09-19 21:48:11 UTC,2018-09-19,21:48:11,0,2455852837,ziojoel,ZioAsso🇧🇫,,"@sanonhadja, si je vous ai bien compris la cherté de la #communication et de l’#internet au #BurkinaFaso est dû au fait que le pays est enclavé #lwili #DialogueAvecLeGouvernement @rtburkina",fr,"[{'screen_name': 'rtburkina', 'name': 'rtb', 'id': '406886112'}]",[],[],0,0,0,"['communication', 'internet', 'burkinafaso', 'lwili', 'dialogueaveclegouvernement']",[],https://twitter.com/ziojoel/status/1042530821830262784,False,,0,,,,,,,,[],,,,
1042407001760952320,1042407001760952320,2018-09-19 13:36:10 UTC,2018-09-19,13:36:10,0,607493317,moussaelmous,Moussa Sawadogo,,"Ce matin, j’ai pris part à un atelier organisé par le HCRUN autour de sa stratégie de communication. Cet outil renforcera les capacités du   HCRUN pour une réconciliation réussie au Burkina Faso.  Bravo et courage au President ainsi qu’à toute son équipe.",fr,[],[],[],0,0,0,[],[],https://twitter.com/MoussaElmous/status/1042407001760952320,False,,0,,,,,,,,[],,,,
1042120068237336576,1042120068237336576,2018-09-18 18:36:00 UTC,2018-09-18,18:36:00,0,925435149046689793,bfcom2017,MCRP-Burkina Faso,,"Le Ministère de la Communication et des relations avec le Parlement a organisé ce mardi 18 octobre une conférence publique sur le thème : ""État de la liberté de la presse au Burkina Faso: comment consolider les acquis?""  https://t.co/BBbensAh23",fr,[],[],['https://pbs.twimg.com/media/DnZan2VXoAAOoUZ.jpg'],0,0,1,[],[],https://twitter.com/BFcom2017/status/1042120068237336576,False,,1,https://pbs.twimg.com/media/DnZan2VXoAAOoUZ.jpg,,,,,,,[],,,,
1042010618675507205,1042010618675507205,2018-09-18 11:21:05 UTC,2018-09-18,11:21:05,0,16683704,allafricafrench,AllAfrica Fr,,Retraités de la communication et de l'information - Jean-Baptiste Ilboudo remplace Paul Ismaël Ouédrao:  https://t.co/Wwtcj3p93r #BurkinaFaso,fr,[],['https://fr.allafrica.com/stories/201809180148.html?utm_campaign=allafrica%3Aeditor&utm_medium=social&utm_source=twitter&utm_content=promote%3Aaans%3Aaccnqx'],[],0,0,0,['burkinafaso'],[],https://twitter.com/AllAfricafrench/status/1042010618675507205,False,,0,,,,,,,,[],,,,
1041708354203049984,1041708354203049984,2018-09-17 15:20:00 UTC,2018-09-17,15:20:00,0,582576323,oscpfafrique,OSCPF AFRIQUE,,Sous le leadership de la DPES s'est tenu à Koudougou l’atelier de renforcement des capacités des acteurs de mise en œuvre de la stratégie de Communication pour le Changement Social et Comportemental dans le cadre du projet SWEDD au #BurkinaFaso.  https://t.co/kt1CFn0Qqq  https://t.co/A27zWUfNh2,fr,[],['https://mafamilleplanifiee.org/atelier-de-renforcement-des-capacites-des-acteurs-de-mise-en-oeuvre-de-la-strategie-nationale-ccsc/'],['https://pbs.twimg.com/media/DnTjTCTX4AEPS5F.jpg'],0,0,4,['burkinafaso'],[],https://twitter.com/OSCPFAFRIQUE/status/1041708354203049984,False,,1,https://pbs.twimg.com/media/DnTjTCTX4AEPS5F.jpg,,,,,,,[],,,,
1041707168741908481,1041707168741908481,2018-09-17 15:15:17 UTC,2018-09-17,15:15:17,0,2223081972,pouagapf,Partenariat de Ouaga,,Sous le leadership de la DPES s'est tenu à Koudougou l’atelier de renforcement des capacités des acteurs de mise en œuvre de la stratégie de Communication pour le Changement Social et Comportemental dans le cadre du projet SWEDD au #BurkinaFaso.  https://t.co/IslUX8ZrqW  https://t.co/JsvepKU3tw,fr,[],['https://partenariatouaga.org/atelier-de-renforcement-des-capacites-des-acteurs-de-mise-en-oeuvre-de-la-strategie-nationale-ccsc/'],['https://pbs.twimg.com/media/DnTjElKW0AA-MTp.jpg'],0,2,6,['burkinafaso'],[],https://twitter.com/POuagaPF/status/1041707168741908481,False,,1,https://pbs.twimg.com/media/DnTjElKW0AA-MTp.jpg,,,,,,,[],,,,
1041694874834280449,1041694874834280449,2018-09-17 14:26:26 UTC,2018-09-17,14:26:26,0,1402311374,sigbf,SIG Burkina Faso,,"Le ministère en charge de la Communication organise ce mardi 18 septembre 2018, à partir de 15h, dans la salle de conférences des Archives nationales, une conférence publique sur le thème : état de la liberté de la presse au Burkina Faso : comment consolider les acquis ? ""  https://t.co/F9MWLjpCVf",fr,[],[],['https://pbs.twimg.com/media/DnTX6OWW0AE3iDQ.jpg'],0,1,2,[],[],https://twitter.com/sigbf/status/1041694874834280449,False,,1,https://pbs.twimg.com/media/DnTX6OWW0AE3iDQ.jpg,,,,,,,[],,,,
1041650692962824193,1041650692962824193,2018-09-17 11:30:52 UTC,2018-09-17,11:30:52,0,1896725383,amwithigah,Asenath Mwithigah,,"We just kicked off our Social Change Communication training in Ouagadougou, Burkina Faso. Looking forward to equipping the stakeholders with knowledge to effectively spark discussions about #endFGM in their communities @TheGirlGen @CelestinCompao1 @equalitynow @28TooMany @UNFPABF",en,"[{'screen_name': 'thegirlgen', 'name': 'the girl generation', 'id': '2836912087'}, {'screen_name': 'celestincompao1', 'name': 'celestin compaore', 'id': '826818163903971328'}, {'screen_name': 'equalitynow', 'name': 'equalitynow', 'id': '14800620'}, {'screen_name': '28toomany', 'name': '28toomany', 'id': '241173327'}, {'screen_name': 'unfpabf', 'name': 'unfpa burkina faso', 'id': '1396712288'}]",[],[],2,10,14,['endfgm'],[],https://twitter.com/amwithigah/status/1041650692962824193,False,,0,,,,,,,,[],,,,
1041081714980925440,1041081714980925440,2018-09-15 21:49:57 UTC,2018-09-15,21:49:57,0,741714781179158528,jeanbaptistenco,Jean-Baptiste,,#BurkinaFaso C'est avec plaisir que nous avons entretenu un public à l'élaboration d'un plan de #Communication efficace et à l'utilisation des #reseauxsociaux pour faire connaître son entreprise et vendre ses produits et services  #digitalmarketing #socialmedia #Manager  https://t.co/b7mBjBWtMp,fr,[],[],['https://pbs.twimg.com/media/DnKqSnNXsAIjo68.jpg'],0,0,0,"['burkinafaso', 'communication', 'reseauxsociaux', 'digitalmarketing', 'socialmedia', 'manager']",[],https://twitter.com/JeanBaptisteNCO/status/1041081714980925440,False,,1,https://pbs.twimg.com/media/DnKqSnNXsAIjo68.jpg,,,,,,,[],,,,
1040614528009101317,1040614528009101317,2018-09-14 14:53:31 UTC,2018-09-14,14:53:31,0,215117963,nigeremploi,Nigeremploi.com,,Expert en Communication (Num 1634)  https://t.co/hBR9Ry22Vj #Emploi #Burkina Faso,en,[],['http://bfemploi.com/annonce.php?action=details&id=1634'],[],0,0,1,"['emploi', 'burkina']",[],https://twitter.com/Nigeremploi/status/1040614528009101317,False,,0,,,,,,,,[],,,,
1040149328579493888,1040149328579493888,2018-09-13 08:04:59 UTC,2018-09-13,08:04:59,0,582576323,oscpfafrique,OSCPF AFRIQUE,,Ce matin à Koudougou au #BurkinaFaso l'UNFPA participe à l’atelier national de renforcement des capacités des acteurs de mise en œuvre de la stratégie de communication pour le changement social et comportemental (CCSC) au titre du projet SWEDD.  https://t.co/NKqAsdbBR5,fr,[],[],"['https://pbs.twimg.com/media/Dm9YaGzX0AAkgY8.jpg', 'https://pbs.twimg.com/media/Dm9YaG1WsAEj8Yo.jpg', 'https://pbs.twimg.com/media/Dm9ZIO7W4AEfblM.jpg', 'https://pbs.twimg.com/media/Dm9ZIO1XoAADj8i.jpg']",0,0,1,['burkinafaso'],[],https://twitter.com/OSCPFAFRIQUE/status/1040149328579493888,False,,1,https://pbs.twimg.com/media/Dm9YaGzX0AAkgY8.jpg,,,,,,,[],,,,
1040147166730301443,1040147166730301443,2018-09-13 07:56:24 UTC,2018-09-13,07:56:24,0,2223081972,pouagapf,Partenariat de Ouaga,,Ce matin à Koudougou au #BurkinaFaso l'UNFPA participe à l’atelier national de renforcement des capacités des acteurs de mise en œuvre de la stratégie de communication pour le changement social et comportemental (CCSC) au titre du projet SWEDD.  https://t.co/rfSZFHumEr,fr,[],[],"['https://pbs.twimg.com/media/Dm9YNSRW0AA8SOx.jpg', 'https://pbs.twimg.com/media/Dm9YNSXWwAA-ZnR.jpg', 'https://pbs.twimg.com/media/Dm9YNSSXgAAsNvB.jpg', 'https://pbs.twimg.com/media/Dm9YNSSW0AAZ440.jpg']",0,2,7,['burkinafaso'],[],https://twitter.com/POuagaPF/status/1040147166730301443,False,,1,https://pbs.twimg.com/media/Dm9YNSRW0AA8SOx.jpg,,,,,,,[],,,,
1038765795092910081,1038765795092910081,2018-09-09 12:27:19 UTC,2018-09-09,12:27:19,0,909686414232752128,jigiafrica,Jigi,,"« Les objectifs des terroristes, c’est de briser notre cohésion sociale, l’unité de la nation. » Une très utile réflexion sur le rôle de l’information/communication dans la lutte contre le terrorisme au #BurkinaFaso (mais aussi au #Mali et au #Niger).  https://t.co/QCFrBGvs6Q",fr,[],['http://lemessagerdafrique.mondoblog.org/2018/09/04/lutte-contre-le-terrorisme-au-burkina/'],[],0,1,1,"['burkinafaso', 'mali', 'niger']",[],https://twitter.com/JigiAfrica/status/1038765795092910081,False,,0,,,,,,,,[],,,,
1038519065009160193,1038519065009160193,2018-09-08 20:06:54 UTC,2018-09-08,20:06:54,0,741714781179158528,jeanbaptistenco,Jean-Baptiste,,"#SanaBob #Reggae #BurkinaFaso Il a été sujet d'une de mes émissions #Radio. N'ayant pas eu la chance d'être scolarisé, #Sana milite pour l'éducation des enfants. Il prône la #cohésion_sociale coe élément favorable au dvp de l'#Afrique #Digital #socialmedia #Manager #Communication  https://t.co/63wJqmDSWE",fr,[],[],['https://pbs.twimg.com/media/DmmPcdVWsAMJknk.jpg'],0,0,0,"['sanabob', 'reggae', 'burkinafaso', 'radio', 'sana', 'cohésion_sociale', 'afrique', 'digital', 'socialmedia', 'manager', 'communication']",[],https://twitter.com/JeanBaptisteNCO/status/1038519065009160193,False,,1,https://pbs.twimg.com/media/DmmPcdVWsAMJknk.jpg,,,,,,,[],,,,
1037302475718569990,1037302475718569990,2018-09-05 11:32:37 UTC,2018-09-05,11:32:37,0,741714781179158528,jeanbaptistenco,Jean-Baptiste,,"#formation #conference 15Sept2018 9h Centre Cardinal Paul Zoungrana #Ouagadougou #BurkinaFaso ""Les #ReseauxSociaux leviers de trafic et de visibilité pour un #SiteWeb #Blog, Non des leviers pour y enfermer les internautes"" #DigitalMarketing #MediaSocial #Communication",fr,[],[],[],0,0,0,"['formation', 'conference', 'ouagadougou', 'burkinafaso', 'reseauxsociaux', 'siteweb', 'blog', 'digitalmarketing', 'mediasocial', 'communication']",[],https://twitter.com/JeanBaptisteNCO/status/1037302475718569990,False,,0,,,,,,,,[],,,,
1035598537332015105,1035598537332015105,2018-08-31 18:41:46 UTC,2018-08-31,18:41:46,0,582576323,oscpfafrique,OSCPF AFRIQUE,,"Ce jeudi 30 Août 2018 dans les locaux de la direction de santé de la famille au #BurkinaFaso, s’est tenue la revue à mi-parcours de la stratégie nationale de communication pour le changement social et comportemental (CCSC) 2017-2019.  https://t.co/9fa6emX0TM",fr,[],[],"['https://pbs.twimg.com/media/Dl8vXbsW0AAloAL.jpg', 'https://pbs.twimg.com/media/Dl8vXbtWsAAanvL.jpg', 'https://pbs.twimg.com/media/Dl8vXbwXsAAG4l_.jpg', 'https://pbs.twimg.com/media/Dl8vXbtXgAEP_Rq.jpg']",0,0,8,['burkinafaso'],[],https://twitter.com/OSCPFAFRIQUE/status/1035598537332015105,False,,1,https://pbs.twimg.com/media/Dl8vXbsW0AAloAL.jpg,,,,,,,[],,,,
1035598404670443521,1035598404670443521,2018-08-31 18:41:14 UTC,2018-08-31,18:41:14,0,2223081972,pouagapf,Partenariat de Ouaga,,"Ce jeudi 30 Août 2018 dans les locaux de la direction de santé de la famille au #BurkinaFaso, s’est tenue la revue à mi-parcours de la stratégie nationale de communication pour le changement social et comportemental (CCSC) 2017-2019.  https://t.co/Ntv4lipRCg",fr,[],[],"['https://pbs.twimg.com/media/Dl8u33gX4AArdAl.jpg', 'https://pbs.twimg.com/media/Dl8u32xXoAA10Ha.jpg', 'https://pbs.twimg.com/media/Dl8u33NXoAA6mc8.jpg', 'https://pbs.twimg.com/media/Dl8vNjLX4AAeQT0.jpg']",0,1,11,['burkinafaso'],[],https://twitter.com/POuagaPF/status/1035598404670443521,False,,1,https://pbs.twimg.com/media/Dl8u33gX4AArdAl.jpg,,,,,,,[],,,,
1035221291689639938,1035221291689639938,2018-08-30 17:42:44 UTC,2018-08-30,17:42:44,0,2150751720,realnewsmag,Realnews,,Business:  Postal and Electronic Communication Regulatory Authority of Burkina Faso  https://t.co/77S09TjEWM,en,[],['https://realnewsmagazine.net/business/postal-and-electronic-communication-regulatory-authority-of-burkina-faso/'],[],0,0,0,[],[],https://twitter.com/RealnewsMag/status/1035221291689639938,False,,0,,,,,,,,[],,,,
1035211311251173376,1035211311251173376,2018-08-30 17:03:04 UTC,2018-08-30,17:03:04,0,95291791,ngcomcommission,ncc.gov.ng,,Postal and Electronic Communication Regulatory Authority of Burkina Faso Pays Courtesy Visit to NCC.  LINK -  https://t.co/B1JFzPIGVP  https://t.co/9GNu6muIvB,en,[],['https://www.ncc.gov.ng/stakeholder/media-public/news-headlines/400-postal-and-electronic-communication-regulatory-authority-of-burkina-faso-pays-courtesy-visit-to-ncc'],"['https://pbs.twimg.com/media/Dl3O71fWwAIwvGw.jpg', 'https://pbs.twimg.com/media/Dl3O71fWsAIREwX.jpg', 'https://pbs.twimg.com/media/Dl3O71oX0AcJnbH.jpg', 'https://pbs.twimg.com/media/Dl3O72FW0AADuK3.jpg']",0,3,6,[],[],https://twitter.com/NgComCommission/status/1035211311251173376,False,,1,https://pbs.twimg.com/media/Dl3O71fWwAIwvGw.jpg,,,,,,,[],,,,
1034785966551166976,1034785966551166976,2018-08-29 12:52:54 UTC,2018-08-29,12:52:54,0,843044372916682752,aboubakarsawad,Aboubakar CIDIQ,,"Nouveau code électoral Burkinabè/ Intégralité de la conférence animée par les ministres de la culture et de la communication du Burkina Faso, en Côte d’Ivoire  https://t.co/qAdBBW1Wwa",fr,[],['http://cestlemoment.info/nouveau-code-electoral-burkinabe-integralite-de-la-conference-animee-par-les-ministres-de-la-culture-et-de-la-communication-du-burkina-faso-en-cote-divoire/'],[],0,0,2,[],[],https://twitter.com/AboubakarSAWAD/status/1034785966551166976,False,,0,,,,,,,,[],,,,
1034361941765054464,1034361941765054464,2018-08-28 08:47:59 UTC,2018-08-28,08:47:59,0,896099179986026496,qgjeune,QG Jeune,,Progettomondo Mlal recherche un/e Chargé/e de Communication pour intégrer l’équipe de coordination nationales au Burkina Faso. Bonne chance!!  https://t.co/2qAlUxC5sR,fr,[],['https://www.qgjeune.org/charge-e-de-communication/'],[],0,0,0,[],[],https://twitter.com/qgjeune/status/1034361941765054464,False,,0,,,,,,,,[],,,,
1033873573767774209,1033679215718277121,2018-08-27 00:27:23 UTC,2018-08-27,00:27:23,0,155081880,gugustt,Gustave NOMBRE,,@emmanutapsoba @yabsi1er @simon_compaore @baowends @Djibsbal @BFA2020 @DDJOUMA @Dieuson1 @abdouzoure @KindoB @yeroseo Ouais c'est au #BurkinaFaso que les manquements d'un citoyen justifient le raté de la communication d'un homme politique. Le comportement incivique d'un citoyen justifie celui d'une autorité. Au Burkina Faso. Chapeau !,fr,[],[],[],0,0,2,['burkinafaso'],[],https://twitter.com/Gugustt/status/1033873573767774209,False,,0,,,,,,,,"[{'screen_name': 'emmanutapsoba', 'name': 'Emmanuel Tapsoba', 'id': '1446861938'}, {'screen_name': 'yabsi1er', 'name': 'YABRE Idrissa', 'id': '105442822'}, {'screen_name': 'simon_compaore', 'name': 'Simon Compaore', 'id': '728105349492805632'}, {'screen_name': 'baowends', 'name': 'Bowen', 'id': '1349024526'}, {'screen_name': 'Djibsbal', 'name': 'BALIMA Djibrila 🇧🇫', 'id': '2231641312'}, {'screen_name': 'BFA2020', 'name': 'Le Faso toujours 🇧🇫', 'id': '2225826358'}, {'screen_name': 'DDJOUMA', 'name': 'Daouda Djouma', 'id': '231219258'}, {'screen_name': 'Dieuson1', 'name': 'Dieudonné LANKOANDE', 'id': '65612337'}, {'screen_name': 'abdouzoure', 'name': 'Abdou ZOURE', 'id': '594781060'}, {'screen_name': 'KindoB', 'name': 'Bassératou KINDO', 'id': '421460937'}, {'screen_name': 'yeroseo', 'name': 'Yéroséo Somda', 'id': '2815375551'}]",,,,
1032948686001778688,1032948686001778688,2018-08-24 11:12:12 UTC,2018-08-24,11:12:12,0,16683704,allafricafrench,AllAfrica Fr,,Conseil supérieur de la communication - Les neuf conseillers s'assurent du soutien du président du Fas:  https://t.co/iLJqoD4IbZ #BurkinaFaso,fr,[],['https://fr.allafrica.com/stories/201808240238.html?utm_campaign=allafrica%3Aeditor&utm_medium=social&utm_source=twitter&utm_content=promote%3Aaans%3Aaccnqx'],[],0,0,0,['burkinafaso'],[],https://twitter.com/AllAfricafrench/status/1032948686001778688,False,,0,,,,,,,,[],,,,
1032693132457136128,1032693132457136128,2018-08-23 18:16:43 UTC,2018-08-23,18:16:43,0,826249793504698369,notrefaso,Notre Faso,,Entretien ce jeudi au Palais de Kosyam avec la nouvelle équipe dirigeante du Conseil Supérieur de la Communication. #BurkinaFaso #lwili  https://t.co/pUvhAkZN0d,fr,[],[],"['https://pbs.twimg.com/media/DlTcCV7XsAAvdS_.jpg', 'https://pbs.twimg.com/media/DlTcCszXcAAWINQ.jpg', 'https://pbs.twimg.com/media/DlTcDc0WsAA0DTS.jpg', 'https://pbs.twimg.com/media/DlTcD6eW4AE5jE8.jpg']",0,0,0,"['burkinafaso', 'lwili']",[],https://twitter.com/NotreFaso/status/1032693132457136128,False,,1,https://pbs.twimg.com/media/DlTcCV7XsAAvdS_.jpg,,,,,,,[],,,,
1032692183286071296,1032692183286071296,2018-08-23 18:12:57 UTC,2018-08-23,18:12:57,0,3353383450,rochkaborepf,Roch KABORE,,Entretien ce jeudi au Palais de Kosyam avec la nouvelle équipe dirigeante du Conseil Supérieur de la Communication. #BurkinaFaso #lwili  https://t.co/etGKOVLuCs,fr,[],[],"['https://pbs.twimg.com/media/DlTcCV7XsAAvdS_.jpg', 'https://pbs.twimg.com/media/DlTcCszXcAAWINQ.jpg', 'https://pbs.twimg.com/media/DlTcDc0WsAA0DTS.jpg', 'https://pbs.twimg.com/media/DlTcD6eW4AE5jE8.jpg']",4,13,83,"['burkinafaso', 'lwili']",[],https://twitter.com/rochkaborepf/status/1032692183286071296,False,,1,https://pbs.twimg.com/media/DlTcCV7XsAAvdS_.jpg,,,,,,,[],,,,
1032687686715404291,1032687686715404291,2018-08-23 17:55:05 UTC,2018-08-23,17:55:05,0,897481534231523328,oeildufaso,Œil du Faso,,#BurkinaFaso : Le chef de l'état a reçu le collège des conseillers du (CSC) conseil supérieur de la Communication.   Le président de la République a reçu ce matin 23 août 2018 l'ensemble du collège des...  https://t.co/AMzV8cOuL5,fr,[],['https://www.facebook.com/1910962582275551/posts/1945351875503288/'],[],0,0,0,['burkinafaso'],[],https://twitter.com/OeilDuFaso/status/1032687686715404291,False,,0,,,,,,,,[],,,,
1032680506616434689,1032680506616434689,2018-08-23 17:26:33 UTC,2018-08-23,17:26:33,0,66553045,koaci,koaci.com,,Burkina Faso: Les nouveaux membres du Conseil supérieur de la Communication chez le président du Faso  https://t.co/cr3EhB3RBv  https://t.co/cr3EhB3RBv,fr,[],"['http://koaci.com/burkina-faso-nouveaux-membres-conseil-superieur-communication-chez-president-faso-122582.html', 'http://koaci.com/burkina-faso-nouveaux-membres-conseil-superieur-communication-chez-president-faso-122582.html']",[],0,0,0,[],[],https://twitter.com/Koaci/status/1032680506616434689,False,,0,,,,,,,,[],,,,
1032680044328562688,1032680044328562688,2018-08-23 17:24:43 UTC,2018-08-23,17:24:43,0,66553045,koaci,koaci.com,,Burkina Faso: Les nouveaux membres du Conseil supérieur de la Communication chez le président du Faso  https://t.co/cr3EhB3RBv,fr,[],['http://koaci.com/burkina-faso-nouveaux-membres-conseil-superieur-communication-chez-president-faso-122582.html'],[],0,0,1,[],[],https://twitter.com/Koaci/status/1032680044328562688,False,,0,,,,,,,,[],,,,
1031538432550555648,1031538432550555648,2018-08-20 13:48:22 UTC,2018-08-20,13:48:22,0,922558231846817793,aemptg,AEMP-TOGO,,"COMMUNICATION ORALE: Troubles du langage à l'unité  de PédoPsychiatre au CHU Yalgado Ouédraogo: épidémiologie et facteurs  étiologique  Prof Kapouné KARFO, psychiatre des Hôpitaux  (#BurkinaFaso)  #CongresFOAF  @foafafrique  https://t.co/oCMmJuxZkn",fr,"[{'screen_name': 'foafafrique', 'name': 'foaf', 'id': '984812977797857280'}]",[],"['https://pbs.twimg.com/media/DlC5-MfXgAAbBgB.jpg', 'https://pbs.twimg.com/media/DlC6FKKX0AEhGF8.jpg', 'https://pbs.twimg.com/media/DlDCt-oXgAATgS5.jpg']",0,3,9,"['burkinafaso', 'congresfoaf']",[],https://twitter.com/aemptg/status/1031538432550555648,False,,1,https://pbs.twimg.com/media/DlC5-MfXgAAbBgB.jpg,,,,,,,[],,,,
