id,conversation_id,created_at,date,time,timezone,user_id,username,name,place,tweet,language,mentions,urls,photos,replies_count,retweets_count,likes_count,hashtags,cashtags,link,retweet,quote_url,video,thumbnail,near,geo,source,user_rt_id,user_rt,retweet_id,reply_to,retweet_date,translate,trans_src,trans_dest
1341898364032593921,1341898361805426690,2020-12-24 00:07:55 UTC,2020-12-24,00:07:55,0,1277154856806035456,redlionmedia2,RED LION MEDIA,,"Masiyiwa also owns just over half of private company Liquid Telecom, which provides fiber optic and satellite services to telecom firms across Africa. His other assets include stakes in mobile phone networks in Burundi and Lesotho, and investments in fintech and power...",en,[],[],[],1,0,0,[],[],https://twitter.com/REDLIONMEDIA2/status/1341898364032593921,False,,0,,,,,,,,[],,,,
1340227238252429313,1340224718138437632,2020-12-19 09:27:28 UTC,2020-12-19,09:27:28,0,1057002968728432642,moseskawooya2,Hajji Musa K,,"@SoftPowerNews @UgandaCAA Most of Ugandans have Covid-19 tests done at their workplaces and results sent on their mobile phones. Do you accept results on their handsets? The increase of infection to Ugandans is from Burundi, Kenya, Tanzania, DRC, and South Sudan. Target those borders",en,[],[],[],0,0,0,[],[],https://twitter.com/MosesKawooya2/status/1340227238252429313,False,,0,,,,,,,,"[{'screen_name': 'SoftPowerNews', 'name': 'SoftPower News', 'id': '3784907241'}, {'screen_name': 'UgandaCAA', 'name': 'Uganda CAA', 'id': '2885386137'}]",,,,
1337729393234472962,1337729393234472962,2020-12-12 12:01:55 UTC,2020-12-12,12:01:55,0,2457263700,imitwe,Stockman 🇧🇮,,Voilà. Slowly #Burundi is getting there. You can now make medical reservations on mobile phones😍. Businesses and banks are embracing versatility...  https://t.co/1nQYyPKR4v,en,[],[],"['https://pbs.twimg.com/media/EpCRB2pXMAYf0MJ.jpg', 'https://pbs.twimg.com/media/EpCRahvXEAEI4dp.jpg', 'https://pbs.twimg.com/media/EpCRPgfXYAAp-iZ.jpg', 'https://pbs.twimg.com/media/EpCRpWqXMAAwzAI.jpg']",2,17,89,['burundi'],[],https://twitter.com/iMitwe/status/1337729393234472962,False,https://twitter.com/iMitwe/status/1337135721602297860,1,https://pbs.twimg.com/media/EpCRB2pXMAYf0MJ.jpg,,,,,,,[],,,,
1279382670456188928,1279348094459539463,2020-07-04 11:52:53 UTC,2020-07-04,11:52:53,0,541914020,mimireeds,🕯 Mitchell Mhlanga 🇿🇼,,"@HabaneNzwakele His other assets include stakes in mobile phone networks, beverages and media ventures in Burundi, Botswana, CAR, South Africa, UK and Lesotho, and investments in fintech, water and power distribution firms in Africa. Now ranked 8th richest man in Africa and 900th in the world.",en,[],[],[],1,0,0,[],[],https://twitter.com/MimiReeds/status/1279382670456188928,False,,0,,,,,,,,"[{'screen_name': 'HabaneNzwakele', 'name': 'Gukurahundi Equalizer', 'id': '294001660'}]",,,,
1277472336753635328,1277472336753635328,2020-06-29 05:21:54 UTC,2020-06-29,05:21:54,0,3294116661,worldmeritbi,World Merit Burundi,,Always @CarteDorian in rural areas using mobile phone. @UNICEF_Burundi  https://t.co/s9UYqm2AAF,en,"[{'screen_name': 'cartedorian', 'name': 'dorian', 'id': '2755003365'}, {'screen_name': 'unicef_burundi', 'name': 'unicef burundi', 'id': '1242803435864457216'}]",[],"['https://pbs.twimg.com/media/Ebp-SJDWsAQRe2p.jpg', 'https://pbs.twimg.com/media/Ebp-SJZWoAEHmQ0.jpg', 'https://pbs.twimg.com/media/Ebp-SJsXYAEipok.jpg', 'https://pbs.twimg.com/media/Ebp-SJ3WAAAo0ze.jpg']",0,0,1,[],[],https://twitter.com/WorldMeritBI/status/1277472336753635328,False,,1,https://pbs.twimg.com/media/Ebp-SJDWsAQRe2p.jpg,,,,,,,[],,,,
1276785691460956161,1276785679851155456,2020-06-27 07:53:25 UTC,2020-06-27,07:53:25,0,917983451671924737,kkr_arvind,arvind sharma,,"methodological approaches. In an effort to better understand how mobile phones empower women, authors also conducted an individual level analysis on 100,000 women from Angola, Burundi,Ethiopia,Malawi, Tanzania,Uganda,and Zimbabwe between 2015 and 2017. Though these sub- Saharan",en,[],[],[],1,0,0,[],[],https://twitter.com/kkr_arvind/status/1276785691460956161,False,,0,,,,,,,,[],,,,
1263124101742440448,1263124101742440448,2020-05-20 15:07:08 UTC,2020-05-20,15:07:08,0,46601072,ngendapatrick,Ngendakumana J. Patrick,,"Yes, there is internet in Burundi and far cheaper than in Uganda where you pay tax for using a mobile phone.",en,[],[],[],2,3,46,[],[],https://twitter.com/ngendapatrick/status/1263124101742440448,False,https://twitter.com/LaikaMukasa/status/1263005583550099457,0,,,,,,,,[],,,,
1262327194103287808,1262327194103287808,2020-05-18 10:20:30 UTC,2020-05-18,10:20:30,0,2148553704,drumchronicles,Evelyn Tremble,,#Burundi Free and totally unfair Elections 2020: “Local and foreign observers are strictly prohibited from using mobile phones and taking photos inside polling stations on polling day”  https://t.co/HQNTlwsbYS,en,[],[],['https://pbs.twimg.com/media/EYSu9lMXsAAg-xP.jpg'],0,1,1,['burundi'],[],https://twitter.com/DrumChronicles/status/1262327194103287808,False,,1,https://pbs.twimg.com/media/EYSu9lMXsAAg-xP.jpg,,,,,,,[],,,,
1238360796645617670,1238360796645617670,2020-03-13 07:06:36 UTC,2020-03-13,07:06:36,0,2214134386,franzquotes,Franz Derrick D. フランツ,,It takes 3min: If you have ever had /or have a mobile phone subscribed in  #Burundi I would much appreciate if you help me fill this short survey.  https://t.co/3cpqea8e7b,en,[],['https://forms.gle/Bm9Zwhbqudx4S6556'],[],0,0,0,['burundi'],[],https://twitter.com/franzquotes/status/1238360796645617670,False,,0,,,,,,,,[],,,,
1234617103916900353,1234617103916900353,2020-03-02 23:10:30 UTC,2020-03-02,23:10:30,0,1144599392873324544,swasloo,Sammie Wasloo,,"Sign up for Shutterstock, start uploading your mobile phone/camera photos. You WILL start making money on the side!  https://t.co/RTWAmeE8wn #photography #photographer #money #makemoney #jobs #moneymaking #Algeria #Angola #Benin #Botswana #Burundi #Cameroon #Chad #Comoros #Congo",en,[],['http://submit.shutterstock.com?rid=3116378'],[],0,0,1,"['photography', 'photographer', 'money', 'makemoney', 'jobs', 'moneymaking', 'algeria', 'angola', 'benin', 'botswana', 'burundi', 'cameroon', 'chad', 'comoros', 'congo']",[],https://twitter.com/SWasloo/status/1234617103916900353,False,,0,,,,,,,,[],,,,
1223288389555904512,1223288389555904512,2020-01-31 16:54:14 UTC,2020-01-31,16:54:14,0,876578482893008896,internetlife100,🔰David🇵🇹🌍🔰,,Burundi 🇧🇮 jan 2020  👨‍👨‍👧‍👦 Population: 11.71 Million  🔢  6.94 Million mobile phone connections (%) 🌐 1.15 Million Internet users (9.9%) 👥  530.0 Thousand Active Social media Users (4.5%)  #Digital #Internet #socialmedia #Burundi #yUburundi  https://t.co/Qm2zE9TBN4,en,[],[],['https://pbs.twimg.com/media/EPn-TavWsAAk6Mn.jpg'],0,0,0,"['digital', 'internet', 'socialmedia', 'burundi', 'yuburundi']",[],https://twitter.com/Internetlife100/status/1223288389555904512,False,,1,https://pbs.twimg.com/media/EPn-TavWsAAk6Mn.jpg,,,,,,,[],,,,
1219553250778722304,1219553250778722304,2020-01-21 09:32:07 UTC,2020-01-21,09:32:07,0,3383666795,regionweek,RegionWeek,,"#TECH- 🔴 The first (mobile phones, computers, etc.) assembly plant in #Gitega, #Burundi.  https://t.co/7aKsuLNaGl",en,[],[],['https://pbs.twimg.com/media/EOy42z7WsAE3RWh.jpg'],0,0,1,"['tech', 'gitega', 'burundi']",[],https://twitter.com/RegionWeek/status/1219553250778722304,False,,1,https://pbs.twimg.com/media/EOy42z7WsAE3RWh.jpg,,,,,,,[],,,,
1200034232518746112,1200034232518746112,2019-11-28 12:50:31 UTC,2019-11-28,12:50:31,0,1130794218094551045,misscareerafric,Miss Career Africa,,"she wants to see her country develop in technological and medical fields. ONLINE MEDICAL CONSULTATION IN BURUNDI will help people from all class get the right consultation|data for good health, doctor advice all by using a mobile phone.Kindly vote for her.  https://t.co/pQloiONNvs  https://t.co/8XjETXOdxN",en,[],['https://misscareerafrica.org/candidate-page/46'],['https://pbs.twimg.com/media/EKdgwnPWoAE26RI.jpg'],0,0,0,[],[],https://twitter.com/Misscareerafric/status/1200034232518746112,False,,1,https://pbs.twimg.com/media/EKdgwnPWoAE26RI.jpg,,,,,,,[],,,,
1200025349020631040,1200025349020631040,2019-11-28 12:15:13 UTC,2019-11-28,12:15:13,0,236770150,poandpo,POST Online Media,,"Text only, lite version of POST Online Media for slow connections, rural areas and older mobile phones, tablets and computers:  https://t.co/XvD9uFjomD #Algeria #Angola #Benin #Botswana #BurkinaFaso #Burundi #Cabo Verde #Cameroon #CentralAfricanRepublic #Chad #Comoros #Congo",en,[],['https://lite.poandpo.com'],[],0,0,0,"['algeria', 'angola', 'benin', 'botswana', 'burkinafaso', 'burundi', 'cabo', 'cameroon', 'centralafricanrepublic', 'chad', 'comoros', 'congo']",[],https://twitter.com/poandpo/status/1200025349020631040,False,,0,,,,,,,,[],,,,
1195982041587863553,1195982041587863553,2019-11-17 08:28:33 UTC,2019-11-17,08:28:33,0,236770150,poandpo,POST Online Media,,"Text only, lite version of POST Online Media for slow connections, rural areas and older mobile phones, tablets and computers:  https://t.co/XvD9uFjomD #news #Algeria #Angola #Benin #Botswana #BurkinaFaso #Burundi #CaboVerde #Cameroon #CentralAfricanRepublic #Chad #Comoros #Congo",en,[],['https://lite.poandpo.com'],[],0,0,0,"['news', 'algeria', 'angola', 'benin', 'botswana', 'burkinafaso', 'burundi', 'caboverde', 'cameroon', 'centralafricanrepublic', 'chad', 'comoros', 'congo']",[],https://twitter.com/poandpo/status/1195982041587863553,False,,0,,,,,,,,[],,,,
1181920235177365504,1181920235177365504,2019-10-09 13:11:57 UTC,2019-10-09,13:11:57,0,2410872103,hallaboutafrica,James Hall,,"Essential mineral. 2019 Nobel Prize in Chemistry awarded to 3 scientists who developed the lithium-ion battery that ""has revolutionized our lives and is used in everything from mobile phones to laptops and electric vehicles.” In Africa, Lithium from Burundi, DRC and Zimbabwe.  https://t.co/MYCICbcZUv",en,[],[],['https://pbs.twimg.com/media/EGcGLSTWsAEgW_K.jpg'],2,18,33,[],[],https://twitter.com/hallaboutafrica/status/1181920235177365504,False,,1,https://pbs.twimg.com/media/EGcGLSTWsAEgW_K.jpg,,,,,,,[],,,,
1181051904194940928,1181051904194940928,2019-10-07 03:41:31 UTC,2019-10-07,03:41:31,0,66058532,ruthnesoba,Ruth Nesoba,,"Two nuns from #Burundi were killed in the collapse of a communication installation pole owned by #Orange in #Uvira, in the eastern Democratic Republic of #Congo, according to a report from the #French mobile phone operator on #Sunday. #DRCongo  https://t.co/I4A9QrdDmj",en,[],[],['https://pbs.twimg.com/media/EGPwcO9WkAErMR1.jpg'],1,0,1,"['burundi', 'orange', 'uvira', 'congo', 'french', 'sunday', 'drcongo']",[],https://twitter.com/RuthNesoba/status/1181051904194940928,False,,1,https://pbs.twimg.com/media/EGPwcO9WkAErMR1.jpg,,,,,,,[],,,,
1180821100240015362,1180821100240015362,2019-10-06 12:24:23 UTC,2019-10-06,12:24:23,0,30446521,iburundi,iBurundi,,#Burundi police spokesman says they first arrested the houseworker of the late JMV Rugerinyange and then interrogated him. He adds they then found him selling mobile phones belonging to Mr. Rugerinyange. But HOW? The houseworker was already in custody!   https://t.co/aUnhdJWnVI,en,[],[],[],4,9,7,['burundi'],[],https://twitter.com/iburundi/status/1180821100240015362,False,,1,https://pbs.twimg.com/ext_tw_video_thumb/1180475462902001665/pu/img/jX1Kp13LWSkSopVQ.jpg,,,,,,,[],,,,
1176211382943068162,1176211382943068162,2019-09-23 19:07:01 UTC,2019-09-23,19:07:01,0,1139422560469131264,labxcel,XcelLab,,Top-Up Your Mobile Phone Plan in Burundi On XcelPay #XcelPay #MobileRecharge #Burundi #Crypto    https://t.co/rEFYHYFxqi  https://t.co/BrZeETAtOb,en,[],['https://buff.ly/2kw7oaD'],['https://pbs.twimg.com/media/EFK-BQnWwAEVwpW.jpg'],0,0,0,"['xcelpay', 'mobilerecharge', 'burundi', 'crypto']",[],https://twitter.com/LabXcel/status/1176211382943068162,False,,1,https://pbs.twimg.com/media/EFK-BQnWwAEVwpW.jpg,,,,,,,[],,,,
1176114524480557057,1176114524480557057,2019-09-23 12:42:08 UTC,2019-09-23,12:42:08,0,1056209596187140102,pertsovao,OL,,Top-Up Your Mobile Phone Plan in Burundi on @xceltrip  https://t.co/o78ouSe9Vn If you are travelling to Burundi and want to use ur #Crypto -book your stay and flights to Burundi with @xceltrip and top up your local mobile phone plan on @XcelPayWallet,en,"[{'screen_name': 'xceltrip', 'name': 'xceltrip', 'id': '840815553409245184'}, {'screen_name': 'xceltrip', 'name': 'xceltrip', 'id': '840815553409245184'}, {'screen_name': 'xcelpaywallet', 'name': 'xcelpay wallet', 'id': '1010867811672117249'}]",['https://link.medium.com/X1fOXhVvd0'],[],0,1,2,['crypto'],[],https://twitter.com/PertsovaO/status/1176114524480557057,False,,0,,,,,,,,[],,,,
1176111292316377089,1176111292316377089,2019-09-23 12:29:17 UTC,2019-09-23,12:29:17,0,1010867811672117249,xcelpaywallet,XcelPay Wallet,,Top-Up Your Mobile Phone Plan in Burundi On XcelPay #XcelPay #MobileRecharge #Burundi #Crypto    https://t.co/obB18cvAgQ  https://t.co/GpTxjr2TyR,en,[],['https://buff.ly/2kw7oaD'],['https://pbs.twimg.com/media/EFJi_NlXUAIpXUv.jpg'],0,0,0,"['xcelpay', 'mobilerecharge', 'burundi', 'crypto']",[],https://twitter.com/XcelPayWallet/status/1176111292316377089,False,,1,https://pbs.twimg.com/media/EFJi_NlXUAIpXUv.jpg,,,,,,,[],,,,
1171074552375496706,1171074552375496706,2019-09-09 14:55:05 UTC,2019-09-09,14:55:05,0,330702406,reverd_com,Reverd.com,,"Unknown - Mobile, Burundi -  https://t.co/3qgZo9ujo7 - Scam (annoying phone calls)",en,[],['http://reverd.com/blog/257-72-33-52-06'],[],0,0,0,[],[],https://twitter.com/reverd_com/status/1171074552375496706,False,,0,,,,,,,,[],,,,
1162264322468220929,1162260127795146762,2019-08-16 07:26:22 UTC,2019-08-16,07:26:22,0,1299327840,arnoldi254,Arnold,,"His other assets include stakes in mobile phone networks in Burundi and Lesotho, and investments in fintech and power distribution firms in Africa.  #SOARAfrica2019",en,[],[],[],1,7,0,['soarafrica2019'],[],https://twitter.com/arnoldi254/status/1162264322468220929,False,,0,,,,,,,,[],,,,
1155176646376337408,1154055576101543938,2019-07-27 18:02:29 UTC,2019-07-27,18:02:29,0,2499642079,he_shedit4_us,A Mighty Fortress is our God🏰,,@geauxky There's a mobile phones' shop on his name in Burundi from his election till now though he's gone,en,[],[],[],0,0,0,[],[],https://twitter.com/He_shedit4_us/status/1155176646376337408,False,,0,,,,,,,,"[{'screen_name': 'geauxky', 'name': 'GEAUXKY', 'id': '427156881'}]",,,,
1149570969427566593,1149570969427566593,2019-07-12 06:47:31 UTC,2019-07-12,06:47:31,0,1026203168244461571,katalestore,katale Store,,"Did you know you can now send money to across East Africa?  You can now send money to Burundi, Kenya, Rwanda and Tanzania using your Mobile Phone.  Dial *165*1*2#Yes. #MTNMoMo #MobileMoney @mtnug  https://t.co/85El7xHePX",en,"[{'screen_name': 'mtnug', 'name': 'mtn uganda', 'id': '238115057'}]",[],['https://pbs.twimg.com/media/D_QYpCxU8AAyRcm.jpg'],0,1,3,"['mtnmomo', 'mobilemoney']",[],https://twitter.com/KataleStore/status/1149570969427566593,False,,1,https://pbs.twimg.com/media/D_QYpCxU8AAyRcm.jpg,,,,,,,[],,,,
1149567953924325376,1149567953924325376,2019-07-12 06:35:32 UTC,2019-07-12,06:35:32,0,1026203168244461571,katalestore,katale Store,,"Did you know you can now send money to across East Africa?  You can now send money to Burundi, Kenya, Rwanda and Tanzania using your Mobile Phone.  Dial *165*1*2#Yes. #MTNMoMo #MobileMoney @mtnug  https://t.co/zOwWU8jmeg",en,"[{'screen_name': 'mtnug', 'name': 'mtn uganda', 'id': '238115057'}]",[],['https://pbs.twimg.com/media/D_QV6f5U4AASsd5.jpg'],0,1,1,"['mtnmomo', 'mobilemoney']",[],https://twitter.com/KataleStore/status/1149567953924325376,False,,1,https://pbs.twimg.com/media/D_QV6f5U4AASsd5.jpg,,,,,,,[],,,,
1148895147855360001,1148895147855360001,2019-07-10 10:02:03 UTC,2019-07-10,10:02:03,0,1026203168244461571,katalestore,katale Store,,"Did you know you can now send money to across East Africa?  You can now send money to Burundi, Kenya, Rwanda and Tanzania using your Mobile Phone.  Dial *165*1*2#Yes. #MTNMoMo #MobileMoney  https://t.co/Xvt8ypIa7v",en,[],[],['https://pbs.twimg.com/media/D_GyB9RWkAEUe7m.jpg'],0,1,2,"['mtnmomo', 'mobilemoney']",[],https://twitter.com/KataleStore/status/1148895147855360001,False,,1,https://pbs.twimg.com/media/D_GyB9RWkAEUe7m.jpg,,,,,,,[],,,,
1148894633667125248,1148894633667125248,2019-07-10 10:00:00 UTC,2019-07-10,10:00:00,0,238115057,mtnug,MTN Uganda,,"Did you know you can now send money to across East Africa?  You can now send money to Burundi, Kenya, Rwanda and Tanzania using your Mobile Phone.  Dial *165*1*2#Yes. #MTNMoMo #MobileMoney  https://t.co/OIbpfUkAdT",en,[],[],['https://pbs.twimg.com/media/D_GimPGXYAEIVR1.jpg'],0,4,12,"['mtnmomo', 'mobilemoney']",[],https://twitter.com/mtnug/status/1148894633667125248,False,,1,https://pbs.twimg.com/media/D_GimPGXYAEIVR1.jpg,,,,,,,[],,,,
1125319424062496768,1125319424062496768,2019-05-06 08:40:32 UTC,2019-05-06,08:40:32,0,992119990823374850,primaforex,Prima Forex Bureau,,"#Burundi; Good morning to u all... @PrimaForex  we are experiencing a technical issue with our Iandline... please, when trying to reach us, use mobile phone numbers: 75978511 we thank you for your understanding and believe the matter will be sorted shortly.  https://t.co/zOXZKOctG6",en,"[{'screen_name': 'primaforex', 'name': 'prima forex bureau', 'id': '992119990823374850'}]",[],['https://pbs.twimg.com/media/D53wCU6XoAEzzC6.jpg'],0,0,1,['burundi'],[],https://twitter.com/PrimaForex/status/1125319424062496768,False,,1,https://pbs.twimg.com/media/D53wCU6XoAEzzC6.jpg,,,,,,,[],,,,
1116258511472734208,1115485505783717889,2019-04-11 08:35:42 UTC,2019-04-11,08:35:42,0,794472189470920708,hkinspain,Helen King,,"@DaviBeckham24x7 Thank you. I have worked in the financial area to fight Malaria in Senegal and Burundi. Please, ask your musical friends to record a song, in the local languages because most people who suffer from this disease do not read any language, have no mobile phone. Music works",en,[],[],[],0,0,0,[],[],https://twitter.com/HKinspain/status/1116258511472734208,False,,0,,,,,,,,"[{'screen_name': 'DaviBeckham24x7', 'name': 'David Beckham', 'id': '620475809'}]",,,,
1098129108498812928,1098129108498812928,2019-02-20 07:55:56 UTC,2019-02-20,07:55:56,0,992119990823374850,primaforex,Prima Forex Bureau,,"#Burundi; Good morning to all... @PrimaForex we are experiencing a technical issue with our Iandline... please, when trying to reach us, use mobile phone numbers... we thank you for your understanding and believe the matter will be sorted shortly",en,"[{'screen_name': 'primaforex', 'name': 'prima forex bureau', 'id': '992119990823374850'}]",[],[],1,0,0,['burundi'],[],https://twitter.com/PrimaForex/status/1098129108498812928,False,,0,,,,,,,,[],,,,
1077436571463442432,1077436571463442432,2018-12-25 05:31:11 UTC,2018-12-25,05:31:11,0,733241246525820928,tradenewsalert,Trade News Alert,,"E. Africa Business Council wants Burundi &amp; Tanzania to join Kenya, Uganda,Rwanda &amp; SouthSudan in  #OneAreaNetwork that abolishes roaming charges on mobile phone.  @EABCArusha says this wld lower cross border telecommunication tariffs,boost trade &amp; integration in line with @AfCfta",en,[],[],[],0,15,16,['oneareanetwork'],[],https://twitter.com/TradeNewsAlert/status/1077436571463442432,False,,0,,,,,,,,[],,,,
1052889311874568192,1052889311874568192,2018-10-18 11:49:08 UTC,2018-10-18,11:49:08,0,58876796,miko75011,Michel Arseneault,,@UNICEF Burundi office not picking up the phone. Am looking for rep's mobile number for an intervew. Can you help?,en,[],[],[],0,0,0,[],[],https://twitter.com/miko75011/status/1052889311874568192,False,,0,,,,,,,,[],,,,
1043279262613041152,1043279262613041152,2018-09-21 23:22:14 UTC,2018-09-21,23:22:14,0,720610225951117312,emojihaikus,Emoji Haikus,,🇧🇮 🎉 ⛸️ 👃 📵 👛 FLAG FOR BURUNDI PARTY POPPER ICE SKATE NOSE NO MOBILE PHONES PURSE,en,[],[],[],0,0,0,[],[],https://twitter.com/emojihaikus/status/1043279262613041152,False,,0,,,,,,,,[],,,,
1037663773962772480,1037663773962772480,2018-09-06 11:28:17 UTC,2018-09-06,11:28:17,0,816998935059460096,ikirihonews,Ikiriho News,,#Burundi In @RutanaProvince The #Lumitel mobile phone company's agents also take part of the strike movement. Only 2 workers are present at the station to ensure the minimum service  https://t.co/8ii7h7IH01,en,"[{'screen_name': 'rutanaprovince', 'name': 'province rutana', 'id': '765511417902538752'}]",[],['https://pbs.twimg.com/media/DmaCEPrWwAEyf9v.jpg'],1,0,0,"['burundi', 'lumitel']",[],https://twitter.com/IkirihoNews/status/1037663773962772480,False,,1,https://pbs.twimg.com/media/DmaCEPrWwAEyf9v.jpg,,,,,,,[],,,,
1037624922984652800,1037624903074238465,2018-09-06 08:53:54 UTC,2018-09-06,08:53:54,0,816998935059460096,ikirihonews,Ikiriho News,,"#Lumitel staff, a mobile phone company operating in #Burundi has been on strike since this Thursday September 6th 2018, nationwide. They are claiming contracts and other benefits  https://t.co/2jSXoeCe5V",en,[],[],"['https://pbs.twimg.com/media/DmZhZR9XoAEEBhl.jpg', 'https://pbs.twimg.com/media/DmZhazpX4AAHJyu.jpg']",0,0,0,"['lumitel', 'burundi']",[],https://twitter.com/IkirihoNews/status/1037624922984652800,False,,1,https://pbs.twimg.com/media/DmZhZR9XoAEEBhl.jpg,,,,,,,[],,,,
1035495461627551744,1035495461627551744,2018-08-31 11:52:11 UTC,2018-08-31,11:52:11,0,173870393,fnziza,Dr NZIZA Franck,,26% of africa is online and 90 % of users are using mobile phones. What about #Burundi ? @say_campaign @Ndakiranet @Min_JPTic  #BDES2018  https://t.co/zmksXqBwSW,en,"[{'screen_name': 'say_campaign', 'name': 'say campaign', 'id': '1013371960397615105'}, {'screen_name': 'ndakiranet', 'name': 'ndakira.net', 'id': '1000675041892274176'}]",[],['https://pbs.twimg.com/media/Dl7RoZ8WwAAgKS6.png'],2,2,2,"['burundi', 'bdes2018']",[],https://twitter.com/FNZIZA/status/1035495461627551744,False,,1,https://pbs.twimg.com/media/Dl7RoZ8WwAAgKS6.png,,,,,,,[],,,,
1025779345275727875,1025779345275727875,2018-08-04 16:23:48 UTC,2018-08-04,16:23:48,0,3383666795,regionweek,RegionWeek,,"Burundi: ICT Minister calls on youth to ""rationally"" use mobile phones&gt;Read More : -  https://t.co/p1m5YiZ6qP&gt; #Burundi  https://t.co/yRKlbr6GcB",en,[],['https://regionweek.com/burundi-ict-minister-calls-on-youth-to-rationally-use-mobile-phones/'],['https://pbs.twimg.com/media/DjxM4J7V4AQPSU3.jpg'],0,0,0,['burundi'],[],https://twitter.com/RegionWeek/status/1025779345275727875,False,,1,https://pbs.twimg.com/media/DjxM4J7V4AQPSU3.jpg,,,,,,,[],,,,
1009804947842617347,1009802350188482561,2018-06-21 14:27:15 UTC,2018-06-21,14:27:15,0,212295064,my_shoes93,my_shoes93,,"@thejensie Also, do NOT answer on mobile phone if you see numbers from : Malaysia, Congo, Egypt, Tanzania, Burundi, Sudan, Zambia, Vanuatu, Samoa or Mali.    And DO NOT call them back if you have `missed calls `  😉",en,[],[],[],0,0,1,[],[],https://twitter.com/my_shoes93/status/1009804947842617347,False,,0,,,,,,,,"[{'screen_name': 'thejensie', 'name': 'Jens Voigt', 'id': '333568300'}]",,,,
990707386804588545,990707386804588545,2018-04-29 21:40:22 UTC,2018-04-29,21:40:22,0,2394630988,baconib,Blaise Nijimbere 🇧🇮,,"Retweeted iBurundi (@iburundi):  #Burundi—In order to hunt opponents down, today Jan 31, the ruling party top officials gave 298 mobile phones &amp; ""other equipments"" to the party's members in Ngozi. #BdiReferendumCrimes 3/n  https://t.co/peiwYRFfdS",en,"[{'screen_name': 'iburundi', 'name': 'iburundi', 'id': '30446521'}]",[],['https://pbs.twimg.com/media/DU56BPWX0AARBwS.jpg'],0,0,0,"['burundi', 'bdireferendumcrimes']",[],https://twitter.com/Baconib/status/990707386804588545,False,,1,https://pbs.twimg.com/media/DU56BPWX0AARBwS.jpg,,,,,,,[],,,,
988361649487859712,988361649487859712,2018-04-23 10:19:14 UTC,2018-04-23,10:19:14,0,68656320,szondi,Siphumelele Zondi,,This was taken by @KatishDigiMedia when we met Remy at Dzaleka Refugee Camp in Malawi. Remy is a refugee from Burundi who took us to his offices where he teaches other young people how to code and build mobile phone applications. I love his work!!  https://t.co/Ra4equVVKX,en,"[{'screen_name': 'katishdigimedia', 'name': 'katish digital media', 'id': '131147897'}]",[],['https://pbs.twimg.com/media/DbdcxqaWsAM6bGz.jpg'],0,2,2,[],[],https://twitter.com/SZondi/status/988361649487859712,False,,1,https://pbs.twimg.com/media/DbdcxqaWsAM6bGz.jpg,,,,,,,[],,,,
981435858179018753,981435849240907776,2018-04-04 07:38:37 UTC,2018-04-04,07:38:37,0,975106128584609792,mpi_digital,MPI Digital,,"Liquid Telecom provides fiber optic and satellite services to telecom firms  across Africa. His other assets include stakes in mobile phone  networks in Burundi and Lesotho, and investments in fintech and power  distribution firms in Africa.  #ForbesAfrica #ConsultMPI",en,[],[],[],1,0,1,"['forbesafrica', 'consultmpi']",[],https://twitter.com/mpi_digital/status/981435858179018753,False,,0,,,,,,,,[],,,,
979730173040918528,979730173040918528,2018-03-30 14:40:50 UTC,2018-03-30,14:40:50,0,4117826787,claudeniyongab1,claude NIYONGABO,,"#Burundi : Discount transport if you can pay with @EcobankBurundi ,using your mobile phone @EconetBurundi  *326# A great innovation 👌  https://t.co/BB4L2onZvP",en,"[{'screen_name': 'ecobankburundi', 'name': 'ecobank burundi', 'id': '936534514129604609'}, {'screen_name': 'econetburundi', 'name': 'econet wireless', 'id': '921060349'}]",[],"['https://pbs.twimg.com/media/DZix-BcWAAEoDIh.jpg', 'https://pbs.twimg.com/media/DZizR04WkAENR8T.jpg']",0,3,5,['burundi'],[],https://twitter.com/claudeNiyongab1/status/979730173040918528,False,,1,https://pbs.twimg.com/media/DZix-BcWAAEoDIh.jpg,,,,,,,[],,,,
