id,conversation_id,created_at,date,time,timezone,user_id,username,name,place,tweet,language,mentions,urls,photos,replies_count,retweets_count,likes_count,hashtags,cashtags,link,retweet,quote_url,video,thumbnail,near,geo,source,user_rt_id,user_rt,retweet_id,reply_to,retweet_date,translate,trans_src,trans_dest
1344355837318467586,1344355837318467586,2020-12-30 18:53:03 UTC,2020-12-30,18:53:03,0,258884175,capitaltvtz,Capital Television,,Three Children two from the same family nationals of Burundi who entered the country illegaly and engaged in farming activities at Nyarugusu village Kasulu district Kigoma region have died in fire incidents.  https://t.co/h3HbqiQwuc,en,[],[],['https://pbs.twimg.com/media/EqgcgOFW8AI4lMD.jpg'],0,0,0,[],[],https://twitter.com/Capitaltvtz/status/1344355837318467586,False,,1,https://pbs.twimg.com/media/EqgcgOFW8AI4lMD.jpg,,,,,,,[],,,,
1342105560402038789,1342105560402038789,2020-12-24 13:51:15 UTC,2020-12-24,13:51:15,0,1123906323563851776,sfcgburundi,Search For Common Ground - Burundi,,Retrouvez l'horaire d'où nous allons suivre la compétition  #NdUmuDG sur les radios et télévision .  #NdUmupro #Burundi #Abatwip  https://t.co/wTj72s8k33,fr,[],[],['https://pbs.twimg.com/media/EqAdTckW8AEjGZF.jpg'],0,0,2,"['ndumudg', 'ndumupro', 'burundi', 'abatwip']",[],https://twitter.com/SFCGBurundi/status/1342105560402038789,False,,1,https://pbs.twimg.com/media/EqAdTckW8AEjGZF.jpg,,,,,,,[],,,,
1342062211695398912,1342062211695398912,2020-12-24 10:59:00 UTC,2020-12-24,10:59:00,0,1123906323563851776,sfcgburundi,Search For Common Ground - Burundi,,"#Abatwip,  aujourd'hui à 21h30, vous allez suivre la compétition #NdUmuDG à Télévision Nationale du Burundi @RTNBurundi  #NdUmupro #Burundi  #AbatwipIsango  https://t.co/0mMBfDyzKw",fr,"[{'screen_name': 'rtnburundi', 'name': 'rtnb', 'id': '1131108866'}]",[],['https://pbs.twimg.com/media/Ep_lf7yW4AEWWnC.jpg'],0,4,4,"['abatwip', 'ndumudg', 'ndumupro', 'burundi', 'abatwipisango']",[],https://twitter.com/SFCGBurundi/status/1342062211695398912,False,,1,https://pbs.twimg.com/media/Ep_lf7yW4AEWWnC.jpg,,,,,,,[],,,,
1340468208340508672,1340468208340508672,2020-12-20 01:25:00 UTC,2020-12-20,01:25:00,0,105997198,cb_television,CB Televisión,,"#Internacional | ➡ El ex presidente de Burundi, Pierre Buyoya, falleció en París, a la edad de 71 años, a causa del covid-19, según informaron sus familiares. Ver más... 👇👇👇  https://t.co/tupxY80TId",es,[],['https://cbtelevision.com.mx/muere-por-coronavirus-pierre-buyoya-ex-presidente-de-burundi/'],[],0,0,1,['internacional'],[],https://twitter.com/cb_television/status/1340468208340508672,False,,0,,,,,,,,[],,,,
1339557052377681920,1339557052377681920,2020-12-17 13:04:23 UTC,2020-12-17,13:04:23,0,1123906323563851776,sfcgburundi,Search For Common Ground - Burundi,,"Aho muzokurikiranira rya higanwa #NdUmuDG  ku ma radio no kuma television iwanyu, ku musi wejo wa gatanu igenekerezo rya 18 kigarama 2020. #ndumupro  #Burundi  #Abatwip  https://t.co/ORvmLNYdwu",in,[],[],['https://pbs.twimg.com/media/EpcPx5lXYAE1SvU.jpg'],0,3,5,"['ndumudg', 'ndumupro', 'burundi', 'abatwip']",[],https://twitter.com/SFCGBurundi/status/1339557052377681920,False,,1,https://pbs.twimg.com/media/EpcPx5lXYAE1SvU.jpg,,,,,,,[],,,,
1331912677829074947,1331912677829074947,2020-11-26 10:48:22 UTC,2020-11-26,10:48:22,0,2399381083,fikiri93,Fikiri NZOYISENGA,,"An interview with @RTNBurundi  (#burundi national radio &amp; television), and other media on our campaign to encourage men to get more envolved in the fight for #genderequality. #16DaysofActivism2020 #OrangeTheWorld #SDG5 #semerera  https://t.co/I07FwQs9V3",en,"[{'screen_name': 'rtnburundi', 'name': 'rtnb', 'id': '1131108866'}]",[],['https://pbs.twimg.com/media/EnvnZzZW4AEvQSn.jpg'],0,0,2,"['burundi', 'genderequality', '16daysofactivism2020', 'orangetheworld', 'sdg5', 'semerera']",[],https://twitter.com/Fikiri93/status/1331912677829074947,False,,1,https://pbs.twimg.com/media/EnvnZzZW4AEvQSn.jpg,,,,,,,[],,,,
1331247764391473152,1331247764391473152,2020-11-24 14:46:15 UTC,2020-11-24,14:46:15,0,1093134025970122752,indimurwanko,Issa Ndimurwanko,,"Qu""est ce qui se passe avec humura Burundi, rpa, télévision renaissance et autres médias indépendants?",fr,[],[],[],5,0,0,[],[],https://twitter.com/INdimurwanko/status/1331247764391473152,False,,0,,,,,,,,[],,,,
1330532358152392711,1330532358152392711,2020-11-22 15:23:28 UTC,2020-11-22,15:23:28,0,1242904674,teddymazina,TEDDY MAZINA,,#Burundi #Resistance #resilience La télévision en exil @RTVRenaissance fait un travail magnifique de recueil de témoignages sur les crimes du passé.  Témoignage poignant sur la rafle des étudiants #hutu en 1972 à l'univ. du Burundi.  MERCI #MuhoziInnocent   https://t.co/vDl5uuoh2b,fr,"[{'screen_name': 'rtvrenaissance', 'name': 'télé renaissance', 'id': '1050030722906492929'}]",['https://youtu.be/uflbU0O2EBs'],[],1,4,26,"['burundi', 'resistance', 'resilience', 'hutu', 'muhoziinnocent']",[],https://twitter.com/TEDDYMAZINA/status/1330532358152392711,False,,0,,,,,,,,[],,,,
1330153054054862850,1330153054054862850,2020-11-21 14:16:15 UTC,2020-11-21,14:16:15,0,1206554606454611969,burundi_monpays,BURUNDI MON PAYS 🇧🇮,,"C'est aujourd'hui la #WorldTelevisionDay2020.  Avant les décodeurs Startimes, Canal Plus, les antennes paraboliques, #internet, etc., on avait la @RTNBurundi. La fameuse, l’indémodable Radio Télévision Nationale #Burundi-aise.  Réminiscence.  #technologie",fr,"[{'screen_name': 'rtnburundi', 'name': 'rtnb', 'id': '1131108866'}]",[],[],0,0,1,"['worldtelevisionday2020', 'internet', 'burundi', 'technologie']",[],https://twitter.com/Burundi_MonPays/status/1330153054054862850,False,https://twitter.com/YBurundi/status/1330131304415891457,0,,,,,,,,[],,,,
1330131304415891457,1330131304415891457,2020-11-21 12:49:50 UTC,2020-11-21,12:49:50,0,3092444379,yburundi,Yaga Burundi,,"C'est aujourd'hui la #WorldTelevisionDay2020.  Avant les décodeurs Startimes, Canal Plus, les antennes paraboliques, #internet, etc., on avait la @RTNBurundi. La fameuse, l’indémodable Radio Télévision Nationale #Burundi-aise.  Réminiscence.  #technologie   https://t.co/AxhA7k58Je",fr,"[{'screen_name': 'rtnburundi', 'name': 'rtnb', 'id': '1131108866'}]",['https://www.yaga-burundi.com/2019/il-etait-une-fois-rtnb/'],[],0,1,10,"['worldtelevisionday2020', 'internet', 'burundi', 'technologie']",[],https://twitter.com/YBurundi/status/1330131304415891457,False,,0,,,,,,,,[],,,,
1329762631780093954,1329762631780093954,2020-11-20 12:24:51 UTC,2020-11-20,12:24:51,0,1153719688146427906,burundirally,CLUB AUTOMOBILE DU BURUNDI,,"Classée parmi les partenaires prestigieux du @burundirallye, @tele10bdi ne cesse de soutenir la promotion du sport automobile au #Burundi. L'entreprise de télévision payante a déjà confirmé son appui à l'organisation du Rallye de @NgoziProvince,5è Édition. 05-06/12 #OdeurYaRallye  https://t.co/qcLNjT2UYL",fr,"[{'screen_name': 'tele10bdi', 'name': 'télé 10 burundi', 'id': '1069193857'}, {'screen_name': 'ngoziprovince', 'name': 'province ngozi', 'id': '765521718718988288'}]",[],"['https://pbs.twimg.com/media/EnRED90XMAA9f0v.jpg', 'https://pbs.twimg.com/media/EnRED9yXIAEyjMp.jpg']",1,5,7,"['burundi', 'odeuryarallye']",[],https://twitter.com/BurundiRally/status/1329762631780093954,False,,1,https://pbs.twimg.com/media/EnRED90XMAA9f0v.jpg,,,,,,,[],,,,
1328116533483212806,1328116533483212806,2020-11-15 23:23:51 UTC,2020-11-15,23:23:51,0,2214691797,burundi__,🎄❄️𝕭𝖚𝖗𝖚𝖓𝖉𝖎❄️🎄,,Yo a la tarde: venga me voy pronto a la cama y asi mañana madrugo para estudiar   Yo a las doce y media de la noche bailando delante del espejo con los cascos a tope:   QUIERO SER UN BOTE DE COLON Y SALIR ANUNCIADO POR LA TELEVISIÓN,es,[],[],[],0,0,1,[],[],https://twitter.com/burundi__/status/1328116533483212806,False,,0,,,,,,,,[],,,,
1328021020754673664,1328021020754673664,2020-11-15 17:04:19 UTC,2020-11-15,17:04:19,0,116318816,angeloosaurio,Angel,,"Mi tio me dice que ponga el futbol, la televisión me da un Burundi 🇧🇮 vs Mauritania 🇲🇷, no me quejo.",es,[],[],[],0,0,1,[],[],https://twitter.com/Angeloosaurio/status/1328021020754673664,False,,0,,,,,,,,[],,,,
1327928562029105153,1327928562029105153,2020-11-15 10:56:55 UTC,2020-11-15,10:56:55,0,919951462985293824,ingomagazine,INGOMAG,,"Aux amateurs du ballon rond, vous pouvez suivre le match entre le #Burundi et la #Mauritanie à partir de vos postes téléviseurs sur la deuxième chaîne de la Télévision Nationale, @RTNBurundi et sur Bein Sport HD7.  #ingomag  https://t.co/exhYK1cbq6",fr,"[{'screen_name': 'rtnburundi', 'name': 'rtnb', 'id': '1131108866'}]",[],['https://pbs.twimg.com/media/Em2_1x6XEAIWw0q.jpg'],1,7,8,"['burundi', 'mauritanie', 'ingomag']",[],https://twitter.com/IngoMagazine/status/1327928562029105153,False,,1,https://pbs.twimg.com/media/Em2_1x6XEAIWw0q.jpg,,,,,,,[],,,,
1327923691712344064,1327923691712344064,2020-11-15 10:37:34 UTC,2020-11-15,10:37:34,0,3532253309,burundiff,F.F.B,,"Pour ceux qui veulent suivre le match #Burundi vs #Mauritanie à partir de leur postes téléviseur, veuillez vous branchez à la 2e chaîne de la Télévision Nationale et sur Bein Sport HD7  https://t.co/kiWw7OmRNC",fr,[],[],['https://pbs.twimg.com/media/Em27i-PXcAEi11K.jpg'],1,12,30,"['burundi', 'mauritanie']",[],https://twitter.com/BurundiFF/status/1327923691712344064,False,,1,https://pbs.twimg.com/media/Em27i-PXcAEi11K.jpg,,,,,,,[],,,,
1326200152328114176,1326200152328114176,2020-11-10 16:28:50 UTC,2020-11-10,16:28:50,0,1319289876156563458,bnminfo,BNM,,"#Radio #Television #National du #Burundi (RTNB) visits the work done by our partner, MBJ Farmar’s Cooperative. Read more at,  https://t.co/zLMymPoxe1  https://t.co/iaEglmkpLy",en,[],['http://www.basicneedsmission.com'],"['https://pbs.twimg.com/media/Emeb_cPXUAIVsII.jpg', 'https://pbs.twimg.com/media/Emeb_8SW4AMX_mj.jpg', 'https://pbs.twimg.com/media/EmecAcxXYAIBYxL.jpg']",0,0,0,"['radio', 'television', 'national', 'burundi']",[],https://twitter.com/BNMINFO/status/1326200152328114176,False,,1,https://pbs.twimg.com/media/Emeb_cPXUAIVsII.jpg,,,,,,,[],,,,
1323610922624126977,1323610922624126977,2020-11-03 13:00:10 UTC,2020-11-03,13:00:10,0,4110537459,nzimarana,Raymond Nzimana,,"#Burundi : Réouverture de l'Aéroport International Ndadaye Melchior de Bujumbura ce dimanche le 08 novembre. Annonce du porte-parole du gouvernement Prosper Ntahogwamiye, ce mardi à la Télévision Nationale.  https://t.co/xbz8hZsxKs",fr,[],[],['https://pbs.twimg.com/media/El5pCdtXYAAL1xL.jpg'],0,1,0,['burundi'],[],https://twitter.com/nzimarana/status/1323610922624126977,False,,1,https://pbs.twimg.com/media/El5pCdtXYAAL1xL.jpg,,,,,,,[],,,,
1323606361196945411,1323606361196945411,2020-11-03 12:42:02 UTC,2020-11-03,12:42:02,0,837649905959202817,nyakabeto,Bigirimana Sylvere,,#Burundi : Réouverture de l'Aéroport International Ndadaye Melchior ce dimanche le 08 novembre. Annonce du porte parole du gouvernement ce mardi à la Télévision Nationale. C'est après la visite du comité national de lutte contre la pandémie Covid-19 ce vendredi dernier.  https://t.co/SAyXsMXN7P,fr,[],[],['https://pbs.twimg.com/media/El5kgfRXIAMeDIi.png'],0,1,0,['burundi'],[],https://twitter.com/nyakabeto/status/1323606361196945411,False,,1,https://pbs.twimg.com/media/El5kgfRXIAMeDIi.png,,,,,,,[],,,,
1323189847905964032,1323189820827598848,2020-11-02 09:06:58 UTC,2020-11-02,09:06:58,0,3305551917,azamtvrw,Azam TV Rwanda,,"#RTNB Channel 390 Radio Télévision Nationale du Burundi - Follow the news feed of the web editorial staff.  #CGTN Channel 238 formerly known as CCTV-9 and CCTV News, is an international English-language news channel based in Beijing owned by China Central Television.  https://t.co/g4rNNBL7yG",en,[],[],"['https://pbs.twimg.com/media/Elzp7HTX0AImIPo.jpg', 'https://pbs.twimg.com/media/ElzqCQbXUAEFNiu.png']",0,0,1,"['rtnb', 'cgtn']",[],https://twitter.com/azamtvRw/status/1323189847905964032,False,,1,https://pbs.twimg.com/media/Elzp7HTX0AImIPo.jpg,,,,,,,[],,,,
1316461593820106758,1316455191680626693,2020-10-14 19:31:17 UTC,2020-10-14,19:31:17,0,945146163178635264,nodemocracyinuk,Only corrupt politicians support election theft,,The notion was endorsed by one of the most powerful television executives in UK. He felt global welfare was paramount &amp; he had a greater obligation to someone in Burundi than in Birmingham The political class failed to control the inflow in the interests of existing citizens.,en,[],[],[],1,0,0,[],[],https://twitter.com/NoDemocracyInUK/status/1316461593820106758,False,,0,,,,,,,,[],,,,
1316179906842243074,1316179906842243074,2020-10-14 00:51:57 UTC,2020-10-14,00:51:57,0,30446521,iburundi,iBurundi,,"#Burundi — Cela fait exactement cinq ans que l’ancien caméraman de la Radio Télévision Nationale a été tué avec son épouse, leurs deux enfants et son neveu. La coalition burundaise des défenseurs des droits humains exige la réouverture du procès y relatif.  https://t.co/5YXqyuRLim",fr,[],['https://www.sosmediasburundi.org/2020/10/13/burundi-affaire-nkezabahizi-la-coalition-burundaise-des-defenseurs-des-droits-humains-demande-la'],[],2,8,8,['burundi'],[],https://twitter.com/iburundi/status/1316179906842243074,False,,0,,,,,,,,[],,,,
1313160832352751616,1313160832352751616,2020-10-05 16:55:14 UTC,2020-10-05,16:55:14,0,805547931310968833,boshirwa_meki,Melchisédeck Bōshírwa,,"En pleine et après l'émission Horizons Littéraires animée par Eric Irambona à la 2è chaîne de la Radio-Télévision Nationale du Burundi, RTNB.   #poésie #écriture  https://t.co/PuCQWEpmPs",fr,[],[],"['https://pbs.twimg.com/media/EjlImF9WoAQiMGp.jpg', 'https://pbs.twimg.com/media/EjlIqqxXYAA5x27.jpg', 'https://pbs.twimg.com/media/EjlIuvcXkAccGOg.jpg']",0,0,3,"['poésie', 'écriture']",[],https://twitter.com/boshirwa_meki/status/1313160832352751616,False,,1,https://pbs.twimg.com/media/EjlImF9WoAQiMGp.jpg,,,,,,,[],,,,
1311178350589890560,1311178350589890560,2020-09-30 05:37:33 UTC,2020-09-30,05:37:33,0,1216898839,senafrique,SEN-AFRICA #BSDP17,,21-year-old Elsie Jennifer Hakizimana is one of five #COVID19 Design Innovation Challenge winners from #Burundi. With the help of @CartedoApp Elsie was able to prototype a series of radio &amp; television shows &amp; a website to help spread accurate information about #COVID19. …,en,"[{'screen_name': 'cartedoapp', 'name': 'cartedo', 'id': '1069767371819311104'}]",[],[],0,0,0,"['covid19', 'burundi', 'covid19']",[],https://twitter.com/senafrique/status/1311178350589890560,False,,0,,,,,,,,[],,,,
1311173924944777222,1311173924944777222,2020-09-30 05:19:58 UTC,2020-09-30,05:19:58,0,324977497,unicefafrica,UNICEF Africa,,21-year-old Elsie Jennifer Hakizimana is one of five #COVID19 Design Innovation Challenge winners from #Burundi. With the help of @CartedoApp Elsie was able to prototype a series of radio &amp; television shows &amp; a website to help spread accurate information about #COVID19.  https://t.co/d3nuzvNHyK,en,"[{'screen_name': 'cartedoapp', 'name': 'cartedo', 'id': '1069767371819311104'}]",[],['https://pbs.twimg.com/media/EjI5sFSWAAAn0ig.jpg'],0,2,3,"['covid19', 'burundi', 'covid19']",[],https://twitter.com/UNICEFAfrica/status/1311173924944777222,False,,1,https://pbs.twimg.com/media/EjI5sFSWAAAn0ig.jpg,,,,,,,[],,,,
1310956415624900609,1310862947682594816,2020-09-29 14:55:40 UTC,2020-09-29,14:55:40,0,331646763,ndayaki,NDaYaKire🇧🇮🇧🇮,,@BurundiFF Quid de la diffusion des. Matchs sur la Télévision Nationale du Burundi?🤔,fr,[],[],[],0,0,0,[],[],https://twitter.com/NdaYaki/status/1310956415624900609,False,,0,,,,,,,,"[{'screen_name': 'BurundiFF', 'name': 'F.F.B', 'id': '3532253309'}]",,,,
1310561219703713794,1310513297016451072,2020-09-28 12:45:18 UTC,2020-09-28,12:45:18,0,1305081677786550273,think_and_bee,Argie Bee,,"@danieljohnsalt Goodhart: ‘I was even more surprised when the notion was endorsed by another guest, one of the most powerful television executives in the country. He, too, felt global welfare was paramount and that he had a greater obligation to someone in Burundi than to someone in Birmingham.'",en,[],[],[],0,0,0,[],[],https://twitter.com/think_and_bee/status/1310561219703713794,False,,0,,,,,,,,"[{'screen_name': 'danieljohnsalt', 'name': 'Dan Salt', 'id': '2910094226'}]",,,,
1309915622369824775,1309915622369824775,2020-09-26 17:59:56 UTC,2020-09-26,17:59:56,0,844672741106204674,aiex_rm,Alex,,"LUKA JOVIC TITULAR AHORA MISMO EL RESTO ME DA EXACTAMENTE IGUAL, NO ME MOLESTEN. EL NIÑO AFRICANO DE UN PUEBLO EN BURUNDI QUE TODOS LOS DÍAS SE HACE 5 KILÓMETROS PARA VER AL REAL MADRID EN LA ÚNICA TELEVISIÓN DEL PUEBLO, HOY ESTÁ SALTANDO DE ALEGRÍA. GRACIAS SIDANE.",es,[],[],[],20,154,1204,[],[],https://twitter.com/AIex_rm/status/1309915622369824775,False,,0,,,,,,,,[],,,,
1309843913054838785,1309843913054838785,2020-09-26 13:14:59 UTC,2020-09-26,13:14:59,0,3214029743,lumitel_burundi,Lumitel Burundi,,"Visitez  https://t.co/X2osgLdPz4 pour regarder les chaines de télévision, les films et différents clips vidéos  gratuitement jusqu'au 30/09/2020.  https://t.co/7ylTJDMxqw",fr,[],['http://www.lumiteltv.bi'],['https://pbs.twimg.com/media/Ei1_rpmXkAI3qqz.jpg'],0,1,0,[],[],https://twitter.com/lumitel_burundi/status/1309843913054838785,False,,1,https://pbs.twimg.com/media/Ei1_rpmXkAI3qqz.jpg,,,,,,,[],,,,
1309753691541573632,1309720378172944384,2020-09-26 07:16:28 UTC,2020-09-26,07:16:28,0,1242092461746503686,montene32358837,MONTENEGRO,,@CalandracasEl Radio Burundi y Television isa de Madagascar,es,[],[],[],0,0,0,[],[],https://twitter.com/MONTENE32358837/status/1309753691541573632,False,,0,,,,,,,,"[{'screen_name': 'CalandracasEl', 'name': 'CALANDRACAS', 'id': '918420373795991553'}]",,,,
1309394511060140033,1309394511060140033,2020-09-25 07:29:13 UTC,2020-09-25,07:29:13,0,804236975922446336,abpinfos,ABP,,"#Burundi: @Gitega: The public radio and television program held by the President of the Republic, @GeneralNeva, has started  https://t.co/29q2ATQXsV",en,"[{'screen_name': 'gitega', 'name': 'province gitega', 'id': '765508677755363328'}, {'screen_name': 'generalneva', 'name': 'se evariste ndayishimiye', 'id': '769073306167341056'}]",[],"['https://pbs.twimg.com/media/EivnGoAWkAAK_ul.jpg', 'https://pbs.twimg.com/media/EivnLhTXYAAKm4B.jpg', 'https://pbs.twimg.com/media/EivnOFeXcAALYS_.jpg', 'https://pbs.twimg.com/media/EivnS6hWkAA6HPD.jpg']",0,3,5,['burundi'],[],https://twitter.com/ABPInfos/status/1309394511060140033,False,,1,https://pbs.twimg.com/media/EivnGoAWkAAK_ul.jpg,,,,,,,[],,,,
1308988146206601216,1308899788168069120,2020-09-24 04:34:28 UTC,2020-09-24,04:34:28,0,1302556014353448960,stephano_abel,Ebel kaparata(abednego),,"@IrYvan_Manager @nkurunzizaherm2 @blandineniyo @Irumva_ @TheobaltMajamb1 @pierre_dusabe @NtihaboseO @bidaharira @MugiranezaBill @regisbayihaye @CishahayoCyril1 @BiGrndOd @Dr_KiC @EmeryDushime @NChadrine @joseph_nzomwita Jew ndumurundi kand  ndumutanzania ndavukiye mur tanzania muga naherej muburund Ubu ND dar  es salaam,je nshaka uzombarize umukuru wigihugu c'burundi ni kuki uburundi télévision yigihugu idateye imbere,nukuvuga itar buboneke neza nkizind télévision",und,[],[],[],0,0,2,[],[],https://twitter.com/stephano_abel/status/1308988146206601216,False,,0,,,,,,,,"[{'screen_name': 'IrYvan_Manager', 'name': 'Ir Yvan AKIMANA', 'id': '1271029997252288512'}, {'screen_name': 'nkurunzizaherm2', 'name': 'nkurunziza hermes', 'id': '1142666562815627264'}, {'screen_name': 'blandineniyo', 'name': 'Blandineniyo', 'id': '1277495515228372992'}, {'screen_name': 'Irumva_', 'name': 'Irumva Emmanuel', 'id': '1116039672575270913'}, {'screen_name': 'TheobaltMajamb1', 'name': 'theobaltm11@gmail.com', 'id': '902307663471669249'}, {'screen_name': 'pierre_dusabe', 'name': 'Dusabe pierre Chanel', 'id': '1295272579712856070'}, {'screen_name': 'NtihaboseO', 'name': 'NTIHABOSEKUMWE', 'id': '3291080750'}, {'screen_name': 'bidaharira', 'name': 'Kevin Bidaharira', 'id': '1005357048530432001'}, {'screen_name': 'MugiranezaBill', 'name': '¢αяℓ вιℓℓ мυgιяαиєzα', 'id': '3370480751'}, {'screen_name': 'regisbayihaye', 'name': 'Régis Bayihaye', 'id': '4063478987'}, {'screen_name': 'CishahayoCyril1', 'name': 'CISHAHAYO Laurent. (楼仁帝）', 'id': '1145768620489871361'}, {'screen_name': 'EmeryDushime', 'name': 'Dushime Emery', 'id': '4404679215'}, {'screen_name': 'NChadrine', 'name': 'Ndayishimiye chadrine', 'id': '1097567558549585920'}, {'screen_name': 'joseph_nzomwita', 'name': 'Nzomwita Joseph', 'id': '1253726239556329477'}]",,,,
1305822202202333184,1305822202202333184,2020-09-15 10:54:08 UTC,2020-09-15,10:54:08,0,919951462985293824,ingomagazine,INGOMAG,,La télévision en ligne Waka light TV gravit les échelons en soutenant la 14ème édition du flambeau de la paix qui sera lancée officiellement dans quelques heures.  #Burundi #ingomag  https://t.co/8mqktveR9c,fr,[],[],['https://pbs.twimg.com/media/Eh82X0cWkAAm-PE.jpg'],0,2,6,"['burundi', 'ingomag']",[],https://twitter.com/IngoMagazine/status/1305822202202333184,False,,1,https://pbs.twimg.com/media/Eh82X0cWkAAm-PE.jpg,,,,,,,[],,,,
1304523177419329540,1303002446004989953,2020-09-11 20:52:17 UTC,2020-09-11,20:52:17,0,210458968,pericopolalena,Perico,,"@Monedilla1 @Martadpp @isaserras Por eso PabLenin dijo que no debería haber medios públicos, y la televisión pública es de lo mas sectario, anda vete con el cuento a uno de Burundi",es,[],[],[],1,0,0,[],[],https://twitter.com/PericoPolaLena/status/1304523177419329540,False,,0,,,,,,,,"[{'screen_name': 'Monedilla1', 'name': 'Monedillas sueltas', 'id': '964632098475855873'}, {'screen_name': 'Martadpp', 'name': 'Marta de Pedro 🇪🇸🖤', 'id': '303719783'}, {'screen_name': 'isaserras', 'name': 'Isabel Serra', 'id': '529634658'}]",,,,
1304279456211755009,1304279456211755009,2020-09-11 04:43:49 UTC,2020-09-11,04:43:49,0,805547931310968833,boshirwa_meki,Melchisédeck Bōshírwa,,"Vaillant, J''ai rêvé...  J'ai rêvé des rêves À révéler au vrai visage D'une vue ravigorante Via la véracité d'une vie Que je veux vivifier Et raviver sans virevolter  🗒️✍️📖📚  Invité à la @RTNBurundi dans l'émission ""À la source"" qui passe à la Télévision Nationale #Burundi  https://t.co/N1ALSPJMfw",fr,"[{'screen_name': 'rtnburundi', 'name': 'rtnb', 'id': '1131108866'}]",[],['https://pbs.twimg.com/media/Ehm7QJ3WAAEwyZw.jpg'],0,0,3,['burundi'],[],https://twitter.com/boshirwa_meki/status/1304279456211755009,False,,1,https://pbs.twimg.com/media/Ehm7QJ3WAAEwyZw.jpg,,,,,,,[],,,,
1301969122490830849,1301969122490830849,2020-09-04 19:43:22 UTC,2020-09-04,19:43:22,0,1264833328668119053,julesnzosaba201,julesnzosaba2020,,#Burundi Ceux qui ne sont pas au #Rwanda suivent la télévision rwandaise sur internet.  S'il y a un pays où les autorités sont sur terrain c'est bien le Rwanda. Voulez-vs qu'ils jouent aux vrais faux croyants pour jouer la comédie chaque dimanche comme ici ?,fr,[],[],[],0,0,0,"['burundi', 'rwanda']",[],https://twitter.com/julesnzosaba201/status/1301969122490830849,False,https://twitter.com/RWALINDAP/status/1301963596100964352,0,,,,,,,,[],,,,
1301465107873095685,1301465107873095685,2020-09-03 10:20:36 UTC,2020-09-03,10:20:36,0,919951462985293824,ingomagazine,INGOMAG,,"Bientôt INGO TV, une chaîne de télévision qui mettra en exergue la beauté et le potentiel du #Burundi dans toutes les dimensions, 24h/24 et 7j/7. Le Groupe #INGO ne cesse d’innover: #ingoMAG #ingoTV #ingoTECH #ingoPHARMA #ingoSHOP #ingoBRANDING #ingoFASHION #ingoEVENTS  https://t.co/Yuv2Xhd731",fr,[],[],['https://pbs.twimg.com/media/Eg-7nLeXYAgoZfs.jpg'],1,18,35,"['burundi', 'ingo', 'ingomag', 'ingotv', 'ingotech', 'ingopharma', 'ingoshop', 'ingobranding', 'ingofashion', 'ingoevents']",[],https://twitter.com/IngoMagazine/status/1301465107873095685,False,,1,https://pbs.twimg.com/media/Eg-7nLeXYAgoZfs.jpg,,,,,,,[],,,,
1300528806936145921,1300528806936145921,2020-08-31 20:20:04 UTC,2020-08-31,20:20:04,0,1715196954,humekaamahoro,Humeka Amahoro,,"C’est le récit sans faille d’une des catastrophes humaines du XXe siècle les plus impitoyables et les plus cyniquement exploitées. » Linden MacIntyre, journaliste d’investigation primé, CBC Television. #Rwanda #Burundi #RDC  https://t.co/5msFzjXisu",fr,[],[],['https://pbs.twimg.com/media/EgxoDshWsAMscKy.jpg'],0,3,5,"['rwanda', 'burundi', 'rdc']",[],https://twitter.com/HumekaAmahoro/status/1300528806936145921,False,,1,https://pbs.twimg.com/media/EgxoDshWsAMscKy.jpg,,,,,,,[],,,,
1298560328863752192,1298560328863752192,2020-08-26 09:58:03 UTC,2020-08-26,09:58:03,0,1005850958,croix_rougebdi,CroixRougeBurundi,,La Croix-Rouge du Burundi et la Radio Télévision Nationale du Burundi main dans la main contre la COVID-19  https://t.co/LvpoywHkyr,fr,[],['http://croixrouge.bi/la-croix-rouge-du-burundi-et-la-radio-television-nationale-du-burundi-main-dans-la-main-contre-la-covid-19/'],[],0,3,5,[],[],https://twitter.com/croix_rougebdi/status/1298560328863752192,False,,0,,,,,,,,[],,,,
1296862835700576257,1296862835700576257,2020-08-21 17:32:49 UTC,2020-08-21,17:32:49,0,1260938125699887105,leonardndolima4,Leonard Ndolimana,,"Cette television basee au Rwanda n' est la que pr copier des strategies pouvant aller jusqu'a destabiliser le Burundi.J'aurais aime qu'elle diffuse les propos de Mme Barankitse Maggy,lors de son passage a Radio canada ou elle disait qu'elle allait etrangler le president Burundais",fr,[],[],[],1,0,2,[],[],https://twitter.com/LeonardNdolima4/status/1296862835700576257,False,https://twitter.com/RTVRenaissance/status/1296503569630322689,0,,,,,,,,[],,,,
