id,conversation_id,created_at,date,time,timezone,user_id,username,name,place,tweet,language,mentions,urls,photos,replies_count,retweets_count,likes_count,hashtags,cashtags,link,retweet,quote_url,video,thumbnail,near,geo,source,user_rt_id,user_rt,retweet_id,reply_to,retweet_date,translate,trans_src,trans_dest
1144266662289522692,1144266662289522692,2019-06-27 15:30:06 UTC,2019-06-27,15:30:06,0,594934011,pricecountydail,Price County Review,,"Communications are expected to be upgraded in the near future given the recent purchase of Price County Telephone Company by telecommunications cooperative Norvado, according to CEO Chad Young.  https://t.co/twkSL88t40",en,[],['https://www.apg-wi.com/price_county_review/paywall/county-coard-hears-from-new-business-norvado/article_55a1b14a-9866-11e9-b2b3-6b7062795215.html#utm_campaign=blox&utm_source=twitter&utm_medium=social'],[],0,0,0,[],[],https://twitter.com/PriceCountyDail/status/1144266662289522692,False,,0,,,,,,,,[],,,,
1143964428439703552,1143964428439703552,2019-06-26 19:29:08 UTC,2019-06-26,19:29:08,0,1008833643983192065,rd_colorado,Rural Development Colorado,,"@usdaRD #Telecommunications Programs Assistant Administrator Chad Parker discussed #rural #broadband and @USDA #Reconnect Program @MountainConnect in Keystone, CO.  @RD_Colorado Loan Specialist Cindy Chadwick joined the conversation.  @economicdevelopment #makingtheconnection  https://t.co/hrJLTYRmae",en,"[{'screen_name': 'usda', 'name': 'dept. of agriculture', 'id': '61853389'}, {'screen_name': 'mountainconnect', 'name': 'mountain connect', 'id': '3183197838'}, {'screen_name': 'rd_colorado', 'name': 'rural development colorado', 'id': '1008833643983192065'}]",[],"['https://pbs.twimg.com/media/D-AtT49UEAAoorc.jpg', 'https://pbs.twimg.com/media/D-AtT4_UYAAelyN.jpg', 'https://pbs.twimg.com/media/D-AtT5EUwAAMcCW.jpg']",0,0,1,"['telecommunications', 'rural', 'broadband', 'reconnect', 'makingtheconnection']",[],https://twitter.com/RD_Colorado/status/1143964428439703552,False,,1,https://pbs.twimg.com/media/D-AtT49UEAAoorc.jpg,,,,,,,[],,,,
1140414803888001024,1140414803888001024,2019-06-17 00:24:11 UTC,2019-06-17,00:24:11,0,45451150,chad_meley,Chad Meley,,"See how #TDVantage can help telecommunications companies lower their percentage of dropped calls, raise customer satisfaction levels &amp; reduce customer churn by remotely &amp; automatically optimizing their wireless networks. #Vantage   https://t.co/DdN8sY7ago  https://t.co/aqL74y4iaB",en,[],['http://bit.ly/2KQQ5fe'],['https://pbs.twimg.com/media/D9OROHYXoAE2kLq.jpg'],0,0,5,"['tdvantage', 'vantage']",[],https://twitter.com/chad_meley/status/1140414803888001024,False,,1,https://pbs.twimg.com/media/D9OROHYXoAE2kLq.jpg,,,,,,,[],,,,
1140414752096772096,1140414752096772096,2019-06-17 00:23:59 UTC,2019-06-17,00:23:59,0,45451150,chad_meley,Chad Meley,,"See how #TDVantage can help telecommunications companies lower their percentage of dropped calls, raise customer satisfaction levels &amp; reduce customer churn by remotely &amp; automatically optimizing their wireless networks. #Vantage   https://t.co/OVrmUrs1Uq  https://t.co/mzI5y1NfOR",en,[],['http://bit.ly/2XdiyTd'],['https://pbs.twimg.com/media/D9ORLGgWsAAQsh2.jpg'],0,0,4,"['tdvantage', 'vantage']",[],https://twitter.com/chad_meley/status/1140414752096772096,False,,1,https://pbs.twimg.com/media/D9ORLGgWsAAQsh2.jpg,,,,,,,[],,,,
1140414672904032256,1140414672904032256,2019-06-17 00:23:40 UTC,2019-06-17,00:23:40,0,45451150,chad_meley,Chad Meley,,"See how #TDVantage can help telecommunications companies lower their percentage of dropped calls, raise customer satisfaction levels &amp; reduce customer churn by remotely &amp; automatically optimizing their wireless networks. #Vantage   https://t.co/Nrs7JB2wBr  https://t.co/cRxD5m7Wo7",en,[],['http://bit.ly/2FcpqpC'],['https://pbs.twimg.com/media/D9ORGeJXsAAisNM.jpg'],0,0,1,"['tdvantage', 'vantage']",[],https://twitter.com/chad_meley/status/1140414672904032256,False,,1,https://pbs.twimg.com/media/D9ORGeJXsAAisNM.jpg,,,,,,,[],,,,
1106812483275116547,1106812483275116547,2019-03-16 07:00:34 UTC,2019-03-16,07:00:34,0,3318510966,crweworld,Crwe World,,Primary Research Shows the Chad Telecommunications Market to Grow At a High CAGR during 2019-2025  https://t.co/BlZK5ONtva,en,[],['http://crweworld.com/article/press-releases/1018533/primary-research-shows-the-chad-telecommunications-market-to-grow-at-a-high-cagr-during-2019-2025'],[],0,0,0,[],[],https://twitter.com/CrweWorld/status/1106812483275116547,False,,0,,,,,,,,[],,,,
1106209080413171712,1106199278173802497,2019-03-14 15:02:51 UTC,2019-03-14,15:02:51,0,4887581781,afexafrica,AFEX,,"The  petitioners noted that the social media shutdown in  Chad, which is now the longest network disruption in Africa, violates  @ACHPR Resolution 362 (LIX) 2016 which  condemns the “emerging practice of State Parties interrupting ...telecommunication services ... @IPCng @AFIC1",en,"[{'screen_name': 'achpr', 'name': 'africancommissionhpr', 'id': '893409708'}, {'screen_name': 'ipcng', 'name': 'int. press centre', 'id': '545037797'}, {'screen_name': 'afic1', 'name': 'afic', 'id': '1248021672743129088'}]",[],[],1,2,2,[],[],https://twitter.com/AFEXafrica/status/1106209080413171712,False,,0,,,,,,,,[],,,,
1103802424446205952,1103741459566604289,2019-03-07 23:39:40 UTC,2019-03-07,23:39:40,0,276239681,sandra_cole44,🎭 Sandra Cole 🎭,,"@Toronto_Chad @TPS_BikeHart @ABCourierLtd @TPS_pke_rider @ParkingTPS @TorontoPolice (1) The City, the Toronto Transit Commission or a public transit agency authorized to operate in the City; or   (2) A public utility, including utilities providing telecommunications, energy, water supply or wastewater related services.",en,[],[],[],0,0,0,[],[],https://twitter.com/Sandra_Cole44/status/1103802424446205952,False,,0,,,,,,,,"[{'screen_name': 'Toronto_Chad', 'name': 'socially isolated and self distanced 🇨🇦', 'id': '7414922'}, {'screen_name': 'TPS_BikeHart', 'name': 'PEO Erin Urquhart', 'id': '890220397618221057'}, {'screen_name': 'ABCourierLtd', 'name': 'A&B Courier Ltd.', 'id': '874297347391590400'}, {'screen_name': 'TPS_pke_rider', 'name': 'Sabrina Kloetzig', 'id': '889538738052882432'}, {'screen_name': 'ParkingTPS', 'name': 'TPS Parking', 'id': '890308168961667072'}, {'screen_name': 'TorontoPolice', 'name': 'Toronto Police', 'id': '16295454'}]",,,,
1086940384582946817,1086940384582946817,2019-01-20 10:55:56 UTC,2019-01-20,10:55:56,0,2966329911,menastream,MENASTREAM,,"#Mali: Major assault against #MINUSMA and specifically the #Chad-ian contingent this morning in Aguelhok, #Kidal Region, telecommunications network sabotaged, 6 killed and 19 wounded, according to a provisional toll  https://t.co/PfPVZusRIq",en,[],[],['https://pbs.twimg.com/media/DxWS7FEX0AAxGjY.jpg'],2,30,21,"['mali', 'minusma', 'chad', 'kidal']",[],https://twitter.com/MENASTREAM/status/1086940384582946817,False,,1,https://pbs.twimg.com/media/DxWS7FEX0AAxGjY.jpg,,,,,,,[],,,,
1084415596027174912,1084415596027174912,2019-01-13 11:43:20 UTC,2019-01-13,11:43:20,0,766303363181019136,zimlocals,Zim Local,,#Chad’s President Idriss Déby on Friday fired Oil Minister Boukar Michel &amp; the Telecommunications Minister Ndolenodji Alixe Naïùnaye  https://t.co/7yiCSoOh9X,fr,[],[],['https://pbs.twimg.com/media/DwycvcBXQAAUS2R.jpg'],0,3,2,['chad'],[],https://twitter.com/zimlocals/status/1084415596027174912,False,,1,https://pbs.twimg.com/media/DwycvcBXQAAUS2R.jpg,,,,,,,[],,,,
1080946907751555073,1080946907751555073,2019-01-03 22:00:00 UTC,2019-01-03,22:00:00,0,30020978,ncshp,NC Highway Patrol,,".@NCSHP remembers the life of Patrol Telecommunications Shift Supervisor Chad L. Buchanan who passed away on Monday, December 31.    Visit the link for more  https://t.co/RLtEe7c0gK  https://t.co/ppM075jNlR",en,"[{'screen_name': 'ncshp', 'name': 'nc highway patrol', 'id': '30020978'}]",['https://bit.ly/2BTrYXe'],['https://pbs.twimg.com/media/Dv7wJW6W0AA_NXh.jpg'],0,3,22,[],[],https://twitter.com/NCSHP/status/1080946907751555073,False,,1,https://pbs.twimg.com/media/Dv7wJW6W0AA_NXh.jpg,,,,,,,[],,,,
1074283482891849728,1074283482891849728,2018-12-16 12:41:56 UTC,2018-12-16,12:41:56,0,831174277,isaacos58995146,isaac osei,,Having fun with ministry of energy and representative for agriculture and telecommunications. We ready to make Chad great again with great innovation and leadership #innovation#leadership #Chad — at EVE Orlando  https://t.co/A5ac2ga2w6,en,[],['https://www.facebook.com/45707942/posts/10102842009203028/'],[],0,0,0,['chad'],[],https://twitter.com/isaacos58995146/status/1074283482891849728,False,,0,,,,,,,,[],,,,
1060627738766336000,1060625857411272706,2018-11-08 20:18:53 UTC,2018-11-08,20:18:53,0,985100044926898176,gustave_le_chad,Douce_France⚜️🇫🇷,,"@FANA40326649 @ActuelleRealite il n'y a pas de ligne telephone filaire en afrique et a cause du besoins de telecommunication des etats se sont les portables, communication sans fils, technologie plus recente et pratique qui se sont develloper",fr,[],[],[],1,0,0,[],[],https://twitter.com/Gustave_Le_Chad/status/1060627738766336000,False,,0,,,,,,,,"[{'screen_name': 'ActuelleRealite', 'name': 'Réalité Actuelle', 'id': '1036222141212123136'}]",,,,
1056741404490244097,1056741404490244097,2018-10-29 02:55:58 UTC,2018-10-29,02:55:58,0,268603430,upstate_chad,C.H.,,Hosting Provider Moves to Shut Down Alt-Righy Social Network. When will ISPs and Telecommunication decide to do the same thing?  https://t.co/l8Ej2Bs5t0 via @thedailybeast,en,"[{'screen_name': 'thedailybeast', 'name': 'the daily beast', 'id': '16012783'}]",['https://thebea.st/2RhRPOA?source=twitter&via=desktop'],[],0,0,1,[],[],https://twitter.com/Upstate_Chad/status/1056741404490244097,False,,0,,,,,,,,[],,,,
1041724579163590657,1041724579163590657,2018-09-17 16:24:28 UTC,2018-09-17,16:24:28,0,2832081139,asuticsenegal,ASUTIC,,"Au #Chad, les plaignants contestent #internetshutdowns au tribunal. Les deux plus grands opérateurs de télécommunications et d’accès à Internet, Tigo et Airtel, ont déclaré que les récentes restrictions de l’accès à l’Internet étaient du ressort du gouvernement.",fr,[],[],[],0,0,0,"['chad', 'internetshutdowns']",[],https://twitter.com/asuticsenegal/status/1041724579163590657,False,https://twitter.com/accessnow/status/1041712342462066698,0,,,,,,,,[],,,,
1029913165767761920,1029913165767761920,2018-08-16 02:10:08 UTC,2018-08-16,02:10:08,0,222214316,tvilleut,Taylorsville City,,Financial Matters  Agenda Item 6.1 Resolution No. 18-22 - A Resolution of the City of Taylorsville Approving a Telecommunications Franchise Agreement with MCI Metro Access Transmission Services Corp. D/B/A Verizon Access Transmission Services. - presented by Chad Woolley,en,[],[],[],0,0,0,[],[],https://twitter.com/TvilleUT/status/1029913165767761920,False,,0,,,,,,,,[],,,,
1021395840982765568,1021395840982765568,2018-07-23 14:05:19 UTC,2018-07-23,14:05:19,0,23576880,empo11on,AK Martin,,"Do I know any telecommunications experts in Afghanistan, Lebanon, Chad or Zambia?",en,[],[],[],1,0,0,[],[],https://twitter.com/empo11on/status/1021395840982765568,False,,0,,,,,,,,[],,,,
1006194204614197248,1006194204614197248,2018-06-11 15:19:27 UTC,2018-06-11,15:19:27,0,93073820,chad_wsaw,Chad Franzen WSAW,,NASA: ikrudolf MarsRovers We use a network called the Deep Space Network. The network is the largest and most sensitive scientific telecommunications system in the world. Learn more about the network:  https://t.co/EicFdZSun4,en,[],['https://deepspace.jpl.nasa.gov/about/'],[],0,0,0,[],[],https://twitter.com/Chad_WSAW/status/1006194204614197248,False,,0,,,,,,,,[],,,,
989095948885295104,989095948885295104,2018-04-25 10:57:05 UTC,2018-04-25,10:57:05,0,905757180049190912,kouranjabo,Kouran Jabo,,We are glad to partner with @airtelchad a leader in telecommunication industry in Chad to allow more people to pay easily our product pay as you go.,en,[],[],[],0,0,0,[],[],https://twitter.com/Kouranjabo/status/989095948885295104,False,,0,,,,,,,,[],,,,
983399919326318592,983399919326318592,2018-04-09 17:43:06 UTC,2018-04-09,17:43:06,0,232461939,ugaman01,UGAMAN,,"President Deby has ruled over the Central African nation, #Chad since 1990. Unfortunately, the Chadian regime is used to shutting down telecommunications, [the] internet in particular, whenever there are demonstrations or public expression of people’s discontent towards the govt.",en,[],[],[],0,0,2,['chad'],[],https://twitter.com/Ugaman01/status/983399919326318592,False,,0,,,,,,,,[],,,,
982989748884164609,982989748884164609,2018-04-08 14:33:13 UTC,2018-04-08,14:33:13,0,600141612,chad_burkhart,Chad Burkhart 🚴‍♂️🎧💯🎶🇺🇸,,"Happy Telecommunications Week to all 911 Telecommunicators.  We are the thin yellow line that holds the thin blue and red lines together! We have been called many things, but to me, I call you heroes!",en,[],[],[],0,0,1,[],[],https://twitter.com/chad_burkhart/status/982989748884164609,False,,0,,,,,,,,[],,,,
957277054701064192,957116121014046720,2018-01-27 15:40:09 UTC,2018-01-27,15:40:09,0,804951551160832000,floydian_slip1,Keep Talking,,"@Tom_Ballock @Dr_Chad_Tew I don’t think that it would be problematic to implement legislation, framed on the Fairness Doctrine, that would be effective in this new age of telecommunications.",en,[],[],[],0,0,0,[],[],https://twitter.com/floydian_slip1/status/957277054701064192,False,,0,,,,,,,,"[{'screen_name': 'Tom_Ballock', 'name': 'Cut Their Pay', 'id': '3131570104'}, {'screen_name': 'Dr_Chad_Tew', 'name': 'Chad Tew', 'id': '728086533287247872'}]",,,,
943247221541052417,943247221541052417,2017-12-19 22:30:36 UTC,2017-12-19,22:30:36,0,743449483036475392,hrecc,Harrisonburg-Rockingham ECC,,This morning Team Leader’s Chad Siever and Brittany Wampler of the HRECC Telecommunications Emergency Response...  https://t.co/nWLgp4DMQo,en,[],['https://fb.me/HTmCwZ3I'],[],0,0,0,[],[],https://twitter.com/HRECC/status/943247221541052417,False,,0,,,,,,,,[],,,,
847615968591335424,847615968591335424,2017-03-31 01:06:09 UTC,2017-03-31,01:06:09,0,93073820,chad_wsaw,Chad Franzen WSAW,,NASA: Space weather can interfere with satellites &amp; telecommunications &amp; we may have found a better way of forecas…  https://t.co/MaoUIzV9HE,en,[],['https://twitter.com/i/web/status/847615587974918144'],[],0,0,0,[],[],https://twitter.com/Chad_WSAW/status/847615968591335424,False,,0,,,,,,,,[],,,,
700412499628314624,700412499628314624,2016-02-18 20:12:07 UTC,2016-02-18,20:12:07,0,86326387,internet_sf,Internet Without Borders,,Chad : activist reports that telecommunication companies are pressured to operate a major internet crackdown : (fr)  https://t.co/FG418jdF5K,en,[],['https://www.facebook.com/maina.fils/posts/954543341260021?pnref=story'],[],0,1,0,[],[],https://twitter.com/Internet_SF/status/700412499628314624,False,,0,,,,,,,,[],,,,
684955130622418945,684955130622418945,2016-01-07 04:30:03 UTC,2016-01-07,04:30:03,0,389837574,talkingpointz,TalkingPointz.com,,XKL’s Chad Lamb to Discuss Ethernet’s Role in the Internet of Things at Pacific Telecommunications Council’s…  https://t.co/R7DqqaBN24 #ucoms,en,[],['http://dlvr.it/DCFc45'],[],0,0,0,['ucoms'],[],https://twitter.com/TalkingPointz/status/684955130622418945,False,,0,,,,,,,,[],,,,
659418487845072896,659418487845072896,2015-10-28 17:16:33 UTC,2015-10-28,17:16:33,0,3045097936,sycfolgoso,Servicios Folgoso,,Le secteur des Télécommunications au Tchad. Sector de telecomunicaciones de Chad  https://t.co/h6MKzvne78 vía @businessfrance,ca,"[{'screen_name': 'businessfrance', 'name': 'business france', 'id': '64759929'}]",['http://shrd.by/3ZxqNc'],[],0,0,0,[],[],https://twitter.com/SycFolgoso/status/659418487845072896,False,,0,,,,,,,,[],,,,
654921819250667524,654921819250667524,2015-10-16 07:28:24 UTC,2015-10-16,07:28:24,0,732363570,chinaafricablog,ChinaAfricaBlog,,#China to support #Chad with #industrialization #agriculture #telecommunications &amp; #SEZs  http://t.co/ZnQZOVcUEp  http://t.co/MRHTATBYTu,en,[],['http://goo.gl/MCLNB8'],['https://pbs.twimg.com/media/CRa_7HtWsAA0iMe.jpg'],0,0,0,"['china', 'chad', 'industrialization', 'agriculture', 'telecommunications', 'sezs']",[],https://twitter.com/ChinaAfricaBlog/status/654921819250667524,False,,1,https://pbs.twimg.com/media/CRa_7HtWsAA0iMe.jpg,,,,,,,[],,,,
609637775168667648,609637775168667648,2015-06-13 08:25:46 UTC,2015-06-13,08:25:46,0,121211932,sagovnews,@SAgovnews,,"Telecommunications, Postal Services Min Siyabonga Cwele, welcomes President of Chad Idriss Deby #AUSummit  http://t.co/OMKAI7rPB0",en,[],[],['https://pbs.twimg.com/media/CHXeUxkUMAAg5be.jpg'],1,8,1,['ausummit'],[],https://twitter.com/SAgovnews/status/609637775168667648,False,,1,https://pbs.twimg.com/media/CHXeUxkUMAAg5be.jpg,,,,,,,[],,,,
609188580204937216,609188580204937216,2015-06-12 02:40:50 UTC,2015-06-12,02:40:50,0,78456169,elotitv,Eloti tV,,"Glo propels Eagles, Falcons against Chad, Australia: National telecommunication operator, Globacom has called on...  http://t.co/utU58PFPR2",en,[],['http://fb.me/1GIVzg4ra'],[],0,0,0,[],[],https://twitter.com/ElotiTV/status/609188580204937216,False,,0,,,,,,,,[],,,,
609188291578081280,609188291578081280,2015-06-12 02:39:41 UTC,2015-06-12,02:39:41,0,2457807866,africanewsaddic,John,,"Glo propels Eagles, Falcons against Chad, Australia  National telecommunication operator, Globacom has called on t…  http://t.co/GIa76wvZug",en,[],['http://ift.tt/1GidkER'],[],0,0,0,[],[],https://twitter.com/africanewsaddic/status/609188291578081280,False,,0,,,,,,,,[],,,,
598232037393240064,598232037393240064,2015-05-12 21:03:26 UTC,2015-05-12,21:03:26,0,2300175503,vofngabon,VOFN Gabon,,"IP Telecommunications needs Chad, Nigeria, Gabon, Congo, Sudan, Egypt, Ethiopia, Soma Ip Telecommunications Incs,...  http://t.co/3GAiStZOku",en,[],['http://fb.me/6C5MIkQyW'],[],0,1,0,[],[],https://twitter.com/vofngabon/status/598232037393240064,False,,0,,,,,,,,[],,,,
597306999605301249,597306999605301249,2015-05-10 07:47:40 UTC,2015-05-10,07:47:40,0,2300247766,vofnmaurita,VOFN Mauritania,,"IP Telecommunications needs Morocco,Mauritania,Ghana,Mali,Algeria,Tunisia,Libya,chad Ip Telecommunications Incs,...  http://t.co/sHxUBoUntx",fr,[],['http://fb.me/4xU7pJCkz'],[],0,1,0,[],[],https://twitter.com/vofnmaurita/status/597306999605301249,False,,0,,,,,,,,[],,,,
594498633661317120,594498633661317120,2015-05-02 13:48:14 UTC,2015-05-02,13:48:14,0,2839499103,abnetworkonline,ABNetworkOnline,,#Telecommunications operator @airtelafrica appoints former @MTNza executive as Managing Director of #Chad business  http://t.co/TLdRonspLY,en,"[{'screen_name': 'airtelafrica', 'name': 'airtel africa', 'id': '2650992775'}, {'screen_name': 'mtnza', 'name': 'mtnza', 'id': '82137809'}]",['http://www.africanbusinessnetwork.co.za/index.php/blog/technology/515-new-airtel-chad-md-is-former-mtn-executive'],[],0,0,0,"['telecommunications', 'chad']",[],https://twitter.com/ABNetworkOnline/status/594498633661317120,False,,0,,,,,,,,[],,,,
578941340546826240,578941340546826240,2015-03-20 15:29:06 UTC,2015-03-20,15:29:06,0,223703595,chad_usrec,Chandan Kumar,,"IRIS Software, Inc. is hiring a Telecommunication Engineer / Voip Engineer in Alpharetta, GA #job #VOip, #Voice,  http://t.co/J8RNqNI4lr",en,[],['http://www.dice.com/jobs/detail/-/irissoft/YE7883'],[],0,0,0,"['job', 'voip', 'voice']",[],https://twitter.com/chad_usrec/status/578941340546826240,False,,0,,,,,,,,[],,,,
570550297677799424,570550297677799424,2015-02-25 11:46:05 UTC,2015-02-25,11:46:05,0,108870336,237online,Cameroun,,"Cameroon - Cooperation: SOTEL Chad seeks Camtel's savy: Chad’s incumbent telecommunications operator, SOTEL Chad…  http://t.co/t2THKZL3aD",en,[],['http://dlvr.it/8kVHV7'],[],0,4,1,[],[],https://twitter.com/237online/status/570550297677799424,False,,0,,,,,,,,[],,,,
570494927664066560,570494927664066560,2015-02-25 08:06:04 UTC,2015-02-25,08:06:04,0,2603436108,moukourilaw,D.MOUKOURI AND PARTNERS,,Internet : Execution of a technical and commercial agreement between CAMTEL and Chad telecommunications company.,en,[],[],[],0,0,0,[],[],https://twitter.com/MoukouriLaw/status/570494927664066560,False,,0,,,,,,,,[],,,,
555329724021739520,555329724021739520,2015-01-14 11:44:58 UTC,2015-01-14,11:44:58,0,89717393,omarrcantu,Omarr Cantú 🤠,,"""Swiss Telecommunications Company Sunrise Plans I.P.O."" by CHAD BRAY via NYT  http://t.co/ltrISBUf7i",en,[],['http://ift.tt/1C5VNft'],[],0,0,0,[],[],https://twitter.com/OmarrCantu/status/555329724021739520,False,,0,,,,,,,,[],,,,
555325426072305664,555325426072305664,2015-01-14 11:27:53 UTC,2015-01-14,11:27:53,0,1052654916,gretchenkloo,Gretchen Klosinski,,"""Swiss Telecommunications Company Sunrise Plans I.P.O."" by CHAD BRAY via NYT  http://t.co/eraPbQ1vjs",en,[],['http://dealbook.nytimes.com/2015/01/14/swiss-telecommunications-company-sunrise-plans-i-p-o/'],[],0,0,0,[],[],https://twitter.com/gretchenkloo/status/555325426072305664,False,,0,,,,,,,,[],,,,
555323333999214593,555323333999214593,2015-01-14 11:19:34 UTC,2015-01-14,11:19:34,0,32939702,bordode,"Think, Stop The Silence🏳‍🌈",,“Swiss Telecommunications Company Sunrise Plans I.P.O.” by CHAD BRAY via NYT  http://t.co/rtPkH09XCT…  http://t.co/00YKHkkE5A,en,[],"['http://bit.ly/1APg3m8', 'http://wp.me/p2GZC8-bbG']",[],0,0,0,[],[],https://twitter.com/bordode/status/555323333999214593,False,,0,,,,,,,,[],,,,
555322838262231040,555322838262231040,2015-01-14 11:17:36 UTC,2015-01-14,11:17:36,0,2366060400,richaquilone1,Richard Aquilone,,Swiss Telecommunications Company Sunrise Plans I.P.O. by CHAD BRAY  http://t.co/fQnbnkEB9J,en,[],['http://ift.tt/1zaX0o4'],[],0,0,0,[],[],https://twitter.com/RichAquilone1/status/555322838262231040,False,,0,,,,,,,,[],,,,
555321068047855617,555321068047855617,2015-01-14 11:10:34 UTC,2015-01-14,11:10:34,0,1250543004,agathadejaeger,Agatha Dejaeger,,"""Swiss Telecommunications Company Sunrise Plans I.P.O."" by CHAD BRAY via NYT  http://t.co/6t82Qv1nxx",en,[],['http://dealbook.nytimes.com/2015/01/14/swiss-telecommunications-company-sunrise-plans-i-p-o/'],[],0,0,0,[],[],https://twitter.com/AgathaDejaeger/status/555321068047855617,False,,0,,,,,,,,[],,,,
555320047640797185,555320047640797185,2015-01-14 11:06:31 UTC,2015-01-14,11:06:31,0,717928190,jtcarden,"Joseph Carden, CAE",,"""Swiss Telecommunications Company Sunrise Plans I.P.O."" by CHAD BRAY via NYT Business Day  http://t.co/UWusjqAhXB  http://t.co/iIDLzar1Uo",en,[],['http://ift.tt/1C5VNft'],['https://pbs.twimg.com/media/B7TkpB4IMAAWfui.png'],1,0,0,[],[],https://twitter.com/jtcarden/status/555320047640797185,False,,1,https://pbs.twimg.com/media/B7TkpB4IMAAWfui.png,,,,,,,[],,,,
555318715894345729,555318715894345729,2015-01-14 11:01:13 UTC,2015-01-14,11:01:13,0,32939702,bordode,"Think, Stop The Silence🏳‍🌈",,“Swiss Telecommunications Company Sunrise Plans I.P.O.” by CHAD BRAY via NYT  http://t.co/52jzLZJ416  http://t.co/1ErHt13wZ4,en,[],"['http://bit.ly/1C5YIEV', 'http://wp.me/p2GZC8-bbA']",[],0,0,0,[],[],https://twitter.com/bordode/status/555318715894345729,False,,0,,,,,,,,[],,,,
555318472557993986,555318472557993986,2015-01-14 11:00:15 UTC,2015-01-14,11:00:15,0,315010496,the_gabe_arce,Gabe Arce,,"""Swiss Telecommunications Company Sunrise Plans I.P.O."" by CHAD BRAY via NYT #BusinessNews #business  http://t.co/XRL45VCAx9",en,[],['http://ift.tt/1C5VNft'],[],1,0,0,"['businessnews', 'business']",[],https://twitter.com/The_Gabe_Arce/status/555318472557993986,False,,0,,,,,,,,[],,,,
555318407164620800,555318407164620800,2015-01-14 11:00:00 UTC,2015-01-14,11:00:00,0,2178552602,15centralparkw,15 Central Park W,,"""Swiss Telecommunications Company Sunrise Plans I.P.O."" by CHAD BRAY via NYT  http://t.co/YsBHQXnb9C",en,[],['http://ift.tt/1C5VNft'],[],0,0,0,[],[],https://twitter.com/15CentralParkW/status/555318407164620800,False,,0,,,,,,,,[],,,,
555317327252951040,555317327252951040,2015-01-14 10:55:42 UTC,2015-01-14,10:55:42,0,106908181,hamersharp,HamerSharp,,"""Swiss Telecommunications Company Sunrise Plans I.P.O."" by CHAD BRAY via NYT  http://t.co/TFZgP6ktrG",en,[],['http://ift.tt/1C5VNft'],[],0,0,0,[],[],https://twitter.com/hamersharp/status/555317327252951040,False,,0,,,,,,,,[],,,,
555317056934260737,555317056934260737,2015-01-14 10:54:38 UTC,2015-01-14,10:54:38,0,2284427341,joetopichak,Joe Topichak,,"""Swiss Telecommunications Company Sunrise Plans I.P.O."" by CHAD BRAY via NYT  http://t.co/UwAQPMUuA5",en,[],['http://ift.tt/1C5VNft'],[],0,0,0,[],[],https://twitter.com/joetopichak/status/555317056934260737,False,,0,,,,,,,,[],,,,
555316860393381888,555316860393381888,2015-01-14 10:53:51 UTC,2015-01-14,10:53:51,0,22797771,attilabokor,Attila Bokor,,"""Swiss Telecommunications Company Sunrise Plans I.P.O."" by CHAD BRAY via NYT The New York Times  http://t.co/Vk94CdK4V4",en,[],['http://ift.tt/1C5VNft'],[],0,0,0,[],[],https://twitter.com/attilabokor/status/555316860393381888,False,,0,,,,,,,,[],,,,
555316324982079488,555316324982079488,2015-01-14 10:51:43 UTC,2015-01-14,10:51:43,0,2290002361,mattcroweahhha,Matt Crowe,,Swiss Telecommunications Company Sunrise Plans I.P.O. by CHAD BRAY  http://t.co/HhnUnLqgsN,en,[],['http://ift.tt/150xbdl'],[],0,0,0,[],[],https://twitter.com/MattCroweAHHHA/status/555316324982079488,False,,0,,,,,,,,[],,,,
555315641557975040,555315641557975040,2015-01-14 10:49:00 UTC,2015-01-14,10:49:00,0,32939702,bordode,"Think, Stop The Silence🏳‍🌈",,"""Swiss Telecommunications Company Sunrise Plans I.P.O."" by CHAD BRAY via NYT  http://t.co/kQHwbvEXlf",en,[],['http://nyti.ms/1yfiE9s'],[],0,0,0,[],[],https://twitter.com/bordode/status/555315641557975040,False,,0,,,,,,,,[],,,,
555315555335667712,555315555335667712,2015-01-14 10:48:40 UTC,2015-01-14,10:48:40,0,43518888,qin007,Stan Qin,,"""Swiss Telecommunications Company Sunrise Plans I.P.O."" by CHAD BRAY via NYT  http://t.co/GdcKaZw2sV",en,[],['http://ift.tt/1C5VNft'],[],0,0,0,[],[],https://twitter.com/qin007/status/555315555335667712,False,,0,,,,,,,,[],,,,
