id,conversation_id,created_at,date,time,timezone,user_id,username,name,place,tweet,language,mentions,urls,photos,replies_count,retweets_count,likes_count,hashtags,cashtags,link,retweet,quote_url,video,thumbnail,near,geo,source,user_rt_id,user_rt,retweet_id,reply_to,retweet_date,translate,trans_src,trans_dest
1344683884752101376,1344683884752101376,2020-12-31 16:36:35 UTC,2020-12-31,16:36:35,0,970908187,isman_i_robleh,Isman Ibrahim Robleh,,Célébration de la journée nationale de la presse : J’adhère à la vision de mon collègue de la communication pour une presse libre et indépendante qui offre un panorama complet de l’actualité de Djibouti et d’ailleurs. #Djibouti 🇩🇯🇩🇯🇩🇯,fr,[],[],[],0,3,9,['djibouti'],[],https://twitter.com/ISMAN_I_ROBLEH/status/1344683884752101376,False,,0,,,,,,,,[],,,,
1344680828153044994,1344680828153044994,2020-12-31 16:24:27 UTC,2020-12-31,16:24:27,0,1218560293112025093,livedjib,Djib-Live,,Les lauréats des meilleurs employés de l'année 2020.  Malyoun Ibrahim Hassan (Chargée de communication)  Amina Idan Paul (Ingénieur en énergie)  Charmaké Hamad Ali (Agent administratif )  Abdoulharim Ali Diraneh (Agent administratif ) #Djibouti  https://t.co/xK690PMFBi,fr,[],[],"['https://pbs.twimg.com/media/EqlEC82XcAAVPCs.jpg', 'https://pbs.twimg.com/media/EqlEDkIWMAExDqR.jpg', 'https://pbs.twimg.com/media/EqlEEHFWMAEVtmn.jpg', 'https://pbs.twimg.com/media/EqlEE4mXIAMUlM_.jpg']",0,1,4,['djibouti'],[],https://twitter.com/LiveDjib/status/1344680828153044994,False,,1,https://pbs.twimg.com/media/EqlEC82XcAAVPCs.jpg,,,,,,,[],,,,
1344653968060915713,1344653968060915713,2020-12-31 14:37:43 UTC,2020-12-31,14:37:43,0,4826781063,a_kamil_mohamed,Abdoulkader Kamil Mohamed,,"Au Palais du Peuple, j’ai eu plaisir de participer à la Journée Nationale de la Presse.   Bravo à @BahdonRadwan et aux équipes du ministère de la Communication, Chargé des Postes et des Télécommunications pour l’organisation de ce bel événement !   #djibouti🇩🇯  https://t.co/AgfSSR8stj",fr,"[{'screen_name': 'bahdonradwan', 'name': 'radwan abdillahi bahdon', 'id': '1253657384867659776'}]",[],"['https://pbs.twimg.com/media/Eqkrp60WMAM2Fmb.jpg', 'https://pbs.twimg.com/media/Eqkrp64WMAAnuew.jpg', 'https://pbs.twimg.com/media/Eqkrp67XAAAdn09.jpg', 'https://pbs.twimg.com/media/Eqkrp7BXcAE4s3n.jpg']",1,7,26,['djibouti'],[],https://twitter.com/A_Kamil_Mohamed/status/1344653968060915713,False,,1,https://pbs.twimg.com/media/Eqkrp60WMAM2Fmb.jpg,,,,,,,[],,,,
1344376918418849792,1344376918418849792,2020-12-30 20:16:49 UTC,2020-12-30,20:16:49,0,360117574,23kidar,Kidar Saleh,,"#Djibouti   Sous le haut patronage du Premier Ministre S.E.M Abdoulkader Kamil Mohamed, le Ministère de la Communication, chargé des Postes et des Télécommunications organisera ce jeudi 31 décembre à 8h, au palais du peuple,la Journée Nationale de la Presse.  https://t.co/2zAm4tUGex",fr,[],[],"['https://pbs.twimg.com/media/EqgvrMpXEAEOScE.jpg', 'https://pbs.twimg.com/media/EqgvrkMXYAEUNli.jpg']",0,1,9,['djibouti'],[],https://twitter.com/23Kidar/status/1344376918418849792,False,,1,https://pbs.twimg.com/media/EqgvrMpXEAEOScE.jpg,,,,,,,[],,,,
1344216370007957505,1344216370007957505,2020-12-30 09:38:51 UTC,2020-12-30,09:38:51,0,738288007,somalijob,Somali Jobs,,L'UNICEF recrute - Consultation Nationale pour l'élaboration de supports de communication sur les pratiques sociales essentielles à #Djibouti #Somalijobs  appliquer maintenant -----&gt;&gt;  https://t.co/ZLNtbJWIga #unicefdjibouti #somalijobs,fr,[],['https://somalijobs.net/jobs/consultation-nationale-pour-lelaboration-de-supports-de-communication-sur-les-pratiques-sociales-essentielles-a-djibouti/'],[],0,0,0,"['djibouti', 'somalijobs', 'unicefdjibouti', 'somalijobs']",[],https://twitter.com/SomaliJob/status/1344216370007957505,False,,0,,,,,,,,[],,,,
1344001645215154177,1344001645215154177,2020-12-29 19:25:37 UTC,2020-12-29,19:25:37,0,2855525842,jrjama203,JAMA REYALE- MER-ROUGE (Red-Sea),,ALIILTIREH: DJIBOUTI: Le renforcement de la communication fina...  https://t.co/cj0vhT8JzP,fr,[],['https://gereny.blogspot.com/2020/12/djibouti-le-renforcement-de-la.html?spref=tw'],[],0,0,0,[],[],https://twitter.com/jrjama203/status/1344001645215154177,False,,0,,,,,,,,[],,,,
1343251805250093057,1343251805250093057,2020-12-27 17:46:01 UTC,2020-12-27,17:46:01,0,1273133446572003328,baligubadle2,Baligubadle2,,"We watched this movie before, it undermined Somaliland. It's more concerning this time, their 5th day in Djibouti without any communication. The only thing we heard is that our Representative in Djibouti said that by providing water to them will enhance Hargeisa water supply!!!",en,[],[],[],0,0,0,[],[],https://twitter.com/baligubadle2/status/1343251805250093057,False,https://twitter.com/samotalis/status/1343163491004383232,0,,,,,,,,[],,,,
1342523165319307264,1342523165319307264,2020-12-25 17:30:40 UTC,2020-12-25,17:30:40,0,206797546,ladhka,Mohamoud Walaaleye,,@BillGates praising Rep of #Somaliland communication company @Telesomcompany providing digital currency service #Zaad  to the citizens.  #Somalia #Djibouti #Ethiopia #Kenya #World,en,"[{'screen_name': 'telesomcompany', 'name': 'telesom company', 'id': '1034132162'}]",[],[],0,0,0,"['somaliland', 'zaad', 'somalia', 'djibouti', 'ethiopia', 'kenya', 'world']",[],https://twitter.com/Ladhka/status/1342523165319307264,False,https://twitter.com/ajyassin/status/1342503518532468740,0,,,,,,,,[],,,,
1342163793003106306,1342163793003106306,2020-12-24 17:42:39 UTC,2020-12-24,17:42:39,0,1292874530101366784,uzfo2suxkyhiud1,Abdoulaziz Egeh,,Waxan xalay kaqaybgalnay BBfair Libarray iyo xarun dhaqameed  matxaf laga furaayey magaala madaxda labad somaliland(boorama( oon just ku uganahay imika  Dhinacayga bidix waxa jooga.wafdi kasocday wadank.Djibouti (communication skills .and conflict transformation)  https://t.co/I26u8sCh2z,tl,[],[],"['https://pbs.twimg.com/media/EqBS2LQW4AAn8ON.jpg', 'https://pbs.twimg.com/media/EqBS2uzXUAAjItj.jpg']",0,0,0,[],[],https://twitter.com/uzFo2suXKYHiuD1/status/1342163793003106306,False,,1,https://pbs.twimg.com/media/EqBS2LQW4AAn8ON.jpg,,,,,,,[],,,,
1342027631479447552,1342027631479447552,2020-12-24 08:41:35 UTC,2020-12-24,08:41:35,0,1097176737971167232,lanation77,Journal La Nation,,Le ministre de la Communication reçoit l’ambassadeur de l’Inde à Djibouti   https://t.co/DatXu7aWDV  https://t.co/wlcPCOcKRj,fr,[],['https://bit.ly/3hdQgiO'],['https://pbs.twimg.com/media/Ep_XAOaXEAAYZDh.jpg'],0,0,0,[],[],https://twitter.com/Lanation77/status/1342027631479447552,False,,1,https://pbs.twimg.com/media/Ep_XAOaXEAAYZDh.jpg,,,,,,,[],,,,
1341640345143156737,1341640345143156737,2020-12-23 07:02:39 UTC,2020-12-23,07:02:39,0,1199967392178360321,fatoumaebrahim,Fatouma Ali,,Communication for Development #C4D helps inspire positive social &amp; behaviour change #ForEveryChild.   #Djibouti #C4DUnicef  https://t.co/jQVshxlTdo,en,[],[],['https://pbs.twimg.com/media/Ep52xiYW8AAoOjq.jpg'],0,0,3,"['c4d', 'foreverychild', 'djibouti', 'c4dunicef']",[],https://twitter.com/FatoumaEbrahim/status/1341640345143156737,False,,1,https://pbs.twimg.com/media/Ep52xiYW8AAoOjq.jpg,,,,,,,[],,,,
1341322803790946306,1341322803790946306,2020-12-22 10:00:51 UTC,2020-12-22,10:00:51,0,223653215,mouhyadineali,Mouhyadine🇩🇯,,Bravo à l'association @FemmeTicDjibout  et à sa présidente @Roukiya qui œuvre sans relâche à l'inclusion numérique des femmes a #Djibouti . La communication digital est un must dans le monde d'aujourd'hui. Cela permettra de rehausser le niveau de notre pays dans les NTIC ❤🇩🇯❤,fr,"[{'screen_name': 'femmeticdjibout', 'name': 'femme tic djibouti', 'id': '987235680337219584'}, {'screen_name': 'roukiya', 'name': 'roukiya mohamed abdoulkader', 'id': '560343310'}]",[],[],0,1,8,['djibouti'],[],https://twitter.com/MouhyadineAli/status/1341322803790946306,False,https://twitter.com/FemmeTicDjibout/status/1341315544574812160,0,,,,,,,,[],,,,
1340922521340809222,1340922521340809222,2020-12-21 07:30:16 UTC,2020-12-21,07:30:16,0,1172492406,somalilandtrave,Somaliland Travel,,A step back in time👣! Explore the ancient cave painting of Laas Geel. These drawings date back 9000 BC and are some of the world oldest form of communication.  #LaasGeel #Somalilivestock #Nomads #eastafrica #Africa #252 #my252 #Somaliland #Djibouti  #Somalilandtravelagency.  https://t.co/sxPw32CFbR,en,[],[],['https://pbs.twimg.com/media/Epvp68nWMAE7BBx.jpg'],0,0,2,"['laasgeel', 'somalilivestock', 'nomads', 'eastafrica', 'africa', 'my252', 'somaliland', 'djibouti', 'somalilandtravelagency']",[],https://twitter.com/SomalilandTrave/status/1340922521340809222,False,,1,https://pbs.twimg.com/media/Epvp68nWMAE7BBx.jpg,,,,,,,[],,,,
1340771350814875648,1340771350814875648,2020-12-20 21:29:35 UTC,2020-12-20,21:29:35,0,49031923,fuguni,Jamal Abdulahi,,@AUC_MoussaFaki Where is the communication from #Igadsumit in #Djibouti? Or is this it? #Igad position on the Somalia &amp; #Kenya situation is in the minds of observers. Calling more dialogue doesn’t count.,en,[],[],[],0,0,0,"['igadsumit', 'djibouti', 'igad', 'kenya']",[],https://twitter.com/fuguni/status/1340771350814875648,False,https://twitter.com/AUC_MoussaFaki/status/1340746084705071104,0,,,,,,,,[],,,,
1340183489518448640,1340183489518448640,2020-12-19 06:33:37 UTC,2020-12-19,06:33:37,0,1199967392178360321,fatoumaebrahim,Fatouma Ali,,"Communication for Development (#C4D) is  important for behaviour change! Through C4D, @UNICEFDJIBOUTI1 works with communities to influence them to adopt new behaviours that will help them live longer and healthier.   #UnicefC4D #Djibouti  https://t.co/TNC0fuq9lU",en,"[{'screen_name': 'unicefdjibouti1', 'name': 'unicef djibouti', 'id': '1282571515196846080'}]",[],['https://pbs.twimg.com/media/EplJwjhXMAAwfwx.jpg'],0,2,8,"['c4d', 'unicefc4d', 'djibouti']",[],https://twitter.com/FatoumaEbrahim/status/1340183489518448640,False,,1,https://pbs.twimg.com/media/EplJwjhXMAAwfwx.jpg,,,,,,,[],,,,
1339998415502139403,1339998415502139403,2020-12-18 18:18:12 UTC,2020-12-18,18:18:12,0,373666533,osmandaher,Osman daher,,Je pense que le plus grand partie de Notre pays UMP a un sacre probleme de communication avec la population. Juste un conseil d'ami il faut changer le responsable de la communication au sein du Partie. Ca marche pas du tout. #djibouti  https://t.co/NgKdFVw1FJ,fr,[],[],['https://pbs.twimg.com/media/EpihdQ-XYAIKI78.jpg'],2,0,3,['djibouti'],[],https://twitter.com/Osmandaher/status/1339998415502139403,False,,1,https://pbs.twimg.com/media/EpihdQ-XYAIKI78.jpg,,,,,,,[],,,,
1339982297748148225,1339982297748148225,2020-12-18 17:14:10 UTC,2020-12-18,17:14:10,0,1193947351020441605,rahuljain7783,श्री भगवान ऊवाच,,श्री भगवान ऊवाच 🪔: The Hari Act an Act of Communication Transmission of the Planet 🌎 emerges from Manual T to Auto T to form the Divine Roop of Hari for Jan Kalyaan to Maha Raas to Hari संस्कार — a Keval gyāna to (@UN + @UN_Women) India 🇮🇳 🌎 + Djibouti 🇩🇯 = Hari वंदन 🙏,und,"[{'screen_name': 'un', 'name': 'united nations', 'id': '14159148'}, {'screen_name': 'un_women', 'name': 'un women', 'id': '17137628'}]",[],[],0,0,0,[],[],https://twitter.com/rahuljain7783/status/1339982297748148225,False,https://twitter.com/rahuljain7783/status/1339954040696913921,0,,,,,,,,[],,,,
1339475940972376064,1339475940972376064,2020-12-17 07:42:05 UTC,2020-12-17,07:42:05,0,235498710,kibetkenneth,+254_F1,,"One thing I have learnt over the last few months dealing with Ethiopian/Djibouti banks is that Kenyans take communication very seriously,emails hardly ever go over a day without being replied to,other regions emails are replied to after 10 business days",en,[],[],[],1,0,0,[],[],https://twitter.com/kibetkenneth/status/1339475940972376064,False,,0,,,,,,,,[],,,,
1337270718699102208,1337152848467996676,2020-12-11 05:39:19 UTC,2020-12-11,05:39:19,0,1643026356,natnael_ethio,ናትናኤል | Natnael 🇪🇹,,"@Assita_Kanko @JosepBorrellF TPLF's influence inside Ethiopia, Eritrea, Somalia, South Sudan, Djibouti is dead. The only thing left is its money, the people that push the agendas, &amp; their communication means abroad. It is the effort of the communities of the #HOA  to target &amp; disable it once &amp; for all.",en,[],[],[],1,0,6,['hoa'],[],https://twitter.com/Natnael_Ethio/status/1337270718699102208,False,,0,,,,,,,,"[{'screen_name': 'Assita_Kanko', 'name': 'Assita Kanko MEP', 'id': '52361939'}, {'screen_name': 'JosepBorrellF', 'name': 'Josep Borrell Fontelles', 'id': '1003895325025865730'}]",,,,
1336768136180355073,1336768136180355073,2020-12-09 20:22:14 UTC,2020-12-09,20:22:14,0,23213881,amanbiede,Amanuel Biedemariam,,"TPLF's influence inside Ethiopia, Eritrea, Somalia, South Sudan, Djibouti is dead. The only thing left is its money, the people that push the agendas, &amp; their communication means abroad. It is the effort of the communities of the #HOA  to target &amp; disable it once &amp; for all.  https://t.co/SqYa4G5PQT",en,[],[],['https://pbs.twimg.com/media/Eo0nXZjXUAUU5Mr.png'],9,25,91,['hoa'],[],https://twitter.com/Amanbiede/status/1336768136180355073,False,,1,https://pbs.twimg.com/media/Eo0nXZjXUAUU5Mr.png,,,,,,,[],,,,
1334814541377646598,1334814541377646598,2020-12-04 10:59:20 UTC,2020-12-04,10:59:20,0,450902749,niimegal,Nimo Egal,,Afxumo rag waa ku kala tagaa. Comprehension is the key to #communication. #Proverbs #Somali #Djibouti,tl,[],[],[],0,0,0,"['communication', 'proverbs', 'somali', 'djibouti']",[],https://twitter.com/Niimegal/status/1334814541377646598,False,,0,,,,,,,,[],,,,
1333318729493524481,1333318729493524481,2020-11-30 07:55:31 UTC,2020-11-30,07:55:31,0,1328652567472173059,efadjibouti,Expertise France à Djibouti,,"2/2 🚨 Expertise France a Djibouti recrute !   Recrutement : 👉D'un poste d'ingénieur projet au sein des 5 Conseils régionaux de la République de Djibouti : Ali Sabieh, Arta, Dikhil, Obock et Tadjourah. 👉 D'un poste de chargé.e de communication du Conseil Régional de Tadjourah.  https://t.co/rG6VCb71wr",fr,[],[],['https://pbs.twimg.com/media/EoDmTvYXUAE6AXu.jpg'],0,1,10,[],[],https://twitter.com/EFaDjibouti/status/1333318729493524481,False,,1,https://pbs.twimg.com/media/EoDmTvYXUAE6AXu.jpg,,,,,,,[],,,,
1331206935392227330,1331206935392227330,2020-11-24 12:04:00 UTC,2020-11-24,12:04:00,0,1316981639839420417,madharnabil2,𝔐𝔞𝔡𝔥𝔞𝔯 𝔑𝔞𝔟𝔦𝔩 𝔄𝔥𝔪𝔢𝔡,,"Le ministre de la communication, chargé des Postes et des Télécommunication, #RadwanAbdillahiBahdon (@BahdonRadwan),a reçu le 22/11 dernier dans son cabinet l’Ambassadrice du #Rwanda accréditée à #Djibouti mais  résidente à #AddisAbeba, Mme #HopeTumukundeGasatura. Sc:@Lanation77  https://t.co/kSal7NdeFU",fr,"[{'screen_name': 'bahdonradwan', 'name': 'radwan abdillahi bahdon', 'id': '1253657384867659776'}, {'screen_name': 'lanation77', 'name': 'journal la nation', 'id': '1097176737971167232'}]",[],['https://pbs.twimg.com/media/EnllpwiXEAA8jng.jpg'],0,0,0,"['radwanabdillahibahdon', 'rwanda', 'djibouti', 'addisabeba', 'hopetumukundegasatura']",[],https://twitter.com/MadharNabil2/status/1331206935392227330,False,,1,https://pbs.twimg.com/media/EnllpwiXEAA8jng.jpg,,,,,,,[],,,,
1330623412868362241,1330623412868362241,2020-11-22 21:25:18 UTC,2020-11-22,21:25:18,0,373666533,osmandaher,Osman daher,,Ca serait mieux de fois de faire son discour avec sa langue maternel. Le niveau du pays en communication est vraiment nul nul .... U20 on perdu contre la Tanzanie 6 - 1. A qui la faute de ce mediocrite.  https://t.co/sz8FpFDMn9  #Djibouti  https://t.co/eiDbNiuDUX,fr,[],['https://www.facebook.com/107932070558742/posts/395151035170176/'],[],0,0,0,['djibouti'],[],https://twitter.com/Osmandaher/status/1330623412868362241,False,,1,https://pbs.twimg.com/ext_tw_video_thumb/1330623355259678721/pu/img/HGwSw_OgeZ0hp5bA.jpg,,,,,,,[],,,,
1330112241283313665,1330056614741749761,2020-11-21 11:34:05 UTC,2020-11-21,11:34:05,0,1210178282366390272,pampam94612961,pampam,,@markc_anderson Cellule communication #FFDJ  ? #Djibouti #Macron  #COMFOR #COMBdD #Elysée   https://t.co/CU5rEuZtws #France  Anti #covid19 / #Erytrea Pas de protocoles sanitaire ?,fr,[],['https://youtu.be/lhDvQWexUQ4'],[],0,0,0,"['ffdj', 'djibouti', 'macron', 'comfor', 'combdd', 'elysée', 'france', 'covid19', 'erytrea']",[],https://twitter.com/pampam94612961/status/1330112241283313665,False,,0,,,,,,,,"[{'screen_name': 'markc_anderson', 'name': 'Mark Anderson', 'id': '323954578'}]",,,,
1330059549001314304,1330059549001314304,2020-11-21 08:04:42 UTC,2020-11-21,08:04:42,0,738288007,somalijob,Somali Jobs,,RE-ADVERT: Communication Officer (Communication and Reporting) - #Djibouti #Somalijobs   https://t.co/6l6P1NlH36 #somalijobs #UNOPS,en,[],['https://somalijobs.net/jobs/re-advert-communication-officer-communication-and-reporting-djibouti/'],[],0,0,0,"['djibouti', 'somalijobs', 'somalijobs', 'unops']",[],https://twitter.com/SomaliJob/status/1330059549001314304,False,,0,,,,,,,,[],,,,
1329843038491979777,1329843038491979777,2020-11-20 17:44:22 UTC,2020-11-20,17:44:22,0,1267317265,fr_grunewald,Francois Grunewald,,"Qu'apprendre de l'Afrique en temps de #COVID? De RDC à RCA, Kenya, Djibouti: Prévention, communication, #travailcommunautaire. Chez nous, on a oublié les principes de base de #santépublique. voir  https://t.co/lYwThgVjXz @olivierveran @prioritesante @ALIMA_ORG @MSF_france  @RFI  https://t.co/vGLYqtihB5",fr,"[{'screen_name': 'olivierveran', 'name': 'olivier véran', 'id': '600345740'}, {'screen_name': 'prioritesante', 'name': 'rfi priorité santé', 'id': '376122284'}, {'screen_name': 'alima_org', 'name': 'alima', 'id': '819116890278817793'}, {'screen_name': 'msf_france', 'name': 'msf france', 'id': '14755217'}, {'screen_name': 'rfi', 'name': 'rfi', 'id': '32861321'}]",['https://www.urd.org/fr/projet/observatoire-covid-19/'],"['https://pbs.twimg.com/media/EnSLc8WXMAAOORq.jpg', 'https://pbs.twimg.com/media/EnSLiQ9XIAALXJd.jpg', 'https://pbs.twimg.com/media/EnSLmDLXEAMDJ-4.jpg', 'https://pbs.twimg.com/media/EnSLqHYW8AE4jYx.jpg']",0,0,2,"['covid', 'travailcommunautaire', 'santépublique']",[],https://twitter.com/Fr_Grunewald/status/1329843038491979777,False,,1,https://pbs.twimg.com/media/EnSLc8WXMAAOORq.jpg,,,,,,,[],,,,
1329704554519212039,1329704554519212039,2020-11-20 08:34:05 UTC,2020-11-20,08:34:05,0,1259887189409832961,journoafrica,Journalists Africa,,UNOPS is looking for a Communication Officer (Communication and Reporting) in Djibouti - Re-advertised  https://t.co/XDVLr6OwwL #Africa #mediajobs #communicationsjobs  https://t.co/RSesoxLfiP,en,[],['https://bit.ly/36NK9x4'],['https://pbs.twimg.com/media/EnQPPoTXEAE3jnQ.jpg'],0,0,0,"['africa', 'mediajobs', 'communicationsjobs']",[],https://twitter.com/journoafrica/status/1329704554519212039,False,,1,https://pbs.twimg.com/media/EnQPPoTXEAE3jnQ.jpg,,,,,,,[],,,,
1328014647484616704,1328014647484616704,2020-11-15 16:38:59 UTC,2020-11-15,16:38:59,0,740410080,cabinet_incom,Cabinet inCOM,,"""Change is never easy but always possible"" Let's start the week with a good vibes 😃  Bon debut de semaine guys ✌️ #Sunday #goodvibes #Marketing #Communication #inCOM #Advertising #Brand #Success #Digital #Strategy #Media #Team #Djibouti #Business #socialmedia  https://t.co/9vEqPSsySN",en,[],[],['https://pbs.twimg.com/media/Em4OMWlXEAARYmz.jpg'],1,1,4,"['sunday', 'goodvibes', 'marketing', 'communication', 'incom', 'advertising', 'brand', 'success', 'digital', 'strategy', 'media', 'team', 'djibouti', 'business', 'socialmedia']",[],https://twitter.com/cabinet_incom/status/1328014647484616704,False,,1,https://pbs.twimg.com/media/Em4OMWlXEAARYmz.jpg,,,,,,,[],,,,
1326934648828686342,1326934648828686342,2020-11-12 17:07:28 UTC,2020-11-12,17:07:28,0,740410080,cabinet_incom,Cabinet inCOM,,Cabinet inCOM - 𝐆𝐞𝐭 𝐓𝐨 𝐊𝐧𝐨𝐰 𝐔𝐬  You want to know more about us ?  Check it out ⬇️😃  #Marketing #Communication #inCOM #Advertising #Brand #Success #Digital #Strategy #Media #Team #Djibouti #Business #SocialMedia  https://t.co/6kYLUdgMip,en,[],[],[],0,0,1,"['marketing', 'communication', 'incom', 'advertising', 'brand', 'success', 'digital', 'strategy', 'media', 'team', 'djibouti', 'business', 'socialmedia']",[],https://twitter.com/cabinet_incom/status/1326934648828686342,False,,1,https://pbs.twimg.com/ext_tw_video_thumb/1326933891303813120/pu/img/2lTlO9cbV0-gyduS.jpg,,,,,,,[],,,,
1325673132183724032,1325673132183724032,2020-11-09 05:34:39 UTC,2020-11-09,05:34:39,0,1122035534,lassinialpha,alpha.lassini,,"DJIBOUTI  - GOUVERNANCE  ""Opération de pulvérisation anti moustique"" à grand frais de communication et de dépenses par un gouv en mal de boussole!  Et si vous organisiez un environnement sain, une ville propre?    https://t.co/LTPNgHRGjN",fr,[],['https://www.facebook.com/rtd.chaine2/videos/365213658031307/'],[],0,0,0,[],[],https://twitter.com/LassiniAlpha/status/1325673132183724032,False,,0,,,,,,,,[],,,,
1323945365075337216,1323945365075337216,2020-11-04 11:09:07 UTC,2020-11-04,11:09:07,0,2855525842,jrjama203,JAMA REYALE- MER-ROUGE (Red-Sea),,DJIBOUTI: cabine intitulé  https://t.co/ZTsPV4t22u de communication et Marketing ouvre se porte au 5é étage du bâtiment Salam Group Bank Djibouti  https://t.co/NS1kExqUcr,fr,[],['http://in.com'],['https://pbs.twimg.com/media/El-YeyVXYAA_aBH.jpg'],0,1,3,[],[],https://twitter.com/jrjama203/status/1323945365075337216,False,,1,https://pbs.twimg.com/media/El-YeyVXYAA_aBH.jpg,,,,,,,[],,,,
1323591242597490690,1323591242597490690,2020-11-03 11:41:58 UTC,2020-11-03,11:41:58,0,740410080,cabinet_incom,Cabinet inCOM,,"[#𝐢𝐧𝐂𝐎𝐌_𝐁𝐢𝐠𝐎𝐩𝐞𝐧𝐢𝐧𝐠]   Our guests, our prides  ✨  #BigEvent #Marketing #Communication  #Djibouti  #Incom #InComDigital #InComTraining #InComProduction #InComEvents #InComCreativity  🗓02 Novembre 2020 📌Salaam Tower - Centre d’Affaire REGUS  https://t.co/kBaZeG7vAK",fr,[],[],"['https://pbs.twimg.com/media/El5XNLoWMAAJD8w.jpg', 'https://pbs.twimg.com/media/El5XNNUWkAA7YeV.jpg', 'https://pbs.twimg.com/media/El5XNNcXUAEr9jn.jpg', 'https://pbs.twimg.com/media/El5XNNjXUAQ8--Q.jpg']",0,0,4,"['𝐢𝐧𝐂𝐎𝐌_𝐁𝐢𝐠𝐎𝐩𝐞𝐧𝐢𝐧𝐠', 'bigevent', 'marketing', 'communication', 'djibouti', 'incom', 'incomdigital', 'incomtraining', 'incomproduction', 'incomevents', 'incomcreativity']",[],https://twitter.com/cabinet_incom/status/1323591242597490690,False,,1,https://pbs.twimg.com/media/El5XNLoWMAAJD8w.jpg,,,,,,,[],,,,
1323509635328942080,1323509635328942080,2020-11-03 06:17:41 UTC,2020-11-03,06:17:41,0,1271774285430956032,djiboutimoney,D-Money,,"Le Ministre de la Communication, accompagné de l'équipe D-Money de Djibouti Telecom se sont rendus successivement dans les bureaux, du Ministre de l'Intérieur, le Ministre de l'Énergie, et le Ministre du Travail pour procéder à l'ouverture de leurs porte-monnaie électronique.  https://t.co/xBZE4La90U",fr,[],[],"['https://pbs.twimg.com/media/El4LwDbX0AMaV8L.jpg', 'https://pbs.twimg.com/media/El4LwE-X0AYxWbG.jpg', 'https://pbs.twimg.com/media/El4LwH3XgAYNNdW.jpg', 'https://pbs.twimg.com/media/El4LwH5WoAEAPhO.jpg']",0,2,7,[],[],https://twitter.com/djiboutimoney/status/1323509635328942080,False,,1,https://pbs.twimg.com/media/El4LwDbX0AMaV8L.jpg,,,,,,,[],,,,
1321193431989977092,1321193431989977092,2020-10-27 20:53:55 UTC,2020-10-27,20:53:55,0,457930397,saebazam,SAEB AZAM™,,"Le plus grand problème de la communication, c'est que nous n'écoutons pas pour comprendre... Nous écoutons pour contredire !  Bonne nuit  #coronavirus #leadership #COVID19 #reconfinement #Djibouti",fr,[],[],[],0,0,0,"['coronavirus', 'leadership', 'covid19', 'reconfinement', 'djibouti']",[],https://twitter.com/SAEBAZAM/status/1321193431989977092,False,,0,,,,,,,,[],,,,
1319732024823959554,1319732024823959554,2020-10-23 20:06:48 UTC,2020-10-23,20:06:48,0,1209318091,hgaradg,Houmed Garad,,"Solidaire avec vous. Et sans prendre un risque, je peux affirmer qu'il n'y a eu aucune communication pour expliquer cette plongée dans les ténèbres. Ai-je tort?  #Djibouti",fr,[],[],[],2,1,11,['djibouti'],[],https://twitter.com/HGaradG/status/1319732024823959554,False,https://twitter.com/Rahimpro/status/1319693737740668931,0,,,,,,,,[],,,,
1316843140523995138,1316843140523995138,2020-10-15 20:47:25 UTC,2020-10-15,20:47:25,0,607222955,djib_ville,East Africa,,Monsieur le ministre @MinSantedj on dirait que votre Secretaire et votre service de communication ne sont pas opérationnels #Djibouti @IsmailOguelleh  https://t.co/gXw78i0IHm,fr,"[{'screen_name': 'minsantedj', 'name': 'minsantédj', 'id': '894266976499060736'}, {'screen_name': 'ismailoguelleh', 'name': 'ismail omar guelleh', 'id': '3297036587'}]",[],['https://pbs.twimg.com/media/EkZd2rIXsAMPzC9.jpg'],0,0,0,['djibouti'],[],https://twitter.com/djib_ville/status/1316843140523995138,False,,1,https://pbs.twimg.com/media/EkZd2rIXsAMPzC9.jpg,,,,,,,[],,,,
1315709563560226816,1315709563560226816,2020-10-12 17:42:59 UTC,2020-10-12,17:42:59,0,843201553796423680,djiboutitechhub,CTID,,"🚀Lancement du Programme ""African Game Dev Community"" à 🇩🇯   ▪️Tu es étudiant(e) ou diplômé(e)s en informatique/communication/Multimédia?  ▪️Entre 18-30 ans? ▪️Passionné de jeux Vidéo&amp;de Technologies?  Candidatez👉 https://t.co/VFYdKtpYXS   ⏳25/10/2020   #Djibouti #Gaming #3D  https://t.co/OTRxM6l4x7",fr,[],['https://vu.fr/NpEz'],['https://pbs.twimg.com/media/EkJWcd7XkAAi4pE.jpg'],0,6,12,"['djibouti', 'gaming', '3d']",[],https://twitter.com/DjiboutiTechHub/status/1315709563560226816,False,,1,https://pbs.twimg.com/media/EkJWcd7XkAAi4pE.jpg,,,,,,,[],,,,
