id,conversation_id,created_at,date,time,timezone,user_id,username,name,place,tweet,language,mentions,urls,photos,replies_count,retweets_count,likes_count,hashtags,cashtags,link,retweet,quote_url,video,thumbnail,near,geo,source,user_rt_id,user_rt,retweet_id,reply_to,retweet_date,translate,trans_src,trans_dest
1039723793248411648,1039723793248411648,2018-09-12 03:54:04 UTC,2018-09-12,03:54:04,0,1341063961,jadecclarke,Jade Clarke,,"@halelule Hi, I'm a radio producer at the Australian Broadcasting Corporation. I'm hoping to set up an interview with you on the reopening of the Ethiopia-Eritrea border. Could you please follow me so I can DM you. Thanks, Jade",en,[],[],[],0,0,0,[],[],https://twitter.com/jadecclarke/status/1039723793248411648,False,,0,,,,,,,,[],,,,
1039583713191968768,1039572713113710592,2018-09-11 18:37:26 UTC,2018-09-11,18:37:26,0,65388966,senifalu,SENIFALU,,"@tesfanews @tesfanews What is wrong with u guys? No more #Issias, @hawelti or EriTV said this or that?  I guess #AbiyAhmed was given all the power of attorney to declare law in #Eritrea.  Long live #ETV &amp; Fana Broadcasting!!!",en,"[{'screen_name': 'hawelti', 'name': 'yemane g. meskel', 'id': '438370063'}]",[],[],0,0,1,"['issias', 'abiyahmed', 'eritrea', 'etv']",[],https://twitter.com/SENIFALU/status/1039583713191968768,False,,0,,,,,,,,"[{'screen_name': 'tesfanews', 'name': '#In17Days 🎙️', 'id': '245735621'}]",,,,
1038684534093606912,1038684534093606912,2018-09-09 07:04:25 UTC,2018-09-09,07:04:25,0,952866654232379397,brought_to_you,Brought to You,,"RT BBCMonitoring: Eritrea will rejoin the IGAD regional bloc next month at a ceremony in Addis Ababa,  Ethiopia's Fana Broadcasting Corporation reports.",en,[],[],[],0,0,0,[],[],https://twitter.com/Brought_to_You/status/1038684534093606912,False,,0,,,,,,,,[],,,,
1038420091099078657,1038420091099078657,2018-09-08 13:33:37 UTC,2018-09-08,13:33:37,0,569238628,bbcmonitoring,BBC Monitoring,,"Eritrea will rejoin the IGAD regional bloc next month at a ceremony in Addis Ababa,  Ethiopia's Fana Broadcasting Corporation reports.",en,[],[],[],4,42,53,[],[],https://twitter.com/BBCMonitoring/status/1038420091099078657,False,,0,,,,,,,,[],,,,
1037967463533686784,1037967463533686784,2018-09-07 07:35:02 UTC,2018-09-07,07:35:02,0,97865418,eritreacompass,Eritrea Compass,,Fana Broadcasting reportage on Dr Abiy visit to #Eritrea #IGAD #Ethiopia #Assab #Massawa  https://t.co/Ve8dD5XeJs,en,[],['https://www.facebook.com/story.php?story_fbid=2161000114169279&id=1586354144967215'],[],0,0,1,"['eritrea', 'igad', 'ethiopia', 'assab', 'massawa']",[],https://twitter.com/eritreacompass/status/1037967463533686784,False,,0,,,,,,,,[],,,,
1037704205413376000,1037704171150032896,2018-09-06 14:08:56 UTC,2018-09-06,14:08:56,0,816998935059460096,ikirihonews,Ikiriho News,,State affiliated #Ehiopi-an Fana Broadcasting said #Ethiopia’s Prime Minister Abiy Ahmed and #Eritrea’s President Isaias Afwerki re-opened the embassy in a brief ceremony   https://t.co/qqxpwtDy7g,en,[],['https://af.reuters.com/article/topNews/idAFKCN1LM0T6-OZATP'],[],0,0,0,"['ehiopi', 'ethiopia', 'eritrea']",[],https://twitter.com/IkirihoNews/status/1037704205413376000,False,,0,,,,,,,,[],,,,
1037659356316270593,1037659356316270593,2018-09-06 11:10:43 UTC,2018-09-06,11:10:43,0,85318467,thenationnews,The Nation Nigeria,,Fana Broadcasting said Ethiopia’s Prime Minister Abiy Ahmed and Eritrea’s President Isaias Afwerki re-opened the embassy in a brief ceremony.... https://t.co/OvBE1VN18t,en,[],['http://thenationonlineng.net/ethiopia-reopens-embassy-eritrea/'],[],0,0,0,[],[],https://twitter.com/TheNationNews/status/1037659356316270593,False,,0,,,,,,,,[],,,,
1037382893541240832,1037382893541240832,2018-09-05 16:52:10 UTC,2018-09-05,16:52:10,0,993201718883225600,annafricatv,African News Network,,"Ethiopian Prime Minister Abiy Ahmed on Wednesday returned to Eritrea on an unannounced working visit, state-run Fana broadcasting corporate has reported. #AfricanNewsNetwork #Ethiopia #Eritrea  https://t.co/toF6FpTW1z  https://t.co/Hom2ow5BSH",en,[],['https://annafrica.net/2018/09/05/ethiopian-pm-returns-to-eritrea-on-unannounced-working-visit/'],['https://pbs.twimg.com/media/DmWGPi5UYAAnY0H.jpg'],0,0,0,"['africannewsnetwork', 'ethiopia', 'eritrea']",[],https://twitter.com/annafricatv/status/1037382893541240832,False,,1,https://pbs.twimg.com/media/DmWGPi5UYAAnY0H.jpg,,,,,,,[],,,,
1037309344839290880,1037309344839290880,2018-09-05 11:59:54 UTC,2018-09-05,11:59:54,0,955548272495595520,merhabafrika,Merhaba Afrika,,"#Ethiopian Prime Minister Abiy Ahmed on Wednesday returned to #Eritrea on an unannounced working visit, state-run Fana (@fanatelevision) broadcasting corporate has reported. 🇪🇷 🇪🇹  https://t.co/AgiajPTAB0",en,"[{'screen_name': 'fanatelevision', 'name': 'fbc (fana broadcasting corporate s.c.)', 'id': '779821454'}]",[],['https://pbs.twimg.com/media/DmVDWaWW4AI9nWY.jpg'],0,2,4,"['ethiopian', 'eritrea']",[],https://twitter.com/merhabafrika/status/1037309344839290880,False,,1,https://pbs.twimg.com/media/DmVDWaWW4AI9nWY.jpg,,,,,,,[],,,,
1037274638852780032,1037274638852780032,2018-09-05 09:42:00 UTC,2018-09-05,09:42:00,0,60017224,peninsulaqatar,The Peninsula Qatar,,"The Mekelle entered the Red Sea port of #Massawa and was due to carry 11,000 tonnes of Eritrean zinc to China, Ethiopian broadcaster Fana Broadcasting reported. #Eritrea #Ethiopia    https://t.co/hUmx5sM6Xy",en,[],['https://www.thepeninsulaqatar.com/article/05/09/2018/Ethiopian-commercial-ship-docks-in-Eritrea-for-first-time-in-20-years---broadcaster'],[],0,0,1,"['massawa', 'eritrea', 'ethiopia']",[],https://twitter.com/PeninsulaQatar/status/1037274638852780032,False,,0,,,,,,,,[],,,,
1034397767442018305,1034397767442018305,2018-08-28 11:10:20 UTC,2018-08-28,11:10:20,0,714032407,nessunluogo24,Nessun Luogo24,,"Good morning @Nanjala1 I'm writing in order to invite you to our radio programme at @Radio24_news, an italian national broadcasting radio service, for a brief interview by phone this evening about Etiopia and Eritrea situation nowadays. Are you available? Best Regards!",en,"[{'screen_name': 'nanjala1', 'name': 'nanjala nyabola', 'id': '563190755'}, {'screen_name': 'radio24_news', 'name': 'radio 24', 'id': '126677638'}]",[],[],1,1,8,[],[],https://twitter.com/NessunLuogo24/status/1034397767442018305,False,,0,,,,,,,,[],,,,
1029707273751470081,1029707273751470081,2018-08-15 12:31:59 UTC,2018-08-15,12:31:59,0,715859950199840768,aklilu_ht,Aklilu H.michael T,,Delegates from the #Amhara Kilil of #Ethiopia embark on a visit to #Eritrea. They will hold takes with President #Isaias Afwerki of Eritrea as #FBC (Fana Broadcasting Corporate S.C.) reports  https://t.co/5NJo0vFzTN,en,[],[],['https://pbs.twimg.com/media/DkpBQJJW0AA9UOy.jpg'],1,3,5,"['amhara', 'ethiopia', 'eritrea', 'isaias', 'fbc']",[],https://twitter.com/Aklilu_HT/status/1029707273751470081,False,,1,https://pbs.twimg.com/media/DkpBQJJW0AA9UOy.jpg,,,,,,,[],,,,
1028172526948503553,1027923781476605953,2018-08-11 06:53:27 UTC,2018-08-11,06:53:27,0,2915105754,b_nick,Eritrea,,@RahelTewelde11 @tesfanews Today VOA Amharic was broadcasting a debate b/n two Ethiopians on how to take Assab from Eritrea - dumbfounded! The reason this question was brought up again is b/c PM Abiy failed to put the record straight when asked about the ownership of Assab. Disappointed.,en,[],[],[],1,0,4,[],[],https://twitter.com/b_nick/status/1028172526948503553,False,,0,,,,,,,,"[{'screen_name': 'RahelTewelde11', 'name': 'Rahel Tewelde', 'id': '2863770490'}, {'screen_name': 'tesfanews', 'name': '#In17Days 🎙️', 'id': '245735621'}]",,,,
1028058056276492288,1028058056276492288,2018-08-10 23:18:35 UTC,2018-08-10,23:18:35,0,4341952421,africa_alert,Africa Alert,,#UAE to build #oil pipeline between #Eritrea and #Ethiopia – Fana Broadcasting  https://t.co/MJnEeoRDU1,en,[],['http://www.engineeringnews.co.za/article/uae-to-build-oil-pipeline-between-eritrea-and-ethiopia-fana-broadcasting-2018-08-10'],[],0,0,0,"['uae', 'oil', 'eritrea', 'ethiopia']",[],https://twitter.com/Africa_Alert/status/1028058056276492288,False,,0,,,,,,,,[],,,,
1027905025639686145,1027905025639686145,2018-08-10 13:10:30 UTC,2018-08-10,13:10:30,0,1072923019,azizsapphire,عبدالعزيز المقبل,,UAE to build oil pipeline between Eritrea and Ethiopia -Fana Broadcasting  https://t.co/aBej1Cl3XN,en,[],['https://af.reuters.com/article/investingNews/idAFKBN1KV0UO-OZABS'],[],1,5,6,[],[],https://twitter.com/AzizSapphire/status/1027905025639686145,False,,0,,,,,,,,[],,,,
1027903494639026176,1027903494639026176,2018-08-10 13:04:25 UTC,2018-08-10,13:04:25,0,386258799,stephen_yeboah,Stephen Yeboah,,UAE to build oil pipeline between #Eritrea and #Ethiopia - Fana Broadcasting  https://t.co/ztzEKGRjzA,en,[],['https://af.reuters.com/article/investingNews/idAFKBN1KV0UO-OZABS'],[],0,2,0,"['eritrea', 'ethiopia']",[],https://twitter.com/stephen_yeboah/status/1027903494639026176,False,,0,,,,,,,,[],,,,
1027879241084530690,1027879241084530690,2018-08-10 11:28:02 UTC,2018-08-10,11:28:02,0,396853724,lwpnews,Loveworld Plus News,,UAE to build oil pipeline between Eritrea and Ethiopia – Fana Broadcasting  https://t.co/V2nr9q1pbE,en,[],['https://goo.gl/qYurXk'],[],0,0,0,[],[],https://twitter.com/lwpnews/status/1027879241084530690,False,,0,,,,,,,,[],,,,
1027865043013181440,1027865043013181440,2018-08-10 10:31:37 UTC,2018-08-10,10:31:37,0,21516577,iethiopia,iEthiopia,,UAE to build oil pipeline between Eritrea and Ethiopia -Fana Broadcasting -   https://t.co/GyJ3PQopWe,en,[],['http://feeds.reuters.com/~r/reuters/AfricaEthiopiaNews/~3/CQlc7h5hRF8/idAFN6N1UJ005'],[],0,0,0,[],[],https://twitter.com/iEthiopia/status/1027865043013181440,False,,0,,,,,,,,[],,,,
1027861207657730048,1027861207657730048,2018-08-10 10:16:23 UTC,2018-08-10,10:16:23,0,339833759,eshetebekele,Eshete Bekele,,"according to Party affiliated Fana broadcasting, UAE plans to build oil pipeline connecting #Eritrea’s port city of Assab with #Ethiopia’s capital Addis Ababa.     https://t.co/bo0h21zch2",en,[],['http://www.fanabc.com/index.php/news/item/35232-%E1%8A%A2%E1%89%B5%E1%8B%AE%E1%8C%B5%E1%8B%AB%E1%8A%93-%E1%8B%A8%E1%89%B0%E1%89%A3%E1%89%A0%E1%88%A9%E1%89%B5-%E1%8A%A0%E1%88%A8%E1%89%A5-%E1%8A%A4%E1%88%9D%E1%88%AC%E1%89%B6%E1%89%BD-%E1%8A%A8%E1%8A%A0%E1%88%B0%E1%89%A5-%E1%8A%A5%E1%88%B5%E1%8A%A8-%E1%8A%A0%E1%8B%B2%E1%88%B5-%E1%8A%A0%E1%89%A0%E1%89%A3-%E1%8B%A8%E1%8A%90%E1%8B%B3%E1%8C%85-%E1%88%9B%E1%88%B5%E1%89%B0%E1%88%8B%E1%88%88%E1%8D%8A%E1%8B%AB-%E1%89%B1%E1%89%A6-%E1%88%88%E1%88%98%E1%8B%98%E1%88%AD%E1%8C%8B%E1%89%B5-%E1%8A%A0%E1%89%85%E1%8B%B0%E1%8B%8B%E1%88%8D.htmlaccording'],[],0,2,1,"['eritrea', 'ethiopia']",[],https://twitter.com/EsheteBekele/status/1027861207657730048,False,,0,,,,,,,,[],,,,
1027858431041056768,1027858431041056768,2018-08-10 10:05:21 UTC,2018-08-10,10:05:21,0,1224492829,gobanimodoon,Abdirashid Muse,,#UAE to build oil pipeline between #Eritrea and #Ethiopia -Fana Broadcasting  https://t.co/NuAfY3CZD5,en,[],['http://news.trust.org/item/20180810084634-dd940/'],[],0,1,0,"['uae', 'eritrea', 'ethiopia']",[],https://twitter.com/Gobanimodoon/status/1027858431041056768,False,,0,,,,,,,,[],,,,
1027857076108898304,1027857076108898304,2018-08-10 09:59:58 UTC,2018-08-10,09:59:58,0,937962626222497793,dev_discourse,Devdiscourse,,UAE to build oil pipeline between Eritrea and Ethiopia -Fana Broadcasting   https://t.co/b2XjkbB3cX #oilpipeline #AbiyAhmed #ReemAlHashimy #UAE #Eritrea #Ethopia,en,[],['https://bit.ly/2npVcGj'],[],0,0,0,"['oilpipeline', 'abiyahmed', 'reemalhashimy', 'uae', 'eritrea', 'ethopia']",[],https://twitter.com/dev_discourse/status/1027857076108898304,False,,0,,,,,,,,[],,,,
1027854568204451842,1027854568204451842,2018-08-10 09:50:00 UTC,2018-08-10,09:50:00,0,178779512,dailystarleb,The Daily Star Lebanon,,UAE to build oil pipeline between Eritrea and Ethiopia: Fana Broadcasting  https://t.co/hnl6m8hZlz,en,[],['http://bit.ly/2vSvsWZ'],[],0,1,0,[],[],https://twitter.com/DailyStarLeb/status/1027854568204451842,False,,0,,,,,,,,[],,,,
1027849816062283776,1027849816062283776,2018-08-10 09:31:07 UTC,2018-08-10,09:31:07,0,4119535324,lebanonobserve,Lebanon observer,,UAE to build oil pipeline between Eritrea and Ethiopia: Fana Broadcasting  https://t.co/UWpWdZX0jT,en,[],['http://ow.ly/d4Fi50ic6fI'],[],0,2,0,[],[],https://twitter.com/LebanonObserve/status/1027849816062283776,False,,0,,,,,,,,[],,,,
1027849757480439809,1027849757480439809,2018-08-10 09:30:53 UTC,2018-08-10,09:30:53,0,1260285841,votana,altAfrica,,#ObservedElsewhere - UAE to build oil pipeline between #Eritrea and #Ethiopia – Fana Broadcasting  https://t.co/RkcvpRmKHT  https://t.co/6zjElwA6x4,en,[],"['http://www.engineeringnews.co.za/article/uae-to-build-oil-pipeline-between-eritrea-and-ethiopia-fana-broadcasting', 'https://bit.ly/2OVPCYN']",[],0,1,1,"['observedelsewhere', 'eritrea', 'ethiopia']",[],https://twitter.com/Votana/status/1027849757480439809,False,,0,,,,,,,,[],,,,
1027848223862358016,1027848223862358016,2018-08-10 09:24:47 UTC,2018-08-10,09:24:47,0,36016773,rupertbu,Rupert Bumfrey,,UAE to build oil pipeline between Eritrea and Ethiopia: Fana Broadcasting | Reuters  https://t.co/GfDxN1Vric,en,[],['http://dlvr.it/QfQjxd'],[],0,0,0,[],[],https://twitter.com/rupertbu/status/1027848223862358016,False,,0,,,,,,,,[],,,,
1027848065934393344,1027848065934393344,2018-08-10 09:24:10 UTC,2018-08-10,09:24:10,0,1451808590,tekening_int,Tekening Int.,,UAE to build oil pipeline between Eritrea and Ethiopia – Fana Broadcasting  https://t.co/SqWyeFVpCV,en,[],['https://ift.tt/2Mf72kO'],[],0,0,0,[],[],https://twitter.com/Tekening_int/status/1027848065934393344,False,,0,,,,,,,,[],,,,
1027847973529694209,1027847973529694209,2018-08-10 09:23:48 UTC,2018-08-10,09:23:48,0,705753891917402112,eyeonthehorn,EyeOnSudan,,#Reuters UAE to build oil pipeline between Eritrea and Ethiopia -Fana Broadcasting  https://t.co/7wAY2PmZtM #Eritrea #Erythrée,en,[],['https://ift.tt/2Or9DWh'],[],0,0,0,"['reuters', 'eritrea', 'erythrée']",[],https://twitter.com/EyeOnTheHorn/status/1027847973529694209,False,,0,,,,,,,,[],,,,
1027847354764935168,1027847354764935168,2018-08-10 09:21:20 UTC,2018-08-10,09:21:20,0,80575445,kataeb_eng,Kataeb.org English,,Fana broadcasting: UAE to build oil pipeline between Eritrea and Ethiopia,en,[],[],[],0,0,1,[],[],https://twitter.com/Kataeb_Eng/status/1027847354764935168,False,,0,,,,,,,,[],,,,
1027843074679099393,1027843074679099393,2018-08-10 09:04:20 UTC,2018-08-10,09:04:20,0,818267730004611072,ethiopianewsapp,Ethiopian News,,UAE to build oil pipeline between Eritrea and #Ethiopia -Fana Broadcasting  https://t.co/q5JimZqQja,en,[],['http://www.trust.org/item/20180810084634-dd940/'],[],1,0,1,['ethiopia'],[],https://twitter.com/EthiopiaNewsApp/status/1027843074679099393,False,,0,,,,,,,,[],,,,
1027167377476263937,1027167377476263937,2018-08-08 12:19:21 UTC,2018-08-08,12:19:21,0,2394705050,eritreanpress,Eritrean Press,,"Eri-TV should start broadcasting LIVE programmes, particularly news on @YouTube to its mass audience. Why do 'Enda Zena' always lag on simpler technologies? @hawelti @ERiTV_Official #Eritrea  https://t.co/jAqHXDikIR",en,"[{'screen_name': 'youtube', 'name': 'youtube', 'id': '10228272'}, {'screen_name': 'hawelti', 'name': 'yemane g. meskel', 'id': '438370063'}, {'screen_name': 'eritv_official', 'name': 'denden media', 'id': '934043809721307136'}]",[],['https://pbs.twimg.com/media/DkE61LXXsAUekXh.jpg'],2,3,14,['eritrea'],[],https://twitter.com/EritreanPress/status/1027167377476263937,False,,1,https://pbs.twimg.com/media/DkE61LXXsAUekXh.jpg,,,,,,,[],,,,
1026529140005117952,1026529140005117952,2018-08-06 18:03:13 UTC,2018-08-06,18:03:13,0,52804339,em_mehari,Enawgaw Mehari,,"@fitsumaregaa @amirabiy  p2p is getting ready to launch for the first time Pan African CME on oct20,2018. We hope the Medical communities from Eritrea to South Africa will join the digital broadcasting on face book for free , it is Triangular Partnership to bridge Africa together",en,"[{'screen_name': 'amirabiy', 'name': 'amir aman, md', 'id': '323224940'}]",[],[],0,0,1,[],[],https://twitter.com/em_mehari/status/1026529140005117952,False,,0,,,,,,,,[],,,,
1025338918911320067,1025338918911320067,2018-08-03 11:13:42 UTC,2018-08-03,11:13:42,0,240598292,mowliidhaji,Mowliid Haji Abdi,,"#JUSTIN : Ethiopia is keen to play a mediating role in the political crisis between Eritrea and Djibouti, government-affiliated Fana Broadcasting Corporate has reported, quoting Foreign Ministry spokesperson Meles Alem.",en,[],[],[],0,1,1,['justin'],[],https://twitter.com/MowliidHaji/status/1025338918911320067,False,,0,,,,,,,,[],,,,
1022021539414372352,1022021539414372352,2018-07-25 07:31:37 UTC,2018-07-25,07:31:37,0,888087056559349760,zenadamzena,ዜናዳም,,"Retweeted FANA BROADCASTING C (@fanatelevision):  #Ethiopia -n and #Eritrea-n embassies in #Nairobi, #Kenya colorfully celebrate the normalization of relations between the two countries in unison.  https://t.co/B4z1YPyves",en,"[{'screen_name': 'fanatelevision', 'name': 'fbc (fana broadcasting corporate s.c.)', 'id': '779821454'}]",[],"['https://pbs.twimg.com/media/Di7u0HgXoAEXwmQ.jpg', 'https://pbs.twimg.com/media/Di7u1qbWsAAzF3j.jpg', 'https://pbs.twimg.com/media/Di7u2jBXoAALtpQ.jpg']",0,0,0,"['ethiopia', 'eritrea', 'nairobi', 'kenya']",[],https://twitter.com/zenadamzena/status/1022021539414372352,False,,1,https://pbs.twimg.com/media/Di7u0HgXoAEXwmQ.jpg,,,,,,,[],,,,
1021818348961759232,1021818348961759232,2018-07-24 18:04:13 UTC,2018-07-24,18:04:13,0,888087056559349760,zenadamzena,ዜናዳም,,Retweeted FANA BROADCASTING C (@fanatelevision):  Medal award ceremony for #Ethiopia ’s Prime Minister Dr Abiy Ahmed and #Eritrea -n President Isaias Afeworki in #AbuDhabi #UAE  https://t.co/KCfB0c7XZ2,en,"[{'screen_name': 'fanatelevision', 'name': 'fbc (fana broadcasting corporate s.c.)', 'id': '779821454'}]",['https://www.youtube.com/watch?v=IjRZ3ORkZBg'],[],0,0,1,"['ethiopia', 'eritrea', 'abudhabi', 'uae']",[],https://twitter.com/zenadamzena/status/1021818348961759232,False,,0,,,,,,,,[],,,,
1021812625464860673,1021812625464860673,2018-07-24 17:41:28 UTC,2018-07-24,17:41:28,0,888087056559349760,zenadamzena,ዜናዳም,,"Retweeted FANA BROADCASTING C (@fanatelevision):  Tripartite summit between #Ethiopia , #Eritrea, and #UAE starts in #AbuDhabi  https://t.co/RhYKJdHlrF  https://t.co/eAieMvuZHa  https://t.co/RhYKJdHlrF",en,"[{'screen_name': 'fanatelevision', 'name': 'fbc (fana broadcasting corporate s.c.)', 'id': '779821454'}]","['http://et.fanabc.com/english/index.php/news/item/12701-tripartite-summit-between-ethiopia,-eritrea,-and-uae-starts-in-abu-dhabi', 'http://et.fanabc.com/english/index.php/news/item/12701-tripartite-summit-between-ethiopia,-eritrea,-and-uae-starts-in-abu-dhabi']","['https://pbs.twimg.com/media/Di3AjREXcAU-DJ4.jpg', 'https://pbs.twimg.com/media/Di3AkNrWwAAwfbW.jpg']",0,2,1,"['ethiopia', 'eritrea', 'uae', 'abudhabi']",[],https://twitter.com/zenadamzena/status/1021812625464860673,False,,1,https://pbs.twimg.com/media/Di3AjREXcAU-DJ4.jpg,,,,,,,[],,,,
1019875795194597376,1019875795194597376,2018-07-19 09:25:12 UTC,2018-07-19,09:25:12,0,2873698809,ghideonmusa,Ghideon Musa,,"#Ethiopia has appointed its first ambassador to #Eritrea in two decades. Redwan Hussein had become Addis Ababa's representative in Asmara, Ethiopia's state-linked Fana Broadcasting Corporate reported.  https://t.co/MKrjTjh0uP",en,[],[],['https://pbs.twimg.com/media/DidTUWmWAAADBgH.jpg'],3,5,13,"['ethiopia', 'eritrea']",[],https://twitter.com/GhideonMusa/status/1019875795194597376,False,,1,https://pbs.twimg.com/media/DidTUWmWAAADBgH.jpg,,,,,,,[],,,,
1019165167794483201,1019165167794483201,2018-07-17 10:21:25 UTC,2018-07-17,10:21:25,0,768054593045471232,tewerwari_1,Simon K Hagos,,"According to the #Ethiopia|n foreign ministry spokes person, Mr. Meles Alem, preparations from both govs to re-open #Eritrea|n port of Asseb and securing its high level functionality are already started and  are on going at a higher pace.  (Credit: Fana broadcasting)  https://t.co/tmbSV2iINH",en,[],[],['https://pbs.twimg.com/media/DiTNUXfUcAAIN8a.jpg'],1,1,4,"['ethiopia', 'eritrea']",[],https://twitter.com/tewerwari_1/status/1019165167794483201,False,,1,https://pbs.twimg.com/media/DiTNUXfUcAAIN8a.jpg,,,,,,,[],,,,
1018867345685655553,1018867345685655553,2018-07-16 14:37:59 UTC,2018-07-16,14:37:59,0,969779291935379456,debiaaw,debi,,Retweeted FANA BROADCASTING C (@fanatelevision):  Reopening ceremony of #Eritrea -n embassy in Addis Ababa #Ethiopia  https://t.co/DPcIV65821  https://t.co/bxrtfsCZGF,en,"[{'screen_name': 'fanatelevision', 'name': 'fbc (fana broadcasting corporate s.c.)', 'id': '779821454'}]",['https://twitter.com/fanatelevision/status/1018743654792531969/photo/1?utm_source=fb&utm_medium=fb&utm_campaign=debiaaw&utm_content=1018867330049298432'],"['https://pbs.twimg.com/media/DiNN8jiWAAADABR.jpg', 'https://pbs.twimg.com/media/DiNN8jhW4AAEoVj.jpg']",0,0,0,"['eritrea', 'ethiopia']",[],https://twitter.com/debiaaw/status/1018867345685655553,False,,1,https://pbs.twimg.com/media/DiNN8jiWAAADABR.jpg,,,,,,,[],,,,
1018742474611646464,1018742474611646464,2018-07-16 06:21:47 UTC,2018-07-16,06:21:47,0,1018235197622444032,dtaffere,Dr.Taffere,,"Eritrea to open its Embassy in Addis Ababa ,Ethiopia ( near Stadium) : source Fana Broadcasting .#Ethiopia  #Eritrea",en,[],[],[],1,0,1,"['ethiopia', 'eritrea']",[],https://twitter.com/DTaffere/status/1018742474611646464,False,,0,,,,,,,,[],,,,
1018544654806110210,1018544654806110210,2018-07-15 17:15:44 UTC,2018-07-15,17:15:44,0,78729763,tesfatsion,Berekhet (በረኸት),,Enjoying The peace event in #Addis which is &gt;&gt; the #WorldCup2018 !  The youth in #Ethiopia seem empowered and must be given full credit for the change. Hope to see a similar change in #Eritrea. — watching Ethiopian Broadcasting Corporation,en,[],[],[],0,0,0,"['addis', 'worldcup2018', 'ethiopia', 'eritrea']",[],https://twitter.com/Tesfatsion/status/1018544654806110210,False,,0,,,,,,,,[],,,,
1018092927506178048,1018092927506178048,2018-07-14 11:20:43 UTC,2018-07-14,11:20:43,0,103581482,ternafi,Hadelibi☝♡,,Historical day in #Ethiopia but what is #AlJazeera broadcasting...  #MSM #PIAinAddis got them going nuts.  #Eritrea and #Ethiopia will develop to the highest - hand in hand without giving an ear to outdated doom and gloom #MSM narratives.  https://t.co/rkoz8dQwH9,en,[],['https://twitter.com/AJEnglish/status/1018091486980857857'],[],0,0,2,"['ethiopia', 'aljazeera', 'msm', 'piainaddis', 'eritrea', 'ethiopia', 'msm']",[],https://twitter.com/Ternafi/status/1018092927506178048,False,https://twitter.com/AJEnglish/status/1018091486980857857,0,,,,,,,,[],,,,
1018032361341104128,1018032361341104128,2018-07-14 07:20:03 UTC,2018-07-14,07:20:03,0,563510089,dahirabdille,Dahir Abdille,,Retweeted FANA BROADCASTING C (@fanatelevision):  President Isaias Afeworki arrives in #AddisAbaba.  #Ethiopia #Eritrea  https://t.co/zRQt74X7mP  https://t.co/wziYUOHf1y,en,"[{'screen_name': 'fanatelevision', 'name': 'fbc (fana broadcasting corporate s.c.)', 'id': '779821454'}]",['https://twitter.com/fanatelevision/status/1018030266475048960/photo/1?utm_source=fb&utm_medium=fb&utm_campaign=dahirabdille&utm_content=1018032322950639616'],"['https://pbs.twimg.com/media/DiDFHH4WkAAZzE8.jpg', 'https://pbs.twimg.com/media/DiDFHKzX0AAQC9I.jpg', 'https://pbs.twimg.com/media/DiDFHH4W0AAxNEN.jpg', 'https://pbs.twimg.com/media/DiDFHH3WkAANUNC.jpg']",0,0,0,"['addisababa', 'ethiopia', 'eritrea']",[],https://twitter.com/dahirabdille/status/1018032361341104128,False,,1,https://pbs.twimg.com/media/DiDFHH4WkAAZzE8.jpg,,,,,,,[],,,,
1016933243516436480,1016911980962242561,2018-07-11 06:32:33 UTC,2018-07-11,06:32:33,0,1305673812,erythreansea,Bahre Negash,,"@eliasamare Holding Tigray hostage, the paranoid TPLF has been desperately trying to block the media from broadcasting, reflecting &amp; spreading the  radical changes taking place all over Ethiopia &amp; Eritrea, since the rise of PM Abiy Ahmed.  https://t.co/4VwSjiSoze",en,[],[],"['https://pbs.twimg.com/media/DhzfXuyUEAAvq6c.jpg', 'https://pbs.twimg.com/media/DhzfX9QUwAAfyt8.jpg', 'https://pbs.twimg.com/media/DhzfYa1VAAESTIT.jpg', 'https://pbs.twimg.com/media/DhzfY7cU8AAPXo5.jpg']",0,0,0,[],[],https://twitter.com/ErythreanSea/status/1016933243516436480,False,,1,https://pbs.twimg.com/media/DhzfXuyUEAAvq6c.jpg,,,,,,,"[{'screen_name': 'eliasamare', 'name': 'Elias Amare ኤልያስ ኣማረ', 'id': '48472244'}]",,,,
1016289167481999361,1016289167481999361,2018-07-09 11:53:13 UTC,2018-07-09,11:53:13,0,327368651,realdamee,Damee,,Retweeted FANA BROADCASTING C (@fanatelevision):  #Ethiopia: PM Dr Abiy concludes visit to #Asmara #Eritrea  https://t.co/Owm7FRYfNj  https://t.co/HLowlGsC3G  https://t.co/xQ6ObcOw65,en,"[{'screen_name': 'fanatelevision', 'name': 'fbc (fana broadcasting corporate s.c.)', 'id': '779821454'}]","['http://et.fanabc.com/english/index.php/news/item/12578-pm-dr-abiy-concludes-visit-to-asmara', 'https://twitter.com/fanatelevision/status/1016284320116420609/photo/1?utm_source=fb&utm_medium=fb&utm_campaign=DemisewT&utm_content=1016289119390064641']","['https://pbs.twimg.com/media/DhqRMGhW0AAMWW5.jpg', 'https://pbs.twimg.com/media/DhqRMGfXcAAdSyS.jpg', 'https://pbs.twimg.com/media/DhqRMGhX4AIvLcx.jpg']",0,0,0,"['ethiopia', 'asmara', 'eritrea']",[],https://twitter.com/realDamee/status/1016289167481999361,False,,1,https://pbs.twimg.com/media/DhqRMGhW0AAMWW5.jpg,,,,,,,[],,,,
1016286149348937729,1016286149348937729,2018-07-09 11:41:14 UTC,2018-07-09,11:41:14,0,1691380777,ethiopia_un,Ethiopia at the UN,,#Ethiopia and #Eritrea signed a Joint Declaration of Peace and Friendship today.   FBC (Fana Broadcasting Corporate S.C.)  https://t.co/WvQUanzj3A,en,[],['https://www.facebook.com/story.php?story_fbid=2149531158661834&id=1466744650273825'],[],0,12,43,"['ethiopia', 'eritrea']",[],https://twitter.com/Ethiopia_UN/status/1016286149348937729,False,,0,,,,,,,,[],,,,
